username,date,time,tweet,likes,replies,retweets,retweet,hashtags
pscahn,2017-11-27,12:53:45,New issue of Seminars in Speech and Language features @MGHInstitute interprofessional education and practice  http://doi.org/10.1055/s-00000076 …,6,0,5,True,
MGHInstitute,2017-11-25,10:00:06,Applications for the 2018 IHP Boston Marathon team are currently being accepted! Learn more about Team IHP and how to apply:  http://bit.ly/2fdIbL2 ,2,0,1,True,
MGHInstitute,2017-11-24,07:54:02,Just a reminder that the IHP is an officially registered charity on @amazonsmile! Thank you for your consideration this holiday season.  http://amzn.to/2zWy221  pic.twitter.com/0KBaK5Og99,1,0,0,True,
MGHInstitute,2017-11-23,09:00:22, pic.twitter.com/EwNEKSLQlW,3,0,1,True,
MGHInstitute,2017-11-22,08:00:05,During her 35 yrs in social work Phyllis Cox has helped thousands of ppl improve their quality of life.  http://bit.ly/2zP1V1u  #Fortyfor40,0,0,1,True,#Fortyfor40
MGHInstitute,2017-11-21,09:00:11,"Exciting leadership opportunity! The IHP is currently searching for a Chair of our Department of Communication Sciences & Disorders. To learn more or to apply, click here:  http://bit.ly/2xdzUy1 ",3,0,3,True,
rbwestrick,2017-11-20,07:41:12,“Most of the injuries here seem to come from playing basketball”  -when chatting with a young Navy sailor stationed near us at CharlestownNavy Yard in Boston @MGHInstitute @SPTSTactical,3,1,2,True,
MGHInstitute,2017-11-20,10:00:03,Athletes @BostonCollege are safer thanks to Kathleen Gill-Body and her colleagues @newtonwellesley.  http://bit.ly/2zP3358  #Fortyfor40,4,0,1,True,#Fortyfor40
MassGeneralNews,2017-11-17,08:13:18,Honored to be once again named a top place to work by @BostonGlobe! http://bit.ly/2iq2Q1n ,40,0,21,True,
MGHInstitute,2017-11-18,14:00:04,As clinical director @grounds4health Ellen Starr helps the nonprofit reduce cervical cancer among women.  http://bit.ly/2y5gSiD  #Fortyfor40,2,0,1,True,#Fortyfor40
MGHInstitute,2017-11-17,14:36:07,School of Nursing faculty Rita Olans takes a lead role in including nurses in national efforts to prevent antimicrobial resistance.  http://bit.ly/2zKNOgn  #AntibioticAwarenessWeek,0,0,0,True,#AntibioticAwarenessWeek
IHPCPD,2017-11-17,10:35:42,"If you could create the optimal #interprofessional clinical learning and practice environment of the future, what would it look like? Answer this question and more at #LeadingAcrossProfessions2018 in Boston on April 5-6 @MGHInstitute @BostonChildrens http://bit.ly/2j4p0Wn ",2,0,2,True,"#interprofessional,#LeadingAcrossProfessions2018"
Diana_C_Fischer,2017-11-16,19:23:02,So thankful for Compassionate care through the Schwartz Center @theSCCH event tonight! @SpauldingRehab @NHPHealth @MGHInstitute pic.twitter.com/pWcaDqM0hr,7,0,2,True,
MGHInstitute,2017-11-16,13:00:02,Kevin Whitney is the chief nursing officer & senior VP for Patient Care Services at @newtonwellesley.  http://bit.ly/2y4kWQr  #Fortyfor40,0,0,0,True,#Fortyfor40
DebNavedo,2017-11-16,11:03:02,"So proud of my colleagues: R Edwards, S Venugopal, and S Ramani. @MGHInstHPEd @MGHInstitute https://twitter.com/mghinsthped/status/931179815973072896 …",7,1,1,True,
MGHInstitute,2017-11-16,11:16:33,Exciting new partnership with @ACKHospital & the Department of Physician Assistant Studies. Two of our current second year PA clinical students were selected to help pilot a new education program on the island of Nantucket this winter. http://bit.ly/2my7rTx ,3,0,3,True,
MGHInstHPEd,2017-11-16,09:19:03,Responding to educational stakeholders: @MGHInstitute HPEd faculty publish a 12-tips article @MedTeachJournal http://www.tandfonline.com/doi/full/10.1080/0142159X.2017.1396307 …,11,0,8,True,
NatQualityForum,2017-11-15,14:26:48,"Rita Olans @MGHInstitute and @Kuperrx @VizientInc both emphasize the importance of leadership among nurses, pharmacists for #antibiotic #stewardship #AntibioticAwarenessWeek pic.twitter.com/dB4JV0yhtJ",2,0,1,True,"#antibiotic,#stewardship,#AntibioticAwarenessWeek"
NatQualityForum,2017-11-15,14:16:28,Rita Olans @MGHInstitute talks about the essential role of nurses in #antibiotic #stewardship. #NQF #AntibioticsAwarenessWeek #AntibioticResistance pic.twitter.com/QaXRCWUUWf,7,1,7,True,"#antibiotic,#stewardship,#NQF,#AntibioticsAwarenessWeek,#AntibioticResistance"
MaryGallagherOT,2017-11-14,15:42:26,"When I splint, you splint, we splint! #OTtalk #splintingclass @ MGH Institute of Health Professions  https://www.instagram.com/p/BbfbsriBoZ0/ ",1,2,1,True,"#OTtalk,#splintingclass"
MGHInstitute,2017-11-14,10:00:09,"MaryEllen Graham is the 1st clinical quality improvement manager @FLBlue, the state's largest insurer.  http://bit.ly/2y4k7XK  #Fortyfor40",1,0,1,True,#Fortyfor40
kayleyOTD,2017-11-13,21:00:13,Be sure to follow @MaryGallagherOT from @MGHInstitute. She’s running for ASD Student Representative to the Representative Assembly (RA)!,3,0,2,True,
TaelorMadeOT,2017-11-13,16:49:08,"I am on a mission. Now, who wants to join me??? 🙋🏼‍♀️ Grateful to have attended this conference by @ATTAChorg and others today. ""We must establish connection before correction."" #ACEs #OT #OTDToBe #Advocate pic.twitter.com/uEXhOQaWd5",3,0,2,True,"#ACEs,#OT,#OTDToBe,#Advocate"
MGHInstitute,2017-11-13,08:00:07,"Happy Nurse Practitioner Week! To all the nurse practitioners in the IHP community, please accept our heartfelt appreciation and gratitude for your hard work and contributions that shape the future of nursing education and patient care. #NPWeek pic.twitter.com/0CB1w0gfXG",11,0,8,True,#NPWeek
MGHInstitute,2017-11-13,07:00:08,Calling all IHP students! Stop by today or tomorrow and sign a postcard to thank our generous donors. You can also pick up some new IHP swag and grab a treat. #ThankADonorDay pic.twitter.com/rWc6i7F8wm,0,0,1,True,#ThankADonorDay
MGHInstitute,2017-11-12,13:20:01,SLP alumni @KJSLP & @swardtherapy have worked together since 97 when they founded Cognitive Connections.  http://bit.ly/2zOF1Y4  #Fortyfor40,1,1,1,True,#Fortyfor40
OTemily3,2017-11-10,18:41:20,@Mandykay07 @cdntwyla @MGHInstitute @SpauldingRehab Mandy & Twyla presenting at #MAOT17 @PartnersCareers & repping @BUSargent & @TuftsUniversity ! pic.twitter.com/eSVjsot1Gu,8,0,3,True,#MAOT17
mobozzen,2017-11-10,17:38:13,Good to see Margie Gillis @Literacy_How attending Dr. C. Haynes on “Strategies for Developing Narrative & Expository Writing” @MGHInstitute pic.twitter.com/VDQ8VdYvDb,2,0,2,True,
OTemily3,2017-11-10,12:51:10,Our Mandy Mack presenting her #safety skills for entry-level students poster @ #maot17 @MGHInstitute @kayleyOTD pic.twitter.com/18gdmfBAPl,7,0,4,True,"#safety,#maot17"
OTemily3,2017-11-10,12:36:30,@MGHInstitute our #2017 #OTD alumni Amanda Roberts presenting her capstone doctoral work at #MAOT17! pic.twitter.com/MFYlmK0nkb,5,0,3,True,"#2017,#OTD,#MAOT17"
MGHInstitute,2017-11-10,12:00:03,Jennifer Walk has a clinic in Germany to support families w/ a child who has communication difficulties.  http://bit.ly/2y58XC8  #Fortyfor40,0,0,0,True,#Fortyfor40
OTemily3,2017-11-10,08:03:28,@MGHInstitute https://twitter.com/mtiltonota/status/928985384444362753 …,2,0,2,True,
OTemily3,2017-11-10,08:00:13,@MGHInstitute Our Susan Fasoli accepting the #maot17 Catherine Trombly Award! @LisaTConnor pic.twitter.com/nKTDd0gi5e,3,1,2,True,#maot17
MGHInstitute,2017-11-10,10:00:08,A heartfelt thank you to those in the IHP community who have been members of the United States Uniformed Services and served our country.   http://bit.ly/2mdruGD  #IHPVeterans #ThankYouforYourService,0,0,1,True,"#IHPVeterans,#ThankYouforYourService"
RebeccaInzana,2017-11-09,13:30:44,Come visit Us at the #ASHA17 #gradschoolfair table! West Hall A behind Posters #Mghihp @MGHInstitute pic.twitter.com/uW81u0bdBI,4,0,1,True,"#ASHA17,#gradschoolfair,#Mghihp"
RebeccaInzana,2017-11-09,14:53:56,"#ASHA17 1:30, room 504 (West 2nd floor) Med SLP prep! Be There! @MGHInstitute pic.twitter.com/7U33dKNSXM",6,0,3,True,#ASHA17
MGHInstitute,2017-11-09,12:00:08,"Come see our newly designed interprofessional center at the IMPACT Practice Center Community Open House on Tuesday, November 14. RSVP here:  http://bit.ly/2manbMe ",1,0,2,True,
MGHInstitute,2017-11-09,09:00:15,Today is Genetic Counselor Awareness Day. Genetic counselors play an important part in people’s healthcare – from helping them better understand genetic testing to identifying keys to their family health history. Learn more:  https://goo.gl/T3cZTT  pic.twitter.com/gHDyAMuCiN,2,0,2,True,
MGHInstitute,2017-11-08,13:00:08,Kenya Palmer’s enthusiasm for healthy living & well-being permeates her work as an NP @The_BMC.  http://bit.ly/2zPzgti  #Fortyfor40,0,0,0,True,#Fortyfor40
MGHInstitute,2017-11-08,11:00:18,OTD prof Sue Fasoli in @HoustonChron on patients using wearable robotics in neuro motor recovery. @memorialhermann http://bit.ly/2zm8wmF ,1,0,3,True,
MGHInstitute,2017-11-08,09:29:15,Incredible photo of our beautiful campus this morning! Thanks @jorgesanchez74 for sharing. https://twitter.com/jorgesanchez74/status/928263409493143552 …,0,0,0,True,
MGHInstitute,2017-11-06,17:04:03,"Today's Schwartz Rounds discussion, ""When the Patient is Prejudiced"" w/ Manny Acheampong, Jennifer Mackey, & Brian French. @MGH_BlumCenter pic.twitter.com/lc6PwmDGBt",2,0,2,True,
MGHInstitute,2017-11-06,10:00:02,Adam Carreiro was in the first IHP Master of Physician Assistant Studies graduating class in 2017.  http://bit.ly/2zNXcgu  #Fortyfor40,0,0,1,True,#Fortyfor40
MGHInstitute,2017-11-06,09:05:01,"Today's Schwartz Center Rounds topic is, ""When the Patient is Prejudiced."" Join us today at noon in Shouse 322.  http://bit.ly/2m0W7zl ",0,0,0,True,
MGHInstitute,2017-11-04,13:00:02,A debilitating ski injury did not deter IHP nursing almuni Kelly Brush Davisson from helping others.  http://bit.ly/2y4z38s  #Fortyfor40,1,0,1,True,#Fortyfor40
MGHInstitute,2017-11-02,12:00:05,BA Harris dedicated her career to ensuring PT was integrated into IHP's interprofessional education.  http://bit.ly/2zMHv9j  #Fortyfor40,1,0,1,True,#Fortyfor40
MGHInstitute,2017-10-31,09:00:05,Joan Clifford has spent her professional career caring for the country’s veterans.  http://bit.ly/2y3iDgn  #Fortyfor40,0,0,1,True,#Fortyfor40
MGHInstitute,2017-10-29,18:00:02,Marie Jette developed an interest in medical speech pathology & instrumentation as an SLP student.  http://bit.ly/2zNPh2K  #Fortyfor40,0,0,0,True,#Fortyfor40
KeshrieN,2017-10-28,12:28:46,Excited to present at #APTAMA chapter conference pic.twitter.com/ZQJo6AErkL,15,0,4,True,#APTAMA
MGHInstitute,2017-10-27,14:52:01,"Dan Dyrek has worked with thousands of professional, Olympic, & collegiate athletes during his career.  http://bit.ly/2zMAhlH  #Fortyfor40",0,0,1,True,#Fortyfor40
MGHInstitute,2017-10-25,12:00:14,It was while volunteering in Haiti in 2012 that Alexia Marcous first decided to become a #nurse. #Fortyfor40  http://bit.ly/2zPzbWA ,0,0,1,True,"#nurse,#Fortyfor40"
PartnersCPD,2017-10-24,06:47:46,Join our conference December 8 w/ @BrighamWomens to learn more about #antimicrobial #stewardship. Sign up now!  http://ow.ly/Xwgd30g5GgM ,4,0,2,True,"#antimicrobial,#stewardship"
OTemily3,2017-10-21,10:35:23,#selfcare #mindful exercises to use during a busy clinical day taking care of clients @MGHInstitute @BensonHenry #MindBody pic.twitter.com/4C4YIRfIl0,5,0,3,True,"#selfcare,#mindful,#MindBody"
MGHInstitute,2017-10-20,15:30:03,We are excited to announce the IMPACT Practice Center is now officially open to the Boston community! Learn more:  http://bit.ly/2ipQ5qz ,5,0,3,True,
MGHInstitute,2017-10-20,15:14:15,A special thanks to @marty_walsh for attending our ribbon cutting ceremony. The IMPACT Practice Center is officially open to the community! pic.twitter.com/vhBqmdkiwC,6,0,2,True,
MGHInstitute,2017-10-20,10:00:08,Kathleen Belmonte has devoted her nursing career to helping people thrive while living with diabetes.  http://bit.ly/2yWjXSr  #Fortyfor40,0,0,1,True,#Fortyfor40
OTemily3,2017-10-19,11:45:27,@BensonHenry @harvardmed @MGHInstitute Kick-off afternoon at #MindBodyCME. Eager to learn & think pic.twitter.com/p6kUEjTr70,3,1,3,True,#MindBodyCME
trishn1,2017-10-18,18:54:05,"@MrsMcNanyVDV Thanks for sharing, Maggie. Charley is one of our fabulous faculty members at MGH Institute in our CAS in Literacy and Language @MGHInstitute",2,0,2,True,
NatQualityForum,2017-10-18,15:30:28,Nov. 15 @CDCgov @HCAhealthcare @VizientInc @MediaTJC @Aetna @PeggyFund @MGHInstitute #ABX #antibioticresistance  http://bit.ly/NQPABX ,2,0,2,True,"#ABX,#antibioticresistance"
KennedyFSC,2017-10-17,15:48:51,@KennedyFSC hosted a #Narcan training for >50 nursing students today. Thanks @MGHInstitute @turnitaroundctn for support #learntosavealife,4,1,2,True,"#Narcan,#learntosavealife"
OTemily3,2017-10-18,08:40:26,#Grateful to be attending this conference to bring back what I learn to our #OTD students & the #OT profession! @LisaTConnor @MGHInstitute https://twitter.com/BensonHenry/status/920643333130563590 …,6,0,2,True,"#Grateful,#OTD,#OT"
trishn1,2017-10-17,18:26:08,"@MGHInstitute , you are invited to our next webinar  http://info.mghihp.edu/-temporary-slug-0abfbc61-a71a-4e4b-8c41-bafa7764ad5b?hs_preview=JtApoOld-5390290130&utm_medium=social&utm_source=twitter …#highered #ld #dyslexiaawarenessmonth #edchat #spedchat #slp @mghInstitute",2,0,3,True,"#highered,#ld,#dyslexiaawarenessmonth,#edchat,#spedchat,#slp"
MGHInstitute,2017-10-17,12:00:17,@PTDayofService A big thank you to all the Physical Therapy Students that came out and volunteered this past Saturday for @ptdayofservice! #PTDOS #PTMonth pic.twitter.com/G56yXoU4V0,3,0,0,True,"#PTDOS,#PTMonth"
MGHInstitute,2017-10-16,17:00:06,Kimberly Russell has had a steady upward trajectory since graduating w/ a  medical imaging certificate.  http://bit.ly/2yNsZRI  #Fortyfor40,0,0,0,True,#Fortyfor40
MGHInstitute,2017-10-16,12:44:39,IHP receives 2017 Health Professions Higher Education Excellence in Diversity (HEED) Award from @INSIGHT_News.  http://bit.ly/2hKVTGX ,0,0,0,True,
AceraSchool,2017-10-15,10:30:32,"Join a discussion with Cognitive Neuroscientist Yael Arbel from @MGHInstitute; #AceraInnovates 10/19, 6:30pm  http://bit.ly/acerainno  pic.twitter.com/MSWrXTaHBx",2,0,1,True,#AceraInnovates
BostonAchilles,2017-10-14,06:52:08,@MGHInstitute Today is #ptdayofservice! Way to go @mghinstitute #physicaltherapy students! Thanks for repping…  https://www.instagram.com/p/BaOjf3Tgjij/ ,3,1,1,True,"#ptdayofservice,#physicaltherapy"
trishn1,2017-10-12,19:39:45,I thought this might be of interest to you…  https://nj.dyslexiaida.org/events/ Check out MGH Institute's CAS Literacy and Language /CSD faculty Charley Haynes!keynote speaker at NJ International Dyslexia Association's Fall Conference @MGHInstitute,5,1,3,True,
IHPCPD,2017-10-12,12:40:54,"#IHPCPD upcoming workshops, conferences & online courses - sign up for alerts and updates! #continuingeducation  http://bit.ly/2uVJqFa  pic.twitter.com/LRL8f4UQsK",0,0,2,True,"#IHPCPD,#continuingeducation"
MGHInstitute,2017-10-12,13:51:02,Roya Ghazinouri has pioneered new programs & implemented innovative approaches to health care.  http://bit.ly/2yHyilB  #Fortyfor40,0,0,0,True,#Fortyfor40
trishn1,2017-10-11,11:31:54,"So proud of Joanna, one of our amazing faculty in the CSD and Literacy and Language CAS programs at MGH Institute of Health Professions. @MGHInstitute https://twitter.com/doctorwhy/status/917389466188353536 …",2,0,2,True,
MGHInstitute,2017-10-10,16:00:07,Nikki Blanc was part of the inaugural Doctor of Occupational Therapy graduating class this past spring.  http://bit.ly/2yVHMFS  #Fortyfor40,4,0,4,True,#Fortyfor40
NUPT_ClinEd,2017-10-10,12:25:28,"@eventbrite The @Aptaofma North Metro District presents ""The Role of PT in patients with ALS"" at the @MGHInstitute  https://www.eventbrite.com/e/north-metro-district-role-of-pt-in-patients-with-als-tickets-37252774050?utm-medium=discovery&utm-campaign=social&utm-content=attendeeshare&aff=estw&utm-source=tw&utm-term=listing … @Eventbrite",2,0,2,True,
BellackLibrary,2017-10-09,13:30:34,Managing your citations can be overwhelming. Learn how to use RefWorks on Monday 10/16 at 12 pm. http://ow.ly/q3HJ30f88UN ,0,0,1,True,
doctorwhy,2017-10-09,09:01:07,Next up: Joanna Christodoulou @MGHInstitute talking about Mind-Brain-Education pic.twitter.com/jGgiYbEZek,5,2,3,True,
MGHInstitute,2017-10-07,15:00:02,4 members of the MGH Institute community have been selected as Fellows of the @AAN_Nursing & are officially being inducted during #AAN17.,3,0,1,True,#AAN17
MGHInstitute,2017-10-06,14:23:10,"Happy 50th anniversary to the #PA profession and happy #PAweek to our PA faculty, staff, students, and alumni! #cheersto50years pic.twitter.com/UonIYmEioc",2,0,1,True,"#PA,#PAweek,#cheersto50years"
DavidHajjar,2017-10-05,21:16:11,Thank you to the SLP Dept @MGHInstitute for this honor.  Working hard in my 1st semester @IthacaCollege  https://www.mghihp.edu/forty-40-david-j-hajjar-phd-ms-slp-%E2%80%9998 …,4,0,1,True,
JONAonline,2017-10-06,03:33:00,#Nurses are positioned to communicate with policymakers about the actual impact of policies. @MGHInstitute  http://journals.lww.com/jonajournal/Abstract/2017/10000/Enhanced_Influence_Through_Advancing_Scope_of.3.aspx …,2,0,2,True,#Nurses
BostonMagazine,2017-10-05,10:11:00,10 gorgeous fall foliage runs in Massachusetts:  http://bit.ly/2fU57ka  pic.twitter.com/7mQWeIj3Ib,15,0,7,True,
kayleyOTD,2017-10-05,12:54:21,Nothing is like understanding motor learning theory than learning how to juggle in class 😹 #OccupationalTherapy @MGHInstitute,1,1,1,True,#OccupationalTherapy
MGHInstitute,2017-10-04,18:00:03,"Bermuda is a healthier place because of the efforts of alumna Julie Burrows, SLP ’03, a #Fortyfor40 profilee.  http://bit.ly/2yHOkID ",1,0,1,True,#Fortyfor40
MGHInstitute,2017-10-04,14:38:49,Provost Alex Johnson invites IHP community to join him in reflecting on this week's events in his latest blog post.  http://bit.ly/2xhVG3E ,0,0,1,True,
MGHInstitute,2017-10-04,12:32:27,Exciting leadership opportunity! IHP is searching for a Chair of Department of Communication Sciences & Disorders.  http://bit.ly/2xdzUy1 ,4,0,4,True,
JONAonline,2017-10-04,03:29:00,Enhanced Influence Through Advancing Scope of Practice Policy Research- Alex Hoyt @MGHInstitute http://journals.lww.com/jonajournal/Abstract/2017/10000/Enhanced_Influence_Through_Advancing_Scope_of.3.aspx …,5,0,3,True,
MGHInstitute,2017-10-03,16:00:10,"Matthew Gallagher, DPT ’08 is helping patients rehab with @uchealth. He’s one of our #Fortyfor40 alumni profiles.  http://bit.ly/2xGkLbX ",1,0,0,True,#Fortyfor40
MGHInstitute,2017-10-03,15:07:31,"#BSN students gave more than 1,000 flu shots today to @MassGeneralNews employees, IHP students, staff, faculty, & the public. #nursingschool pic.twitter.com/eMGbETrnbe",3,0,0,True,"#BSN,#nursingschool"
thartman2u,2017-10-02,17:54:20,Great advice & discussion about clinical/academic #IPE- #CABVI @MassGeneralNews @MGHInstitute pic.twitter.com/1o5syoCo2y,7,1,4,True,"#IPE,#CABVI"
FaulknerHosp,2017-09-29,07:00:58,@MGHInstitute The @mghinstitute presents a workshop for RNs/PAs: Impact of the Opioid Epidemic on our Patients/Practice on 10/17.  http://ow.ly/fWLJ30fm7J7 ,3,1,4,True,
MGHInstitute,2017-09-29,08:15:54,Thanks @CR_Justice for participating in this year's Community Impact Day and for highlighting our students work! http://bit.ly/2xOWaCn ,1,0,1,True,
OTemily3,2017-09-28,16:28:03,@MGHInstitute @TuftsUniversity @BUSargent #OT SOTA clubs joined efforts to raise $2800 for displaced OTA students in #Houston! @ajlamb1216 pic.twitter.com/trML9hexTr,13,1,8,True,"#OT,#Houston"
NewGradOT,2017-09-27,16:22:05,First year #occupationaltherapy student from @MGHInstitute shares tips with perspective students http://newgradoccupationaltherapy.com/choosing-occupational-therapy/ …,4,0,2,True,#occupationaltherapy
MGHInstitute,2017-09-27,14:15:19,"@MCNPtweets Stephanie Ahmed, DNP ’08 of @BrighamWomens & President of @MCNPTweets is one of our #Fortyfor40 alumni profiles.  http://bit.ly/2hutRPQ  pic.twitter.com/qdAjLtUSzb",2,0,1,True,#Fortyfor40
kayleyOTD,2017-09-25,10:58:30,Representing #OccupationalTherapy from @MGHInstitute at #OTHillDay @AOTAInc pic.twitter.com/0Bhi7J9hRI,14,0,4,True,"#OccupationalTherapy,#OTHillDay"
MGHInstitute,2017-09-25,08:15:41,"Join us at Noon for the first Schwartz Rounds of the academic year: ""Social Determinants of Native Health."" http://bit.ly/2htHkaF ",3,0,2,True,
TaelorMadeOT,2017-09-21,13:43:15,The @MGHInstitute #SOTA is sponsoring OT students in Houston after #Harvey 1/2 towards our goal!!  #Pres #VicePres #TeamOT #Fundraiser pic.twitter.com/wALtF4sHKU,6,1,3,True,"#SOTA,#Harvey,#Pres,#VicePres,#TeamOT,#Fundraiser"
MGHInstitute,2017-09-20,09:51:02,300 students participated in this year's Community IMPACT Day assisting more than 40 non-profits throughout Boston.  http://bit.ly/2fjD7tc ,1,0,3,True,
OTemily3,2017-09-19,19:00:46,@MGHInstitute @kayleyOTD @TaeEFutureOTD Pleas share with #OT and #CSD peers!  @OTDbcp #school-based resources for #OT @prilbo https://twitter.com/NewGradOT/status/910262732225748992 …,6,0,3,True,"#OT,#CSD,#school,#OT"
museumofscience,2017-09-19,10:28:35,@MGHInstitute the Museum of Science is FREE for college students this Friday 9/22 from 5p-9p! More info visit:  http://bit.ly/2xVZB7f  pic.twitter.com/0wD1N5EHYx,2,0,1,True,
IHPCPD,2017-09-19,12:26:55,Planning is under way for the #POCUltrasound course in the new IP Clinical Center at @MGHInstitute – take a look.  http://bit.ly/2uGfRMd  pic.twitter.com/EKGPS00jep,5,0,5,True,#POCUltrasound
BellackLibrary,2017-09-18,12:44:20,"Today is the day! Our first event, Appy Hour, is taking place in the library from 4:30 to 6pm. Drop in, grab a snack & check out cool apps!",5,0,1,True,
IHPCPD,2017-09-18,14:24:20,"Meet our #POCUltrasound Course Directors, Hana Dubsky,PA-C and Heidi Kimberly,MD! Register and join them on Oct 21:  http://bit.ly/2uGfRMd  pic.twitter.com/zo1J8UicoA",2,0,2,True,#POCUltrasound
MGHInstitute,2017-09-18,09:28:18,School of Nursing Assistant Professor Jean Bernhardt is part of the Massachusetts General Hospital team sent by @projecthopeorg. https://twitter.com/wgbhnews/status/909755864411668480 …,4,0,1,True,
LisaTConnor,2017-09-15,19:07:47,Great time in cooking group today with @MGHInstitute Intensive Comprehensive Aphasia Program #SIHP'S CAP #MGHIHPOT,5,0,3,True,"#SIHP,#MGHIHPOT"
CR_Justice,2017-09-15,13:19:43,Big thanks from our staff & clients to the awesome @MGHInstitute volunteers who came & spruced up the landscaping around Brooke House today! pic.twitter.com/UBRhyoDs35,6,1,2,True,
CaitlinFitzPT,2017-09-15,09:40:46,We are down with the bingo lingo! #teamb10 @MGHInstitute #impactpractice #ipe pic.twitter.com/574PAMQgiz,4,0,2,True,"#teamb10,#impactpractice,#ipe"
CaitlinFitzPT,2017-09-15,08:40:42,Psyched for community day! @MGHInstitute #impactpractice pic.twitter.com/lqwVQNgT7j,6,1,2,True,#impactpractice
MGHInstitute,2017-09-14,18:52:17,President Milone-Nuzzo joins college & university presidents calling for U.S. to uphold & continue (DACA) program. http://bit.ly/2h5wjfs ,2,0,1,True,
OTemily3,2017-09-08,16:05:56,"#OT brings trauma-informed lens, holistic care to team & communities at prevention, intervention &a reintegration levels. @MGHInstitute https://twitter.com/thenamedicine/status/906255295537709057 …",2,0,3,True,#OT
MGHInstitute,2017-09-08,15:07:50,The academic year kicked off this week with the Institute's Annual Faculty Convocation.  http://bit.ly/2xiPYDm ,2,0,1,True,
MassGeneralNews,2017-09-07,08:41:11,"Profiles in Education: meet Mark Andrew, PA student @MGHInstitute:   http://bit.ly/2j5Tomy  pic.twitter.com/byvZYBQzXO",6,0,3,True,
OTemily3,2017-09-03,18:34:47,"This, & adding #SEL education to #outdoor play, makes for a great set-up for #self-efficacy in life, in all #occupations @MGHInstitute https://twitter.com/mel_smith19/status/903894259366936578 …",1,0,2,True,"#SEL,#outdoor,#self,#occupations"
OTemily3,2017-08-31,06:58:33,This is where I get to work. @Const_Wharf @bostonNHP @USSConstitution @MGHInstitute pic.twitter.com/f5jy9v8UDw,11,0,2,True,
MassGeneralNews,2017-08-29,14:17:13,"@Forbes Feeling honored and proud to have topped this list: ""The Hospitals Most Loved By Their Employees"" via @forbes http://www.forbes.com/sites/karstenstrauss/2017/08/29/the-hospitals-most-loved-by-their-employees/#4adb4bf246af …",66,0,26,True,#4adb4bf246af
marty_walsh,2017-08-29,07:51:10,"Boston's #HelpforHouston Drive starts today! Please help us fill up our bins at City Hall, Bolling & BCYF Cntrs w/ much-needed items for TX. pic.twitter.com/t4ManKK57M",505,18,488,True,#HelpforHouston
IHPCPD,2017-08-29,08:08:31,"In October, we will explore how person-centered and non-judgmental language can help decrease the stigma of SUD:  http://bit.ly/2iDRlG6  pic.twitter.com/6qgyzjcOWg",1,0,2,True,
MGHInstHPEd,2017-08-28,02:23:26,Meeting up with incoming MS-HPEd scholars at #AMEE2017 . Looking forward to seeing new cohort in a few weeks @MGHInstitute @DebNavedo,5,0,1,True,#AMEE2017
OTemily3,2017-08-27,15:37:42,Here's how to help the victims of Hurricane Harvey  http://www.huffingtonpost.com/entry/how-to-help-hurricane-storm-harvey_us_59a166dde4b0821444c37515 … # via @HuffPostImpact @MGHInstitute Let's do something!,3,0,1,True,
OTemily3,2017-08-21,19:47:51,@MGHInstitute IIP 2017 - 11 innovative tasks today- hard work rewarded w eclipse party & an international potluck dinner @SetonHall pic.twitter.com/tMisTw4xec,7,1,3,True,
MGHInstitute,2017-08-21,14:59:56,Jim & Laura from our Office of Enrollment Services viewing the first total solar eclipse in the US in 99 years. #SolarEclipse2017 pic.twitter.com/WJGfoboq6W,4,0,2,True,#SolarEclipse2017
