username,date,time,tweet,likes,replies,retweets,retweet,hashtags
LeeLindquistMD,2018-07-24,15:21:23,Thank you for AWESOME experience today in Boston! Amazing people! @MGHPallCare @NorthwesternMed #Geriatrics pic.twitter.com/mx11kOmZiZ,2,0,1,True,#Geriatrics
NorthwesternMed,2018-07-24,13:34:04,Thank you @_workingmother_! We're honored to receive this recognition #DBPInclusionIndex https://twitter.com/_workingmother_/status/1021784571380039680 …,8,1,1,True,#DBPInclusionIndex
DrStreicher,2018-07-24,10:45:01,@NorthwesternMed Bayer Announced It Will Stop Selling  #Essure. Should women who currently have an ESSURE  have it removed? Tune in tomorrow  @WGNMorningNews  9:15  https://www.self.com/story/bayer-stop-selling-essure-in-the-us … via @SELFmagazine @northwesternmed,4,0,3,True,#Essure
NorthwesternMed,2018-07-24,11:00:30,"Hey, parents! Beat the #stress of #summervacation with these #selfcare tips from a Northwestern Medicine psychologist. http://bit.ly/2NJ5XOX ",0,0,0,True,"#stress,#summervacation,#selfcare"
babaksjahromi,2018-07-23,13:38:06,Drs. Ansari and Darwish representing @NorthwesternMed at @SNISinfo #SNIS2018 meeting! pic.twitter.com/mYTUzP0fOZ – at Hilton San Francisco Union Square,18,0,6,True,#SNIS2018
NorthwesternMed,2018-07-21,11:00:12,#TAVR procedures are providing patients with a minimally invasive alternative to open heart surgery. #Cardiology http://bit.ly/2mz4xeF ,1,0,1,True,"#TAVR,#Cardiology"
NorthwesternMed,2018-07-20,11:00:18,Combat #Alzheimers and #Parkinsons with some #summerfun and #aerobics. http://bit.ly/2NyIX59 ,4,1,3,True,"#Alzheimers,#Parkinsons,#summerfun,#aerobics"
NorthwesternMed,2018-07-19,14:35:48,Who says cake can't be #brainfood? 🧠🎂😋 #NMNeurology #NMBetter pic.twitter.com/fSEbIgrKu4,11,0,1,True,"#brainfood,#NMNeurology,#NMBetter"
NorthwesternMed,2018-07-19,14:19:36,"Alcohol-related liver deaths have skyrocketed among millennials, according to a new study. Haripriya Maddur, MD, transplant hematologist at Northwestern Memorial Hospital, weighs in. https://www.nbcnews.com/health/health-news/deaths-liver-disease-are-surging-drinking-blame-n892521?sf90615189=1 …",8,1,5,True,
DrStreicher,2018-07-19,13:35:00,Does #chocolate cause #migraines? #Coffee prolong life? #Fertility treatments promote #ovarian cancer?  http://bit.ly/2L6BCgI … for this mornings segment on @WGNMorningNews @NorthwesternMed pic.twitter.com/jP4DvsQQNx,3,0,2,True,"#chocolate,#migraines,#Coffee,#Fertility,#ovarian"
NUFeinbergMed,2018-07-19,11:18:57,"Scientists @NorthwesternMed have discovered a protective cellular mechanism that kicks in during iron deficiency, keeping cells running even in the face of continued iron deprivation, according to a study published in @PNASNews:  http://bit.ly/2mt6MzW  pic.twitter.com/F5A5YwuLoQ",4,0,2,True,
dianebwayne,2018-07-18,22:18:46,A beautiful night and a great event with amazing colleagues!!  #purplepride #summerinchicago #WomenofNorthwestern https://twitter.com/NU_WFO/status/1019740789604257794 …,12,0,3,True,"#purplepride,#summerinchicago,#WomenofNorthwestern"
NorthwesternMed,2018-07-19,11:00:19,Northwestern Medicine is taking the lead in finding new ways treat the number one cause of death in the world. http://bit.ly/2msxc4X ,6,0,3,True,
NorthwesternMed,2018-07-18,15:14:17,Could a #ChicagoHotDog ever be considered healthy? We dare you to try. Check out our step-by-step recipe! #NationalHotDogDay  http://bit.ly/2Ns6ODO  pic.twitter.com/6cI9ogqO4H,7,0,3,True,"#ChicagoHotDog,#NationalHotDogDay"
magdymiladmd,2018-07-18,14:08:39,It was an honor to care for you and help with your #fibroids ⁦@NorthwesternMed⁩. https://wgntv.com/2017/10/23/fibroids-and-fertility/ …,11,0,2,True,#fibroids
NorthwesternMed,2018-07-18,11:00:16,New research from Northwestern Medicine shows potential for reducing the severity of #allergicreactions. http://bit.ly/2NsSACn ,2,0,0,True,#allergicreactions
NorthwesternMed,2018-07-18,11:00:13,"Healthcare providers are invited to attend the 2018 Northwestern Medicine Comprehensive Stroke and Cerebrovascular Conference on Saturday, October 13 at the Hyatt Centric Chicago Magnificent Mile. Book your seat now! http://bit.ly/2NmRYyj ",7,0,2,True,
NMCardiology,2018-07-18,10:40:11,@NorthwesternMed @CountryPumpDoc speaks to @Suntimes and @chicagotribune about the rare heart condition that tragically took the life of a @ChicagoFireDep rescue diver: https://chicago.suntimes.com/news/juan-bucio-cfd-diver-autopsy/ …,1,0,2,True,
NorthwesternMed,2018-07-18,10:26:03,"Due to increased patient volumes, expect extended wait times in the Kishwaukee Hospital Emergency Department. For minor illnesses or injuries, please consider visiting your primary care physician or Northwestern Medicine Convenient Care Sycamore located at 1850 Gateway Drive.",3,1,4,True,
NorthwesternMed,2018-07-18,09:59:54,We'll be LIVE on @facebook today at 1:15pm CST with two of our @NMCardiology physicians! Tune in to learn more about the latest advances in #cardiacsurgery at Northwestern Medicine. #HeartHealth #Cardiology pic.twitter.com/I1rHkTF77c,7,0,5,True,"#cardiacsurgery,#HeartHealth,#Cardiology"
iamkasmer,2018-07-17,18:40:20,"#behindthescenes @NorthwesternMed’s Haripriya Maddur, MD speaks with @DrJohnTorres about the rising number of millennials being diagnosed with #liverdisease ! Tune in to @NBCNightlyNews tomorrow evening! pic.twitter.com/SVcmyGJTFJ",16,0,7,True,"#behindthescenes,#liverdisease"
MegsMcCann,2018-07-17,19:20:45,Always a good day working with @NBCNewsHealth! Looking forward to their upcoming segment on @NorthwesternMed’s efforts to address the opioid epidemic. @JJStulberg pic.twitter.com/JeQk2c8rcV,14,1,5,True,
NUFeinbergMed,2018-07-18,09:40:33,Scientists have identified thousands of molecules unique to human fat cells that may play an important role in fat metabolism.  http://bit.ly/2zZiaNR  #metabolism #genetics @sciencemagazine pic.twitter.com/HQBcZcINDk,2,0,1,True,"#metabolism,#genetics"
NorthwesternMed,2018-07-17,16:52:53,"Martella, a longtime friend and fellow Northwestern Medicine nurse, surprised @BonnieHunt_real on the set of @WindyCityLIVE earlier today. Thank you both for touching the lives of so many patients in and outside these hospital walls! pic.twitter.com/zEAmMS82RR",19,0,5,True,
NorthwesternMed,2018-07-17,14:00:15,"#CardiacSurgery is one of the most rapidly evolving fields of medicine. Join us LIVE on Wednesday, July 18 at 1:15pm CST to learn how Northwestern Medicine is pioneering these incredible advances. pic.twitter.com/KCgek5rsXQ",8,0,2,True,#CardiacSurgery
NorthwesternMed,2018-07-17,11:33:29,"On @QueerEye, the #Fab5 share more than fashion advice, but also how to talk with others who have differing ideologies. Dr. Reinecke, chief psychologist, offers tips to @chicagotribune on how to have productive conversations when discussing tough topics. http://www.chicagotribune.com/lifestyles/sc-fam-queer-eye-political-differences-0724-story.html …",10,0,3,True,#Fab5
NeurosurgeryNM,2018-07-17,09:10:16,Do you #crossfit? @NaderDahdaleh & research team have published 20 papers recently & generating a significant amount of interest for paper on Cross Fit related injuries treated at @NorthwesternMed  as well as papers on #DVT after spinal surgery.  http://ow.ly/Q01i30kYuXS  #spine pic.twitter.com/YLSO9TsAWj,7,0,4,True,"#crossfit,#DVT,#spine"
NUFeinbergMed,2018-07-16,12:22:50,"In the latest episode of our ""Breakthroughs"" #podcast, Robert Kalb, MD, Director of @LesTurnerALS at @NorthwesternMed, explains why he is optimistic that breakthroughs in the basic biology of #ALS are on the way and a cure is possible. https://soundcloud.com/user-549060398/what-causes-als-with-robert-kalb-md …",2,0,2,True,"#podcast,#ALS"
NMSurgery,2018-07-13,08:46:21,Northwestern's own @kbilimoria interviewed by @AmCollSurgeons about incorporating research into their profession https://twitter.com/AmCollSurgeons/status/1017529178818785282 …,8,1,7,True,
CTCorps,2018-07-14,11:03:06,"Happy birthday to CTC therapy dog Winston!  Winston visits with patients at @NorthwesternMed.  Wishing you a great day, Winston!To support Winston's comforting work, please consider donating to CTC today:  https://buff.ly/2qHJuIz  pic.twitter.com/6M0tYR5eqL",5,0,3,True,
NorthwesternMed,2018-07-13,14:02:09,Heading out on a #RoadTrip? Here are some #HeartHealthy foods that will help fuel you for your adventures. #Nutrition http://bit.ly/2mf5ubG ,2,0,3,True,"#RoadTrip,#HeartHealthy,#Nutrition"
NUFeinbergMed,2018-07-13,09:28:01,A new @NorthwesternMed study has identified a trigger of some fibrotic diseases and an experimental compound to treat it:  http://bit.ly/2mfsHdW  pic.twitter.com/EyIv2yY4Go,8,0,3,True,
NorthwesternDHF,2018-07-12,16:01:48,The Northbrook Tower: Third annual digestive health gala raises record-breaking $2.41 Million  http://bit.ly/2L9BwAK  @NorthbrookTower @NMHnews @NorthwesternMed @NUFeinbergMed @ResearchNU pic.twitter.com/k2CJtufJcv,3,0,1,True,
Chicago_Spine,2018-07-12,12:02:09,Julian is a great example of the modern treatment of spinal cord injury! #spine #trauma Rapid cutting edge surgery + amazing team + extraordinary patient = miraculous  recovery @NorthwesternMed @Chicago_Spine https://chicago.cbslocal.com/2018/07/11/medical-miracle-man-paralyzed-diving-accident-walks-again/ …,20,0,5,True,"#spine,#trauma"
NorthwesternMed,2018-07-12,11:59:02,"John partakes in weight lifting, yoga, Pilates, walking and running, but would you believe us if we told you he suffered a #HeartAttack less than four years ago? @DoctorFitHeart with @NMCardiology explains to @nytimes the benefits of this recovery plan. https://nyti.ms/2me985u ",11,0,4,True,#HeartAttack
NorthwesternMed,2018-07-12,11:00:22,"Motivated by the #TourDeFrance? Turns out, biking offers quite a host of health benefits. #TDF2018 http://bit.ly/2L82uvV ",4,0,2,True,"#TourDeFrance,#TDF2018"
kbilimoria,2018-07-11,06:24:57,"Female residents report working more, experiencing certain aspects of burnout more frequently, & having poorer psychological well-being. Qualitative findings offer potential solutions. ⁦@CapriceGreenber⁩ ⁦@AmBdSurg⁩  ⁦@AmCollSurgeons⁩ https://journals.lww.com/annalsofsurgery/pages/articleviewer.aspx?year=2018&issue=08000&article=00003&type=Abstract …",31,0,16,True,
NMCardiology,2018-07-11,17:05:09,Did you know that @NorthwesternMed was one of the 6 centers selected by the @American_Heart to be part of a new grant-funded national network dedicated to researching & understanding the causes of atrial fibrillation? Read more about it here:  http://ow.ly/NWxx30kUnrD  #afib,14,0,13,True,#afib
NeurosurgeryNM,2018-07-11,14:24:21,"Nearly 80% of people face a painful #back or #neck problem at some point in their lives. Whether you need care for common injuries or complex spine surgery, @NorthwesternMed #spine specialists combine innovation & skill to help restore your movement & improve your quality of life pic.twitter.com/UtKFfSrb60",10,0,2,True,"#back,#neck,#spine"
DrStreicher,2018-07-11,08:27:00,#Fertility treatments and #ovariancancer. Is there a connection? Today on @WGNMorningNews 9:15. @NorthwesternMed,2,0,2,True,"#Fertility,#ovariancancer"
chiwomanmag,2018-06-25,09:01:19,#bodypositivity takes on a whole new meaning with gynecologist @DrStreicher's tips for #selflove  http://bit.ly/cw-streicher  pic.twitter.com/GEgHBER97v,3,0,1,True,"#bodypositivity,#selflove"
EpDoyle,2018-07-10,15:00:06,Looking good at the Delnor Outpatient Infusion Clinic @NorthwesternMed currently under construction. Check out the before and during photos. @KTGY_Group pic.twitter.com/zDakDUmxBp,10,0,3,True,
NMCardiology,2018-07-10,15:05:10,Less than one month away from our #NMAPH18 conference! Sessions will cover Right Ventricle and Pulmonary Thromboembolism. Register here:   http://ow.ly/esqe30kThzR  pic.twitter.com/qwOdD3rqA8,3,0,1,True,#NMAPH18
NUFeinbergMed,2018-07-10,10:20:11,"Good news for #coffee drinkers! Drinking coffee is associated with a lower risk of death, according to a large study published in @JAMAInternalMed.  http://bit.ly/2mapTOZ  pic.twitter.com/2hUS1yJX4M",7,0,6,True,#coffee
NorthwesternMed,2018-07-10,11:00:15,"#Running won’t cause #arthritis, but it can lead to other common knee problems. Here are some symptoms and treatment options. http://bit.ly/2JasNfY ",5,0,3,True,"#Running,#arthritis"
JAMAOto,2018-07-09,16:00:02,"Transcutaneous osseointegrated implants effective in #pediatric pts w/ aural atresia, according to new findings from colleagues at @NorthwesternMed  https://ja.ma/2KIXgY2  pic.twitter.com/cX7AvjDahf",6,0,5,True,#pediatric
NUFeinbergMed,2018-07-09,14:13:31,"“Most seniors don’t want to move to assisted living. So, if we can get things lined up so that they can stay in their own home, then why not do it?” — @LeeLindquistMD, a leader in the movement to help seniors “age in place”  http://bit.ly/2L1NNr3  pic.twitter.com/COxsEiJehH",20,0,12,True,
NorthwesternMed,2018-07-09,14:01:01,"Neurologist, Dr. Stephen VanHaerents speaks about this rare condition. https://twitter.com/dailyherald/status/1015901001558024195 …",4,0,0,True,
NorthwesternMed,2018-07-09,11:00:11,Go beyond plain old H2O and try some enjoyable options for staying hydrated this #summer. #HealthTips http://bit.ly/2J731Jo ,7,0,1,True,"#summer,#HealthTips"
NorthwesternMed,2018-07-07,11:00:17,"After being diagnosed with Wilms’ tumor as a child, Chiara Rodgers became an advocate and a symbol of strength for others. When her father was diagnosed with #prostatecancer, she knew exactly how to help him. Learn more about their story. http://bit.ly/2lZPytK ",5,0,2,True,#prostatecancer
NUFeinbergMed,2018-07-06,13:00:01,From @NBCNews - @NorthwesternMed study shows game-based HIV prevention program shows results https://nbcnews.to/2m09Xz2 ,2,0,2,True,
AKoreishi_MD,2018-07-05,09:10:18,Feeling grateful to have had opportunity to travel and provide a helping hand in Guatemala.  #GuatemalaEstaUnida #Icare #gratitude #Ophthalmology pic.twitter.com/odosa5fu01,12,0,3,True,"#GuatemalaEstaUnida,#Icare,#gratitude,#Ophthalmology"
NorthwesternMed,2018-07-06,11:00:19,Trying to lose weight? Set yourself up for success. http://bit.ly/2KSJEW2 ,3,0,0,True,
BrainTumorInst,2018-07-06,09:31:24,The Hispanic Brain and Spine Tumor Program at @NorthwesternMed offers care entirely in Spanish https://youtu.be/uSCMvj9OkMw ,7,1,3,True,
NorthwesternMed,2018-07-05,11:00:24,Could a #ChicagoHotDog ever be considered healthy? We dare you to try! http://bit.ly/2KN7xhT ,3,0,2,True,#ChicagoHotDog
NorthwesternMed,2018-07-04,14:00:06,Wishing everyone a fun and safe #4thOfJuly! How will you be spending the holiday weekend? Your @KCCougars have a few home games lined up that are enjoyable for the whole family.  https://atmilb.com/2KxLX53  pic.twitter.com/cgQsy5Crvy,13,0,1,True,#4thOfJuly
NorthwesternMed,2018-07-03,11:00:13,Don’t let health hazards hijack your fun! Here are some ways to make the most of a day exploring #musicfestivals. #SummerTips http://bit.ly/2KtN9q2 ,2,0,1,True,"#musicfestivals,#SummerTips"
NMCardiology,2018-07-02,20:33:37,Welcome fellows! We are so excited to see what you will do! https://twitter.com/nmhheartdoc/status/1013951066004754433 …,17,0,3,True,
NMCardiology,2018-07-02,15:06:13,"@American_Heart chose @NorthwesternMed as 1 of 6 centers in a grant-funded national network dedicated to researching atrial fibrillation, the most common type of irregular heartbeat. Congrats to @PassmanRod, who will lead Northwestern's effort. #afib https://bit.ly/2NlekRx ",9,0,3,True,#afib
NorthwesternMed,2018-07-02,13:51:12,It’s a beautiful #summer day! How are you enjoying this great weather? pic.twitter.com/WXZdJSHyKE,39,1,4,True,#summer
Philanthropy,2018-07-02,12:46:00,A gift of $25 million to @NorthwesternMed from Neil Bluhm through his family’s foundation will go toward using artificial intelligence and machine learning to advance the study and treatment of cardiovascular disease. https://bit.ly/2tUVVSN ,7,0,3,True,
NorthwesternMed,2018-07-02,11:00:24,On today’s #QuickDose: medical emergencies have their own timeline. Here’s how to prepare before your trip. #HealthTips http://bit.ly/2tZ59gT ,2,0,1,True,"#QuickDose,#HealthTips"
chicagotribune,2018-07-01,20:48:31,Kids who have difficulties standing or walking independently have a chance to be mobile and independent thanks to motorized cars retrofitted by Northwestern students.“The inclusiveness is so important for these kids.” https://trib.in/2KzEscW  pic.twitter.com/MJSNLuCsa3,98,5,32,True,
NorthwesternMed,2018-06-30,11:00:23,Forgetfulness or dementia? Learn the difference and when it's time to see a physician.  http://bit.ly/2IFJpM7  pic.twitter.com/1NicM6ldbT,8,0,3,True,
NorthwesternMed,2018-06-29,11:06:01,A new drug is being used to help fight #prostatecancer. @ChrisHushNBC met with @CaPsurvivorship to learn more about this breakthrough clinical trial. https://www.nbcchicago.com/on-air/as-seen-on/web---new-drug-released-for-prostate-cancer_Chicago-486883861.html …,7,0,3,True,#prostatecancer
NorthwesternMed,2018-06-29,11:00:12,#WaterSafety is extremely important. Here is what you should know about #DrowningPrevention. #Parenting http://bit.ly/2yUfWOX ,1,0,1,True,"#WaterSafety,#DrowningPrevention,#Parenting"
NorthwesternMed,2018-06-28,12:22:01,"A new study lead by Maha Hussain, MD, oncologist for Northwestern Medicine and Deputy Director at @LurieCancer, shows promise in significantly lowering the risk of spreading or death for patients diagnosed with aggressive #prostatecancer. http://www.chicagotribune.com/news/local/breaking/ct-met-prostate-cancer-drug-20180626-story.html …",14,0,9,True,#prostatecancer
NorthwesternMed,2018-06-28,11:00:12,You’re not the only one enjoying the great weather. Find out where germs are hanging out this #summer and how to protect yourself and your family. http://bit.ly/2Iz3Uu6 ,4,0,2,True,#summer
NorthwesternMed,2018-06-27,11:00:21,"#HeartHealthy activities can be fun for the whole family. Here’s a to-do list you’ll actually enjoy finishing, with a little help from #NorthwesternMedicine! http://bit.ly/2yMC5i3 ",4,0,1,True,"#HeartHealthy,#NorthwesternMedicine"
NorthwesternMed,2018-06-27,09:03:54,Pssst! Northwestern Medicine Immediate Care Glenview has a new look. Visit our website for more information:  https://bit.ly/2lBBZQZ . pic.twitter.com/3HuL9hN7v9,15,0,0,True,
CrainsChicago,2018-06-26,19:33:08,"Bluhm family gives @NorthwesternMed $25 million, with part of the money funding a center that will use ""artificial intelligence and machine learning to advance the study and treatment of cardiovascular disease"" http://cra.in/Mndt0X3 ",36,1,8,True,
NUFeinbergMed,2018-06-26,10:58:34,"Dr. Katherine Wisner has dedicated her career to understanding how to treat pregnant and postpartum women with mental illnesses, such as #depression. Listen to her interview on our ""Breakthroughs"" #podcast to learn more:  https://bit.ly/2tH6CYU  @AsherCenterNU #pregnancy pic.twitter.com/qeNmlHL6em",21,0,12,True,"#depression,#podcast,#pregnancy"
NMCardiology,2018-06-26,08:05:40,"@NMCardiology is launching a new center dedicated to artificial intelligence and machine learning to improve diagnosis, treatment and research for cardiovascular disease, thanks to a generous donation from Neil Bluhm. Read more:  https://bit.ly/2tvCGQe  pic.twitter.com/ZZGskPQqCj",8,0,3,True,
NMCardiology,2018-06-25,16:37:49,Set your DVRs! @WilcoxHeart and @jonrichmd will be on @WindyCityLIVE on @ABC7Chicago tomorrow talking about heart failure treatment and research @NorthwesternMed. The show starts at 1 pm. #mustseeTV,13,0,4,True,#mustseeTV
LurieChildrens,2018-06-25,10:59:59,"On Fri, The Who frontman Roger Daltrey delivered a check for $500K on behalf of @TeenCancerUSA to help expand @LurieCancer Adolescent & Young Adult #Cancer program, a joint effort of @LurieChildrens and @NorthwesternMed led by Drs. Jennifer Reichek & Stacy Sanford. #all4your1 pic.twitter.com/acvf6uF6WR",40,0,14,True,"#Cancer,#all4your1"
NorthwesternMed,2018-06-25,10:08:33,What is the relationship between #diabetes and #heartdisease? Find out why this specific risk factor lands on our list of 10 signs it’s time to see a #cardiologist. http://bit.ly/2Kk0GfB ,6,0,1,True,"#diabetes,#heartdisease,#cardiologist"
LeeLindquistMD,2018-06-25,09:02:13,"""A prevailing myth is that older people are less comfortable with tech.""...Truths: 1) Older people use technology 2) Tech needs to be better designed for older adults. Great article by @chrissyfarr #geriatrics #seniors https://www.cnbc.com/amp/2018/06/22/why-apple-should-hire-your-grandmother.html?__twitter_impression=true …",40,5,29,True,"#geriatrics,#seniors"
NUFeinbergMed,2018-06-24,17:18:21,Scenes from a beautiful day at the #Chicago #PrideParade! 🏳️‍🌈 #pride🌈 #nufeinbergmed #northwestern #pridemonth🌈 pic.twitter.com/WtSrbG7Fw3,94,1,26,True,"#Chicago,#PrideParade,#pride,#nufeinbergmed,#northwestern,#pridemonth"
LeeLindquistMD,2018-06-23,17:10:07,Happy Saturday! Great time playing giant Operation game at @brookfield_zoo with @NorthwesternMed and my future geriatricians! pic.twitter.com/TTzKMJM7nI,13,0,2,True,
NorthwesternMed,2018-06-23,11:01:28,"A swimming accident left Julian paralyzed from the neck down, but our relentless care inspired his will to walk again.  http://bit.ly/2lrpl7g  pic.twitter.com/x3vBwqwiqf",11,0,2,True,
TeenCancerUSA,2018-06-22,18:30:44,"Today, we officially announced our partnership with @LurieCancer to expand the Adolescent and Young Adult (AYA) oncology program.THANK YOU @NorthwesternMed and @LurieChildrens and everyone involved! @TheWho pic.twitter.com/DH9Utq5OSh",45,0,13,True,
NorthwesternMed,2018-06-22,13:42:29,"Northwestern Medicine is proud to show our #pride, today and every day. Have a fun and safe time at the parade, Chicago! #PrideMonth 🏳️‍🌈 pic.twitter.com/1uwTckZYBc",50,0,18,True,"#pride,#PrideMonth"
NorthwesternMed,2018-06-21,11:37:53,Forgetting your keys is normal. Forgetting your car is not. Find out when to see a physician about #memoryloss. http://bit.ly/2Kc2rOY ,1,0,1,True,#memoryloss
NeurosurgeryNM,2018-06-21,09:26:10,Happy #NationalSelfieDay 🤳 via @babaksjahromi @MatthewPottsMD @mtwalshmd 😀👨‍⚕️ Lets see your #teamwork #selfie! pic.twitter.com/YA90B07781,8,1,1,True,"#NationalSelfieDay,#teamwork,#selfie"
NMOphthalmology,2018-06-21,09:27:26,Throw back Thursday to when @susieQP8 started the #NYerORCoverChallenge ! Pictured below are Drs. Anchala and Liu from @NMOphthalmology #womeninsurgery #womensurgeons pic.twitter.com/npJp1pVDLX,14,2,2,True,"#NYerORCoverChallenge,#womeninsurgery,#womensurgeons"
NUFeinbergMed,2018-06-20,21:39:09,Feinberg students and faculty open up about #LGBTQ acceptance.  #NorthwesternDiversity #Pride #PrideMonth #Chicago pic.twitter.com/reVpk1JGIN,29,1,12,True,"#LGBTQ,#NorthwesternDiversity,#Pride,#PrideMonth,#Chicago"
NorthwesternMed,2018-06-20,11:05:37,"Eating nutrient-rich fruits and vegetables is essential to a #hearthealthy diet. The next time you’re at the #farmersmarket, pick up some in-season produce. #HealthyEats http://bit.ly/2K0JZpb ",4,0,2,True,"#hearthealthy,#farmersmarket,#HealthyEats"
NorthwesternMed,2018-06-19,10:00:16,"Struggling to manage your weight? You’re not alone. From diet consultations to the latest surgical procedures, at Northwestern Medicine, our patients have options and bariatric specialist Matthew Pittman, MD, is here to discuss them. Make sure to tune in today at 12:00 pm CST! pic.twitter.com/gteUi78Z8n",4,0,0,True,
NUFeinbergMed,2018-06-19,08:37:04,"Through innovative transitional care programs, @NorthwesternMed clinicians are helping vulnerable patients achieve healthier lives after leaving the hospital:  http://bit.ly/2yj2HqI  @NorthwesternEM pic.twitter.com/sY97CYyQRI",11,0,7,True,
ABC7Chicago,2018-06-17,18:50:32,HEARTWARMING! This Chicago cancer survivor is celebrating his first Father's Day:  https://abc7.ws/2M18dR3  pic.twitter.com/u0tdr1nvwV,39,0,4,True,
NorthwesternMed,2018-06-18,13:57:50,It's a hot one out there! Make sure you know the signs and symptoms of heat-related illnesses. http://www.nmbreakthroughs.org/daily-health/guide-to-heat-related-illness …,11,0,1,True,
ChiHealthMag,2018-06-18,12:40:12,"An estimated 3.5 percent of kids and teens in the U.S. have chronic high blood pressure. Experts from @NorthwesternMed, @LurieChildrens, and @LoyolaHealth help explain the rising problem and, more importantly, what can be done about it: http://bit.ly/2I30K31 ",8,1,5,True,
NorthwesternMed,2018-06-18,11:00:11,"Does size matter? This #MensHealthMonth, we’re decoding the symptoms and dangers of enlarged organs. http://bit.ly/2JWKoJi ",4,0,0,True,#MensHealthMonth
TrinaOrlando,2018-06-17,21:50:45,When you have babies six weeks apart... you swap places and take same pic in same hospital 🤗 (I’m trying to not be bitter about how AMAZING @NatalieMNBC looks 24 hours after having a baby 😏) #BabyBrooks #BabyGama #ArabellaB #SailorGama #NBC5BabyBoom #NewsBabies @NorthwesternMed pic.twitter.com/octbr3CTcq,25,2,1,True,"#BabyBrooks,#BabyGama,#ArabellaB,#SailorGama,#NBC5BabyBoom,#NewsBabies"
NeurosurgeryNM,2018-06-17,13:05:38,@LurieCancer Rare catch: the (usually impeccably dressed) Dr. Chandler finally acquiesces to an impromptu selfie w/ @babaksjahromi #selfiesunday #neurosurgery #teamwork #teamworkmakesthedreamwork #workfun #northwesternmedicine #neurosurgerynm #MBTI #sundayfunday @luriecancer @NorthwesternMed pic.twitter.com/wu2h9kv8Wc,31,1,6,True,"#selfiesunday,#neurosurgery,#teamwork,#teamworkmakesthedreamwork,#workfun,#northwesternmedicine,#neurosurgerynm,#MBTI,#sundayfunday"
