username,date,time,tweet,likes,replies,retweets,retweet,hashtags
NorthwesternMed,2018-01-22,15:18:33,"Join us in congratulating Erin Gard, who on January 20, 2018 celebrated one year of being #SeizureFree! After receiving care from Dr. Schuele, she and her mother give thanks to the entire #Epilepsy and #Neurology teams. #NMBetter pic.twitter.com/HDEoshra4m",24,0,3,True,"#SeizureFree,#Epilepsy,#Neurology,#NMBetter"
NorthwesternMed,2018-01-22,13:29:58,Stuffy nose got you reaching for a warm bowl of chicken noodle soup? Find out why:  http://bit.ly/2j4SCmV  pic.twitter.com/XDYcSEyHAK,2,0,0,True,
NorthwesternMed,2018-01-21,11:00:00,"Cow’s milk, #almondmilk and everything in between! Get a quick rundown on the pros and cons of different types of #milk. #NMQuickDose http://bit.ly/2CBNi38 ",4,0,2,True,"#almondmilk,#milk,#NMQuickDose"
NorthwesternMed,2018-01-20,18:10:11, pic.twitter.com/hTz3BL5zfI,13,0,3,True,
NorthwesternMed,2018-01-20,14:00:00,Losing momentum on your #fitness goals? Start logging! Studies suggest online activity is tied to #weightloss: http://bit.ly/2AD9k4c ,2,0,0,True,"#fitness,#weightloss"
NorthwesternMed,2018-01-20,11:00:04,"Washing your hands can prevent as many as 200 diseases, but can you over-wash? #QuickDose http://bit.ly/2FJk17W ",3,0,3,True,#QuickDose
NorthwesternMed,2018-01-19,11:00:04,Don't let Jack Frost stop you from #exercising! Warm up with a new #workoutplan: http://bit.ly/2ASjamF ,2,0,2,True,"#exercising,#workoutplan"
babaksjahromi,2018-01-18,18:54:29,Hosting quarterly EMS educational forum now at Northwestern Memorial Hospital. Great turnout from our life-saving #EMS colleagues! #firstresponder #paramedic#timeisbrain #hospital #healthcare #stroke #ELVO #aneurysm pic.twitter.com/EPb2U3xd79,18,1,2,True,"#EMS,#firstresponder,#paramedic,#timeisbrain,#hospital,#healthcare,#stroke,#ELVO,#aneurysm"
NorthwesternMed,2018-01-18,15:23:28,We're behind the scenes with @RonMott at Northwestern Memorial Hospital. Make sure to tune into the @TODAYshow tomorrow morning for a report on the nationwide #flu outbreak! pic.twitter.com/smqP9z2BCw,8,0,4,True,#flu
NUFeinbergMed,2018-01-18,10:30:04,"Newly diagnosed with malignant #glioblastoma, Harold “Woody” Wolff was looking for his best chance at beating one of the deadliest of brain cancers. He received that chance — and much more when we sought a second opinion from @NorthwesternMed neurosurgeons  http://bit.ly/2DnjVFF  pic.twitter.com/8zRt7iL4Eh",18,0,4,True,#glioblastoma
joshuarosenowMD,2018-01-18,00:43:02,"Whew!  Survived first day of clinic in our new home, the Regenstein Center for Neurological Care. We're still figuring out where everything is but it's #HomeSweetHome. #neurosurgery @NeurosurgeryNM @NorthwesternMed pic.twitter.com/stIrbm2r0s",17,1,3,True,"#HomeSweetHome,#neurosurgery"
NorthwesternMed,2018-01-18,11:00:01,Is your tummy trouble something more? Read up on the early signs of #digestive problems in women: http://bit.ly/2CCyroO ,1,0,1,True,#digestive
NorthwesternMed,2018-01-17,16:00:01,Does your #NewYearResolution take your #hearthealth into consideration? It's never too early to start thinking about it! Learn how a heart-healthy #diet makes an impact from an early age: http://bit.ly/2ADSuSo ,3,0,4,True,"#NewYearResolution,#hearthealth,#diet"
NorthwesternMed,2018-01-17,13:30:01,"Aches and pains, oh my! Learn when it's time to consult a physician about your muscle aches and #jointpains. #QuickDose http://bit.ly/2B75oI3 ",1,0,0,True,"#jointpains,#QuickDose"
NUFeinbergMed,2018-01-17,10:00:07,.@NorthwesternMed scientists have developed an algorithm that uses brain scans to predict language ability in deaf children after they receive a cochlear implant:  http://bit.ly/2Bag7Bx  pic.twitter.com/dViPYrKlNL,5,0,3,True,
NorthwesternMed,2018-01-17,09:59:22,Planning to see a friend or relative with #Alzheimers? Here’s how to communicate with compassion: http://bit.ly/2mK42yS ,0,0,0,True,#Alzheimers
NorthwesternMed,2018-01-16,16:36:53,Check this out! #HealthTech https://twitter.com/chicago_spine/status/953393777728720903 …,11,0,5,True,#HealthTech
NUFeinbergMed,2018-01-16,11:02:04,The Chicago campus is quickly transforming into a winter wonderland! #Chicago #Winter pic.twitter.com/KhrA0bPlfU,18,0,9,True,"#Chicago,#Winter"
NorthwesternMed,2018-01-16,11:23:22,"Congratulations to @NeurosurgeryNM and Neurology 🧠on the move to their new location, the Regenstein Center for Neurological Care! Visit our website to learn more:  http://bit.ly/2FFCkLB  pic.twitter.com/6uY6ohNaf8",10,0,1,True,
NorthwesternMed,2018-01-15,16:00:01,"Meet Abby Toms, a social worker at Northwestern Memorial Hospital, and yet another one of this year’s recipients of the Reverend Dr. Martin Luther King Jr. #Humanitarian Award. Click to learn more about her volunteer work with @rapevictimadv. #MLKDay http://bit.ly/2FHvu87 ",8,0,4,True,"#Humanitarian,#MLKDay"
NorthwesternMed,2018-01-15,14:00:00,"Meet Mamta Swaroop, MD, a trauma surgeon for Northwestern Medicine and one of four recipients of the Reverend Dr. Martin Luther King Jr. #Humanitarian Award. See how her international first responder courses have made their way to the South Side. #MLKDay http://bit.ly/2DfvzCE ",18,1,8,True,"#Humanitarian,#MLKDay"
NorthwesternMed,2018-01-15,12:30:02,"Meet Beth Froese, MD, from Northwestern Medicine Regional Medical Group. She is another one of this year’s recipients of the Reverend Dr. Martin Luther King Jr. #Humanitarian Award. Visit our YouTube to learn more about her volunteer work in Kenya. #MLKDay http://bit.ly/2DgVCcg ",5,0,2,True,"#Humanitarian,#MLKDay"
NorthwesternMed,2018-01-15,11:13:46,"Meet Kris Ongkiko, RN, from Northwestern Medicine Lake Forest Hospital, one of this year’s recipients of the Reverend Dr. Martin Luther King Jr. #Humanitarian Award. See how her local work with Teens for Unity positively impacts our communities. #MLKDay https://youtu.be/aVpCnI6Sf1c ",7,0,2,True,"#Humanitarian,#MLKDay"
NorthwesternMed,2018-01-15,11:00:00,"What is the mortality rate of #openheartsurgery? With over 10,000 #cardiac procedures under his belt, Patrick McCarthy, MD, Executive Director of the Bluhm Cardiovascular Institute, explains the risks: http://bit.ly/2Cjwqxd ",1,0,0,True,"#openheartsurgery,#cardiac"
NorthwesternMed,2018-01-15,10:47:33,"Last Thursday, Northwestern Medicine celebrated the life of #MLK and his ongoing legacy of service during the 39th Annual Humanitarian Awards Program hosted at Northwestern Memorial Hospital. Today, we'll be sharing stories of those remarkable recipients:  http://bit.ly/2D8Oz1a  pic.twitter.com/ZptJKNnyJt",13,0,5,True,#MLK
NorthwesternMed,2018-01-14,11:00:00,Stay informed this #cervicalhealth awareness month! Here are 5 myths about #gynecologiccancer: http://bit.ly/2BeyEhM ,3,0,3,True,"#cervicalhealth,#gynecologiccancer"
NorthwesternMed,2018-01-13,11:00:02,"New year, new doctor? Consider these 5 factors when choosing a #primarycare physician: http://bit.ly/2AAtkEx ",3,0,3,True,#primarycare
NorthwesternMed,2018-01-12,14:00:00,"For the 12% of men who will be diagnosed with #prostatecancer, proton therapy can work as a powerful treatment alternative. Click to learn more: http://bit.ly/2CASjc7 ",4,0,3,True,#prostatecancer
NUFeinbergMed,2018-01-12,12:30:01,The glass exterior of the new Simpson Querrey Biomedical Research Center is nearly complete! Isn’t it amazing to see so much progress in just a few short months? Watch a video to see how far the building has come in the 2 years since we broke ground:  http://bit.ly/2D7WujL  pic.twitter.com/2rNgpgMQl9,3,0,1,True,
NorthwesternMed,2018-01-12,10:54:56,"Maha H. Hussain, MD, is translating innovative researchinto unsurpassed #cancer care for #Chicagoans. Visit the link to read more her ongoing efforts:  http://bit.ly/2D4Qyrr  pic.twitter.com/y7oFXZHB1m",4,0,0,True,"#cancer,#Chicagoans"
NorthwesternMed,2018-01-12,10:44:08,"Due to the increased risk of #cold and #flu viruses, we ask for your help in protecting the health of our patients. Please view the new visitor guidelines at  http://flu.nm.org .",13,1,5,True,"#cold,#flu"
NUSportsMed,2018-01-12,10:08:12,Things to keep in mind as the temperature drops ❄️☃️ #brrr #layer #prevention pic.twitter.com/pODVk7yOC9,14,0,7,True,"#brrr,#layer,#prevention"
NorthwesternMed,2018-01-11,14:00:03,"10 questions about #gynecological #cancer, answered: http://bit.ly/2kvhzbw ",0,0,0,True,"#gynecological,#cancer"
NorthwesternMed,2018-01-11,12:02:33,Good luck on #MovingDay! https://twitter.com/NeurosurgeryNM/status/951512300887969792 …,7,0,0,True,#MovingDay
NorthwesternMed,2018-01-11,11:16:37,Got Milk? #NationalMilkDay http://bit.ly/2EzOBPZ ,4,0,3,True,#NationalMilkDay
NorthwesternMed,2018-01-11,10:33:35,Northwestern Rehabilitation at Central DuPage and Delnor Hospital offers a wide range of advanced #rehab services. Their cutting-edge total joint program even allows qualifying patients to go straight home and into outpatient therapy. Click to learn more:  http://bit.ly/2zfsIpj  pic.twitter.com/OTbSndrcro,4,0,1,True,#rehab
joshuarosenowMD,2018-01-10,19:41:28,Movin' on up to a deluxe clinic in the sky!  Great views. Phone number is the same 312-695-8143. @NeurosurgeryNM @NorthwesternMed @NM_365 #newdigs #makingmemories #wheresthebathroom pic.twitter.com/mfy4O3ln1l,18,1,4,True,"#newdigs,#makingmemories,#wheresthebathroom"
DrStreicher,2018-01-10,07:40:46,Back from my trip to #Myanmar. Join me at 9:15 @WGNMorningNews when I share stories about birthing babies in Burma! @NorthwesternMed pic.twitter.com/TFgZ4SrxAJ,7,0,2,True,#Myanmar
NorthwesternMed,2018-01-09,14:45:35,Celebrating nine days into the #NewYear with our #BestNine! We shared several stories throughout 2017 and are looking forward to many more “purple moments” in the year ahead. Make sure to follow along! #NMBetter #ColorOfTheYear @pantone 💜 pic.twitter.com/bW3iJE1Ebl,12,0,4,True,"#NewYear,#BestNine,#NMBetter,#ColorOfTheYear"
NMCardiology,2018-01-09,10:12:53,"@NorthwesternMed #icymi @nytimes featuring Dr. @dmljmd at @northwesternmed! ""...Testing for lp(a) should be considered for people with early-onset cardiovascular disease — which means younger than age 50 for men and age 60 for women — or a strong family history of it."" http://ow.ly/TGkM50g4nGd ",8,0,3,True,#icymi
chicagotribune,2018-01-07,20:36:50,"Life after locked-in syndrome: Aurora man finds will to live after rare, paralyzing condition  http://trib.in/2CDlECq  pic.twitter.com/pf2HeIi1JW",18,1,9,True,
LurieChildrens,2018-01-09,07:20:01,"Netflix’s “Rotten” episode, “The Peanut Problem,” featuring Lurie Children's food allergy researcher Dr. Ruchi Gupta, brings awareness to the rise in food allergies See the “Rotten” trailer here:  http://bit.ly/2CRZq2Q  . #all4your1 #foodallergy",24,0,9,True,"#all4your1,#foodallergy"
NorthwesternMed,2018-01-08,14:00:03,Large-scale study finds not all clot-busting drugs should be used in patients with #bloodclots in their legs:  http://bit.ly/2yEAVQp  pic.twitter.com/ZA8JpNVjaf,2,0,1,True,#bloodclots
NorthwesternMed,2018-01-08,10:40:39,"Anchored by Northwestern Memorial Hospital, the highest-ranked #cardiology and #heartsurgery program in #Illinois by @usnews for 10 years straight, we’re on a never-ending pursuit of excellence. Discover how what makes us better, makes you better. pic.twitter.com/aTCP2ormjK",20,0,7,True,"#cardiology,#heartsurgery,#Illinois"
NorthwesternMed,2018-01-07,11:30:38,"We've got #babynews to report! Valley West Hospital welcomed its first baby of 2018--and it's a boy! Please meet Zayon Ezekiel, born on 1/5/18 at 12:04 pm, weighing 7 lbs,13 oz and 19.5 inches. Congratulations to the Papsch family! pic.twitter.com/vY6Oxyy239",8,0,1,True,#babynews
NorthwesternMed,2018-01-05,11:56:18,The #NewYear is off to a beautiful start as we celebrate the first babies born across the Northwestern Medicine health system -- all of them girls! Congratulations to the families on their sweet bundles of joy! May your 2018 be filled with #health and #happiness. pic.twitter.com/D2wvwGntdg,17,0,4,True,"#NewYear,#health,#happiness"
NUFeinbergMed,2018-01-05,11:26:01,"“It’s all about helping seniors age in place — because that’s really the best place for seniors to be” —@LeeLindquistMD, on innovative program offering primary care visits in seniors’ own homes:  http://bit.ly/2m0IihS  @NorthwesternMed pic.twitter.com/P4UUzkxSqC",14,0,6,True,
NorthwesternMed,2018-01-04,16:43:14,Way to go Megan! @meglynn984 https://twitter.com/tracyswartz/status/949048287654498305 …,12,1,1,True,
EpilepsyChicago,2018-01-04,14:12:54,Thank you Dr. Katie Bandt from @NorthwesternMed for stopping by EFGC today to talk about the latest advances in epilepsy surgery. It was a great Lunch and Learn! #EpilepsyChicago pic.twitter.com/hAZVoJPZFI,9,1,3,True,#EpilepsyChicago
NorthwesternMed,2018-01-04,11:00:01,Do you know just how dirty your phone is? Northwestern Medicine experts weigh in. #NMQuickDose http://bit.ly/2AREusG ,2,0,0,True,#NMQuickDose
MedscapeGastro,2017-12-20,13:41:00,The 10 must-read studies of the year for #gastroenterologists: http://ms.spr.ly/6017rI0hV ,6,0,8,True,#gastroenterologists
NorthwesternMed,2018-01-04,09:52:48,"#EosinophilicEsophagitis is listed on @MedscapeGastro as one of the top 10 Practice Changing 2017 “Must Reads” in #Gastroenterology. Register for free to learn more about the findings of Ikuo Hirano, MD:  http://bit.ly/2lTFfH6  pic.twitter.com/ipKWE833z6",2,0,1,True,"#EosinophilicEsophagitis,#Gastroenterology"
NorthwesternMed,2018-01-03,15:09:40,"Take a listen! Chris Malaisrie, MD, talks to @WGNRadio about advances in #cardiacsurgery here at Northwestern Medicine: http://bit.ly/2Ajsz1n ",7,0,4,True,#cardiacsurgery
NorthwesternMed,2018-01-03,14:00:01,"Is #mealprepping on your list of healthy changes for the #newyear? Here's a guide to making delicious, nutritious and ready-to-eat meals: http://bit.ly/2BhpCAw ",4,0,1,True,"#mealprepping,#newyear"
NorthwesternMed,2018-01-03,11:57:18,"Did you know that people who can digest #dairy are actually in the minority? Learn the truth about dairy products, milk substitutes and calcium consumption in our latest article: http://bit.ly/2j6Obbu ",5,0,0,True,#dairy
NorthwesternMed,2018-01-03,11:17:42,"During her 12-week ultrasound, a cyst was found on Melinda's right ovary. After immediate surgery, recovery and three rounds of #chemotherapy, she is now the happy, healthy and #cancerfree mother of Dennis. Read more about her incredible journey:  http://trib.in/2lR2MZl  pic.twitter.com/amxSsoil5V",11,0,4,True,"#chemotherapy,#cancerfree"
NorthwesternMed,2018-01-02,11:48:06,"According to Jonah Stulberg, MD, roughly 80% of #opioids prescribed to patients by surgeons go unused. As a result, he's established a medication disposal program. Click to learn more about his ongoing efforts to lower the number of pills prescribed: http://cbsloc.al/2CFzGnO ",8,0,1,True,#opioids
NUFeinbergMed,2018-01-02,11:28:01,A new @NorthwesternMed study flips long-held beliefs that there is an unexplained or genetic reason why black adults have double the rate of diabetes compared to white adults.  http://bit.ly/2lGJu9I  pic.twitter.com/4FSYsNQ8zZ,12,0,5,True,
NorthwesternMed,2018-01-02,11:00:03,"While #lungcancer is the leading cause of #cancer deaths for both men and women in the United States, it should not be equated with hopelessness. Learn more about the new treatments available: http://bit.ly/2AREYie ",3,0,3,True,"#lungcancer,#cancer"
ABC7Chicago,2018-01-01,07:30:07,New Year's babies born across the Chicago area  http://abc7.ws/2DHDBzF  pic.twitter.com/JOGyifcLkl,29,1,4,True,
WGNNews,2018-01-01,06:39:10,CONGRATS! Meet the first Chicago-area babies born in 2018  http://via.wgntv.com/zuwxE  pic.twitter.com/XhoTNcEGpi,54,0,10,True,
nbcchicago,2018-01-01,12:30:27,Meet the #Chicago area's first babies of 2018  http://nbcchi.com/KIbAp0Q  pic.twitter.com/XJ9saVi5CJ,22,0,5,True,#Chicago
NorthwesternMed,2018-01-01,02:41:50,@CBSThisMorning @MegynTODAY @HuffPost @mashable @BuzzFeed @parentsmagazine,0,0,0,True,
NorthwesternMed,2018-01-01,02:40:15,@TODAYshow,0,0,0,True,
NorthwesternMed,2018-01-01,02:39:45,@GMA,0,0,0,True,
NorthwesternMed,2018-01-01,02:38:57,"We’ve also got some exciting #babynews! Please meet Maren—she was the first Northwestern Medicine baby of #NYE2018, born at 12:10 am at Central DuPage weighing 6 lbs, 14 oz. and 20 inches. Congratulations to the happy family! pic.twitter.com/1jKM6nzBLl",28,4,1,True,"#babynews,#NYE2018"
NorthwesternMed,2018-01-01,01:05:45,"From everyone at Northwestern Medicine, #HappyNewYear! May your 2018 be filled with #health and #happiness!",28,0,9,True,"#HappyNewYear,#health,#happiness"
NorthwesternMed,2017-12-31,14:00:01,"The #NewYear. The middle of March. September 25th. No matter the time of year, taking care of yourself should be top priority. Here are 10 easy tips: http://bit.ly/2ClbPZb ",5,0,1,True,#NewYear
NorthwesternMed,2017-12-31,11:00:03,"From chocolate milkshakes to #kale, see how America’s dieting landscape has progressively changed: http://bit.ly/2AAEGZ4 ",1,0,0,True,#kale
NorthwesternMed,2017-12-30,15:08:00,Two more days till New Year’s Day! Where will the first Northwestern Medicine baby be born?,2,0,2,True,
NorthwesternMed,2017-12-30,14:00:02,Winter weather got your joints aching? Here are a few ways to battle through the colder months: http://bit.ly/2BhnRDq ,3,1,2,True,
NorthwesternMed,2017-12-30,11:00:02,"Sure, #snoring is annoying for those who have to listen to it, but it can also cause or be a sign of #health problems for the snorers themselves. Get the scoop from a Northwestern Medicine physician: http://bit.ly/2yFTxQ9 ",2,0,2,True,"#snoring,#health"
NorthwesternMed,2017-12-29,14:00:00,Ready to rock into the #NewYear? Keep these safety tips in mind when the ball drops: http://bit.ly/2j3RjEW ,3,0,4,True,#NewYear
NorthwesternMed,2017-12-29,10:13:50,The New Year is almost here! Will the first Northwestern Medicine baby of 2018 be a girl or a boy?,1,0,1,True,
NorthwesternMed,2017-12-28,14:11:07,Social Media Helps Australian Man Get Advanced Cancer Treatment at @ChicagoProton http://bit.ly/2CeoY9X ,4,0,1,True,
NorthwesternMed,2017-12-28,14:00:01,Still on the fence about the #flushot? Here's who should definitely get one: http://bit.ly/2j8uPma ,2,0,1,True,#flushot
NorthwesternMed,2017-12-28,11:00:02,Obsessed with #skincare? Find out which fads are actually worth trying in our latest article: http://bit.ly/2CiKcA2 ,1,0,0,True,#skincare
WBBMNewsradio,2017-12-27,19:19:08,"Krystin Friend was just 14-years-old when she was diagnosed with a chronic disease. This week, she gave birth to a healthy baby girl! http://cbsloc.al/2E2ZhYj ",10,0,3,True,
cbschicago,2017-12-27,19:19:09,"Krystin Friend was just 14-years-old when she was diagnosed with a chronic disease. This week, she gave birth to a healthy baby girl! http://cbsloc.al/2E2ZhYj ",14,0,7,True,
NorthwesternMed,2017-12-27,14:00:01,"While #coldweather is often associated with health risks like frostbite and hypothermia, it can also affect your heart. Learn why #heartattacks are more common in the cold: http://bit.ly/2Bgsqy2 ",3,0,4,True,"#coldweather,#heartattacks"
NorthwesternMed,2017-12-27,13:26:15,"It’s a Christmas Miracle! @DanaRebikWGN stopped by to interview Daniel Ganger, MD about his patient’s triumph! #transplant pic.twitter.com/JM0H9cKuq0",9,0,3,True,#transplant
NorthwesternMed,2017-12-27,13:22:19,Guess details of Northwestern Medicine’s first baby of 2018! What will be the baby’s height?,3,0,1,True,
NorthwesternMed,2017-12-27,11:00:04,An ink spill sparked the invention of bioactive tissue papers. Find out what this means to the medical world: http://bit.ly/2yFp1Wv ,2,0,2,True,
NorthwesternMed,2017-12-26,14:00:01,"When the #snow comes down, the layers come on. Learn how to bundle up your children as best you can: http://bit.ly/2og8Yic ",6,0,4,True,#snow
NorthwesternMed,2017-12-26,11:00:04,"Better #volleyball training starts now! Sign up today for our Athletic Training and Sports Performance Clinic to jump higher, react faster and dig deeper:  http://bit.ly/2zU3aPE ",3,1,1,True,#volleyball
NorthwesternMed,2017-12-25,14:00:00,Still trying to decide on your #NewYearResolutions? Here are a few tips for choosing ones that actually last: http://bit.ly/2zfZjeT ,0,0,0,True,#NewYearResolutions
Lisa_Fielding,2017-12-25,12:17:38,A special day at @LurieChildrens as @CardinalBCupich visits & blesses young patients hospitalized on #ChristmasDay pic.twitter.com/crfkabl6lY,17,0,3,True,#ChristmasDay
NorthwesternMed,2017-12-25,11:00:01,#HappyHolidays not so happy? Here's how you can support a friend or family member during a particularly difficult time: http://bit.ly/2yYtYtG ,2,0,1,True,#HappyHolidays
NU_IntMed,2017-12-25,07:54:50,"Complimentary Christmas lunch and dinner will be served in the Prentice Cafeteria (2nd floor) from 11:00 am to 2:00 pm, 4:00 pm to 8:00 pm, and 11:00 pm to 2:00 am today!",12,0,2,True,
NorthwesternMed,2017-12-24,11:00:03,Debilitating #depression and #anxiety made life feel like an act. It took finding the right kind of therapy for Caitlin to feel alive again: http://bit.ly/1QhRSHz ,2,0,1,True,"#depression,#anxiety"
babaksjahromi,2017-12-23,20:28:30,Happy Holidays from the Northwestern Cerebrovascular Team!#Christmas#BestWishes pic.twitter.com/Fa9d2sa6X4 – at Northwestern Memorial Hospital,38,1,4,True,"#Christmas,#BestWishes"
NorthwesternMed,2017-12-23,14:00:00,"From #holiday feasts to late nights, it's normal for these weeks to start to drag. Here are 10 #healthy snacks to jump start your afternoons: http://bit.ly/2t6NVwJ ",7,0,3,True,"#holiday,#healthy"
NorthwesternMed,2017-12-23,11:00:04,Cheating on your #diet could be the key to sustaining it. Learn how: http://bit.ly/2kAKefw ,1,0,1,True,#diet
NorthwesternMed,2017-12-23,10:10:45,"Yesterday was a busy one out at Northwestern Medicine Central DuPage and Delnor Hospital! From colorful Band-Aids and plush toys to dozens of boxed up meals, our patients and the surrounding communities are well taken care of this holiday season. pic.twitter.com/3Q8zCLgR5K",13,0,5,True,
NorthwesternMed,2017-12-22,14:00:02,Cold weather and short days killing your #workout buzz? Check out these 5 ways to workout in the #winter: http://bit.ly/2ASjamF ,0,0,0,True,"#workout,#winter"
CTCorps,2017-12-22,12:03:11,Support Michelle Schwartz and therapy dog Shazam with a donation today!  These two delight patients @NorthwesternMed  https://www.z2systems.com/np/clients/caninetherapycorps/campaign.jsp?campaign=1&fundraiser=24& … pic.twitter.com/yLvJP33izn,5,0,1,True,
mattapgar,2017-12-22,11:09:03,Music to our ears: @NorthwesternMed Hospice #MusicTherapy helps those at end of life:  http://shawurl.com/37c0  pic.twitter.com/kgER4x1bMT,7,0,4,True,#MusicTherapy
NorthwesternMed,2017-12-22,11:00:02,"Do you really need to walk 10,000 steps per day? Here’s the truth behind recent #exercise trends: http://bit.ly/2CjqJ2j ",6,1,3,True,#exercise
NUFeinbergMed,2017-12-22,09:25:02,Wishing you all a relaxing and safe winter break! pic.twitter.com/pLG2zvoENc,24,0,7,True,
NeurosurgeryNM,2017-12-22,10:20:53, pic.twitter.com/HIZSZgpfuV,2,0,1,True,
NeurosurgeryNM,2017-12-22,10:20:32, pic.twitter.com/GNiNjWvgPM,3,0,1,True,
NeurosurgeryNM,2017-12-22,10:20:03, pic.twitter.com/PABdsn7DCN – at Northwestern Memorial Hospital Emergency Room,3,0,2,True,
NeurosurgeryNM,2017-12-22,10:19:11,"Images courtesy of Dianne Paige & family, as well as Dr. Jahromi. (Some information was edited for clarity, medium, & format) Check @babaksjahromi for doc info and a great set of videos he posted about her imaging and surgery. #aneurysm #MedEd",3,1,1,True,"#aneurysm,#MedEd"
NeurosurgeryNM,2017-12-22,10:17:17,"I know it takes a long time for #recovery to continue, and I know all in all I’m doing well. Just trying to be #patient and #accepting!” #MemoriesOf2k17 #GoodNews",2,1,2,True,"#recovery,#patient,#accepting,#MemoriesOf2k17,#GoodNews"
NeurosurgeryNM,2017-12-22,10:16:12,"I still have headaches, and a lot of anxiety about what happened, or could happen. Driving can be a nightmare, and I am only driving short distances. But I get a lot of reassurance from my husband, #family, and my docs…",2,2,1,True,#family
NeurosurgeryNM,2017-12-22,10:15:38,"After 3 weeks, I was transferred to Marion Joy. I wore a helmet for 3 months then had the #crainoplasty done.  In the meantime did occupational and speech therapy.  I did have #TersonSyndrome in my left eye, which I had #surgery July 2017.  Result have been great.",3,1,1,True,"#crainoplasty,#TersonSyndrome,#surgery"
NeurosurgeryNM,2017-12-22,10:14:36,My memory of the first week is very vague but my Mom and family report it was #awesome. @babaksjahromi and the @NorthwesternMed team checked on me several times a day and the #nurses poked and prodded endlessly (remembers and laughs)!,2,2,1,True,"#awesome,#nurses"
NeurosurgeryNM,2017-12-22,10:13:14,I'm not sure exactly when I became aware of my surroundings.  I think 2 days after the surgery?  I knew who my family was.  My Mom stayed with me for 9 days in my room.,1,2,1,True,
NeurosurgeryNM,2017-12-22,10:12:25,My husband was instructed to contact #family (which were all in Michigan and my youngest son in Connecticut).  The surgery was done around 4pm.,3,1,1,True,#family
NeurosurgeryNM,2017-12-21,15:05:11,We spoke with a patient of @babaksjahromi  and asked her to share her story about her #aneurysm journey. Check back tomorrow morning to find out more!,4,1,1,True,#aneurysm
VikHealth,2017-12-21,14:32:16,@NorthwesternMed Thank you for your taking the time to teach our students about important health topics!!#HealthyLiving #Lilltechtips #LiphardtLaura #d56achieves pic.twitter.com/jozdeb4AD2,6,0,1,True,"#HealthyLiving,#Lilltechtips,#LiphardtLaura,#d56achieves"
