username,date,time,tweet,likes,replies,retweets,retweet,hashtags
nyphospital,2018-06-21,10:58:15,"Before construction even began on the #NYP David H. Koch Center, every decision was based on one thing above all else: the patient. Learn more about our hospital of the future:  https://nyphosp.co/2tedsG8  #DHKatNYP pic.twitter.com/FPxpKIVZOc",34,1,6,,"#NYP,#DHKatNYP"
nyphospital,2018-06-21,08:00:06,"#TBT: #NewYork State Senator @LizKrueger's staff is ready to save a life with the help of @Hands_Only_CPR training! Do you know how to Check, Call and Compress? Learn more here:  http://bit.ly/2snqz5P  #HandsOnlyCPR #NYPInYourCommunity pic.twitter.com/ctecKff2pz",16,0,1,,"#TBT,#NewYork,#HandsOnlyCPR,#NYPInYourCommunity"
nyphospital,2018-06-20,18:10:35,It’s that time of year again—prom season! Employees & volunteers rolled out the red carpets for patients at #NYP’s Morgan Stanley Children’s Hospital & Komansky Children's Hospital to give them a night they will never forget!  http://bit.ly/2xLMlGd  CC @WeillCornell @ColumbiaMed pic.twitter.com/gko1DZdGiw,20,0,4,,#NYP
nyphospital,2018-06-20,15:00:02,"Join us in congratulating #NYP's Dr. Steven Corwin for receiving the @Glassdoor Employees' Choice Award, recognizing him as a top CEO in the nation. Dr. Corwin received an approval rating of 94% from employees, & we are so proud to have him as our leader!  https://nyphosp.co/2tbSur9  pic.twitter.com/DucExMiYd9",112,5,20,,#NYP
nyphospital,2018-06-20,13:00:01,#WellnessWednesday: Toss a simple salad together with seasonal produce to add a fresh side to your meal! #NYPBeHealthy pic.twitter.com/HSmxBcjMy1,11,1,8,,"#WellnessWednesday,#NYPBeHealthy"
nyphospital,2018-06-20,08:00:02,"Don't Miss the ""@Columbia University Opioid Symposium: Building New Collaborations Towards New Solutions,"" this Friday at 10:30am. Register today:  https://nyphosp.co/2MqPSO2  #OpioidCrisis pic.twitter.com/D8valwVNn2",8,0,2,,#OpioidCrisis
nyphospital,2018-06-19,20:02:04,Be our guest! We were excited to welcome families from across #NYC to @NYCPride’s Family Movie Night! We hope everyone had a fantastic evening with their loved ones. #NYPride #NYPInYourCommunity #Pride⁠ ⁠⁠ ⁠⁠ ⁠ pic.twitter.com/Rnc8cqIvuK,21,0,3,,"#NYC,#NYPride,#NYPInYourCommunity,#Pride"
nyphospital,2018-06-19,18:00:02,"“That’s what really attracted me to #oncology - the ability to establish a strong relationship in a really stressful time in a family’s life."" See what @JennyRuizMD loves most about working with pediatric cancer patients:  http://bit.ly/2x0aOI5 . #FacesofNYP #MeetTheResidents pic.twitter.com/M6UgtUmw8G",14,0,2,,"#oncology,#FacesofNYP,#MeetTheResidents"
nyphospital,2018-06-19,17:43:05,"#NYP is proud to participate in @NYCPride’s Family Movie Night, featuring a screening of @Disney’s Beauty and the Beast and everyone’s favorite movie snack! #NYPride #Pride⁠ ⁠ pic.twitter.com/YiErVfgQvF",49,0,7,,"#NYP,#NYPride,#Pride"
nyphospital,2018-06-19,15:00:01,.@mgv16 is the Chief of Pediatric Spine and Scoliosis Service at #NYP Morgan Stanley Children's Hospital and attributes advances in #scoliosis care to our experts and their teamwork. CC: @ColumbiaDoctors #ScoliosisAwarenessMonth pic.twitter.com/Kh83uiSKJk,15,0,5,,"#NYP,#scoliosis,#ScoliosisAwarenessMonth"
AllofUsResearch,2018-06-13,10:40:49,"The All of Us Research Program does everything it can to keep participant data safe + private. In his latest @statnews op-ed, @ericdishman discusses the measures the program takes to safeguard participant confidentiality + info:  https://www.statnews.com/2018/06/13/entrusted-my-genetic-data-nih/ … #JoinAllofUs",23,0,20,True,#JoinAllofUs
nyphospital,2018-06-19,11:00:01,"Pediatricians want to clear up misconceptions about vaccines and their risks, so #NYP Morgan Stanley Children's Hospital's @AlokPatelMD is sharing common vaccine myths with @HealthiNation:  http://bit.ly/2GtLbPk  CC: @ColumbiaDoctors pic.twitter.com/ihBq1MU4i1",9,0,4,,#NYP
nyphospital,2018-06-19,08:00:01,Getting married during allergy season? @brides spoke with #NYP & @WeillCornell's Dr. William Reisacher for advice on how to beat spring allergies on your wedding day:  http://bit.ly/2JkOnPo  pic.twitter.com/luYE1OsD8f,5,0,2,,#NYP
nyphospital,2018-06-18,18:00:02,"When a battle w/ breast cancer led to a case of adult onset #scoliosis for 59 y/o Doris Leddy, she underwent a robotic procedure w/ #NYP's @lehmanspineNYC. Today she is standing tall & enjoying life, pain free!  http://bit.ly/2JqAu6z  CC: @ColumbiaDoctors #ScoliosisAwarenessMonth pic.twitter.com/QwYbc4qjwH",8,0,5,,"#scoliosis,#NYP,#ScoliosisAwarenessMonth"
nyphospital,2018-06-18,15:00:15,.@MensHealthMag is talking @Hands_Only_CPR with #NYP's Dr. Holly Andersen. See what she is saying about this life-saving 3-step technique:  http://bit.ly/2Jj3YmU  pic.twitter.com/VreXaul5Hs,10,0,5,,#NYP
ColumbiaNeuro,2018-06-18,10:37:31,Just one more hour until we're live on facebook with Dr. Peter Angevine to talk about adult #scoliosis. Be sure to tune in at 12:30pm EST!  http://Facebook.com/ColumbiaNeuro  #scoliosisawarenessmonth #neurosurgery #spinehealth CC.@nyphospital @ColumbiaDoctors pic.twitter.com/1dYfm8Zus0,4,0,3,True,"#scoliosis,#scoliosisawarenessmonth,#neurosurgery,#spinehealth"
nyphospital,2018-06-18,11:00:01,"While most women know to limit caffeine during pregnancy, the results of a new study may alarm you. #NYP & @WeillCornell's Dr. Susan Loeb-Zeitlin weighs in with @brides' @erinnicolemc:  http://bit.ly/2sMtN3L  pic.twitter.com/zLLokHStCi",3,0,2,,#NYP
nyphospital,2018-06-18,08:00:01,Did you know that itchy skin can reveal a lot about your health? #NYP's Dr. Anthony Rossi explains to @readersdigest:  http://bit.ly/2sySv8y  pic.twitter.com/is1bCIS5z8,3,0,1,,#NYP
nyphospital,2018-06-17,15:00:01,We are proud to announce that the #NYP Social Media team was recently recognized as the No. 1 hospital in the @convince comprehensive report on “The Best of Social Media from America’s Top Hospitals.” Learn more here about this exciting accomplishment:  http://bit.ly/2xIoCaG  pic.twitter.com/EgSrqNioIh,39,0,8,,#NYP
nyphospital,2018-06-17,13:00:01,Join us in wishing a Happy #FathersDay to all of the dads out there! Do you know a #NYP Dad who deserves a little extra recognition today? Be sure to tag them below!D pic.twitter.com/7cVEY0JpiZ,25,1,2,,"#FathersDay,#NYP"
nyphospital,2018-06-17,09:00:22,"Every day is #FathersDay for Drs. David & Benjamin Roye, who for the last 20 years have worked together to repair countless spinal deformities at #NYP Morgan Stanley Children’s Hospital:  http://bit.ly/2tcqFhT . CC @ColumbiaDoctors pic.twitter.com/p1uWXeCmRA",48,1,14,,"#FathersDay,#NYP"
nyphospital,2018-06-17,07:33:57,"We’re sending a big #thankyou to @KatiesArtProj, @Cornucopiaevent, @karla_w_a_K and everyone else who made last night so special for our patients! #Scat4Chat pic.twitter.com/VL4lLnx9m1",11,0,4,,"#thankyou,#Scat4Chat"
WebMD,2018-06-17,04:01:02,Darcy needed a liver transplant before she even reached her 2nd birthday. The hero that saved her life? Her dad. 💙 @nyphospital #FathersDay pic.twitter.com/wPzOuF3ulV,84,3,39,True,#FathersDay
nyphospital,2018-06-16,19:20:33,Our patients are lighting up the dance floor at #Scat4Chat! pic.twitter.com/vWZDnobfGk,31,0,3,,#Scat4Chat
nyphospital,2018-06-16,19:05:20,"#Prom isn’t just for patients - our #NYP leadership team loves prom too! Dr. Craig Albanese, @HopeCopperstone and  @BernadetteKhan love seeing our patients dance the night away! pic.twitter.com/gKflrwgDUI",35,0,2,,"#Prom,#NYP"
nyphospital,2018-06-16,18:51:47,Patients at #NYP Morgan Stanley Children’s Hospital #prom are all smiles tonight! #Scat4Chat pic.twitter.com/wWKl4vBVmU,25,0,2,,"#NYP,#prom,#Scat4Chat"
nyphospital,2018-06-16,18:43:07,Our friends from @KatiesArtProj helped us bring a flapper flair to #NYP prom! #Scat4Chat pic.twitter.com/VRmd4JYEZY,20,0,1,,"#NYP,#Scat4Chat"
nyphospital,2018-06-16,18:20:09,A big #thankyou to our group of CHAT teens for planning a fantastic Great Gatsy-themed #prom! #Scat4Chat pic.twitter.com/RbCmo57XPt,26,0,3,,"#thankyou,#prom,#Scat4Chat"
nyphospital,2018-06-16,18:07:46,Get your dancing shoes ready for #Scat4Chat! We’re looking forward to another great #NYP Morgan Stanley Children’s Hospital Prom. pic.twitter.com/5ROpwZcv7I,24,1,2,,"#Scat4Chat,#NYP"
nyphospital,2018-06-16,15:00:01,"#Prom night at #NYP is a beloved tradition, and we can't wait to celebrate again tonight with our incredible patients at #NYP Morgan Stanley Children's Hospital:  http://bit.ly/2xLMlGd  CC: @ColumbiaMed, @KidsAtColumbia #SCATwithCHAT #Flap4CHAT pic.twitter.com/PJlrKE7AQU",20,0,3,,"#Prom,#NYP,#NYP,#SCATwithCHAT,#Flap4CHAT"
nyphospital,2018-06-16,13:00:35,"“Every year, thousands of Americans die while waiting for a liver transplant due to the scarcity of donor organs.” See how Dr. Adam Griesemer is working to solve the organ donor crisis:  https://bit.ly/2Jp18ZA . #NYPTransplant pic.twitter.com/8koPoHPG9Z",7,0,1,,#NYPTransplant
nyphospital,2018-06-16,09:00:22,@ColumbiaDoctors .@ABC7NY explores how #NYP/ @columbiadoctors’ @mgv16 uses a new pediatric scoliosis treatment that's changing lives! Click to see more of Starla's amazing story:  http://7ny.tv/2yKgsx3  #ScoliosisAwarenessMonth pic.twitter.com/uZVqc071CP,10,1,3,,"#NYP,#ScoliosisAwarenessMonth"
nyphospital,2018-06-15,18:00:01,"Join us in congratulating #NYP's Marketing team & @SeidenNYC for winning @DTCPerspectives' Hospital Marketing National Advertising Award for the ""Best Multicultural Campaign"". Check out their award-winning #DoctorsDay ad below! pic.twitter.com/h4mYBm4M9t",20,1,2,,"#NYP,#DoctorsDay"
nyphospital,2018-06-15,15:00:01,"#ICYMI: We're proud to share that #NYP participated in the @HealthNYGov MAX Series Symposium which celebrated the completion of statewide MAX series efforts & featured highlights of successful community programs across #NewYork. CC: @WeillCornell, @ColumbiaMed #NYPinYourCommunity pic.twitter.com/CHOeGYkGcJ",8,0,1,,"#ICYMI,#NYP,#NewYork,#NYPinYourCommunity"
nyphospital,2018-06-15,14:00:04,Did you know that #NYP experts dedicated exclusively to spine care are attracting patients from around the globe? See how the state-of-the-art Daniel & Jane Och Spine Hospital stands tall as a world leader:  http://bit.ly/2o6cVlJ  CC: @ColumbiaDoctors #ScoliosisAwarenessMonth pic.twitter.com/OXX21KJQ88,6,0,4,,"#NYP,#ScoliosisAwarenessMonth"
nyphospital,2018-06-15,13:00:04,.@DJodorkovskyMD speaks with @divalentinope of the @greatist on how #anxiety may impact your GI track:  http://bit.ly/2HIlBqN . CC @ColumbiaDoctors pic.twitter.com/C5YX8ldhVy,6,0,4,,#anxiety
nyphospital,2018-06-15,11:00:02,How worried do you really need to be about so-called ‘Super Gonorrhea'? Learn more as #NYP/@ColumbiaDoctors @AnaGCepin shares her expert insight with @SELFmagazine:  http://bit.ly/2HiOTMo  pic.twitter.com/MJQq38oxbF,2,0,1,,#NYP
nyphospital,2018-06-14,18:00:07,"Each year, approximately 35,000 confirmed & probable cases of Lyme disease are reported in the United States, according to the @CDCgov. Learn how to protect yourself and your family against tick bites and Lyme disease from an #NYP/@ColumbiaDoctors expert:  http://bit.ly/2kWAlt3  pic.twitter.com/vvKs2JUJBD",8,0,4,,#NYP
nyphospital,2018-06-14,15:56:11,"#ThankYou to our incredible panel for educating us, and sharing personal stories during today’s Dialogues in Diversity Seminar, ""Exploring the Spectrum of Gender Identity: Caring for transgender and gender non-conforming patients, families and employees"". #NYPDiversity #NYPride pic.twitter.com/z6o9Nuu6Nz",15,1,5,,"#ThankYou,#NYPDiversity,#NYPride"
nyphospital,2018-06-14,15:51:01,#NYP’s Brandon Elgun on how to help create change: “Keep listening. Keep learning. Keep having discussions like this.” #NYPDiversity #NYPride #Pride pic.twitter.com/qZTBCCzdot,21,0,5,,"#NYP,#NYPDiversity,#NYPride,#Pride"
nyphospital,2018-06-14,15:00:09,"“There has been incredible strides made in Trans Health in #NYC, but there is still a lot of work for us to do.”- #NYP’s Emmet Phipps #NYPDiversity #NYPride #Pride pic.twitter.com/f197dE13tS",21,0,4,,"#NYC,#NYP,#NYPDiversity,#NYPride,#Pride"
nyphospital,2018-06-14,14:46:01,“We’re here because we have the support from the top. We have the opportunity to make a change.”- Brandon Elgun on #NYPDiversity and inclusion efforts. pic.twitter.com/VUVmRDlHdj,45,2,9,,#NYPDiversity
nyphospital,2018-06-14,14:42:27,"""What we need to do for our employees and our patients is to make sure we have a welcoming environment where everyone feels like they belong."" - @J_MMejia #NYPDiversity #NYPride #Pride pic.twitter.com/4Iy0IeyaTh",45,0,6,,"#NYPDiversity,#NYPride,#Pride"
nyphospital,2018-06-14,14:32:37,"""If you take one minute to see what it would be like to navigate the world differently, the world would be a better place.""- #NYP’s Marianna da Costa #NYPDiversity pic.twitter.com/ONs4U1jQ3h",16,0,5,,"#NYP,#NYPDiversity"
nyphospital,2018-06-14,14:04:43,"We are looking forward to an important conversation during today’s Dialogues in Diversity Seminar, ""Exploring the Spectrum of Gender Identity: Caring for transgender and gender non-conforming patients, families and employees"". #NYPDiversity pic.twitter.com/dIGxI15i09",16,0,3,,#NYPDiversity
nyphospital,2018-06-14,13:00:02,#TBT: #NYP Lower Manhattan Hospital employees proudly participated in yesterday's @NYBloodCenter Blood Drive and recognize the significant role blood donations play in caring for our patients. #NYPGreen pic.twitter.com/aTHdnxVdnz,7,0,1,,"#TBT,#NYP,#NYPGreen"
nyphospital,2018-06-14,11:00:02,"Join us in congratulating #NYP & @WeillCornell's Dr. Tony Rosen, who has been awarded the Jeffrey H. Silverstein Memorial Award for Emerging Investigators in the Surgical & Related Medical Specialties for his research focusing on geriatrics. Learn more:  http://bit.ly/2LariQ8  pic.twitter.com/FimKQ9mzM2",22,0,4,,#NYP
nyphospital,2018-06-14,09:00:03,"The #NYPBeHealthy team reminds you to take small breaks from technology to help unclutter your mind. For example, try disconnecting from electronic devices at least 30 minutes before bed. Check out some more sleep tips here:  https://bit.ly/2JHiQYi . pic.twitter.com/ID1TDccyWy",9,0,5,,#NYPBeHealthy
nyphospital,2018-06-14,08:00:03,"Last week @NYPQueens hosted a Continuing Medical Education event at @StJohnsU, that showcased #NYP's Mobile Stroke Treatment Unit (MSTU) and highlighted how we are advancing #stroke care. Learn more about the #MSTU here:  http://bit.ly/2uHEu7c  pic.twitter.com/dtbSYXcAwV",9,0,2,,"#NYP,#stroke,#MSTU"
nyphospital,2018-06-13,18:00:02,"The #NYP family is so proud of the 2018 Lang Youth Medical Program graduates! See how #NYP, in partnership with philanthropist Eugene Lang, aims to inspire #NewYorkCity students to become future leaders in #science and #healthcare!  http://bit.ly/2rkCGjX  #NYPinYourCommunity pic.twitter.com/MD5EzGoLhu",19,0,3,,"#NYP,#NYP,#NewYorkCity,#science,#healthcare,#NYPinYourCommunity"
nyphospital,2018-06-13,15:00:14,"Do you know how to ""Stop the Bleed""? Our amazing staff at #NYP Lower Manhattan Hospital does! We are proud to continue bystander emergency training, that could save someone's life with a just a few simple steps. pic.twitter.com/m7PMUlz1Wk",30,0,4,,#NYP
nyphospital,2018-06-13,13:00:03,"Join #NYP/@ColumbiaMed on Friday, June 22nd for an important symposium to help advance new efforts to address the #OpioidCrisis:  https://nyphosp.co/2MqPSO2  pic.twitter.com/WQQyEXGsSi",7,0,2,,"#NYP,#OpioidCrisis"
NYPBrooklyn,2018-06-13,10:44:04,"Up it goes! The last beam in the Center for Community Health, expected to open in 2020.  https://bit.ly/2sTJIxX  CC: @WeillCornell pic.twitter.com/GSxHmLLLHb",57,0,13,True,
nyphospital,2018-06-13,11:00:03,"Don't miss #NYP's next Dialogues in Diversity Seminar, ""Exploring the Spectrum of Gender Identity: Caring for transgender and gender non-conforming patients, families and employees""-Thursday, June 14th at 3pm in the Uris Auditorium. #NYPDiversity pic.twitter.com/KCvYIRcE2T",16,0,4,,"#NYP,#NYPDiversity"
nyphospital,2018-06-13,09:57:17,Blood drives are currently taking place across all #NYP campuses. Be sure to stop by and do your part! Appointments are available and walk-ins are welcome:  http://bit.ly/2qVK31d  #NYPGreen CC: @NYBloodCenter pic.twitter.com/utEnQRxA2c,18,0,5,,"#NYP,#NYPGreen"
nyphospital,2018-06-13,09:00:01,"ADHD is an umbrella term that describes kids who have various challenges with inattention, impulsivity, and hyperactivity. #NYP experts @AlokPatelMD and Dr. Susan Samuels speak with @HealthiNation about ADHD vs. being fidgety:  http://bit.ly/2IMhYoa  pic.twitter.com/KeIQMGx79k",9,0,1,,#NYP
nyphospital,2018-06-13,07:00:01,#NYP recognizes the significant role of blood donations in caring for our patients and others in the community. Join us and @NYBloodCenter today at one of our campuses. Appointments are available and walk-ins are welcome:  http://bit.ly/2qVK31d  #NYPGreen pic.twitter.com/EJVOD3QI8f,6,0,3,,"#NYP,#NYPGreen"
NYPJeffBokser,2018-06-12,21:13:22,@nyphospital Emergency Management Team spent the day learning from the @NWS about the future of climate to best prepare for maintaining operations during weather events to serve our patients and communities. #NYPBeReady pic.twitter.com/SQOUEy0R5l,26,1,6,True,#NYPBeReady
nyphospital,2018-06-12,17:28:09,They did it! Join us in congratulating the 2018 #NYP Lang Youth Medical Program graduating class! We wish them a wonderful future filled with success! #NYPPride pic.twitter.com/6v5aRI5TBD,43,0,8,,"#NYP,#NYPPride"
nyphospital,2018-06-12,17:04:23,"After 6 years of hard work and dedication, the #graduates can’t wait to receive their #diplomas! pic.twitter.com/6OSAZppaTi",13,0,4,,"#graduates,#diplomas"
nyphospital,2018-06-12,16:55:43,"“Work hard in everything you do in life, work as hard as you possibly can.” - #NYP’s Dr. Steven J. Corwin offers a piece of advice to this year’s graduates. pic.twitter.com/VcQt2RcaH4",24,0,6,,#NYP
nyphospital,2018-06-12,16:51:45,"“It’s very humbling to see you graduate here tonight and the pride your parents have in you, because certainly we have that.” - #NYP President and CEO Dr. Steven J. Corwin to our Lang Youth Medical Program graduates. pic.twitter.com/AdHCKPqHqt",8,0,4,,#NYP
nyphospital,2018-06-12,16:40:23,"“One decade later we have reached a goal of 100 graduating Lang Youth scholars, which is an incredible achievement.” - VP of #NYP’s Ambulatory Care Network, Davina V. Prabhu pic.twitter.com/l3N46fjaXU",8,0,3,,#NYP
nyphospital,2018-06-12,16:22:28,The stage is set for #NYP’s 10th Annual Lang Youth Medical Program Graduation ceremony! We can’t wait to celebrate this exceptional group of students. CC: @ColumbiaMed pic.twitter.com/W4eJaUv0Oq,11,0,5,,#NYP
nyphospital,2018-06-12,15:00:00,Did you know the health consequences of premature birth can be serious and lifelong? #NYP & @ColumbiaDoctors' @drcynthiagyamfi offers insight to @Healthline's @GWCitroner: http://bit.ly/2xtAOfd ,10,0,3,,#NYP
nyphospital,2018-06-12,13:00:02,#NYP/@ColumbiaDoctors' Dr. Wendy Chung is talking to @GMA about your genetic makeup and how your parents come into play. Click to learn more:  https://abcn.ws/2ryv1it  CC: @ABC pic.twitter.com/RA8GFmG61a,4,0,1,,#NYP
Ballingerae,2018-06-12,12:35:13,"“One of the challenges we face in health care design is that the way it’s delivered is changing at such a rapid pace,” –Erin Nunes Cooper, Ballinger associate principal. Read more in @ENRnews  https://www.enr.com/articles/44491-boxed-in-ny-hospital-project-thinks-out-of-the-box … #DHKatNYP pic.twitter.com/iEKdx9Hc2o",9,0,5,True,#DHKatNYP
nyphospital,2018-06-12,11:00:35,"There are 80 different organs in the human body, but only one super organ has the ability to regenerate – the liver. See how the liver’s ability to regenerate makes it possible to donate a part of your liver to someone in need:  https://bit.ly/2Jp18ZA . #NYPTransplant pic.twitter.com/SkNcUbZZ31",28,0,12,,#NYPTransplant
nyphospital,2018-06-12,08:00:08,What does your liver have in common with a #starfish? Click here to find out:  http://bit.ly/2M1nCBr . #NYPTransplant #HealthMatters pic.twitter.com/rjFGkoiJjQ,9,0,0,,"#starfish,#NYPTransplant,#HealthMatters"
nyphospital,2018-06-11,18:00:02,"Father and daughter duo, Corinne and Michael O’Mara have a special connection to the new #NYP David H. Koch Center. Corinne works as a nurse at #DHKatNYP, while Michael, an electrician, spent the last several years helping to bring the new state-of-the-art space to life! pic.twitter.com/2Jt5YVPA3j",41,0,2,,"#NYP,#DHKatNYP"
nyphospital,2018-06-11,16:00:02,We had so much fun this weekend sponsoring the Kid Zone at the @MarfanFdn's nationwide walk to help raise awareness and find a cure for Marfan and other related disorders. pic.twitter.com/SQ2AJt3cDU,12,0,2,,
nyphospital,2018-06-11,15:00:01,"""Death should not be an outcome of mental illness. And zero suicide is an absolutely achievable goal,"" #NYP/@ColumbiaDoctors' @DrJlieberman tells @CBSSunday: https://cbsn.ws/2l1MJb3 ",4,1,2,,#NYP
galeabrewer,2018-06-11,13:25:04,"Congratulations to @nyphospital on today's ribbon-cutting for new, first-of-its-kind Mothers Center! Learn more:  http://ow.ly/gLJM30krujS ",17,1,4,True,
nyphospital,2018-06-11,13:00:01,"The #NewYork area is currently experiencing a blood shortage, and #NYP needs your help! Join us and @NYBloodCenter for a blood drive on June 13th:  http://bit.ly/2qVK31d  #NYPGreen pic.twitter.com/uiks03ZvPY",11,1,7,,"#NewYork,#NYP,#NYPGreen"
nyphospital,2018-06-11,11:00:02,"""Unless we get care to the ambulatory setting and more convenient settings, we're not going to be able to reduce the cost of care in the country,""-#NYP's Dr. Steven Corwin tells @healthcaredive's @jeffpbyers:  http://bit.ly/2LFApcW  #DHKatNYP pic.twitter.com/Bwj4JZhrYZ",14,0,4,,"#NYP,#DHKatNYP"
nyphospital,2018-06-11,08:00:02,"#NYP is proud to provide care that is rooted in equality, respect & understanding for people from all walks of life:  http://bit.ly/2M4Ay9I  #PrideMonth #NYPDiversity #NYPPride #LGBTQ pic.twitter.com/mMNHyJVg17",80,0,25,,"#NYP,#PrideMonth,#NYPDiversity,#NYPPride,#LGBTQ"
nyphospital,2018-06-10,15:00:01,.@OncLive is discussing biomarkers in mantle cell lymphoma (MCL) with #NYP & @WeillCornell's Dr. Jia Ruan. Learn more here:  http://bit.ly/2GKRf7U . pic.twitter.com/6JQMSAA6Mw,13,1,3,,#NYP
nyphospital,2018-06-10,13:00:12,"We are proud to share that more than 275 physicians affiliated w/ #NYP have been recognized among the best doctors in the #NewYork metropolitan region, in @NYMag's “Best Doctors” issue. See which physicians made the list:  http://bit.ly/2LjTEri  CC: @WeillCornell @ColumbiaDoctors pic.twitter.com/RYeF3GDUqV",28,0,4,,"#NYP,#NewYork"
nyphospital,2018-06-10,11:00:02,"“Ultimately healthcare comes down to a human-to-human interaction. So if you’re going to go into artificial intelligence, machine learning, etc., it’s got to be able to re-humanize, as opposed to de-humanize, care,” Dr. Corwin said at #TechonomyNYC:  http://bit.ly/2JsChrd  pic.twitter.com/g0J1g74DuH",54,0,16,,#TechonomyNYC
nyphospital,2018-06-10,09:00:01,"“We need adequate hydration so that our muscles can work,"" #NYP & @WeillCornell's Dr. Alexis Halpern explains to @greatist how staying hydrated improves both physical and cognitive performance:  http://bit.ly/2klkqEo  pic.twitter.com/gln3V4RIQb",4,0,3,,#NYP
nyphospital,2018-06-09,15:00:01,"Sitting is not ideal for your health and standing may not be great either, so what should you do at work? @MSN is talking to #NYP & @WeillCornell's Dr. Richard Isaacson about possible solutions:  http://bit.ly/2H0VmQC  pic.twitter.com/Vi8qjbtvIp",10,0,2,,#NYP
nyphospital,2018-06-09,13:00:04,Our incredible #NYPGreen team collected 247 scrubs for the @AfyaFoundation to donate to clinicians working to address the recent #Ebola outbreak in the Democratic Republic of Congo. Way to go! pic.twitter.com/avlyB8bfQE,9,0,1,,"#NYPGreen,#Ebola"
nyphospital,2018-06-09,11:00:01,"Join us on Thursday, June 14th at 3pm in the Uris Auditorium for our next Dialogues in Diversity Seminar, ""Exploring the Spectrum of Gender Identity: Caring for transgender and gender non-conforming patients, families and employees."" #NYPDiversity pic.twitter.com/sKu9Cs2X9C",11,0,4,,#NYPDiversity
nyphospital,2018-06-09,09:00:01,"Stress can impact the body, but did you know that it can also impact your skin? @SELFmagazine talks to #NYP & @WeillCornell's Dr. Shannon Bennett to learn more:  http://bit.ly/2k0RQYG  CC: @ZahraBarnes pic.twitter.com/x5rgRDId0C",5,0,2,,#NYP
nyphospital,2018-06-08,18:00:01,".@WeillCornell has announced that the Division of #EmergencyMedicine has expanded into a comprehensive academic department & @DrSharma_NY, Emergency Physician-in-Chief at #NYP & @WeillCornell has been named Inaugural Department Chairman. Learn more:  http://bit.ly/2kL1Fue  pic.twitter.com/c0llorxBVg",41,0,4,,"#EmergencyMedicine,#NYP"
nyphospital,2018-06-08,16:20:17,"#NYP’s Dr. Andrew McAleavey is talking about #veterans, mental health and busting myths during the “Your Brain on the Military” talk at the @IntrepidMuseum. CC: @WeillCornell @ColumbiaDoctors pic.twitter.com/atZNOwekhL",8,0,3,,"#NYP,#veterans"
nyphospital,2018-06-08,15:45:01,#NYP's Dr. Benjamin Suarez-Jimenez continues the conversation at the @IntrepidMuseum and speaks about the neuroscience of the brain and how we shape our future. CC: @ColumbiaDoctors @WeillCornell pic.twitter.com/MIzQNlZyeo,5,0,1,,#NYP
