username,date,time,tweet,likes,replies,retweets,retweet,hashtags
Stanford,2018-04-16,14:50:00,".@StanfordSTC's Dan Reicher organized ""a floating Chautauqua"" down the Rio Grande. http://stanford.io/2H5DxMn ",30,0,2,True,
Stanford,2018-04-16,13:04:58,"“Today at CBPA, we want to create room for experimentation and encourage artists to explore outside of definition and forms."" - Amara Tabor-Smith, Committee on Black Performing Arts (CBPA) director and @StanfordTAPS artist-in-residence  http://stanford.io/2HqJMxH  pic.twitter.com/hzJGgjWsAK",36,1,7,True,
Stanford,2018-04-15,23:38:01,"Freshman @StanfordMVB player Jaylen Jasper came from a sports family. When his little brother nearly died, his family grew stronger together.  http://stanford.io/2qAW8tF  pic.twitter.com/BUc2oS4RRb",49,0,7,True,
Stanford,2018-04-15,21:33:24,"In this miniature city, self-driving robots move in a way analogous to how self-driving cars would behave in the world, says robotic autonomy course instructor Marco Pavone. http://stanford.io/2ITJmx0  pic.twitter.com/QjPigDeGUF",69,1,29,True,
Stanford,2018-04-15,19:20:00,".@StanfordMed neuroscientist Rob Malenka says understanding the neural mechanisms underlying aggression, anger, empathy, and compassion is as important as studying Alzheimer's disease. http://stanford.io/2IUb38R ",88,0,31,True,
Stanford,2018-04-15,10:37:01,Listen to School's In today at 9 a.m. PT on @SIRIUSXM channel 121 and find full episodes at  http://stanford.io/2IOUafJ . pic.twitter.com/p3fdad7JzH,19,1,3,True,
Stanford,2018-04-15,09:34:01,Guests on today's episode of Stanford Legal include California's solicitor general and three @StanfordLaw professors. Listen at 8 a.m. PT on @SIRIUSXM channel 121 and find past episodes at  http://stanford.io/2qqylwj . pic.twitter.com/VQ3zkR4cJA,17,1,4,True,
Stanford,2018-04-14,20:45:00,"""You need glue to bind a community together. But you also need WD-40 to reduce friction,"" says  @StanfordGSB's Hayagreeva “Huggy” Rao. http://stanford.io/2quUXvt ",68,3,22,True,
Stanford,2018-04-14,19:30:00,"“I don’t think we know what ‘attention’ is,” says @russpoldrack. “There’s lots of things people in psychology and neuroscience study that they call ‘attention’ that are clearly different things.” http://stanford.io/2qtoeHc ",54,2,18,True,
Stanford,2018-04-14,16:44:00,A small forest is growing in the basement of Green Library. http://stanford.io/2ITDvrw ,108,1,18,True,
Stanford,2018-04-14,09:39:01,Design learning and stereotype threat are the topics of discussion on this weekend's episode of School's In. Full episodes are available at  http://stanford.io/2IUjqBr . pic.twitter.com/iHUNYJpV3U,23,4,6,True,
Stanford,2018-04-14,08:33:01,Listen to Stanford Legal today at 7 a.m. PT for discussion on trade wars and states' rights. Full episodes are available at  http://stanford.io/2IPChxu . pic.twitter.com/gWpkSsUAqg,31,1,5,True,
Stanford,2018-04-13,19:29:00,"“It all ties back to what we have known all along: It's a mix of genes and environment that influences health,” @StanfordMed's Erik Ingelsson said.  http://stanford.io/2IRu2Rm ",29,1,5,True,
Stanford,2018-04-13,18:32:29,"Tomorrow at Cardinalpalooza, join student athletes at The Farm's annual spring sports festival. Admission is free to football's Cardinal and White Spring Game, softball's home contest, and the Fan Fest.  http://stanford.io/2qut5I7  pic.twitter.com/Uf0pGUMgSr",38,0,8,True,
Stanford,2018-04-13,17:32:00,"What makes a brand iconic, and how can it keep from fading away? ""You want to be relevant to both heart and head — both emotionally and rationally,"" says Soon Yu, MBA '93. http://stanford.io/2HkSRIg ",49,0,11,True,
Stanford,2018-04-13,16:51:28,"Jack Andraka, a junior majoring in anthropology and in electrical engineering, has been awarded a 2018 Truman Scholarship. http://stanford.io/2qs8d4g ",34,0,5,True,
Stanford,2018-04-13,14:52:27,"""You need glue to bind a community together. But you also need WD-40 to reduce friction,"" says  @StanfordGSB's Hayagreeva “Huggy” Rao. http://stanford.io/2quEW97 ",35,2,13,True,
Stanford,2018-04-13,10:30:00,"“I don’t think we know what ‘attention’ is,” says @russpoldrack. “There’s lots of things people in psychology and neuroscience study that they call ‘attention’ that are clearly different things.” http://stanford.io/2quVLR2 ",79,3,35,True,
Stanford,2018-04-12,23:00:00,"The authors link undersized jaws to increased risk of heart disease, hyperactivity, sleep deprivation, and other issues that are endemic to modern life. http://stanford.io/2INJeyS ",76,3,28,True,
Stanford,2018-04-12,22:30:22,"“These robots are small but they contain a representative set of sensors that you would see on a real self-driving car,” said course instructor Marco Pavone. http://stanford.io/2HgyV9w  pic.twitter.com/MWHlI1pIAD",42,2,12,True,
Stanford,2018-04-12,21:00:00,"“Zouping provides a rare and invaluable base line to understand how exactly the county has changed, both economically and politically,” says Jean Oi. http://stanford.io/2IPRn5Y ",17,0,4,True,
Stanford,2018-04-12,18:43:26,".@StanfordLaw's Joseph Bankman is advocating for a pre-filled tax return, which would simplify the process of filing taxes for millions of Americans. http://stanford.io/2IQIt86 ",28,0,9,True,
Stanford,2018-04-12,17:39:33,"Logos are important, but they aren't everything. In a new book, @StanfordGSB's Soon Yu explains what makes some companies iconic. http://stanford.io/2HjbvQQ ",65,2,24,True,
Stanford,2018-04-12,16:11:27,A Quaker who amassed an enormous fortune through gun sales in 18th-century Britain is the focal point of a new book by Stanford historian Priya Satia. http://stanford.io/2qnOnHh ,28,0,12,True,
Stanford,2018-04-12,13:40:02,"""Doctors literally get less pain medicine training than veterinarians,"" says Stanford psychologist Beth Darnall. http://stanford.io/2qpOu5g ",38,5,25,True,
Stanford,2018-04-12,12:34:47,Stanford computer scientists have developed a new way to compress and transmit video over the internet that dramatically reduces delays and improves picture quality. http://stanford.io/2IKXQPF ,88,3,37,True,
Stanford,2018-04-12,11:47:30,There's a one-of-a-kind arboretum hidden in the basement of Green Library. http://stanford.io/2IQqQFL ,89,1,20,True,
Stanford,2018-04-12,01:01:25,"Freshman @StanfordMVB player Jaylen Jasper came from a sports family. When his little brother nearly died, his family's love, friendship, teamwork, and hustle grew stronger.  http://stanford.io/2IMabmx  pic.twitter.com/jiU8W3zS09",50,1,5,True,
Stanford,2018-04-11,22:37:58,"""I utilize spiritual ritual in non-traditional ways to think about ways that we can change the vibration of an issue, as opposed to just educate people on an issue through performance."" - Amara Tabor-Smith  http://stanford.io/2qp84OP  pic.twitter.com/K2nmo9CaIF",77,2,21,True,
Stanford,2018-04-11,15:30:00,"Rob Malenka, ""a neuroscientist's neuroscientist,"" says understanding the neural mechanisms underlying aggression, anger, empathy, and compassion is as important as studying Alzheimer's disease. http://stanford.io/2HdDOQx ",62,4,25,True,
Stanford,2018-04-11,14:00:01,"""I think the attention to what is said, and unsaid, in a poem is good practice for any patient encounter, as well as for understanding team dynamics in an operating room,"" says @StanfordMed anesthesiologist and poet @audreyshafer. http://stanford.io/2HcvOzd ",21,0,9,True,
Stanford,2018-04-11,12:35:25,Students used industry-standard software and image classification developed through deep learning algorithms to program small robots to move like autonomous cars.  http://stanford.io/2IIkkR9  pic.twitter.com/I6Jwil0ET8,34,1,12,True,
Stanford,2018-04-11,11:21:00,"In their book, Kahn and Ehrlich make the case that crooked teeth (and braces) are a modern problem caused primarily by eating soft foods, living in confined spaces with allergens, and poor posture. http://stanford.io/2H8kog7 ",42,0,11,True,
Stanford,2018-04-10,19:28:02,"Shifting negative or catastrophic thoughts about pain through cognitive behavioral therapy could help pain treatments work better, says @StanfordMed clinical professor @BethDarnall. http://stanford.io/2Hfwa8A ",127,6,73,True,
Stanford,2018-04-10,16:52:31,Students used industry-standard software and image classification developed through deep learning algorithms to program small robots to move like autonomous cars. http://stanford.io/2Hfj37m ,48,0,19,True,
Stanford,2018-04-10,16:34:01,"Speakers at this year's Architecture + Landscape Spring Lecture Series will focus on volumetric expression, which can ""humanize scale, create visual interest and variety, or choreograph a spatial experience,” said Zach Pozner, director of architecture. http://stanford.io/2GRdYys ",24,0,8,True,
Stanford,2018-04-10,14:38:29,"Owing to larger, stronger jaws than we have today, hunter-gatherers wouldn't have had crooked teeth or snored, biologist Paul Ehrlich and orthodontist Sandra Kahn argue. http://stanford.io/2HrXwFO ",25,2,14,True,
StanfordBrain,2018-04-10,11:15:00,"“We need scientific language, not a folk language,” says @russpoldrack. He argues that we use ancient words like ""attention"" to describe a range of mental states and behavior, creating ambiguity in the study of psychology. http://stanford.io/2H9zp12 ",33,3,16,True,
Stanford,2018-04-10,11:20:01,Nominations for @C3E_EnergyWomen Awards recognizing outstanding mid-career women making an impact in clean energy will be accepted through April 11.  http://stanford.io/2IHC2nS  pic.twitter.com/ZQQxkPCu7f,23,0,10,True,
Stanford,2018-04-10,10:18:00,A hybrid technique that involves combining CRISPR and DNA barcoding could dramatically speed up cancer research and drug development. http://stanford.io/2HbPmDX ,44,0,22,True,
Stanford,2018-04-09,23:00:00,"“This is 10 steps forward in our ability to model human cancer,” says Dmitri Petrov. http://stanford.io/2ICv57O ",106,3,27,True,
Stanford,2018-04-09,21:00:00,"In tonight’s Cardinal Conversation, Anne Applebaum, Ted Koppel, and Jessica Lessin discuss “Real and Fake News”. https://youtu.be/diKQ8EOxNS8 ",28,0,5,True,
Stanford,2018-04-09,18:47:54,"Rev. Professor Jane Shaw emphasizes the value of Elizabeth Alexander's ""ability to articulate the importance of the arts and humanities, as well as a sense of the sacred, for reaching beyond ourselves and connecting to others.” http://stanford.io/2HcdAy2 ",19,0,7,True,
Stanford,2018-04-09,17:12:00,"“I’m immensely grateful for the foundation’s support. The freedom and opportunity to be creative are what make a Guggenheim so special,” says @StanfordEarth professor Rob Jackson, one of three Stanford recipients of a 2018 Guggenheim Fellowship. http://stanford.io/2H9KHSZ ",44,0,5,True,
Stanford,2018-04-09,16:00:00,Stanford political scientist Jean Oi discusses how a formally rural Chinese community's metamorphosis into an urban hub with a flourishing commercial economy showcases the country's overall political and economic transformation. http://stanford.io/2IHr2XH ,18,0,5,True,
Stanford,2018-04-09,14:48:26,"“We set out to study the relationship between friend networks and predictability, and ended up uncovering an inference mechanism that hadn’t been noticed before.” says Johan Ugander, assistant professor of management science and engineering. http://stanford.io/2HbdGpB ",44,0,14,True,
Stanford,2018-04-08,22:31:01,"Check out this year's #Webbys nominees, including @StanfordEarth in the Science category. Cast your vote here:  http://stanford.io/2uY2QOC  pic.twitter.com/q4nmZz3Juj",36,1,9,True,#Webbys
Stanford,2018-04-08,20:37:00,A hybrid technique that involves combining CRISPR and DNA barcoding could dramatically speed up cancer research and drug development. http://stanford.io/2Jq1gbF ,145,1,51,True,
Stanford,2018-04-08,19:00:00,"Word embeddings can be used to study historical changes in stereotypes, said James Zou, an assistant professor of biomedical data science. http://stanford.io/2JptH9A ",60,2,25,True,
Stanford,2018-04-07,20:45:00,"""Rather than start drafting your presentation, email, or meeting agenda by asking, 'What do I want to say?' start by asking, 'What does my audience need to hear?'” writes @StanfordGSB lecturer Matt Abrahams. http://stanford.io/2qbn4zJ ",189,5,61,True,
Stanford,2018-04-07,19:40:00,"""The more information we fill our minds with, the poorer our ability to remember things becomes,"" @emmaseppala says. ""The brain literally acts as if it were cluttered and we're less able to ignore irrelevant information."" http://stanford.io/2ErGDbh ",85,0,40,True,
Stanford,2018-04-06,21:15:00,"At Cardinalpalooza, Stanford's spring sports festival, watch softball, baseball and football games and enjoy facepainting and more on Saturday, April 14. http://stanford.io/2uOulKF ",48,0,10,True,
Stanford,2018-04-06,19:41:01,.@StanfordEarth has been nominated for a Webby award in the Science category. Give a thumbs-up to science and cast your #Webbys vote here:  http://stanford.io/2uUIeH6  pic.twitter.com/GSu9xUzQyj,52,2,17,True,#Webbys
Stanford,2018-04-06,18:45:00,"""Rather than start drafting your presentation, email, or meeting agenda by asking, 'What do I want to say?' start by asking, 'What does my audience need to hear?'” writes @StanfordGSB lecturer Matt Abrahams. http://stanford.io/2qbgIAj ",114,0,34,True,
Stanford,2018-04-06,17:54:00,"""Prenatal exposure to the death of a maternal relative increases take-up of ADHD medications during childhood and anti-anxiety and depression medications in adulthood,"" found researchers @PerssonPetra and @maya_rossin. http://stanford.io/2JnN2bg ",25,0,5,True,
Stanford,2018-04-06,15:50:34,"""The more information we fill our minds with, the poorer our ability to remember things becomes,"" @emmaseppala says. ""The brain literally acts as if it were cluttered and we're less able to ignore irrelevant information."" http://stanford.io/2qgJM9V ",79,0,42,True,
Stanford,2018-04-06,14:34:28,"Elizabeth Alexander has an ""ability to articulate the importance of the arts and humanities, as well as a sense of the sacred, for reaching beyond ourselves and connecting to others,” said the Rev. Professor Jane Shaw. http://stanford.io/2q9e6mC ",27,0,6,True,
Stanford,2018-04-05,16:29:26,The Stanford Distinguished Careers Institute give participants who have had long and accomplished careers the opportunity to enroll in classes and decide what's next. http://stanford.io/2IzqVxw ,42,3,4,True,
Stanford,2018-04-05,15:37:00,"Often traced to the @stanforddschool, pop-ups give seasoned instructors a chance to try out new course content and help students become more engaged in their learning environments. http://stanford.io/2uQLuTR ",28,2,10,True,
Stanford,2018-04-05,14:50:01,Research by two @SIEPR faculty fellows has found that losing a loved one during pregnancy may impact the mental health of the child as he or she grows into adulthood.  http://stanford.io/2q89KMG  pic.twitter.com/tfMR1R0ZD9,25,0,9,True,
Stanford,2018-04-05,13:02:37,.@StanfordLaw's Deborah Sivas explains the history of changing fuel emission standards and what litigation from California could mean. http://stanford.io/2GDEbR8 ,20,0,6,True,
Stanford,2018-04-05,12:16:55,".@StanfordMed student Nathaniel Fleming writes about the process of working towards becoming the ""real doctor"" in the room. http://stanford.io/2q6EZr8 ",29,2,7,True,
Stanford,2018-04-04,22:30:02,Hundreds of photos showing intimate moments of mourning immediately after Martin Luther King Jr.’s assassination are available for public viewing online from @StanfordLibs. http://stanford.io/2q8mPWb  pic.twitter.com/2vyanUq4JY,57,2,17,True,
Stanford,2018-04-04,21:30:00,"The time of day when you experience stress matters to your weight, says @StanfordMed's Mary Teruel. http://stanford.io/2q2yJRt ",74,3,28,True,
Stanford,2018-04-04,20:16:01,".@StanfordEarth's William Gearty found that ocean-dwelling mammal size follows the Goldilocks rule  –  not too big (so that they can't eat), not too small (so that they lose heat), but just right (around 1,100 pounds). http://stanford.io/2q6sigg ",63,1,22,True,
Stanford,2018-04-04,13:12:00,"Comprehensive pain management options including body-mind practices could help keep some patients away from opioids and their associated risks, says @StanfordMed clinical professor @BethDarnall. http://stanford.io/2GyH5q7 ",38,14,18,True,
Stanford,2018-04-04,12:03:31,"The research will allow humanities scholars to address questions about the evolution of stereotypes and biases at an unprecedented scale, said history professor Londa Schiebinger. http://stanford.io/2qaO3vx ",38,0,20,True,
Stanford,2018-04-04,10:26:28,".@StanfordVR's Jeremy Bailenson and @stanfordccsre's Jim Steyer surveyed 3,613 parents and found that 62 percent believe VR holds educational promise for their children. http://stanford.io/2q4bPsJ ",27,1,17,True,
Stanford,2018-04-03,19:45:01,Nominations for @C3E_EnergyWomen Awards recognizing outstanding mid-career women making an impact in clean energy will be accepted through April 11.  http://stanford.io/2Ji1At0  pic.twitter.com/dg0tCAMjTP,11,1,4,True,
Stanford,2018-04-03,19:00:00,"""Yes, the timing of your stress does matter,"" says @StanfordMed's Mary Teruel. http://stanford.io/2GO7Avf ",77,1,32,True,
Stanford,2018-04-03,18:01:00,"“This is a technology that’s going to change the way we manufacture essential medicines,” says co-author Christina Smolke. http://stanford.io/2IrQVdM ",37,0,15,True,
Stanford,2018-04-03,16:02:00,"Adjectives such as “intelligent,” “logical,” and “thoughtful” were associated more with men in the first half of the 20th century. But since the 1960s, the same words have increasingly been associated with women. http://stanford.io/2IpJ1Sq ",73,1,40,True,
StanfordEd,2018-04-03,13:11:29,"Students in college history courses often aren't being taught the skills they need to assess historical evidence, according to a new @SHEG_Stanford study. http://stanford.io/2GQKdkw ",53,1,28,True,
Stanford,2018-04-03,13:42:00,A hybrid technique that involves combining CRISPR and DNA barcoding could finally allow scientists to recreate and study the complex genetic diversity of human cancers. http://stanford.io/2Ir84oj ,137,0,35,True,
Stanford,2018-04-03,12:22:27,"Noscapine, a cough suppressant with potential anti-cancer properties derived from opium poppies, could be manufactured by inserting foreign genes into a cell of brewer's yeast.  http://stanford.io/2Jgwp1d  pic.twitter.com/Nw1gfXnIRu",44,1,9,True,
Stanford,2018-04-02,19:00:00,"""Responding to climate change is about managing the resulting risks and making critical decisions about our future."" says @StanfordEarth research scientist Katharine Mach. http://stanford.io/2GOq4vr ",38,0,12,True,
Stanford,2018-04-02,18:30:00,"With a cultural emphasis placed on childbearing, many Ugandan women suffering from heart disease are willing risk their health in order to have a family, @StanfordMed study reports. http://stanford.io/2Ik5Kz2 ",27,0,3,True,
Stanford,2018-04-02,17:45:00,"“We are probably going to see things humanity has never seen, and there will likely be real suffering,” says Stanford biology professor Gretchen Daily. “At the same time, we have a shot at turning things around.” http://stanford.io/2GL9T25 ",80,0,40,True,
Stanford,2018-04-02,17:00:00,"Combining computer simulations and data collected from football gear, Stanford bioengineer David Camarillo and his team study the complex nature of concussions in hopes of improving diagnosis, treatment, and prevention. http://stanford.io/2J9XrqR ",63,0,20,True,
Stanford,2018-04-02,16:30:00,"Developing reliable stress-relief strategies and allowing yourself time to decompress before eating can diminish the temptation to overindulge in food, according to John Morton, chief of bariatric surgery at @StanfordHealth. http://stanford.io/2GPiYXG ",53,0,20,True,
Stanford,2018-04-02,14:24:02,Hundreds of photos showing intimate moments of mourning immediately after King’s assassination are available for public viewing online from @StanfordLibs. http://stanford.io/2InFnZ4  pic.twitter.com/TuaRQLdg28,58,0,19,True,
Stanford,2018-04-01,22:19:00,Discoveries of how to quantify and influence minuscule forces acting upon microscopic structures in our bodies could answer some big questions in biology and contribute to improved medical treatments. http://stanford.io/2GkwpLH ,72,0,17,True,
Stanford,2018-04-01,19:18:00,"Scholars at the Center for Advanced Study in the Behavioral Sciences are combining computer science and social science in novel ways to help build sustainable, healthy work and social environments as the future of work changes. http://stanford.io/2Gn18I9 ",101,3,23,True,
Stanford,2018-04-01,18:15:00,"Self-driving cars should not drive like humans because humans drive in ethically troubling ways, writes @StanfordEthics fellow @jhimmelreich.  http://stanford.io/2pPVYxV ",72,1,15,True,
Stanford,2018-03-31,20:30:00,"If galaxies can form without dark matter, contrary to modern galaxy formation theory, “I would need to rethink what a galaxy is,” Risa Wechsler said. http://stanford.io/2pQRvv8 ",99,2,37,True,
Stanford,2018-03-31,18:05:00,"Girls perform better on standardized tests that have more open-ended questions, while boys have higher scores on tests that include more multiple-choice, found @StanfordEd's Sean Reardon. http://stanford.io/2Ie48XN ",105,0,40,True,
Stanford,2018-03-30,18:43:57,"Congratulations to the 2,040 students representing all 50 states, Washington, D.C., Puerto Rico, and 63 countries who have been offered admission to the Class of 2022:  http://stanford.io/2pRgb6m  pic.twitter.com/ngGA9I5L6V",647,9,135,True,
Stanford,2018-03-30,17:58:28,"Eric Shooter, founding chair of the Department of Neurobiology, ""was a reminder that you can be a great scientist and still support the careers of other young scientists.""  http://stanford.io/2IgQqTP  pic.twitter.com/50GCQsQAES",48,1,12,True,
Stanford,2018-03-30,16:30:00,"If galaxies can form without dark matter, contrary to modern galaxy formation theory, “I would need to rethink what a galaxy is,” Risa Wechsler said. http://stanford.io/2IhF6a2 ",90,4,29,True,
Stanford,2018-03-30,15:40:00,"""Reaching a sustainable peace deal in Afghanistan is not a single problem but a series of formidable hurdles,"" writes @StanfordCISAC pre-doctoral fellow Asfandyar Mir. http://stanford.io/2pRS2Nf ",35,0,14,True,
Stanford,2018-03-30,14:45:00,"Girls perform better on standardized tests that have more open-ended questions, while boys have higher scores on tests that include more multiple-choice, found @StanfordEd's Sean Reardon. http://stanford.io/2pRYdAR ",94,2,39,True,
Stanford,2018-03-30,14:00:01,"“Natural talent is helpful, but I think grit is far more important.” John Dabiri, Professor of Civil & Environmental Engineering and of Mechanical Engineering. #MeetOurFaculty  http://stanford.io/2IdzZYo  pic.twitter.com/fd3e1PsmBm",105,1,27,True,#MeetOurFaculty
Stanford,2018-03-29,16:46:00,"""Good social science should bring us deeper insights about real-world phenomena, and behavioral economics, done right, can accomplish that."" http://stanford.io/2GjrOt5 ",91,2,31,True,
Stanford,2018-03-29,14:37:00,Anna Lembke comments on the impact of new limits on opioid prescriptions.  http://stanford.io/2pLEItN ,21,0,4,True,
Stanford,2018-03-29,12:41:00,"Some Ugandan women are knowingly risking their lives to have children, a new @StanfordMed study reports. http://stanford.io/2GkOZ6n ",41,4,17,True,
Stanford,2018-03-29,11:11:00,"Biracial youth tend to be more socially progressive and liberal than their peers who are of a single racial background, according to new research by Lauren Davenport. http://stanford.io/2IgogbP ",81,3,21,True,
Stanford,2018-03-28,22:45:01,"Injectable gels to rebuild brain tissue and robotic ankles to help patients walk are two projects that Marion Buckwalter and Maarten Lansberg, founders of the Stanford Stroke Recovery Program, are exploring to help patients.  http://stanford.io/2pMSix2  pic.twitter.com/Jf9uO2YfZh",73,1,26,True,
Stanford,2018-03-28,21:30:00,"“This technology will enable nurses, medical students and physicians themselves to actually assess their patient right there and they will be able to determine if the patient is having silent seizures,” says Josef Parvizi. http://stanford.io/2IaeZBW ",122,0,38,True,
Stanford,2018-03-28,21:00:00,"By separating what is actually happening from what we think is happening, “we can find places where we are spinning stories that are not helpful to us, others, or our productivity,” writes @StanfordGSB’s Leah Weiss. http://stanford.io/2GgPmyR ",83,1,31,True,
Stanford,2018-03-28,19:32:02,.@SecretaryPerry toured @SLAClab today and met with staff and Provost Persis Drell in a townhall meeting.  http://stanford.io/2pN2PYW  pic.twitter.com/YFFmiPmM4l,29,0,3,True,
Stanford,2018-03-28,18:30:53,"@StanfordSynchro Senior Erica Slavin will complete her @stanfordsynchro career at the four-day Collegiate National Championships, which begin today in Oro Valley, Arizona. http://stanford.io/2pMwzFv ",26,0,1,True,
Stanford,2018-03-28,13:27:30,"Self-driving cars should not drive like humans because humans drive in ethically troubling ways, writes @jhimmelreich, a fellow at @StanfordEthics. http://stanford.io/2GgFDZu ",59,1,19,True,
Stanford,2018-03-28,12:12:26,"Scholars at the Center for Advanced Study in the Behavioral Sciences are combining computer science and social science in novel ways to help build sustainable, healthy work and social environments as the future of work changes. http://stanford.io/2Idujxx ",71,1,21,True,
