username,date,time,tweet,likes,replies,retweets,retweet,hashtags
Stanford,2018-07-24,17:00:01,"@StanfordHumSci “In the stories of Hecuba and Helen, Euripides created strong female protagonists who persist and resist male patriarchy, who seize control of their destinies in startling ways,” says @StanfordHumsci theater and performance studies professor Rush Rehm. https://stanford.io/2JQgFBa ",7,0,2,True,
Stanford,2018-07-24,16:30:00,Stanford researchers found strong evidence that hotter weather increases both suicide rates and the use of depressive language on social media. @StanfordEarth https://stanford.io/2JRd71n ,24,1,12,True,
Stanford,2018-07-24,16:15:00,"“We have to start considering the pathways by which we might inadvertently create the bad form of chromium from the good and end up contaminating our aquifers,” says @StanfordEarth professor Scott Fendorf. https://stanford.io/2LytncE ",9,1,7,True,
Stanford,2018-07-24,15:41:27,"A group led by Stanford materials scientist Alberto Salleo has created a stretchy patch that, when applied directly to the skin, wicks up sweat and assesses how much cortisol a person is producing. https://stanford.io/2JRCq3A ",25,1,7,True,
Stanford,2018-07-24,15:25:37,.@StanfordHumSci biologists Paul Ehrlich and Rodolfo Dirzo warn that some species will face extinction within the U.S. if their movements are cut off by the continuous border wall President Trump has pledged to build. https://stanford.io/2LFl5Q2 ,26,1,11,True,
Stanford,2018-07-24,14:36:47,“These documents are evidence for the conversations occurring among people from different linguistic backgrounds.” says Stanford historian Rowan Dorin. https://stanford.io/2JR0u6s ,30,1,7,True,
Stanford,2018-07-24,01:54:53,"""Better understanding the causes of suicide is a public health priority,"" says @MarshallBBurke. https://stanford.io/2LKkj19 ",65,3,33,True,
Stanford,2018-07-24,01:45:54,"Pairing police with health-care professionals could provide better care and cost savings in the long term, writes @StanfordMed resident Nathaniel Morris. https://stanford.io/2uLglPs ",34,1,12,True,
Stanford,2018-07-24,01:30:01,"Physicians' steps to avoid liability might not improve patient care, says @StanfordLaw's Michelle Mello. https://stanford.io/2LL0wyK ",23,1,5,True,
Stanford,2018-07-23,21:07:57,"After Hecuba/Helen’s Stanford run, Stanford Repertory Theater will remount the production in September in Athens, the city of the story’s origin.  https://stanford.io/2JOt20C  pic.twitter.com/eNMDjWjJXK",30,0,8,True,
Stanford,2018-07-23,17:54:29,Reach beyond your current interests to develop a passion – while acquiring skills that could make you more successful in whatever you do. https://stanford.io/2JPujo2 ,85,3,32,True,
Stanford,2018-07-23,17:32:39,"When groundwater levels fall, changes in underground water pressure can suck arsenic out of clay like a sponge being squeezed, says @StanfordEarth's Scott Fendorf. https://stanford.io/2LKl0aS ",22,1,11,True,
Stanford,2018-07-22,23:42:00,"Inspired by biology, Gail Wight makes art about life. https://stanford.io/2LeJtJd ",36,2,6,True,
Stanford,2018-07-22,23:16:00,".@StanfordEng scientists have advanced a new way to store wind and solar electricity on a large scale, affordably and at room temperature. https://stanford.io/2JKWS5O ",151,2,32,True,
Stanford,2018-07-22,22:45:00,"“I identified as a tomboy growing up, dark skin, black woman with natural hair, I didn’t really fit into the traditional, classically beautiful definition,” says @IssaRae, '07. Now, she's changing that definition.  https://stanford.io/2LjiUSY ",59,0,11,True,
Stanford,2018-07-22,14:30:09,"“I never would have thought that my interest in science would lead to a deeper relationship with my father.” Wendy Mao, associate professor of geological sciences, of photon science and, by courtesy, of geophysics #MeetOurFaculty  https://stanford.io/2KIW5n2  Photo by Holly Hernandez pic.twitter.com/A3pFMXtLrS",54,1,6,True,#MeetOurFaculty
Stanford,2018-07-22,10:30:01,Listen to School's In today at 9 a.m. PT on @SIRIUSXM Insight channel 121 and find past episodes at  https://stanford.io/2LzOoAs  pic.twitter.com/BMnnJeQ8Hz,24,0,2,True,
Stanford,2018-07-22,09:30:01,.@StanfordLaw professors Jeff Fisher and Michelle Wilde Anderson are the guests on this week's episode of Stanford Legal. Listen on SiriusXM channel 121 and find past episodes at  https://stanford.io/2LbD0yC . pic.twitter.com/pOD5RNIwKB,22,0,5,True,
Stanford,2018-07-21,20:15:00,"""We just listened to the data. Science is about data, not dogma."" Stanford researchers have found that a thin membrane, thought to be just a shrink wrap around some bacterial cell walls, has structural properties critical for survival. https://stanford.io/2JLsXdQ ",73,1,29,True,
Stanford,2018-07-21,19:15:00,"Sweat offers lots of information about a person's health, thanks to the key electrolytes, hormones, and more it contains. https://stanford.io/2L8NIpo ",75,0,10,True,
Stanford,2018-07-21,18:15:00,"The three leaves of parchment discussed ancient medical knowledge, and were written in Arabic using Hebrew letters, with Latin and old Spanish notes on the edges. https://stanford.io/2LAhU90 ",73,0,25,True,
Stanford,2018-07-21,16:38:01,"Twenty years ago, a group of behavioral economists ""cooked-up collaborations"" at @CASBSStanford that would go on to have profound impacts in the field:  https://stanford.io/2JFK6FO  pic.twitter.com/lgEBJABzwZ",41,1,27,True,
Stanford,2018-07-21,09:29:06,.@StanfordEd scholars Linda Darling-Hammond and Ari Kelman are the guests on this week's episode of School's In. Listen on SiriusXM Insight channel 121 and find past episodes at  https://stanford.io/2L9EdX3 . pic.twitter.com/XqVsSDsUwl,24,1,6,True,
Stanford,2018-07-21,08:31:01,Listen to Stanford Legal today at 7 a.m. PT on @SIRIUSXM Insight channel 121 and find past episodes at  https://stanford.io/2LewzLa . pic.twitter.com/B2w4tmABfd,25,1,3,True,
Stanford,2018-07-20,22:27:31,"Selected as part of a nationwide filmmaking competition, ""Many Names"" explores identity, relationships and managing small, everyday interactions. https://stanford.io/2LarrHU ",50,0,9,True,
Stanford,2018-07-20,20:54:00,"Sweat offers lots of information about a person's health, thanks to the key electrolytes, hormones, and more it contains. https://stanford.io/2LbLzJv ",91,1,27,True,
Stanford,2018-07-20,15:00:02,"“We’re discovering new geological materials that nature knows exist, but that no person has ever seen.” Wendy Mao, associate professor of geological sciences, of photon science and, by courtesy, of geophysics #MeetOurFaculty  https://stanford.io/2KIW5n2  Photo by Holly Hernandez pic.twitter.com/AHIEbx5yhX",34,0,12,True,#MeetOurFaculty
Stanford,2018-07-20,14:35:00,"The three leaves of parchment discussed ancient medical knowledge, and were written in Arabic using Hebrew letters, with Latin and old Spanish notes on the edges. https://stanford.io/2JFt4aR ",51,0,17,True,
Stanford,2018-07-20,13:35:00,"While working with @StanfordREAP to improve training for community health workers in China, Zecheng Wang, ’21, also learned how to make wheat naan and grind walnuts. https://stanford.io/2Lb6qg1 ",28,0,12,True,
Stanford,2018-07-20,09:15:00,"Burton Richter's Nobel Prize-winning discovery of a new subatomic particle was described at the time as ""the greatest discovery ever in the field of elementary particles."" https://stanford.io/2LbNVID ",72,3,28,True,
Stanford,2018-07-19,23:44:00,"Children with autism have structural and functional abnormalities in the brain circuit that normally makes social interaction feel rewarding, a @StanfordMed study shows:  https://stanford.io/2L9VPC3 ",77,1,19,True,
Stanford,2018-07-19,23:10:28,"Burton Richter's love of science was born during the nightly blackouts of World War II. Meant to foil potential air raids, they revealed an unparalleled view of the sky and the hazy band of stars known as the Milky Way. https://stanford.io/2JAtTlm ",109,3,24,True,
Stanford,2018-07-19,18:56:27,"""We just listened to the data. Science is about data, not dogma."" Stanford researchers have found that a thin membrane, thought to be just a shrink wrap around some bacterial cell walls, has structural properties critical for survival. https://stanford.io/2LbwaJh ",80,5,36,True,
Stanford,2018-07-19,15:31:02,"When black men see black doctors, they're more likely to follow through with preventive care — an important finding given 1) they have the lowest life expectancy of any major group in the U.S., and 2) that disadvantage is due largely to chronic disease.  https://stanford.io/2JDlBco  pic.twitter.com/r4HdJoDSnn",99,6,47,True,
Stanford,2018-07-19,13:14:00,".@StanfordEng scientists have advanced a new way to store wind and solar electricity on a large scale, affordably and at room temperature. https://stanford.io/2L5BU7r ",111,2,48,True,
Stanford,2018-07-19,12:33:37,"65% of you underestimated the number of Americans who believe the Earth is warming — and that tracks with what Jon Krosnick found. ""If people knew how prevalent green views are in the country, they might be more inclined to demand more government action on the issue,"" he says. https://twitter.com/Stanford/status/1019603674442522626 …",50,0,20,True,
Stanford,2018-07-18,23:26:54,"California's highest-quality wine grapes grow best in what's already a ""narrow climate envelope,"" and that envelope could be shrinking under current warming trends, says @StanfordEarth's Noah Diffenbaugh. https://stanford.io/2L3rmFM ",57,0,18,True,
Stanford,2018-07-18,19:04:26,"Nearly 100,000 people are waiting for a kidney transplant in the U.S. But the system that matches them with live donors isn’t operating as efficiently as it could be, a @StanfordEng study shows. https://stanford.io/2LwgDQC ",51,1,21,True,
Stanford,2018-07-18,14:05:00,"After Katie Ledecky, '20, broke the world record in the 800 freestyle, she quickly set a new goal: shaving off another nine seconds. https://stanford.io/2Jy40Tg ",81,3,11,True,
Stanford,2018-07-18,13:10:00,SPARQ toolkits help people from different backgrounds and points of view find ways to reduce prejudice and resolve disagreements. https://stanford.io/2L40XHY ,39,0,11,True,
Stanford,2018-07-18,11:22:00,"Organ transplants save lives, but the immune-suppressing drugs needed to protect a transplant leave the recipient susceptible to potentially deadly infections. https://stanford.io/2JypfnP ",39,0,10,True,
Stanford,2018-07-18,10:23:53,"Before you read the article, take a guess: What percent of Americans believe the world's temperature has been rising?  https://news.stanford.edu/2018/07/16/poll-shows-consensus-climate-policy-remains-strong/ …",37,2,15,True,
Stanford,2018-07-18,09:52:38,Acoustic ejection (seen here at 1/2500 speed) is at the heart of a new bio-printer that could speed diagnosis of bacterial blood infections and reduce the use of ineffective antibiotics.  https://stanford.io/2L2DbMI  pic.twitter.com/hPDnMFmlzU,53,0,11,True,
Stanford,2018-07-18,01:14:00,"In the U.S., career counselors often advise applicants to convey excitement & enthusiasm when they’re applying for jobs. But it’s important to recognize that message is shaped by our culture, and it may not be right for everyone, Lucy Zhang Bencharit says. https://stanford.io/2L2ecJg ",40,0,8,True,
Stanford,2018-07-17,23:16:00,"Today's predictive text had a precursor in the 1950s, when typists using the Double Pigeon began to experiment with new ways of organizing the characters on their tray beds into a ""connected thought"" layout. https://stanford.io/2L0FpMi ",54,1,11,True,
Stanford,2018-07-17,11:47:35,"""When you watch elephants interacting, it's almost like looking in a mirror,"" Caitlin O’Connell-Rodwell says. ""It's just so human.""  https://stanford.io/2KXYUFe  pic.twitter.com/LcboZGCh3T",106,0,27,True,
Stanford,2018-07-17,00:29:00,"Analyzing data from 10,000 school districts, @StanfordEd researchers uncovered a pattern: in affluent, highly-educated and predominantly white districts, boys outperformed girls in math. In poorer, more racially diverse districts, girls had the upper hand. https://stanford.io/2KZbHHz ",99,5,37,True,
Stanford,2018-07-16,23:28:06,"An extremely fast ""electron camera"" at @SLAClab has produced a detailed atomic movie of the decisive point where molecules hit by light decide to stay intact or break apart.  https://stanford.io/2NlcrDG  pic.twitter.com/KTrTwzVL8U",74,4,21,True,
Stanford,2018-07-16,21:57:02,Which would you think is more damaging to human health -- the workplace or secondhand smoke? @JeffreyPfeffer says the literature provides an unequivocal answer.  https://stanford.io/2L1NeS9  pic.twitter.com/Q7o08NkY0w,54,3,13,True,
Stanford,2018-07-16,19:05:30,"In an effort to identify ways to help Syrian refugees, Stanford researcher Laila Soudi will spend the next five weeks visiting the Jordan-Syria and Lebanon-Syria borders.  https://stanford.io/2KZ05Et  pic.twitter.com/gYqw6yFoGb",39,2,11,True,
Stanford,2018-07-16,15:05:38,"""No matter where you come from ... there is some sense of pride that you share this earth with these creatures."" For almost 25 years now, Caitlin O’Connell-Rodwell has been studying the elephants in Namibia’s Etosha National Park:  https://stanford.io/2KXYUFe  pic.twitter.com/aaYghiQdAb",129,0,29,True,
Stanford,2018-07-16,12:01:44,"The American people are vastly underestimating how green the country wants to be, Jon Krosnick says. https://stanford.io/2NkJmZb ",68,1,21,True,
Stanford,2018-07-15,20:38:00,Radioactive mineral samples collected by @StanfordEarth's Rodney Ewing could aid a Department of Homeland Security project aiming to hunt down the source of illegal nuclear material. https://stanford.io/2NfQjKJ ,33,1,9,True,
Stanford,2018-07-15,20:11:35,A bio-printer in development at Stanford could speed diagnosis of bacterial blood infections and reduce the use of ineffective antibiotics.  https://stanford.io/2L2DbMI  pic.twitter.com/ZBZSYYjJeU,99,0,33,True,
Stanford,2018-07-15,19:34:00,"An algorithm developed in the Stanford @ImmigrationLab uses refugees' backgrounds to match them with their ideal cities, improving their chances at employment and integration. https://stanford.io/2KFyHKX ",100,0,37,True,
Stanford,2018-07-15,17:28:00,Professor Chris Chafe composed a piece of music that tracks global average temperature and CO2 levels from A.D. 850 to 2016 using data compiled by his colleagues at @UCBerkeley. https://stanford.io/2NeoZN2 ,51,2,15,True,
Stanford,2018-07-15,13:25:01,"Matthew Wigler, ’19, is taking a road trip this summer to America's swing districts to learn about the voters who reject partisanship in a time of great political polarization.  https://stanford.io/2KXVyCj  pic.twitter.com/dNPP3qzuoX",66,3,14,True,
Stanford,2018-07-15,11:25:48,"During the summer, classrooms, labs and libraries across campus open up and students of all ages, from all over the world, get a chance to learn from Stanford scholars:  https://stanford.io/2NfFBnG  pic.twitter.com/KkZ69IBlbv",103,1,26,True,
Stanford,2018-07-15,10:31:04,Listen to The Future of Everything today at 9 a.m. PT and find past episodes at  https://stanford.io/2KY8J68 . pic.twitter.com/R7Bh0Quofv,27,0,5,True,
Stanford,2018-07-15,09:23:01,"A free course to consider, from @StanfordOnline: Love as a Force for Social Justice. Enroll today and learn on your own schedule.  https://stanford.io/2KUPEBL  pic.twitter.com/6fDp9QiJ6N",32,2,12,True,
Stanford,2018-07-14,22:48:30,Summer reading to shift your perspective:  https://stanford.io/2Ne8tNe  #CardinalBookClub pic.twitter.com/Ou2YRhfEyQ,88,1,23,True,#CardinalBookClub
Stanford,2018-07-14,22:46:00,"Things professor Mark Applebaum has created: 1) an electro-acoustic contraption (""the Mousetrap"") he alone knows how to play; 2) a piece to be performed by three gesturing conductors—without any actual musicians making sound; 3) a concerto for florist. https://stanford.io/2KYNxge ",47,1,7,True,
Stanford,2018-07-14,21:18:00,A @StanfordLaw program sends students to strengthen justice systems in some of the most historically challenging places on Earth. https://stanford.io/2KVVcff ,53,1,7,True,
Stanford,2018-07-14,12:24:57,Dirty air is responsible for one in five infant deaths in sub‑Saharan Africa.  https://stanford.io/2NeZ8Vd  pic.twitter.com/pkvrGlb5U7,42,1,20,True,
StanfordEd,2018-07-13,12:52:00,"An online course that challenges teachers to overcome the ""math person"" myth results in better outcomes for students. https://stanford.io/2KVLsSr ",66,0,29,True,
Stanford,2018-07-14,09:30:01,Listen to The Future of Everything today at 8 a.m. PT with guests @JeffreyPfeffer and Sarah Billington on SiriusXM Insight channel 121. Past episodes are available at  https://stanford.io/2NfmolZ . pic.twitter.com/n60OwfSoec,26,1,5,True,
Stanford,2018-07-14,07:00:03,"@StanfordTennis .@stanfordtennis alum Mike Bryan (right, in 1996) plays in the men’s doubles final at #Wimbledon today. Down a twin — Bob is sidelined because of an injury — he’ll compete with fellow American Jack Sock. #gostanford pic.twitter.com/Ok5n9AnTCG",44,0,6,True,"#Wimbledon,#gostanford"
Stanford,2018-07-13,18:54:13,"""When someone shows up to a workplace in the morning, they have entrusted—in an important and fundamental way—their psychological and physical well-being to that organization."" -@JeffreyPfeffer  https://stanford.io/2KUyRiq  pic.twitter.com/tWDGR1iu37",56,0,16,True,
Stanford,2018-07-13,18:11:00,"""We can't have sustainability in fisheries without human justice and well-being,"" @oceansolutions' Elena Finkbeiner says. https://stanford.io/2NdRRoz ",37,0,16,True,
Stanford,2018-07-13,16:39:01,"Steven Denning to @StanfordGSB students: ""Rather than simply improve what we have, we must push the limits to provide what is truly needed. We must be big, bold and daring in our thinking, and we must be willing to look outside of ourselves for answers.""  https://stanford.io/2KRJFxH  pic.twitter.com/mE5kg7NmUK",73,1,33,True,
Stanford,2018-07-13,15:20:00,"""Girls are as good as boys at math"" ≠ ""Boys are as good as girls at math"" https://stanford.io/2NffCwu ",244,5,101,True,
Stanford,2018-07-13,13:50:25,"Congrats to Emmy nominees @IssaRae, '07 (Best Actress, Comedy); @SterlingKBrown, '98 (Best Actor, Drama); and Lisa Joy, '99, co-creator and executive producer of Westworld (Best Drama)!  https://stanford.io/2NdmZo9  #Emmys",71,0,16,True,#Emmys
Stanford,2018-07-13,13:25:13,"With four NCAA championships and 17 top-10 sport finishes overall, Stanford has become the first school to capture both the men's and women's Capital One Cup titles in the same season.  https://stanford.io/2KQTQ5H  pic.twitter.com/IgTcfWioFn",76,1,26,True,
Stanford,2018-07-12,19:40:25,"Following up on research he conducted over the academic year, @codyevans is putting his boots on the ground this summer, exploring the “opportunity zones” created by the new tax code. https://stanford.io/2KRXvAe ",19,0,1,True,
Stanford,2018-07-12,19:29:00,"When employers hire for ""cultural fit,"" they’re often making the misguided assumption that there's only one way to thrive at their organization. https://stanford.io/2KDN7Mm ",48,1,22,True,
Stanford,2018-07-12,18:46:19,"A free week-long bootcamp for incoming graduate students provides an introduction to energy research at Stanford, on topics ranging from technology innovation and entrepreneurship to policy, markets, business and regulation. Apply to participate:  https://stanford.io/2KQw2Pb  pic.twitter.com/TNI1UXYHow",48,1,17,True,
Stanford,2018-07-12,17:22:00,"""Malnutrition & poverty are the precise settings where you absolutely do need to breast-feed, because that's the setting where access to safe & clean water for reconstituting powdered formula is often impossible to find,"" @StanfordMed’s Michele Barry says. https://stanford.io/2Nd3fRV ",45,3,14,True,
Stanford,2018-07-12,15:47:00,"By bending, breaking, and blending sound, composers attempt to reshape the world. More from this year's Music and the Brain symposium at @ccrma. https://stanford.io/2NbFFVy ",22,1,10,True,
Stanford,2018-07-12,15:10:00,How can the U.S. break out of gridlock on nuclear waste management? Rodney Ewing discusses current challenges and what's needed to move forward. https://stanford.io/2KR0yIQ ,32,1,15,True,
Stanford,2018-07-12,14:14:00,"To improve student performance in math, teachers need to expand their own beliefs about who can and can’t be successful in the subject, @joboaler’s research suggests. https://stanford.io/2KPIPS6 ",64,5,22,True,
Stanford,2018-07-12,13:16:18,"Could an issue with an economy or a corporation — at any scale — be seen as a design flaw? @steingreenberg, director of the @stanforddschool, discusses on #makemesmart with @kairyssdal and @mollywood:  https://stanford.io/2KSGSEr  pic.twitter.com/8GJEpQfxu7",24,2,5,True,#makemesmart
GoStanford,2018-07-11,15:18:00,A trip they'll remember forever.See @StanfordWLax's adventures abroad in photos ⤵️#GoStanford http://bit.ly/2La23xK ,38,0,11,True,#GoStanford
StanfordLawMag,2018-07-12,08:00:01,"@Broad #StanfordLawMag talked with Deborah Kanter, JD ‘91 (MA ‘92) about finding beauty in the law and her time bringing LA’s @broad museum to life.  https://stanford.io/2MNtXQT  pic.twitter.com/ffdtIrpDT5",25,0,9,True,#StanfordLawMag
Stanford,2018-07-12,00:10:10,"If you can predict the path of the jet stream, the upper atmosphere's undulating river of wind, then you can predict weather – not just for a week or two, but for an entire season. A new Stanford study moves toward that level of foresight.  https://stanford.io/2KP1f5y  pic.twitter.com/pIUOXoeYzn",148,1,59,True,
Stanford,2018-07-11,18:49:00,"Career advice from a @StanfordGSB alum: ""It's a great thing to have a conversation with somebody and ask them, 'What do you see in me? What patterns are you detecting?' Often that will identify some of your core values."" https://stanford.io/2KN9L4R ",85,1,22,True,
Stanford,2018-07-11,17:16:00,"Parag Mallick is a professor with the @CanaryCenter for Cancer Early Detection. On the side, he’s a magician.  https://stanford.io/2KMgcoR  pic.twitter.com/BbEKX5fFQi",61,1,17,True,
Stanford,2018-07-11,16:15:31,"Medical errors are believed to be responsible for 100,000 to 200,000 deaths in the United States each year — and they have more to do with physician burnout than with workplace safety, a @StanfordMed study suggests.  https://stanford.io/2N9IhDf  pic.twitter.com/m5RPBKlmYQ",64,1,33,True,
stanforddschool,2018-07-11,12:30:10,We’re on the airwaves! So pleased to hear @steingreenberg featured on this week’s #makemesmart with @kairyssdal and @mollywood talking about design and the value of empathy. pic.twitter.com/MHv1xrsKrn,66,1,26,True,#makemesmart
Stanford,2018-07-11,12:00:07,"An extremely fast ""electron camera"" at @SLAClab has produced a detailed atomic movie of the decisive point where molecules hit by light decide to stay intact or break apart.  https://stanford.io/2NaGoq6  pic.twitter.com/Xh5UMyu81L",52,0,13,True,
Stanford,2018-07-11,11:22:06,A new @StanfordLibs archive explores how race is mediated in commercial ventures. https://stanford.io/2N9cYIX ,17,0,1,True,
Stanford,2018-07-11,07:00:00,"A @StanfordLaw program deploys students around the globe, aiming to strengthen justice systems in some of the most historically challenging places on Earth. https://stanford.io/2N2NzAo ",34,0,6,True,
Stanford,2018-07-10,18:54:53,"More than 130,000 never-before-seen images by Andy Warhol will be on view in a @CantorArts exhibition and book by Professors Peggy Phelan and Richard Meyer. https://stanford.io/2N72725 ",50,2,17,True,
Stanford,2018-07-10,17:47:40,"Rather than building on science that has a long legacy and is often at the edge of breakthrough – what he calls ""science in flower"" – Tadashi Tokieda prefers pursuing answers amidst the unknown – ""science in bud."" https://stanford.io/2KPBOAV ",60,1,30,True,
Stanford,2018-07-10,17:02:34,For days when you’re in a non-fiction mood:  https://stanford.io/2KLDJpL  #CardinalBookClub pic.twitter.com/MFOUmHkJv7,33,0,6,True,#CardinalBookClub
Stanford,2018-07-10,16:28:28,".@StanfordEarth researchers are monitoring Antarctic ice shelves to understand how and why the continent is changing, and what that could mean for future sea levels. https://stanford.io/2KJAm2N ",41,0,12,True,
Stanford,2018-07-10,13:40:14,"""The pursuit of knowledge, to discovery, seems to me an unalloyed good, akin to ice cream or kindness or apple pie or the Beatles."" @StanfordLaw Dean M. Elizabeth Magill on what matters to her and why:  https://stanford.io/2KL2anB  pic.twitter.com/TLWo1FaZiC",54,1,20,True,
Stanford,2018-07-10,11:09:00,"Thirty-nine percent of Americans over age 65 take five or more medications. But in many cases, doctors have no idea what side effects might arise from adding another drug to a patient’s personal pharmacy. https://stanford.io/2KNEEX1 ",45,1,30,True,
Stanford,2018-07-10,08:30:00,"While saying “girls are as good as boys at math” is meant as encouragement, it can unfortunately backfire. https://stanford.io/2KKmup6 ",114,9,43,True,
Stanford,2018-07-10,08:00:00,"If you can predict the path of the jet stream, the upper atmosphere’s undulating river of wind, then you can predict weather – not just for a week or two, but for an entire season. https://stanford.io/2N30GkW ",36,0,13,True,
Stanford,2018-07-09,21:00:04,"Aquatic mammal size is bounded at the small end by the need to retain heat and at the large end by difficulties getting enough food to survive, @StanfordEarth researchers found.  https://stanford.io/2N3f6BA  pic.twitter.com/wM0uCmbIby",55,0,11,True,
