username,date,time,tweet,likes,replies,retweets,retweet,hashtags
MikeSteinman,2018-03-15,18:48:18,Proud to be colleagues with amazing surgeon-investigator Emily Finlayson - doing groundbreaking work on improving surgical decision-making and outcomes in older adults.  #UCSFwomen #InternationalWomensDay @UCSFGeriatrics @UCSFHospitals @UCSFSurgery,20,0,8,True,"#UCSFwomen,#InternationalWomensDay"
iDelirium_Aware,2018-03-14,18:16:52,"Great #WDAD2018 Material from @UCSFHospitals and @UCSFGeriatrics! Stellar geriatrics programs @geri_fabiny, @MikeSteinman, and @geri_doc to #prevent delirium@AmerDelirium @EDA_delirium @ANZDA_delirium https://twitter.com/UCSFHospitals/status/974050064913125377 …",15,0,14,True,"#WDAD2018,#prevent"
MikeSteinman,2018-03-15,16:27:39,Good riddance. https://www.statnews.com/2018/03/14/sec-charges-theranos-elizabeth-holmes/?utm_source=STAT+Newsletters&utm_campaign=85eab195c7-Daily_Recap&utm_medium=email&utm_term=0_8cab1d7961-85eab195c7-149552077 …,0,0,0,True,
CIHR_IRSC,2018-03-08,06:21:42,Happy International Women's Day! #IWD2018 #MyFeminism pic.twitter.com/uddfksnBuK,28,0,12,True,"#IWD2018,#MyFeminism"
KBibbinsDomingo,2018-03-14,21:58:58,"“If young teenagers can embrace activism and say #Enough by engaging in the political conversation, certainly physicians can too. “YES! https://blogs.scientificamerican.com/observations/its-time-for-more-physicians-to-embrace-advocacy/ …",21,0,10,True,#Enough
WrayCharles,2018-03-15,10:53:39,"Seriously, guys...This has got to come to an end. Physicians take the high road in so many areas, yet we can't seem to get this one right... @choo_ek @JenniferBrokaw @FutureDocs @TomVargheseJr @LekshmiMD @Peralta_KHRC https://twitter.com/JulieSilverMD/status/974120697332158464 …",117,15,54,True,
sarahgcandler,2018-03-14,07:58:45,"I spent 30min diagnosing and counseling a patient with PTSD who’s lost 7 friends to suicide. To bill more than $20 for the visit, I had to listen to his heart, lungs, ask about fevers, diarrhea, etc. It felt inappropriate, intrusive. E/M coding needs an update. #SGIMadvocacy",316,10,93,True,#SGIMadvocacy
Top_Gundersen,2018-03-14,09:32:17,"On my flight to #HPM18:Flight Attendant: Is there a doctor on board?Me: I’m a doctor. F.A.: And what is your specialty?Me: Umm...I’m a hospice doctor. F.A: (silence)Me: I’m also a family doctor. F.A.: Ok, we’ll go with that. #Palliative #HPM",1350,28,208,True,"#HPM18,#Palliative,#HPM"
ucsfcvp,2018-03-14,21:16:27,"""There is no medicine as powerful as housing."" -- Dr. @MKushel testifying at the Subcommittee No. 1 on Health and Human Services in Sacramento, CA #homelessness #housingisthebestmedicine @UCSF pic.twitter.com/DRTq7CrZV9",82,0,41,True,"#homelessness,#housingisthebestmedicine"
UCSFMedicine,2018-03-14,15:51:06,"Today, our @UCSF students gathered in a peaceful vigil for the victims of the #ParklandSchoolShooting and all gun violence. #EnoughIsEnough pic.twitter.com/6NXj8K0zrR",31,0,9,True,"#ParklandSchoolShooting,#EnoughIsEnough"
MikeSteinman,2018-03-14,14:24:55,"Thought experiment to illustrate income inequality: what if people had to pay for goods & services as a percent of their income?Cup of coffee = $2 for someone making $30,000/yr, $2000 for someone making $30 mil/yr.",6,0,0,True,
RitchieCS,2018-03-13,22:48:37,"$31,000 salary differential after adjusting for specialty, academic rank, work hours, research time, and other factors—opportunity to increase equity for women in discovery https://www.ncbi.nlm.nih.gov/pmc/articles/PMC3816636/ …",8,0,13,True,
RitchieCS,2018-03-13,22:40:32,Grateful for Dr Carla Perissinotto who works everyday to improve quality of life and reduce loneliness in seriously ill older adults. #UCSFwomen @UCSFGeriatrics @ucsfhealth,21,0,13,True,#UCSFwomen
prepareforcare,2018-03-13,22:38:06,"Celebrating Brie Williams @briewsf this National Women's History month for her groundbreaking work in prison reform, compassionate release, and #palliative care for prisoners #InternationalWomensDay #UCSFwomen #aahpm18 @UCSFGeriatrics @UCSFHospitals https://nyti.ms/2tRU7NN ",17,0,11,True,"#palliative,#InternationalWomensDay,#UCSFwomen,#aahpm18"
CatherineRLucey,2018-03-13,15:29:01,More resolute & committed #UCSFwomen caring for vulnerable populations: #geriatrics #childrenshealth; #palliativecare-- all great teachers as well in @ucsfbridges @annachodos @andakuo Josette Rivera and Louise Walter pic.twitter.com/UaseKqrN00,20,0,12,True,"#UCSFwomen,#geriatrics,#childrenshealth,#palliativecare"
MikeSteinman,2018-03-13,18:29:45,"I know Ken always tries to elevate himself over others, but this is ridiculous.  ;)  @geri_doc https://twitter.com/cblaummd/status/973610143857500160 …",3,0,0,True,
statnews,2018-03-13,18:03:19,"BREAKING: 'Right-to-try' bill rejected by House, in major blow to GOP efforts https://buff.ly/2tSDh1h ",96,3,91,True,
timkaine,2018-03-12,16:58:17,"Ten rounds.That's the magazine limit allowed in Kentucky while hunting deer.Yet when we call for similar limits on assault weapons used in mass shootings, we're told it violates the 2nd Amendment.Why are we valuing deer lives more than human life?",73851,1968,25094,True,
ChrisMurphyCT,2018-03-12,19:56:01,"My day:First, Trump and Republicans handed over the keys to the school violence debate to the gun industry.Second, my 6 yr old was locked in a tiny bathroom w his 24 classmates for their active shooter drill. ""I didn't like it, Daddy"" he said.Sleep well tonight, colleagues.",67125,1261,21509,True,
geri_doc,2018-03-12,22:13:37,"@GMHarperdoc Among the many great things about @UCSF #geriatrics, one of the greatest is being colleagues with superstar Geriatrician and Educator Mike Harper!  @GMHarperDoc  http://profiles.ucsf.edu/michael.harper ",20,0,4,True,#geriatrics
AlexSmithMD,2018-03-12,11:36:24,"Shout out to @gerimuse, inspiring mid-career transition from clinical program building to research! #UCSFWomen #InterationalWomensDay @UCSFGeriatrics @UCSFHospitals",10,1,6,True,"#UCSFWomen,#InterationalWomensDay"
briewsf,2018-03-12,13:00:41,Proud that Rebecca Sudore @prepareforcare is my colleague.  This National Women’s History Month I celebrate her contributions to advance care planning that empower all people to have a voice in their healthcare!  #InternationalWomensDay #UCSFwomen @UCSFGeriatrics @UCSFHospitals,39,1,17,True,"#InternationalWomensDay,#UCSFwomen"
shannonrwatts,2018-03-10,12:30:10,"Not even a national news story. Yountville ahooter was getting treatment for PTSD, yet still had access to semiautomatic rifles and ammo. https://twitter.com/kron4news/status/972343265209942016 …",23006,270,12565,True,
judith_graham,2018-03-06,19:06:33,Adverse drug events among older adults in community settings are rising.  @MikeSteinman https://twitter.com/MikeSteinman/status/971184190099091456 …,3,0,1,True,
MikeSteinman,2018-03-06,18:42:09,Adverse drug events *during* hospital stays fell 24% from 2010 to 2014 - but number of patients *admitted for* adverse drug events rose 16%. Older adults are highest-risk group.  We in ambulatory care must do better.  @AHRQNews  https://www.hcup-us.ahrq.gov/reports/statbriefs/sb234-Adverse-Drug-Events.jsp … pic.twitter.com/23BpJ5WoMI,12,0,10,True,
SteveKerr,2018-03-03,15:26:07,It's time to stand up to the NRA's bullying  http://nyp.st/2oAyaO8  via @nypost,4845,116,1132,True,
adfoxMD,2018-03-04,08:25:13,"Clinic yesterday one of those days where I was 2 hours behind, surprised by multiple emergency walk-ins, frustrated by forms, but humbled by my patients' resilience & so incredibly touched by these powerful relationships we form in #primarycare. Left clinic exhausted & smiling.",117,4,25,True,#primarycare
LeighKimberg,2018-03-03,16:29:31,@UCSF @annachodos The brilliant Dr. Anna Chodos teaching us about diagnosing dementia in primary care. Basics: Patient has to have both acquired cognitive impairment and acquired functional impairment #dementia #geriatrics #healthcare #vulnerablepop2018 pic.twitter.com/vRum7jV33V,4,0,2,True,"#dementia,#geriatrics,#healthcare,#vulnerablepop2018"
AnilMakam,2018-03-01,08:50:21,"After 2 weeks on wards I'm feeling cynical about the state of #MedEd & #doctoring. If at the end of the day you test & treat for everything that can cause an abnormal finding, what's the point of teaching good clinical reasoning & EBM",14,3,5,True,"#MedEd,#doctoring"
DavidJuurlink,2018-03-03,06:07:54,NPR piece on how opioids can paradoxically worsen pain  https://www.npr.org/sections/health-shots/2018/03/03/586621236/when-opioids-make-pain-worse?utm_source=dlvr.it&utm_medium=twitter … links to two worthwhile reads. /1,218,19,148,True,
DeprescribeNet,2018-02-27,09:01:57,@CBCQuirks Our director @cara_tannenbaum talks #deprescribing on @CBCquirks http://www.cbc.ca/radio/quirks/neanderthals-good-at-art-treating-fake-news-and-more-1.4547017/over-medicated-seniors-are-an-unseen-epidemic-1.4547370 …,17,0,15,True,#deprescribing
zacharyamarcum,2018-02-27,15:22:34,New Editorial in @AGSJournal with @MikeSteinman on developing a core outcome set in trials to improve medication use in older adults  http://onlinelibrary.wiley.com/doi/10.1111/jgs.15269/full/ …,13,0,8,True,
geri_doc,2018-03-02,16:00:57,"Talmadge King:  ""The best leaders make every attempt at building their organizations with people who are brighter and more talented than they are"" @TalmadgeKing @UCSF",38,1,23,True,
geri_doc,2018-02-26,23:24:34,"@marlon_aliberti Geriatric assessment is crucial for improving care of older patients, but busy clinicians need pragmatic measures such as TAGA that collect useful info without much time @Marlon_Aliberti #geriatrics  http://onlinelibrary.wiley.com/doi/10.1111/jgs.15303/full/ …",14,1,6,True,#geriatrics
GeriPowerMD,2018-02-27,01:02:49,O SNAP!!! @GMHarperdoc concisely debunked the Ensure racket with this  slide #gerifellowship #realfood pic.twitter.com/7NmhtVK1rb,9,0,5,True,"#gerifellowship,#realfood"
Atul_Gawande,2018-02-26,17:02:38,"The key thing I learned in doing my interviews for #BeingMortal: People have goals and priorities for their care besides just living longer. We have to ask what they are and align our care with them. When we don't ask what's important to them, the result is profound suffering.",1685,51,871,True,#BeingMortal
Weinsteinlaw,2018-02-24,20:40:54,"“Be a nuisance where it counts. Do your part to inform and stimulate the public to join your action. Be depressed, discouraged, and disappointed at failure & the disheartening effects of ignorance, greed, corruption and bad politics, but never give up.” - Marjory Stoneman Douglas pic.twitter.com/mpBdEnMAs7",1216,19,668,True,
WrayCharles,2018-02-26,10:21:00,"@templeratcliffe @mmteacherdoc @FutureDocs @JournalGIM Not terribly surprising...Reminds me of @TulaneMedicine's Jeff Wiese comment on optimizing performance: "" We need to have a little tension to obtain optimal performance"" - as illustrated by the classic Yerkes Dodson curve. Too little=lazy, Too much=burnt out pic.twitter.com/cYoNA0wu4G",6,0,1,True,
JessicaZitter,2018-02-26,11:15:14,"Some of the #endoflifeplanning you need to do is theoretical, but here’s some that’s practical. Pre-need #funeralplans can be complicated, so here is a primer on everything you’ll need to know from the @nytimes  http://ow.ly/5PJk30ixe7T  #eol #eolc",9,1,11,True,"#endoflifeplanning,#funeralplans,#eol,#eolc"
Atul_Gawande,2018-02-26,06:28:21,"Dr Bernard Lown, Nobel Prize winner and hospital patient at 96, in revolt: ""Healing is replaced with treating, caring is supplanted by managing."" Should he be allowed to eat? Has anyone asked him? The magnificent story from the intern on his medical team. https://www.nytimes.com/2018/02/24/opinion/sunday/doctors-revolt-bernard-lown.html …",2172,57,1264,True,
CatherineRLucey,2018-02-26,11:33:49,"“Trainees should be the reason we succeed in improving patient care, not the reason we don’t.” @UCSFMedicine Nehraj Segal MD #meded21",22,0,7,True,#meded21
MikeSteinman,2018-02-25,11:41:22,Stop. This. Now. https://www.nytimes.com/2018/02/24/us/politics/pharmacy-benefit-managers-gag-clauses.html …,7,0,4,True,
MikeSteinman,2018-02-23,15:55:55,"1. Mic drop2. Define ""adult"" https://twitter.com/sarahchad_/status/967088933795454976 …",0,0,0,True,
KeithNHumphreys,2018-02-21,18:56:18,Benzodiazepine-involved deaths are up 800% -- shape of curve very similar to opioids...many deaths involve both drugs. pic.twitter.com/iNgQ0Bkil0,127,21,134,True,
DeprescribeNet,2018-02-22,08:52:39,@lowninstitute share their highlights from our recent summit on #medication safety and #deprescribing! http://lowninstitute.org/news/blog/deprescribing-lessons-canada/?platform=hootsuite …,3,0,2,True,"#medication,#deprescribing"
Deprescribing,2018-02-09,11:20:16,"Are you a health care professional, policy maker or member of the public interested in implementing #deprescribing #guidelines? If so, join us at our #Deprescribing Guidelines Symposium in March 2018. For more info visit  http://deprescribing.org/news/  pic.twitter.com/CTzR18YO1X",10,0,8,True,"#deprescribing,#guidelines,#Deprescribing"
NicoleK8686,2018-02-19,12:09:31,The same people that said 13 and 14 year olds were perfectly mature enough to date Roy Moore are now saying 17 and 18 year olds are too immature to have opinions on gun control.,378106,2779,126594,True,
Sarahchadwickk,2018-02-19,23:56:19,"Upset to hear our governor Rick Scott wont be attending  the town hall meeting on Wednesday. To be fair, he does have an A+ rating from the NRA, and i think he's scared of my peers and i.",71421,1601,15832,True,
hmkyale,2018-02-20,07:39:24,Don’t we all need awesome qualitative researchers; they are in too short supply. And we need medical journals to recognize the value of this line of inquiry. So needed in medicine. Thank you to my mentors in this area: @lesliecyale @ehbvassar. https://twitter.com/vmontori/status/965682091043311616 …,30,0,14,True,
jeffreylinder,2018-02-18,20:57:32,"A nice effort by @DouthatNYT, but the Las Vegas gunman -- who shot 480 people in 10 minutes -- was 64 years old. He acquired his automatic/semi-automatic weapons to carry out the act. No citizen needs these weapons of war.  https://nyti.ms/2C2DCBu  pic.twitter.com/KTQQ0WY4wV",4,0,3,True,
shannonrwatts,2018-02-19,14:57:58,"1) I'm tired of pundits speculating that if only officials had been warned, they could have taken this kids guns away. It doesn't work like that. The 19-year-old shooter had never been convicted of a crime and hadn't been adjudicated as mentally ill. He legally owned guns.",32070,563,10371,True,
Deprescribing,2018-02-20,11:15:08,This physician wants her patients to use fewer #medications  http://ow.ly/aT3H30ivzWX  via @washingtonpost #deprescribing #polypharmcy,22,0,23,True,"#medications,#deprescribing,#polypharmcy"
Deprescribing,2018-02-19,16:20:07,"Read the latest #deprescribing newsletter to stay up to date on our research, publications and #guideline development  http://ow.ly/SSSn30iqH3t  #polypharmacy pic.twitter.com/rgeolEN5j0",21,0,21,True,"#deprescribing,#guideline,#polypharmacy"
ASlavitt,2018-02-15,22:30:29,They’ve decided on a decade of silence instead. https://twitter.com/thehill/status/964345871117815808 …,4833,75,1587,True,
MikeSteinman,2018-02-18,18:26:54,"Pity the poor drug companies - after funding all of those deeply informative ads and unbiased patient advocacy groups, they barely have any money left to make a profit... https://twitter.com/davidjuurlink/status/963377639925997568 …",0,0,0,True,
AnilMakam,2018-02-13,22:42:54,"I don't understand how so many placebo controlled trials are approved by ethics boards, peer reviewers & NIH (& other funders) when standard of care is not placebo https://twitter.com/RichardLehman1/status/963371448550215680 …",5,0,1,True,
MikeSteinman,2018-02-18,18:23:22,In America we ALL look like those beautiful people in the drug ads. https://twitter.com/davidjuurlink/status/964921253781037056 …,0,0,0,True,
MikeSteinman,2018-02-18,18:21:58,Calling all deprescibing aficionados  -  I'm going; come join me. @Deprescribing @OptimisingRxUse https://twitter.com/deprescribing/status/964265597323436033 …,2,3,0,True,
hmkyale,2018-02-15,08:31:47,"What I say to trainees is… put yourself in place of the patient, who has likely been looking forward to appt for weeks, preparing for it at least all day, & will reflect on it perhaps for a week. Recognize the moment and its importance. Not just another appointment in busy day. https://twitter.com/BMJPatientEd/status/964119621203832834 …",402,13,208,True,
Deprescribing,2018-02-13,10:53:06,A randomized clinical trial on the effect of a pharmacist-led extended #medication review and follow-up on discharge may decrease risk of readmission  http://ow.ly/T91T30inrFV  @JAMAInternalMed #deprescribing #polypharmacy,107,2,92,True,"#medication,#deprescribing,#polypharmacy"
jeffreylinder,2018-02-16,10:17:15,"On October 1, 2017, a gunman shot 480 people -- FOUR HUNDRED AND EIGHTY -- killing 58 with automatic/semi-automatic weapons. Remember? Congress did nothing.How many more have to be shot/die before we reinstate the assault weapons ban?",4,1,4,True,
DevilleSy,2018-02-14,02:22:52,"Roses are red, Lilies are blue, This poem was short,But reviewer 3 required a number of modifications, so we had to cite many of his own poems and also change the title of the poem, rephrase the last few rhymes, and replace violets by lilies #AcademicValentines",11803,80,4162,True,#AcademicValentines
GeriPowerMD,2018-02-12,00:21:51,almost 2 million adults are largely homebound and another 5.5 million are semi-homebound. so rad to see my work in caring for them described by @RitchieCS !! thanks boss!!! #geriatrician #HPM https://catalyst.nejm.org/intersection-home-based-primary-care-palliative/ … pic.twitter.com/PhxM6a9x6b,5,1,1,True,"#geriatrician,#HPM"
UCSF,2018-02-08,02:02:01,BREAKING: New $500 million commitment brings total from the Diller family to UCSF to a remarkable $1.15 billion. #ThankYou for supporting our vision for a healthier world. https://www.ucsf.edu/news/2018/02/409741/ucsf-receives-500m-commitment-helen-diller-foundation-begin-planning-new?utm_source=ucsf_tw&utm_medium=tw&utm_campaign=HDFgift_2018&utm_term= …,104,0,47,True,#ThankYou
MikeSteinman,2018-02-08,10:57:03,"Rather than debating if SBP target for HTN should be 130, 140, or 150, should focus more on determining what are people's *actual* BPs. Clinic BP measures unreliable & often huge visit-to-visit variability - yet we use these to see if pt is at ""goal.""  https://www.ncbi.nlm.nih.gov/pubmed/29365036  pic.twitter.com/HqrY5I4fxO",10,2,3,True,
mad_sters,2018-02-05,16:52:54,"@JAMAInternalMed Really interesting work by @AnilMakam @OanhKieuNguyen in this week's @JamaInternalMed ""Hospital vs Skilled Nursing Facility Use Among Hospitalized Older Adults""  http://ja.ma/2EHyBNi ",4,0,1,True,
LouiseAronson,2018-02-05,16:33:55,Deeply disturbed that @statnews is (again) linking #aging w/ “crisis” & “problem” while also touting the #science & #biotech producing longevity w/o considering or investing in long term impact. Could VR & robots slow the global aging crisis?  https://www.statnews.com/2018/02/05/aging-japan-robots-virtual-reality/ …,5,1,6,True,"#aging,#science,#biotech"
NPRHealth,2018-02-05,19:59:58,Risky Antipsychotic Drugs Still Overprescribed In Nursing Homes http://n.pr/2BbYbdw ,80,12,80,True,
KamalaHarris,2018-02-04,10:48:01,"Rosa Parks once said, “I would like to be known as a person who is concerned about freedom and equality and justice and prosperity for all people.” It is clear she fulfilled that. On #RosaParksDay, let us honor her legacy by continuing to strive for justice and equality.",19110,225,6077,True,#RosaParksDay
MikeSteinman,2018-02-04,19:39:01,Yes- though goal is to get every specialist to also think like the last panel. https://twitter.com/trisha_the_doc/status/959560008315932679 …,3,2,0,True,
MikeSteinman,2018-02-03,22:25:09,"American Geriatrics Society's Outstanding Junior Investigator of the Year Award goes to John Newman!  Congrats to @GeriSciDoc for his incredible work on molecular mechanisms of aging, and much more.  @AmerGeriatrics @UCSFGeriatrics",31,0,13,True,
KathrynSmiles,2018-02-01,04:56:50,"As you can see, I’m fully supportive of @RoyMooresHorse running for office and hopefully embarking on a career of public service. pic.twitter.com/1QNmOZPXOp",166,7,35,True,
MikeSteinman,2018-02-01,10:36:49,How to know if your medical school excels in geriatric training - nice short article in @USNewsHealth feat @AnnaChangUCSF.   https://www.usnews.com/education/best-graduate-schools/top-medical-schools/articles/2018-02-01/identify-medical-schools-for-geriatrics-training … @UCSFGeriatrics,6,0,3,True,
geri_tjas,2018-01-31,04:16:32,#PLOSONE: Prognostic effects of delirium motor subtypes in hospitalized older adults: A prospective cohort st ... http://dx.plos.org/10.1371/journal.pone.0191092 …,7,1,9,True,#PLOSONE
MikeSteinman,2018-01-31,22:02:42,We miss you too - and look forward to ongoing work together into the future! https://twitter.com/geri_tjas/status/958646356729528321 …,0,0,0,True,
jsross119,2018-01-30,13:46:09,"Contrary to popular belief, per-capita end-of-life spending is decreasing among Medicare beneficiaries  http://ja.ma/2BFMPLl  pic.twitter.com/xqu7xrnS38",6,0,8,True,
VinayPrasadMD,2018-01-30,13:56:42,IT disrupts healthcare every day I have clinic https://twitter.com/CostAnEffect/status/958426406920314882 …,147,8,30,True,
FredWuMD,2018-01-30,00:10:12,"87 yrs ago, a 4th year med student received this letter of recommendation for a residency spot. He became the first in the world to repair a congenital heart defect and later became surgeon-in-chief. So take heart! Even we somewhat-above-average folks are capable of great things! pic.twitter.com/ADSOV4PXK1",1156,19,425,True,
MikeSteinman,2018-01-30,11:50:10,Great work being done at UCSF to prepare older adults for surgery with superb interdisciplinary collaboration - glad to see it getting attention. https://twitter.com/DoctorTanMD/status/958359675401129985 …,6,0,2,True,
doctormeera,2018-01-29,19:16:15,"Very poignant article.    ""A tragedy is like a fault line. A life is split into a before and an after, and most of the time, the before was better. Few people will let you admit that out loud."" https://twitter.com/kanamckeeMD/status/957768108827066368 …",2,0,1,True,
Deprescribing,2018-01-29,14:05:12,"To support #clinicians in employing the recommendations outlined in the #antipsychotic #guideline, the team at @bruyerecare developed a two-page #deprescribing algorithm   http://ow.ly/tynT30i0kru  pic.twitter.com/LX181M6raS",86,1,82,True,"#clinicians,#antipsychotic,#guideline,#deprescribing"
geri_doc,2018-01-29,22:38:25,"""The design and interpretation of noninferiority trials led to significant and systematic bias in favor or experimental therapy.  Clinicians should exercise caution when interpreting these trials"" Very important article https://link.springer.com/article/10.1007/s11606-017-4161-4 …",11,1,12,True,
medicalaxioms,2018-01-25,11:37:25,A good primary care MD takes years to find a combination of worthwhile meds that the patient can tolerate. Don’t change everything in a 3 day hospital without a damn good reason.,450,22,92,True,
GeriPowerMD,2018-01-23,23:56:30,MY 5 FAVORITE OFFICE-BASED PROCEDURES 1. Continuity 2. Deprescribing 3. Deprescribing 4. Deprescribing 5. Advance care planning #geriatrician #gerifellowship P.s. conveniently these procedures may also be done in the home,244,6,69,True,"#geriatrician,#gerifellowship"
MikeSteinman,2018-01-24,21:47:26,"Compelling piece on following evidence, not hype or moralistic bias against drug therapy, to combat opioid addiction. By @drJoshS.   https://jamanetwork.com/journals/jama/fullarticle/2670713 … pic.twitter.com/rO7Jg22Ku5",2,0,0,True,
MikeSteinman,2018-01-23,13:29:52,"Health care is a right, not a reward for passing a quiz. https://www.nytimes.com/2018/01/22/upshot/kentucky-medicaid-work-requirement.html …",1,0,0,True,
MikeSteinman,2018-01-23,13:26:13,"And they recently revised their scoring criteria: a score of 30 is now deemed ""Presidential."" https://twitter.com/geri_doc/status/955542822555238400 …",1,0,0,True,
DavidJuurlink,2018-01-23,11:00:58,I’m about to speak to a group of scientists on “Why every scientist should be on Twitter”. Can I get a few RTs in the next 60 minutes to show them its reach?,6798,235,12443,True,
geri_doc,2018-01-22,16:27:13,There is no meaningful evidence that any nutritional supplements or vitamins prevent dementia or cognitive decline.  Useful review article #geriatrics  http://bit.ly/2F5ZFEL ,20,1,21,True,#geriatrics
SFVAMC,2018-01-20,15:57:35,"During this government shutdown, SFVAHCS will be open to serve our #Veterans https://twitter.com/veteranshealth/status/954808020608999424 …",6,0,6,True,#Veterans
GeriSciDoc,2018-01-19,18:32:03,"Can we use this moment of MoCA madness for a cognitive screening PSA: ""Are you over 65? Worried about memory? Ask your doctor if MoCA, SLUMS, GPCOG, or MiniCog are right for you!"" #geriatrics #detectdementia",7,1,4,True,"#geriatrics,#detectdementia"
AlexSmithMD,2018-01-17,16:52:05,Housing is a social determinant of health. Simple point but worth repeating.   Housing is a social determinant of health. @MKushel in @NEJM on Hep A outbreak among California #Homeless,38,1,15,True,#Homeless
geri_doc,2018-01-17,22:56:10,Does physical activity prevent dementia and cognitive decline?  Systematic review shows there is no high quality evidence to support this hypothesis #geriatrics  http://bit.ly/2DIxX1s ,15,2,13,True,#geriatrics
