username,date,time,tweet,likes,replies,retweets,retweet,hashtags
MikeSteinman,2017-11-13,23:18:50,"Functional decline common and complex in late middle age - great paper led by @rtbrownMD, w/ great editorial by @MrDisability, and fascinating linked data visualization tool.  http://annals.org/aim/fullarticle/2662101/functional-impairment-decline-middle-age-cohort-study … @AnnalsofIM pic.twitter.com/ilfk9ibI0K",14,0,12,True,
DavidJuurlink,2017-11-13,16:17:50,"Airport security: ""A pager? Are you a doctor or a drug dealer?""Me: ""That depends on your perspective.""",2429,37,435,True,
RFRedberg,2017-11-02,11:52:06,@nytimes ‘Unbelievable’: Heart Stents Fail to Ease Chest Pain via @NYTimes https://www.nytimes.com/2017/11/02/health/heart-disease-stents.html …,17,0,17,True,
MikeSteinman,2017-10-25,10:43:18,Another disturbing twist in this troubling @statnews story on mass-mkt propranolol lozenges. Ripe for exploitation?  https://www.statnews.com/2017/10/25/anxiety-performance-propranolol/ … pic.twitter.com/jFzSKhkz0c,0,0,0,True,
DayDHollis,2017-10-03,20:34:34,Healthcare providers: this is collusion. We should be ashamed. https://www.newyorker.com/magazine/2017/10/09/how-the-elderly-lose-their-rights …,0,0,4,True,
geri_doc,2017-10-18,21:28:44,Education Dean @CatherineRLucey @UCSF announces that DACA students are welcome to apply for UCSF residency positions  Bravo! Proud of University of California leadership on this human rights issue,54,0,12,True,
MikeSteinman,2017-10-13,16:26:20,October 21 is National Check Your Meds Day. A great reminder to review your meds!  https://www.consumerreports.org/media-room/press-releases/2017/10/consumer_reports_declares_october_21st_2017_national_check_your_meds_day_to_help_prevent_medication_mistakes_save_money1/ … @Ginger_Skinner @ConsumerReports pic.twitter.com/8VfQOXftpB,12,0,7,True,
CDCgov,2017-10-08,11:00:08,Is your power out? DON’T run a generator or any gas-powered engine inside! Keep them at least 20 feet away.  http://go.usa.gov/Dtd  #Nate pic.twitter.com/rDFEuMW8pt,148,10,164,True,#Nate
MikeSteinman,2017-10-02,23:20:29,Yes - that and the coffee provided by the fabulous @AmerGeriatrics staff. https://twitter.com/nlundebjerg/status/914826580324646912 …,3,0,0,True,
ShaunKing,2017-09-25,16:11:56,I love this. pic.twitter.com/tYLZIYfSh1,18416,111,4772,True,
JohnArnoldFndtn,2017-09-25,15:32:14,"AbbVie essentially says, ""Well if Congress isn't going to act, let's forget all that PR crap. Jack up the prices!""   https://www.axios.com/abbvie-believes-political-risks-of-drug-pricing-are-waning-2488356410.html … pic.twitter.com/dJjvIeDcGT",40,1,21,True,
jsross119,2017-09-25,07:27:05,"Just pub'd: FDA Unnaproved Drug Initiative has best intentions, but associated w/ increased drug prices & shortages  http://www.jmcp.org/doi/abs/10.18553/jmcp.2017.23.10.1066#.Wcj0nwgHlxQ.twitter … pic.twitter.com/N7bROPIn8u",13,1,25,True,
geri_doc,2017-09-25,14:23:20,Eric Reid: Why Colin Kaepernick + I Decided to Take a Knee So eloquent Protest=love of country/patriotism @E_Reid35 https://nyti.ms/2jXA7Em ,0,0,2,True,
MikeSteinman,2017-09-17,22:43:13,Go Anil - and those doctors to your right and left aren't too shabby themselves! https://twitter.com/utswnews/status/908681071562231808 …,1,0,0,True,
walidgellad,2017-09-15,05:38:03,One chart that tells you everything you need to know about what's wrong with drug prices in America. https://twitter.com/jamie_love/status/908430243127578624 …,37,4,38,True,
doctormeera,2017-09-16,13:33:43,I love this idea- promote mobility among hospitalized older adults to prevent functional decline! https://twitter.com/07702034ciara/status/908401179754946560 …,19,1,12,True,
OptimisingRxUse,2017-09-15,10:06:06,"Q. How many community-dwelling seniors know the word #deprescribing?We didn't know either, so we asked! @AGSJournal  http://onlinelibrary.wiley.com/doi/10.1111/jgs.15079/full …",16,5,13,True,#deprescribing
MikeSteinman,2017-09-14,10:19:26,Acthar gel (rACTH) - a huge and unconscionable cost trap.  http://jamanetwork.com/journals/jamainternalmedicine/fullarticle/2653007 … @JAMAInternalMed pic.twitter.com/UF55Ik7ZML,2,0,0,True,
MikeSteinman,2017-09-11,14:08:04,Thanks for inviting me - always a pleasure to come to Highland. https://twitter.com/DrLPFernandez/status/906174973999423489 …,0,0,0,True,
MikeSteinman,2017-09-11,11:06:47,Pharma has now officially jumped the shark.  https://www.nytimes.com/2017/09/08/health/allergan-patent-tribe.html?_r=0 … @walidgellad,1,2,3,True,
ASlavitt,2017-09-06,11:09:11,My new column in @USATODAY. Congress is back & health care is first up... https://www.usatoday.com/story/opinion/2017/09/06/health-care-smackdown-last-ditch-aca-repeal-drive-threatens-bipartisan-fixes-andy-slavitt-column/634207001/ …,296,13,317,True,
MikeSteinman,2017-09-07,11:18:14,"Great piece on Trump admin & science. Politicized, but scientists can engage w/o making science partisan.  https://newsatjama.jama.com/2017/09/06/jama-forum-science-and-the-trump-administration/ … @drJoshS",1,0,0,True,
CircOutcomes,2017-08-23,15:00:00,Odds of poor med adherence 6x greater when patient-provider interactions don't address patients’ unmet social needs http://circoutcomes.ahajournals.org/content/10/9/e003659 … pic.twitter.com/uS5y0MiQJH,26,0,35,True,
KirstyPatrick,2017-08-28,16:47:37,Great (and funny) presentation by @FralickMike on #DKA as harm of taking #SGLT2 inhib at #ICPEMontreal (found 2x ⬆️risk -small AR),5,1,1,True,"#DKA,#SGLT2,#ICPEMontreal"
jayparkinson,2017-08-28,18:46:32,80k invites. 499 connected their wearable. And 95% of ppl abandon their wearables after 3 months. So 25 at 3 months. Sounds right to me. https://twitter.com/brennanspiegel/status/901246912988196865 …,45,3,36,True,
MikeSteinman,2017-08-28,20:33:13,Comprehensive but probably confusing for many. Likely a better way of showing these risks. https://twitter.com/doctormeera/status/902334183049109504 …,0,0,0,True,
MikeSteinman,2017-08-28,17:11:19,"""Diabetes-friendly"" beta blockers reduce hypogly but increase risk of hospitalization in nursing home residents. @andrewzullo #ICPEMontreal",1,0,0,True,#ICPEMontreal
AnilMakam,2017-08-28,11:00:09,"Worth repeating: ""don't just do something, stand there!"" Few trainees get this b/c not role-modeled & rewarded  https://jamanetwork.com/journals/jamainternalmedicine/fullarticle/2649266?utm_source=twitter&utm_campaign=content-shareicons&utm_content=article_engagement&utm_medium=social&utm_term=082717#.WaNvduK9d-p.twitter … pic.twitter.com/AsfYzyVsdB",1,0,1,True,
nlundebjerg,2017-08-28,09:06:32,"Me, avg #American: Nope, did not think to look for an arbitration clause in Mom's #nursinghome contract  https://nyti.ms/2vKB1rD  #geriatrics",2,0,1,True,"#American,#nursinghome,#geriatrics"
MikeSteinman,2017-08-25,15:40:01,I’ve got a new drug: amantadine XXL. Trial: works better than dog poop. Price: $1 mil/yr. Hello $$$!   https://www.statnews.com/2017/08/25/adamas-parkinsons-pricing/?utm_source=STAT+Newsletters&utm_campaign=842f14529d-Pharmalot&utm_medium=email&utm_term=0_8cab1d7961-842f14529d-149552077 … @walidgellad,4,0,3,True,
drJoshS,2017-08-25,05:20:52,"First, declare an emergency on #opioids...Then, what? My answer in @USATODAY https://goo.gl/ZjN6jn ",19,1,27,True,#opioids
WrayCharles,2017-08-24,14:35:02,"We need to get over the idea that transferring a pt to ICU or having a ""bounceback"" to hospital is a personal fault  http://blogs.jwatch.org/general-medicine/index.php/2017/08/is-transferring-a-patient-to-the-icu-a-failure/ … pic.twitter.com/ynkp8S9QgS",5,0,3,True,
TideswellUCSF,2017-08-23,17:39:00,Tideswell's Christine Ritchie blogs about the Opportunities and Threats to Home-Based Medical Care Under MACRA  http://www.commonwealthfund.org/publications/blog/2017/aug/opportunities-and-threats-to-home-based-medical-care-under-macra …,2,0,6,True,
DeprescribeNet,2017-08-17,09:05:28,"If any one of these six questions describes your drug regimen, it's time for a #medication #review.  https://www.consumerreports.org/prescription-drugs/is-it-time-for-a-medication-reconciliation/ … #deprescribing",14,0,12,True,"#medication,#review,#deprescribing"
KamalaHarris,2017-08-16,10:41:19,"“We must take sides. Neutrality helps the oppressor, never the victim.” —Elie Wiesel #WednesdayWisdom",13279,226,5445,True,#WednesdayWisdom
walidgellad,2017-08-16,19:20:01,The head of VA pharmacy has a message for the Pres about Merck and drug prices. https://twitter.com/michaelvalent12/status/897280848466251777 …,18,1,12,True,
Masters_JamesD,2017-08-16,03:28:56,This is absolutely chilling from Charlottesville synagogue... the US in 2017. Read it.  http://reformjudaism.org/blog/2017/08/14/charlottesville-local-jewish-community-presses?utm_source=Share&utm_medium=social&utm_campaign=BlogPost&utm_content=Zimmerman … pic.twitter.com/Fc88cQsYoX,18964,747,23929,True,
brianefallon,2017-08-15,22:49:37,Also confronted the Nazis without a permit: pic.twitter.com/3c2f3X9slC,7102,958,3169,True,
SenJohnMcCain,2017-08-15,20:02:31,There's no moral equivalency between racists & Americans standing up to defy hate& bigotry. The President of the United States should say so,186499,15569,59710,True,
shannonrwatts,2017-08-15,23:16:35,Here's a pic of both sides. Which one are you on? pic.twitter.com/H33I3z4ays,3781,126,1913,True,
Deprescribing,2017-08-16,16:30:10,Interested in our #deprescribing guidelines and algorithms? Check out our YouTube channel and subscribe to us!  http://bit.ly/2i5Jscb  pic.twitter.com/eD65pk1jQW,23,0,34,True,#deprescribing
Deprescribing,2017-08-16,11:15:01,"Great way to facilitate communication + #deprescribing: ""Effect of the Tool to Reduce Inappropriate Medications...""  http://bit.ly/2walC5w ",27,1,26,True,#deprescribing
geri_doc,2017-08-15,13:46:00,Five @UCSF #Geriatrics faculty receive excellence in teaching awards!  Bravo! Proud of our great colleagues!  http://meded.ucsf.edu/cfe/excellence-teaching-award-2017 …,20,0,7,True,#Geriatrics
MikeSteinman,2017-08-15,17:16:11,"Goodbye ""UTI,"" hello ""urinary tract dysbiosis"" - smart piece by the incomparable Tom Finucane.  http://onlinelibrary.wiley.com/doi/10.1111/jgs.14907/abstract?campaign=woletoc … pic.twitter.com/2gEBwRAUpf",0,0,0,True,
MikeSteinman,2017-08-11,20:25:56,Agree - and written by my fantastic colleague @LouiseAronson.  @UCSFGeriatrics https://twitter.com/zacharyamarcum/status/896133122848243712 …,7,0,2,True,
geri_doc,2017-08-11,15:53:41,@MikeSteinman Is it time for a medication reconciliation? Great advice from consumer reports and @mikesteinman #geriatrics https://www.consumerreports.org/prescription-drugs/is-it-time-for-a-medication-reconciliation/ …,9,2,6,True,#geriatrics
StefanKertesz,2017-08-10,13:16:05,"@AMERSA_tweets @emmarcourt @walidgellad @ml_barnett 7/Simply counting Rx's and asserting ""low number"" = good care and ""high number"" = bad care is a problematic way to think about human beings",36,3,12,True,
MikeSteinman,2017-08-08,23:35:32,@Ginger_Skinner Important series of articles in @ConsumerReports on overmedication; kudos @ginger_skinner & @TeresaRCarr. https://www.consumerreports.org/prescription-drugs/too-many-meds-americas-love-affair-with-prescription-medication/ …,1,0,2,True,
ZackBergerMDPhD,2017-08-08,21:57:11,"Oh, and lookee there. The patient organization is supported in large measure by the pharma company which is writing the paper. Who knew. https://twitter.com/ZackBergerMDPhD/status/895115577123057665 …",48,3,17,True,
DeprescribeNet,2017-08-07,08:21:27,Fantastic series of articles on #medications and #deprescribing in @ConsumerReports https://twitter.com/ChrisRalphRx/status/893571591652507648 …,4,0,5,True,"#medications,#deprescribing"
EricTopol,2017-08-04,08:25:41,Yes. Way Too Many Meds. Think De-prescribe. https://www.consumerreports.org/prescription-drugs/too-many-meds-americas-love-affair-with-prescription-medication/ … #OASuperb @ConsumerReports by @TeresaRCarr @MLTellado pic.twitter.com/dHcMXIYpN5,102,12,63,True,#OASuperb
statnews,2017-08-07,18:00:02,Drug makers often say they can't give samples to generics makers because of safety regs. The FDA is getting annoyed. http://bit.ly/2uzW3Fo ,20,0,24,True,
samstaydipped,2017-08-02,18:53:46,Imagine carrying 18 dumbbells to the court tryna look cool just to get overshadowed by a old man hitting free throws pic.twitter.com/RLuIIv1WPd,227150,1433,108314,True,
RebeccaDRobbins,2017-08-04,08:32:42,STAT wanted to know: Where in America are people most likely to take their Rx? And least likely? Here's one measure: https://www.statnews.com/2017/08/04/blood-pressure-adherence/ … pic.twitter.com/6khBndrmF5,29,5,38,True,
MikeSteinman,2017-08-03,19:16:50,Studies of medical homes more favorable when evaluation sponsored. Impt piece by @UCSFGeriatrics T32 fellow Anna Oh!  http://jamanetwork.com/journals/jamainternalmedicine/fullarticle/2646772?resultClick=1 …,4,0,3,True,
MikeSteinman,2017-08-03,19:07:27,Clearheaded approach to lipid management from @hmkyale in @JAMA_current.  Simple & smart.   http://jamanetwork.com/journals/jama/fullarticle/2645740?utm_medium=alert&utm_source=JAMALatestIssue&utm_campaign=01-08-2017 … pic.twitter.com/uyvaJyQDqz,2,0,1,True,
GeriSciDoc,2017-08-03,12:33:01,Witnessing a beautiful US naturalization ceremony. This is what makes America great.,7,0,2,True,
BeetaRasouli,2017-08-03,09:24:27,"Personal favorite: ""Sorry I was on mute."" #ConferenceCallBingo pic.twitter.com/JrRyj1j45E",15,0,10,True,#ConferenceCallBingo
KBibbinsDomingo,2017-08-02,10:48:21,"Saw this in 6 diff locations this AM (patient waiting, student lobby, public space) Thanks! @UCSFMedicine @ucsfhealth @UCSFHospitals @ucsf pic.twitter.com/fltpoF5C84",49,0,13,True,
MikeSteinman,2017-08-02,17:04:57,You will sign that advance directive NOW. https://twitter.com/briannamorgannp/status/892747156502831105 …,2,0,0,True,
marlon_aliberti,2017-07-31,16:13:55,Evidence in Geriatrics requires insightful methodology. Great paper from @MikeSteinman et al.  http://jamanetwork.com/journals/jamainternalmedicine/article-abstract/2592699 … #JAMA #β-Blockers #AMI,1,0,1,True,"#JAMA,#β,#AMI"
Atul_Gawande,2017-08-01,16:52:31,.@ASlavitt with breaking news on Trump's decision re: the fate of Cost Sharing Reduction subsidies. Whole thread is worthwhile. https://twitter.com/ASlavitt/status/892475702511112198 …,351,19,327,True,
Age_Matters,2017-07-28,17:43:01,"@GeriSoc My name isn't sweetie, dearie, or love.. great ageism poster from the NHS @gerisoc @geronsociety pic.twitter.com/Egg52m8J5T",486,17,369,True,
drJoshS,2017-07-28,12:18:39,Special thanks to @ASlavitt for his relentless advocacy for common sense and coverage.,34,0,5,True,
KQEDnews,2017-07-28,01:10:04,.@JerryBrownGov reacts to the U.S. Senate voting down legislation aimed at dismantling the #ACA. Story:  http://bit.ly/2uE7gs8  pic.twitter.com/3uKk3YQcPx,42,2,18,True,#ACA
geri_doc,2017-07-28,00:44:08,Great night for America.  Health care preserved for millions.  Disaster averted.,34,1,6,True,
charlesornstein,2017-07-28,00:48:41,"""We're not celebrating. We are relieved,"" says @SenSchumer. ""We are relieved, not for ourselves, but for the American people.""",95,0,46,True,
AlexGelhar,2017-07-28,00:16:46,"While we are celebrating McCain, worth noting the only two GOPers with a consistent backbone in this fight have been two women. 👊",1524,25,426,True,
ezraklein,2017-07-28,00:31:23,"McCain votes no, killing, for now, a GOP bill no one wants to see become law, and a process no one can defend.",5687,65,1711,True,
oconnor_jeremy,2017-07-28,00:32:05,Thank you @SenJohnMcCain @SenatorCollins @lisamurkowski. We will not forget that you stood up for patients nationwide. #ACA,11,0,8,True,#ACA
MikeSteinman,2017-07-27,23:25:42,More amazing work by @GeriSciDoc https://twitter.com/agingup/status/890651831981924352 …,3,0,0,True,
DLeonhardt,2017-07-27,20:20:21,"Unlike many medical org's, AARP has fought hard against these bills, rather than opposing mostly through press release. https://twitter.com/ddiamond/status/890721050404810752 …",2483,26,1001,True,
MikeSteinman,2017-07-27,16:20:45,Well this is...interesting. http://www.newyorker.com/news/ryan-lizza/anthony-scaramucci-called-me-to-unload-about-white-house-leakers-reince-priebus-and-steve-bannon …,2,0,1,True,
geri_doc,2017-07-24,20:08:33,Excited to celebrate 20th anniversary @UCSF #geriatrics Much to be proud of Much work left to do on behalf of older persons #iagg2017,15,0,6,True,"#geriatrics,#iagg2017"
UCSF,2017-07-27,16:13:53,All are welcome here. #UCSFStandsUp pic.twitter.com/rwmP6k0QLq,112,1,38,True,#UCSFStandsUp
MikeSteinman,2017-07-27,16:14:16,CDC budget in double jeopardy with Senate health bill. We must keep @CDCgov strong.  @statnews https://www.statnews.com/2017/07/27/cdc-senate-bill/?utm_source=STAT+Newsletters&utm_campaign=c526ee4af9-DC_Diagnosis&utm_medium=email&utm_term=0_8cab1d7961-c526ee4af9-149772573 …,0,0,0,True,
LenaKMakaroun,2017-07-27,13:25:07,Don't be fooled if u think #transgender military ban doesn't affect u. We are all in danger when discrimination creeps. #ProtectTransTroops,2,0,1,True,"#transgender,#ProtectTransTroops"
ASlavitt,2017-07-27,14:49:28,"1. Last 7 yrs: So far, GOP has defunded the ACA rate stabilization & then complained about its rates...",1956,49,1640,True,
WrayCharles,2017-07-27,11:36:47,A pet-peeve:  contd use of Amio after resolution of A.fib & illness. We can do better! @Deprescribing @MikeSteinman  http://www.amjmed.com/article/S0002-9343(17)30250-4/pdf …,2,0,1,True,
repjohnlewis,2017-07-26,20:51:03,I fought too long to end discrimination based on race and color to allow discrimination based on gender identity to be considered acceptable,253586,2299,75580,True,
lpetrillz,2017-07-27,11:27:41,"Naked in their ambition to simply pass something, even if it is total garbage. https://twitter.com/CAPAction/status/890597219186900995 …",1,0,1,True,
ASlavitt,2017-07-27,09:44:50,"1- The Senate GOP has landed on ""skinny repeal"" as a strategy.It's actually a 2-step fuller repeal.",404,24,517,True,
MikeSteinman,2017-07-27,10:54:59,.@OptimisingRxUse: Danes reduced benzo use by tying to drivers license renewal. Innovative. @Deprescribing #IAGG2017 pic.twitter.com/speDN6B3RS,9,1,5,True,#IAGG2017
MikeSteinman,2017-07-27,10:52:47,Denkinger: Need to categorize trial pops by frailty status to understand tx effects @Deprescribing #IAGG2017 pic.twitter.com/r7yzeKPmve,3,0,3,True,#IAGG2017
ASlavitt,2017-07-26,18:45:58,"NEW NEWS: This is the skinny bill.Premiums ⬆️ 20%Uninsured ⬆️ 16 millionYeah, that's great. Why are we doing this again? https://twitter.com/ddiamond/status/890356189585956875 …",2614,118,3174,True,
OptimisingRxUse,2017-07-26,23:54:21,Multiple generations of #deprescribing clinicians at #IAGG2017 @Deprescribing https://twitter.com/Nailabouni4/status/890423802290593792 …,7,0,3,True,"#deprescribing,#IAGG2017"
OptimisingRxUse,2017-07-27,00:18:20,Amazing #polypharmacy mice! Fascinating reach to inform clinical #deprescribing practice #IAGG2017 https://twitter.com/Reeve_Research/status/890249493811154945 …,2,0,3,True,"#polypharmacy,#deprescribing,#IAGG2017"
Deprescribing,2017-07-26,11:08:36,"Garfinkel "" prescribers must know how to deprescribe"": see here for #deprescribing self-efficacy tool:  http://deprescribing.org/news/creating-evidence-based-deprescribing-guidelines/ … #IAGG2017",25,0,34,True,"#deprescribing,#IAGG2017"
jbendery,2017-07-25,22:09:50,🔥🔥 Senator Struggling To Weigh Interests Of Entire Constituency Against Nothing  http://www.theonion.com/article/senator-struggling-weigh-interests-entire-constitu-56479 … via @TheOnion,82,3,45,True,
RebeccaDRobbins,2017-07-26,08:51:45,Drug industry trade groups spent more lobbying fed govt in first 6 months of this year than in any Jan-Jun on record  https://www.statnews.com/2017/07/21/drug-industry-lobbying-record/ … pic.twitter.com/3ujrHqq1Sn,8,2,25,True,
Atul_Gawande,2017-07-26,08:15:25,"""Skinny repeal"" is a known disaster. 1995: WA state repealed mandate; kept guaranteed issue1999: no insurers left http://bit.ly/2uVGqg2 ",2313,56,2485,True,
doctormeera,2017-07-26,10:32:32,"""Remember that doctors cannot cure everything. Don’t underestimate the beneficial effects of music and of animals."" https://nyti.ms/2tXoyMX ",12,1,4,True,
EWidera,2017-07-22,20:04:54,Just in time for #IAGG2017: @annachodos on @GeriPalBlog podcast to discuss bringing #geriatrics into the community http://www.geripal.org/2017/07/Optimizing-Aging-Collaborative.html …,24,0,20,True,"#IAGG2017,#geriatrics"
geri_doc,2017-07-25,14:43:08,Newman:  Geriatric bioscience not just for richfamous Key to understanding biology of health disparities #geriatrics #iagg2017 @GeriSciDoc,9,0,3,True,"#geriatrics,#iagg2017"
StevenTDennis,2017-07-25,20:53:03,Remember the vote that really matters in Vote-a-Rama is the McConnell substitute at the end of the process. Think Friday 5 a.m.,3559,53,2463,True,
geri_doc,2017-07-25,14:44:42,Walter: One ED visit costs as much as 10 house calls visits! Function focused care in home #geriatrics #iagg2017,75,6,59,True,"#geriatrics,#iagg2017"
JasonFlattUCSF,2017-07-22,09:08:25,Great article on criminal justice & aging. Arresting someone with dementia.  https://nyti.ms/2tmHohn . @briewsf @TideswellUCSF,2,0,5,True,
SFVAMC,2017-07-25,17:57:58,A joint SFVAMC - @UCSF study is making it easier for #Veterans to make choices about end-of-life care http://khn.org/news/jump-starting-hard-conversations-as-the-end-nears/?utm_campaign=KHN%3A%20Daily%20Health%20Policy%20Report&utm_source=hs_email&utm_medium=email&utm_content=54597420&_hsenc=p2ANqtz-_yLfDWb3pGecv0bkvdvCe7CxzFTefjJJ_eaz7Rh9qzYIb9j2r634-inQUUPfvVPvhdaWqq4rU-1pps9sUMtJQnazynMw&_hsmi=54597420 …,2,0,2,True,#Veterans
Atul_Gawande,2017-07-25,16:44:51,"Flowchart of what will now unfold over the next couple days, from @alv9n @voxdotcom http://bit.ly/2tHFc81 ",146,10,230,True,
sharon_inouye,2017-07-25,20:10:33,The phenomenal @DrMarkLachs receives the AFAR Irving Wright award #IAGG2017 pic.twitter.com/qZnmAo6ipw,11,0,6,True,#IAGG2017
AnilMakam,2017-07-25,16:23:39,Amazing how many things we do in medicine when tested turn out to be myths! #ClinicalPearl: check orthostatic vitals within 1 min (not 3)!!! https://twitter.com/JAMAInternalMed/status/889923204038492161 …,3,0,1,True,#ClinicalPearl
UCSFHospitals,2017-07-25,16:00:04,"@prepareforcare UCSF geriatrician, @Prepareforcare, created free site to help people navigate end-of-life care decisions  http://ucsfh.org/2h0ZnYI  via @KHNews pic.twitter.com/8tDOk0Rnis",18,0,7,True,
OptimisingRxUse,2017-07-24,21:01:45,amazing #deprescribing presentation at #IAGG2017 @DeprescribeNet @picardonhealth @Deprescribing pic.twitter.com/Z2Yb2nLy2S,8,0,1,True,"#deprescribing,#IAGG2017"
IAGG_2017,2017-07-23,20:10:26,Loneliness is the new smoking- equivalent to smoking 15 cigarettes a day- it's shaves 8 years off of longevity. @AARP #iagg2017,136,17,203,True,#iagg2017
NotesOnNursing,2017-07-25,12:27:08,".@SenJohnMcCain please don't put ppl w/ #cancer like me into high risk pools, cut our essential benefits & torpedo our health. #itrustyou pic.twitter.com/scsHpdndHR",77,1,41,True,"#cancer,#itrustyou"
ctsinclair,2017-07-25,12:55:21,Why are women excluded from medical society awards?  https://www.statnews.com/2017/07/19/women-excluded-medical-society-awards/ … via @statnews,1,0,4,True,
ASlavitt,2017-07-20,07:53:23,NEW: This story is stunning.It uncovers the propoganda agenda HHS running against ACA-- w taxpayer money.RT http://thebea.st/2th6AG1?source=twitter&via=mobile …,8892,472,11745,True,
HastingsNicki,2017-07-23,17:47:00,Great to see emphasis on role of nurses & pharmacists in improving med management. Great job Session Chair @MikeSteinman! #IAGG2017 pic.twitter.com/o102nYX3AU,4,0,1,True,#IAGG2017
Peralta_KHRC,2017-07-14,12:45:36,very important study about primary CVD prevention in older adults @geri_doc @MikeSteinman https://twitter.com/JAMAInternalMed/status/885665146697330689 …,6,1,6,True,
ehlJAMA,2017-07-14,21:33:41,"Perhaps statististically imperfect but NNT helps clinicians and patients engage in conversation. At best, medicine is an inexact science. https://twitter.com/f2harrell/status/885841511279194112 …",32,1,10,True,
DrAdamMecca,2017-07-15,15:18:13,"Open-label, uncontrolled. AEs will also be disease related with this design. Hard to interpret AE incidence or role of confirmation bias. https://twitter.com/MikeSteinman/status/885567584648744963 …",0,2,1,True,
MikeSteinman,2017-07-13,13:38:01,"Great style changes by @AGSJournal to make language about older adults respectful, concrete. Words matter.   http://onlinelibrary.wiley.com/doi/10.1111/jgs.14941/abstract?campaign=woletoc …",1,0,0,True,
MikeSteinman,2017-07-13,13:34:03,>1/3 of adults age 85+ have difficulty managing their meds. Need high vigilance.   http://onlinelibrary.wiley.com/doi/10.1111/jgs.14819/abstract?campaign=woletoc … @NBleijenberg @geri_doc,8,0,15,True,
MikeSteinman,2017-07-13,13:32:19,"39-59% of ppl who start cholinesterase inhibitors stop in first 18 weeks, mostly 2/2 adverse effects.   http://onlinelibrary.wiley.com/doi/10.1111/jgs.14827/abstract?campaign=woletoc … @mboustan",2,1,5,True,
MikeSteinman,2017-07-13,13:29:57,Rates of serious medication errors at home increased 2x over last decade. http://www.npr.org/sections/health-shots/2017/07/12/536519077/took-the-wrong-medicine-by-mistake-study-finds-such-errors-are-on-the-rise …,2,0,5,True,
AnilMakam,2017-07-12,09:48:10,Another study confirming #hospitalizations for HYPOglycemia more common than HYPERglycemia  https://link.springer.com/article/10.1007%2Fs11606-017-4095-x … #diabetes @JournalGIM pic.twitter.com/PIhBfhfQ0y,3,0,1,True,"#hospitalizations,#diabetes"
