username,date,time,tweet,likes,replies,retweets,retweet,hashtags
UPMCCareers,2017-09-04,07:22:24,"Happy Labor Day to all 80,000 of our employees who help us build a legacy for all while providing Life Changing Medicine! pic.twitter.com/BlSVlFbx8H",4,1,1,True,
PittStudents,2017-08-24,14:30:42,Students are downtown learning about @UPMCCareers in the US Steel Tower #PittOWeek207 pic.twitter.com/TsVtGBH6iB,4,0,2,True,#PittOWeek207
UPMCCareers,2017-09-01,06:30:01,Dr. Andrew Urbach has never worked anywhere by @ChildrensPgh. Read about his lifelong career with UPMC on the blog! https://cards.twitter.com/cards/ap2o1/4q4zl …,6,0,1,True,
UPMCCareers,2017-08-29,18:00:09,"Our last stop in our #AroundOurNeighborhood series is #DowntownPittsburgh, home of our headquarters! What's your favorite spot? pic.twitter.com/Dgoo9P92GC",0,0,0,True,"#AroundOurNeighborhood,#DowntownPittsburgh"
UPMCCareers,2017-08-28,11:00:05,Make a patient or resident smile! Explore housekeeping careers at UPMC! #hiring https://cards.twitter.com/cards/ap2o1/4k56s …,0,0,0,True,#hiring
UPMCCareers,2017-08-25,07:30:33,Sara's UPMC career opportunity came knocking in an unexpected place: a wedding! Read about her journey on the blog: https://cards.twitter.com/cards/ap2o1/4p8w6 …,1,0,0,True,
UPMCCareers,2017-08-22,18:00:08,"Up next in our #AroundOurNeighborhood” series is Altoona, PA! Miles of beautiful scenery & sites makes Altoona a great place for everyone! pic.twitter.com/yd96Rc9aBl",0,0,0,True,#AroundOurNeighborhood
UPMCCareers,2017-08-21,11:00:04,Looking for an administrative or office support career? How about a career where you can make a difference? #hiring https://cards.twitter.com/cards/ap2o1/4k56k …,0,0,0,True,#hiring
UPMCCareers,2017-08-18,08:00:03,"Jennifer is August's Life Changer of the Month. We were inspired by her story of hope, & invite you to read it! https://cards.twitter.com/cards/ap2o1/4mfw2 …",0,0,0,True,
UPMCCareers,2017-08-17,09:28:24,Coming up - FOUR Home Health Nursing and Physical Therapy networking events! Click to see where & when! #careerfair https://cards.twitter.com/cards/ap2o1/4o4ug …,0,0,0,True,#careerfair
UPMCCareers,2017-08-15,18:00:09,"Get to know UPMC w/ our #AroundOurNeighborhood series. 1st: OAKLAND! Universities, museums, & parks define this vibrant neighborhood! pic.twitter.com/IAjWdfjoZT",0,0,0,True,#AroundOurNeighborhood
UPMCCareers,2017-08-14,11:00:02,Are you a data-driven person with an eye for detail? Explore Billing & Registration careers at UPMC! #hiring https://cards.twitter.com/cards/ap2o1/4k56b …,0,0,0,True,#hiring
UPMCCareers,2017-08-13,11:00:01,It’s not too late to attend the @UPMCHealthPlan Member Services Career Fair TOMORROW! Be part of a winning team! https://cards.twitter.com/cards/ap2o1/4mah8 …,0,0,0,True,
UPMCCareers,2017-08-12,08:00:05,"THIS WEEKEND! Talk with our @UPMCHealthPlan recruiters @ Monroeville Mall, 10-8 today and 12-5 tomorrow. Details ⬇️ https://cards.twitter.com/cards/ap2o1/4kb7z …",1,0,1,True,
UPMCCareers,2017-08-11,10:00:01,"In just 2 short years, Harold was promoted twice at @UPMCHealthPlan! Learn more at our 8/14 Health Plan Career Fair! https://cards.twitter.com/cards/ap2o1/4mfre …",0,0,0,True,
UPMCCareers,2017-08-10,06:00:09,TODAY IS THE DAY! Visit us at today's Service Worker Recruitment Event to learn about exciting opportunities at various UPMC locations! pic.twitter.com/UZNsWhGrpf,1,0,1,True,
UPMCCareers,2017-08-10,06:00:03,Today is the day! Meet us at the @penguins practice facility to find out more about service careers with our team! pic.twitter.com/0GfqgWWWLG,1,0,0,True,
UPMCCareers,2017-08-09,18:00:05,A winning career means having leadership who cares & listens. Find out how to start your career @UPMCHealthPlan: https://cards.twitter.com/cards/ap2o1/4mah8 …,0,0,0,True,
UPMCCareers,2017-08-08,06:00:05,Join us at our upcoming Service Worker Recruitment Event at the @penguins official training facility! Details ⬇️ https://cards.twitter.com/cards/ap2o1/4kb5a …,1,0,0,True,
UPMCCareers,2017-08-07,11:00:05,We're looking for #MedicalLab professionals! See if there's an opportunity that's right for you. #hiring https://cards.twitter.com/cards/ap2o1/4d888 …,0,0,0,True,"#MedicalLab,#hiring"
UPMCCareers,2017-08-03,18:00:04,The employees in the video below are firsthand examples how there are MANY rewarding career opportunities that await you at @UPMCHealthPlan! pic.twitter.com/5PKZw4J90F,1,0,1,True,
UPMCCareers,2017-08-02,18:00:01,Start your winning career! Roles await you in the Member Services & Enrollment Departments @UPMCHealthPlan. https://cards.twitter.com/cards/ap2o1/4kb58 …,1,0,2,True,
UPMCCareers,2017-08-01,07:00:02,Interested in temporary work on a great team? Join us TOMORROW at the @UPMCHealthPlan Temporary Career Fair! https://cards.twitter.com/cards/ap2o1/4kaix …,0,0,0,True,
UPMCCareers,2017-07-31,11:00:04,UPMC is #hiring #pharmacists! Explore our Pharmacy openings or share these opportunities with a friend! https://cards.twitter.com/cards/ap2o1/4d892 …,0,0,0,True,"#hiring,#pharmacists"
UPMCCareers,2017-07-27,18:00:02,Join us on 8/2 at the @UPMCHealthPlan Temporary Career Fair to take the 1st step towards a great career with UPMC! https://cards.twitter.com/cards/ap2o1/4kb3b …,0,0,0,True,
UPMCCareers,2017-07-26,11:00:05,"A variety of recruitment events are taking place in the next couple of weeks, and we invite YOU to get in on them! https://cards.twitter.com/cards/ap2o1/4kb2r …",0,0,1,True,
UPMCCareers,2017-07-24,11:00:01,Do you love helping people? Find your place at UPMC with a career in Customer & Member Services! #hiring https://cards.twitter.com/cards/ap2o1/4k4uw …,0,0,0,True,#hiring
UPMCCareers,2017-07-21,10:44:27,"Our summer associates sure stay busy! See what Isabella, Sarah, and Madison have been up to here in the Steel City! https://cards.twitter.com/cards/ap2o1/4i4kg …",0,0,0,True,
UPMCCareers,2017-07-19,06:23:54,Save-the-date for our August 2 UPMC Health Plan Temporary Career Fair! Find out all you need to know here: 👇👇👇 https://cards.twitter.com/cards/ap2o1/4ihu2 …,1,0,0,True,
UPMCCareers,2017-07-17,11:00:03,Find out how you can improve patients' experiences with a career in #healthcare #IT! https://cards.twitter.com/cards/ap2o1/4d87b …,0,0,0,True,"#healthcare,#IT"
UPMCCareers,2017-07-14,06:48:06,"Check out what our summer associates are up to this week in our ""A Peek Into My Week"" blog! A preview: 🌮🎉📷🗓 https://cards.twitter.com/cards/ap2o1/4j6pu …",1,0,1,True,
UPMCCareers,2017-07-11,11:00:04,Register by THIS FRIDAY for the APP Essentials Expo at UPMC Hamot! Amazing networking opportunities await! https://cards.twitter.com/cards/ap2o1/4h12v …,0,0,0,True,
UPMCnews,2017-07-10,09:18:34,"UPMC continues 19-year run on @ahahealthforum's ""Most Wired"" list.  http://bit.ly/2ua8cW7  @hhnmag #UPMCinnovates pic.twitter.com/IiFmcBbFGR",7,0,1,True,#UPMCinnovates
UPMCCareers,2017-07-10,11:00:01,Behavior Health professionals make a difference in people's lives. Explore our opportunities today! https://cards.twitter.com/cards/ap2o1/4d83o …,0,0,0,True,
UPMCCareers,2017-07-07,09:00:09,On Fridays in July we'll be sharing photos from our 2017 Summer Associates! Check out this week's post below! ☀️💼🏙🚲 https://cards.twitter.com/cards/ap2o1/4i4kg …,0,0,0,True,
UPMCCareers,2017-07-05,11:00:05,"Join us on July 15 for our UPMC Hamot OR Open House! Build your nursing career in scenic Erie, PA. https://cards.twitter.com/cards/ap2o1/4h12v …",0,0,0,True,
UPMCCareers,2017-07-04,11:00:15,#HappyIndependenceDay! We hope you enjoy your holiday celebrations today! 🇺🇸 pic.twitter.com/08qh2c3ENr,0,0,0,True,#HappyIndependenceDay
UPMCCareers,2017-07-03,11:30:05,Do you want a career that makes a difference? Find out where your #Nursing career can take you at UPMC! #hiring https://cards.twitter.com/cards/ap2o1/48e4r …,1,0,0,True,"#Nursing,#hiring"
