username,date,time,tweet,likes,replies,retweets,retweet,hashtags
UPMCCareers,2018-02-03,18:00:00,We're excited to kick off our #ILoveMyJob💜 series for 2018 with five employee stories on why they're glad to be part of the UPMC team! Find the stories here 👇 https://cards.twitter.com/cards/ap2o1/5aenb …,3,0,0,True,#ILoveMyJob
UPMCCareers,2018-02-01,18:00:00,"Cory Hahn started working at UPMC while on summer breaks from college. Today, he is a senior manager Mobile Patient Access and Central Hiring! His story on the blog 👇 https://cards.twitter.com/cards/ap2o1/5a31w …",1,0,0,True,
UPMCCareers,2018-01-31,18:00:00,"Our ""I LOVE MY JOB"" annual series is coming back in February with new stories from real UPMC employee! Read some of last year's perspectives 👇💜 https://cards.twitter.com/cards/ap2o1/5a1h7 …",0,0,0,True,
ChildrensPgh,2018-01-31,08:04:36,"The DAISY Award for Extraordinary Nurses recognizes ""the superhuman work that nurses do every day."" Bob Messenger, RN, January’s DAISY Award winner at Children's Hospital, explains what this award means to him. pic.twitter.com/ycdol0djGm",33,0,5,True,
UPMCCareers,2018-01-30,18:00:00,Matthew Gregory's goal was to find a career that was long-term and had plenty of opportunities for growth. Read how a Patient Access career was just that 👇 https://cards.twitter.com/cards/ap2o1/5a18b …,2,0,1,True,
UPMCCareers,2018-01-29,18:16:00,Are you a #GraduateNurse? Come see what UPMC Susquehanna has to offer as you begin your exciting new career!  https://cards.twitter.com/cards/ap2o1/5a31r …,1,0,1,True,#GraduateNurse
UPMCnews,2018-01-29,10:43:05,"Tomorrow, UPMC will honor inspiring employees who demonstrate dignity and respect in the workplace with a little help from @JohnQABC, host of What Would You Do? on ABC. See you soon, John! pic.twitter.com/C85wl5ykGw",6,0,2,True,
UPMCCareers,2018-01-29,06:40:51,"Eleven years ago, Jennifer Wheeler got some news that changed the course of her career. But as the saying goes, “When one door closes, another opens.” https://cards.twitter.com/cards/ap2o1/5990m …",2,0,1,True,
UPMCCareers,2018-01-25,18:00:03,Are you interested in career in #nursing? Come meet with faculty and current students at Jameson Memorial Hospital School of Nursing. Take a tour and learn all about the 16-month RN diploma program and the opportunity to earn a #BSN in 4 years! https://cards.twitter.com/cards/ap2o1/59q73 …,0,0,1,True,"#nursing,#BSN"
PittCareers,2018-01-24,10:02:27,"Students in Government, Non-Profit, and Public Service - network tonight with peers and employers in your industry! Meet @UPMCCareers, @PeaceCorps, @FBI, and more! No pre-registration necessary. #pittnow More info ➡️  https://pitt.joinhandshake.com/events/86238/share_preview … pic.twitter.com/8LlMJKUotW",4,0,2,True,#pittnow
UPMCCareers,2018-01-17,23:00:00,"We know nurses are incredible forces of positivity and drivers of change — and that they could certainly use a few more thank-yous."" 10 Reasons Why We Love Nurses via @UPMCHealthBeat http://share.upmc.com/2017/05/10-reasons-love-nurses/ …",5,0,3,True,
UPMCCareers,2018-01-16,23:00:00,Why become a nurse at UPMC? We asked 5 current nurses that question in this special series: Why I'm a Nurse at UPMC. Read their inspiring reasons and don't miss your last chance to apply for our nursing sign-on bonus eligible positions! https://cards.twitter.com/cards/ap2o1/4vkdi …,1,0,1,True,
PittCareers,2018-01-12,08:41:08,"The Diversity Career Conference is coming up on January 20! A powerful day full of speakers, networking, and top-notch employers! #pittnow More info ➡️  https://pitt.joinhandshake.com/career_fairs/4069/student_preview … pic.twitter.com/kl5YowwMq2",13,0,13,True,#pittnow
UPMCCareers,2018-01-15,23:00:00,Your chance to apply for our nursing sign-on bonus for eligible positions is ending this week! Be inspired to apply by reading this post that reveals 10 things about UPMC nurses: https://cards.twitter.com/cards/ap2o1/5325b …,0,0,0,True,
UPMCCareers,2018-01-15,23:00:00,Your chance to apply for our nursing sign-on bonus for eligible positions is ending this week! Be inspired to apply by reading this post that reveals 10 things about UPMC nurses: https://cards.twitter.com/cards/ap2o1/5325b …,0,0,0,True,
UPMCCareers,2018-01-12,09:39:48,Graduate nurse or soon-to-be? 🎓 Read our guide on how to apply at UPMC and explore postings TODAY before our sign-on bonus for GNs ends! https://cards.twitter.com/cards/ap2o1/57sul …,1,0,1,True,
CarlowU,2018-01-11,08:00:01,"Meet with @UPMCCareers recruiters to learn about the nursing sign on bonus and nursing opportunities within the UPMC Health System.   Today, January 11th | Nursing Recruitment Event | 11am-1pm | Curran Hall | 1st Floor LobbyFor more info contact: careercenter@carlow.edu pic.twitter.com/GBaS79Lrp9",4,0,3,True,
UPMCCareers,2018-01-10,17:00:00,"We've got another graduate nurse Q & A for you today! Read why Kate decided to move back to Pittsburgh to work for UPMC, and what gives UPMC the edge for new nurses looking to start their careers well. https://cards.twitter.com/cards/ap2o1/57dgb …",1,0,0,True,
UPMCCareers,2018-01-10,11:15:00,"Do you have customer service experience? Learn how you can build a career in health care working in physician offices, hospitals, or our Consumer Contact Centers! Join us to network with managers and team leaders at our Patient Access #CareerFair! https://cards.twitter.com/cards/ap2o1/57rvf …",0,1,0,True,#CareerFair
UPMCCareers,2018-01-10,09:20:17,"Ned Schano, senior manager of media relations at @UPMCHealthPlan, says he believes in Pittsburgh. Read why he chose to stay in the 'burgh and build his career at UPMC! https://twitter.com/ImaginePgh/status/950767180924309510 …",0,0,0,True,
UPMCCareers,2018-01-09,17:00:00,"Wonder what it's like to be a Graduate Nurse at UPMC? We got the inside scoop from Kelsy Richardson, a nurse at UPMC Mercy! Read our Q & A with her! https://cards.twitter.com/cards/ap2o1/57dfd …",3,0,2,True,
UPMCCareers,2018-01-07,11:00:02,Are you a #graduatenurse interested in learning more about UPMC? Join us tomorrow for an open house at UPMC Passavant! https://cards.twitter.com/cards/ap2o1/55hd1 …,3,0,1,True,#graduatenurse
UPMCCareers,2018-01-05,18:00:12,Join us for brunch tomorrow at UPMC Northwest to learn about opportunities for graduate nurses!  http://bit.ly/2CZP4vg ,0,0,0,True,
UPMCCareers,2018-01-05,18:00:00,Join us for brunch tomorrow at UPMC Northwest to learn about opportunities for #graduatenurses! https://cards.twitter.com/cards/ap2o1/55hdm …,0,0,0,True,#graduatenurses
UPMCCareers,2018-01-03,18:00:01,Our tips for your best career yet continue! Read over 12 tips for your career straight from our recruiters. #HappyNewYear https://cards.twitter.com/cards/ap2o1/54sev …,1,0,1,True,#HappyNewYear
UPMCCareers,2018-01-02,18:00:00,Happy New Year! Is one of your New Years resolutions to be career-ready? Check out our blog below for tips on how to start well in your 2018 career journey! https://cards.twitter.com/cards/ap2o1/54se1 …,0,1,0,True,
UPMCCareers,2017-12-29,17:05:00,Are you a #CRNP or #PhysicianAssistant looking for a new opportunity? Join us at @stbcbeer in the North Shore for a night of #networking! https://cards.twitter.com/cards/ap2o1/56h7x …,3,0,0,True,"#CRNP,#PhysicianAssistant,#networking"
UPMCCareers,2017-12-29,09:00:11,Is your New Year’s Resolution to make a change in your career? Look back at our ‘Ask The Recruiter’ video series for some tips from our recruitment team on what they look for in candidates applying to UPMC! http://bit.ly/2lqc8ey ,0,2,1,True,
UPMCCareers,2017-12-28,17:05:00,Join us Jan. 11 us at the #Pharmacy Intern #CareerFair to meet with recruiters from multiple UPMC Pharmacies! https://cards.twitter.com/cards/ap2o1/56epz …,0,0,0,True,"#Pharmacy,#CareerFair"
UPMCCareers,2017-12-28,10:00:11,"One of our favorite videos in 2017 was this incredible story of Merel Duursma, a former Children’s Hospital patient who beat cancer as a little girl and now is a nurse at Children’s Hospital of Pittsburgh of UPMC. Watch: http://bit.ly/2lbyqS0 ",4,0,1,True,
UPMCCareers,2017-12-26,08:00:11,"We’re going to share a few highlights from UPMC from 2017, starting with this video showing how many people we care for in one year! Watch: http://bit.ly/2l0BnEG ",1,0,0,True,
UPMCCareers,2017-12-22,18:00:00,"Are you interested in a career in the operating room, PACU, or in a #surgicalservices support role?  Come network with our hiring managers to learn about opportunities at UPMC East! https://cards.twitter.com/cards/ap2o1/55vem …",0,0,0,True,#surgicalservices
UPMCCareers,2017-12-20,12:36:23,"Christal Morris, vice president of Human Resources here at UPMC, has traveled to 49 states. Find out why she chose to live and work in Pittsburgh and how she achieved her success! https://twitter.com/ImaginePgh/status/943245063961882624 …",1,0,1,True,
UPMCnews,2017-12-15,10:43:05,"Hey, @geekwire! Welcoming yinz to da Burgh. Meet the geeks who make life changing medicine happen. 🌉👨‍⚕️🏥👩‍⚕️🔬 pic.twitter.com/ZbHCPvKoTv",30,0,15,True,
UPMCCareers,2017-12-15,08:53:23,We’re continuing to share how UPMC celebrates the holidays with this very cute video from Magee Women’s Hospital featuring Magee Hat Makers. This is one cute and festive video! https://cards.twitter.com/cards/ap2o1/54s0c …,6,0,2,True,
UPMCCareers,2017-12-07,23:00:00,"Our UPMC holiday series continues with this heartwarming video of UPMC's own ""singing doctor"" Carey Andrew-Jaja! https://cards.twitter.com/cards/ap2o1/532fj …",2,0,2,True,
UPMCCareers,2017-12-06,17:00:00,"When Andrew Soltesz turned 40, he decided to go back school to become a nurse! His story: https://cards.twitter.com/cards/ap2o1/53249 …",1,0,0,True,
UPMCCareers,2017-12-05,17:00:02,"Today we're sharing 10 quotes about nursing, and are dedicating this post to our 14,000 nurses at UPMC! https://cards.twitter.com/cards/ap2o1/5325b …",1,0,2,True,
UPMCCareers,2017-12-04,15:08:54,"Nice work, everyone! https://twitter.com/UPMCnews/status/936708120654512130 …",3,0,0,True,
UPMCCareers,2017-12-01,07:00:10,The holiday season is here! We’re looking forward to sharing a bit more of people making a difference during the holidays here at UPMC for the next few Fridays. Keep an eye out! pic.twitter.com/5BmZNBm4FN,0,0,0,True,
UPMCCareers,2017-11-29,18:00:02,"When Cristian Minor moved to Pittsburgh from Mexico, his goal was to become a lawyer. Now he's an attorney at UPMC! https://cards.twitter.com/cards/ap2o1/52nbg …",0,0,0,True,
UPMCCareers,2017-11-28,18:00:01,#ICYMI: Did you hear that UPMC announced a $2 billion investment over the next 5 years? Learn more: #UPMCinnovates  https://goo.gl/Rw8Fn3  pic.twitter.com/QLERdKFThN,0,0,0,True,"#ICYMI,#UPMCinnovates"
UPMCCareers,2017-11-17,08:36:52,"And lastly, Laura Jones of UPMC Northwest/UPMC Hamot is thankful for her skilled co-workers! #UPMCGivesThanks pic.twitter.com/OyFp3hh5Qp",0,0,0,True,#UPMCGivesThanks
UPMCCareers,2017-11-17,08:35:47,"Kim Howell, an RN at UPMC Hamot, is thankful for the gift of time on her busy floor! #UPMCGivesThanks pic.twitter.com/Zxowmj9ZmH",0,1,0,True,#UPMCGivesThanks
UPMCCareers,2017-11-17,08:33:51,Paul Adam of UPMC's Insurance Service Division is thankful for his great team! #UPMCGivesThanks pic.twitter.com/qTKfFROfn5,0,1,0,True,#UPMCGivesThanks
UPMCCareers,2017-11-17,08:32:51,Jennifer Lucas of UPMC Presbyterian is thankful for her new job as an Admin Assistant with Cardio Thoracic Surgery unit! #UPMCGivesThanks pic.twitter.com/0riRscVVYI,0,1,0,True,#UPMCGivesThanks
UPMCCareers,2017-11-17,08:31:54,"Gladys Carlen of UPMC Mercy Cancer Registry is thankful for the work she dog with her dog, Hon-e-Bear! #UPMCGivesThanks pic.twitter.com/Kevg7DMuwI",0,1,0,True,#UPMCGivesThanks
UPMCCareers,2017-11-17,08:30:51,Our #UPMCGivesThanks series continues! 5 UPMC employees shared how they're thankful for their WORK (thread). pic.twitter.com/MYIfFTdl6f,0,1,0,True,#UPMCGivesThanks
UPMCCareers,2017-11-17,07:00:08,"UPMC is based in Pittsburgh, and we're getting excited for tonight's Light Up Night! 🎄 What are you most excited for in the upcoming holiday season? pic.twitter.com/aWUC8nYXca",2,0,0,True,
UPMCCareers,2017-11-15,14:57:45,Medical assistant ➡ RN ➡ BSN ➡ MSN ➡ UPMC Shadyside School of Nursing faculty ➡ PhD student = Tim Gill! His story: https://cards.twitter.com/cards/ap2o1/50bqe …,0,0,0,True,
UPMCCareers,2017-11-09,18:59:26,"On Thursdays of November, we're sharing what UPMC employees are thankful for! Today's word? HEALTH #UPMCGivesThanks pic.twitter.com/yzQWZid4Bb",5,0,1,True,#UPMCGivesThanks
UPMCCareers,2017-11-09,09:59:00,"UPMC nursing instructor Jean Ruiz's life story began in the Philippines, but brought her to Pittsburgh. Be inspired: https://cards.twitter.com/cards/ap2o1/4zymn …",1,0,0,True,
UPMCCareers,2017-11-08,18:00:05,Our final #UPMCRNHappyHour is TOMORROW! Don't miss your chance to talk with our recruiters! https://cards.twitter.com/cards/ap2o1/4ve3q …,0,0,0,True,#UPMCRNHappyHour
UPMCCareers,2017-11-07,17:30:10,Learn what Merridith Akrie loves most about being an ED patient information coordinator at Magee-Womens Hospital! http://bit.ly/2AryLFV ,0,0,0,True,
UPMCCareers,2017-11-06,18:00:05,"Stop by @StackdWexford to hear about #nursing sign-on bonuses — up to $10,000! #UPMCRNHappyHour https://cards.twitter.com/cards/ap2o1/4ve3d …",0,0,0,True,"#nursing,#UPMCRNHappyHour"
UPMCCareers,2017-11-06,10:00:05,Join us tomorrow at Peter's Pub in Oakland for a night of networking! #UPMCRNHappyHour https://cards.twitter.com/cards/ap2o1/4ve3f …,1,0,0,True,#UPMCRNHappyHour
UPMCCareers,2017-11-03,13:41:50,"UPMC announces its plan to create a hub of high-quality, specialized care for every patient. #UPMCinnovates  http://bit.ly/2yrBbHr  pic.twitter.com/3vR5m360lH",2,0,1,True,#UPMCinnovates
UPMCnews,2017-11-03,13:13:59,We will transform patient care w/3 new specialty hospitals offering next-generation treatments in a patient-centered setting. #UPMCinnovates pic.twitter.com/25WWmRZrtK,40,1,40,True,#UPMCinnovates
UPMCnews,2017-11-03,13:04:07,"A hub of high-quality, specialized care for every patient. The future starts now. WATCH LIVE.  http://bit.ly/2A63nvE  #UPMCinnovates pic.twitter.com/FUPt3S73Dw",24,0,21,True,#UPMCinnovates
UPMCCareers,2017-11-03,11:00:44,"In 2014, Magee opened the Pregnancy Recovery Center, an outpatient program offering women care for #opioid addiction. Today, #UPMCinnovates. pic.twitter.com/SIsCcf98zy",4,0,0,True,"#opioid,#UPMCinnovates"
UPMCCareers,2017-11-03,09:14:05,UPMC Chautauqua WCA recruiters will be at Landmark Restaurant in Jamestown. Come network with us! http://bit.ly/2gZImeD  pic.twitter.com/cLYdWpuoVi,0,0,0,True,
UPMCnews,2017-11-02,23:01:24,"Today, #UPMCinnovates. Join us at 2 p.m. as we announce our plan to radically transform health care. pic.twitter.com/LaJdPvyfUy",73,0,45,True,#UPMCinnovates
UPMCCareers,2017-11-01,18:12:06,RN Happy Hour at Mario's Dockside tomorrow —  don't miss it! #UPMCRNHappyHour https://cards.twitter.com/cards/ap2o1/4ve3b …,0,0,0,True,#UPMCRNHappyHour
UPMCCareers,2017-11-01,17:30:02,Twin sisters Andrea and Andia Berry have a life and career story that we don't often hear. In their own words: https://cards.twitter.com/cards/ap2o1/4yphs …,0,0,1,True,
UPMCCareers,2017-10-31,18:35:03,We'll see you tomorrow @CalamarisErie at 4:30! Make sure to ask about sign-on bonuses!  #UPMCRNHappyHour https://cards.twitter.com/cards/ap2o1/4wd6a …,0,0,0,True,#UPMCRNHappyHour
VibrantBurgh,2017-10-31,09:05:13,Join the Pittsburgh Chapters of NSBE and NBMBAA along wth @UPMCCareers for The Uncommon Leader  https://buff.ly/2xzsohU  pic.twitter.com/IIYLR9KWyK,1,0,1,True,
UPMCCareers,2017-10-31,10:14:06,Tomorrow's the day! Come to @primantibros in Harmarville to talk with our nursing recruiters! #UPMCRNHappyHour https://cards.twitter.com/cards/ap2o1/4wrt6 …,1,0,0,True,#UPMCRNHappyHour
UPMCCareers,2017-10-29,11:00:09,Do you know a stand-out #nurse? Nominate them to get a shout-out on Bubba Show on @StarPittsburgh!   http://bit.ly/2hkfH4M  pic.twitter.com/euzKSR8TRH,3,1,3,True,#nurse
UPMCCareers,2017-10-28,11:00:12,"Today’s “Falling for Pittsburgh” feature is McConnell’s Mills, which is only a short drive from Pittsburgh! What places do you recommend? pic.twitter.com/tqGrVg7FKa",0,0,0,True,
UPMCCareers,2017-10-27,17:30:08,"Congrats Ian Cummins, nurse at UPMC Mercy, for recognition on @StarPittsburgh! Nominate a special nurse you know!  http://bit.ly/2gHymGE  pic.twitter.com/IUbmxXxeKu",2,0,1,True,
UPMCCareers,2017-10-26,18:00:03,Join us at Cadillac Ranch in Robinson to network with our recruiters - apps are on us! #UPMCRNHappyHour https://cards.twitter.com/cards/ap2o1/4ve3q …,0,0,0,True,#UPMCRNHappyHour
UPMCCareers,2017-10-26,10:55:22,"#SurgicalServices pros, network with UPMC Hamot hiring managers & learn about sign-on bonuses for some positions! https://cards.twitter.com/cards/ap2o1/4y7th …",0,0,0,True,#SurgicalServices
UPMCCareers,2017-10-25,18:00:06,#ORNurse and #SurgTech Networking Event TOMORROW. Arrive early to sign in. We can't wait to meet you! https://cards.twitter.com/cards/ap2o1/4ubt3 …,0,0,2,True,"#ORNurse,#SurgTech"
UPMCCareers,2017-10-25,18:00:04,"#Nurses, come to @RBPittsburgh tomorrow to meet with our recruiters and reps from UPMC hospitals! #UPMCRNHappyHour https://cards.twitter.com/cards/ap2o1/4ve3a …",1,0,0,True,"#Nurses,#UPMCRNHappyHour"
Q929FM,2017-10-25,05:30:00,"Give a nurse in your life a shout-out all this week in the morning, 6-10AM with @UPMCCareers!   http://www.q929fm.com/2017/10/16/nurses-shout-out-2/ … pic.twitter.com/xaxulTrZbm",1,0,2,True,
UPMCCareers,2017-10-24,16:33:45,Did you know we have a series of videos on commonly asked questions about UPMC's hiring process? Watch them below! https://youtu.be/zfSuD9L6gz8 ,1,0,0,True,
UPMCCareers,2017-10-23,17:53:06,Our first #UPMCRNHappyHour is tomorrow! Can't make it? There are 7 more where that came from. Find one near you! https://cards.twitter.com/cards/ap2o1/4ve2y …,1,0,0,True,#UPMCRNHappyHour
Q929FM,2017-10-22,14:15:01,"Give your favorite nurse a deserved shout-out with Diaz all this week, & win TSO tickets courtesy of @UPMCCareers! http://www.q929fm.com/2017/10/16/nurses-shout-out-2/ … pic.twitter.com/CHfMw5TcXO",0,0,2,True,
UPMCCareers,2017-10-21,11:00:09,"From Steelers games to walks at Point State Park, autumn in the ‘Burgh can’t be beat. What’s your favorite fall activity around Pittsburgh? pic.twitter.com/KCtP9BJWm7",0,0,0,True,
UPMCCareers,2017-10-20,11:00:11,"Fall is in full swing here in Pittsburgh! Keep an eye out starting tomorrow for a few posts in a new series, “Falling for Pittsburgh!” pic.twitter.com/5QcRKmqLcL",0,0,0,True,
UPMCCareers,2017-10-19,17:41:04,"Swing by @StackdWexford on the 7th to hear about our nursing sign-on bonuses - up to $10,000! #UPMCRNHappyHour https://cards.twitter.com/cards/ap2o1/4ve3d …",0,0,0,True,#UPMCRNHappyHour
UPMCCareers,2017-10-17,11:00:19,"For a limited time, we're offering sign-on bonuses up to $10K for #RNs and $5K for #GNs. Learn how to qualify!  http://bit.ly/2gNDycR  pic.twitter.com/fhjXAOB8Gg",1,3,3,True,"#RNs,#GNs"
UPMCCareers,2017-10-17,10:00:02,Our nursing recruiters will be at Calamari's Squid Row in Erie on November 1. Stop by! #UPMCRNHappyHour https://cards.twitter.com/cards/ap2o1/4wd6a …,0,0,0,True,#UPMCRNHappyHour
UPMCEnterprises,2017-10-13,10:20:14,Where innovation meets impact. Join our team and work with developers and innovators changing health care.  http://ow.ly/W4Ue30fDpvW  pic.twitter.com/8ASI4ujtQQ,5,0,5,True,
UPMCCareers,2017-10-13,18:05:06,"Respiratory therapists, connect with hiring managers and be interviewed for positions on-site!  #RRT #CRT https://cards.twitter.com/cards/ap2o1/4vww0 …",0,0,0,True,"#RRT,#CRT"
UPMCCareers,2017-10-11,17:30:05,Nolan Chismire has witnessed some amazing things as an ER nurse at UPMC Presbyterian. Read his story on the blog! https://cards.twitter.com/cards/ap2o1/4vkdi …,0,0,0,True,
UPMCCareers,2017-10-11,16:30:05,"#Addiction stops here. Dawndra Jones, CNO of UPMC McKeesport, invites nurses to join a LIFE CHANGING team. https://cards.twitter.com/cards/ap2o1/4vk94 …",3,0,2,True,#Addiction
UPMCCareers,2017-10-10,18:00:04,Raise a glass and toast to a the start of a great #nursing career! #UPMCRNHappyHour https://cards.twitter.com/cards/ap2o1/4ve3b …,0,0,0,True,"#nursing,#UPMCRNHappyHour"
UPMCCareers,2017-10-10,11:00:05,"#ORNurses & #SurgTechs, join us at @UPMC Presbyterian for an afternoon of networking! https://cards.twitter.com/cards/ap2o1/4ubt3 …",0,0,0,True,"#ORNurses,#SurgTechs"
UPMCCareers,2017-10-09,15:30:05,Have you seen our newly refreshed nursing page? Check it out on your computer or phone & explore great info! https://cards.twitter.com/cards/ap2o1/4vkd8 …,2,0,0,True,
UPMCCareers,2017-10-07,09:00:04,Nolan Chismire wanted to be a nurse since high school. On Wednesday we’ll share he’s now made his hope a reality! pic.twitter.com/GzRPDlpLPj,0,0,0,True,
UPMCCareers,2017-10-06,08:00:05,"Jessy Rajput, a lifelong nurse, shared what her motivation is after 33 years of #nursing at UPMC! Her story: https://cards.twitter.com/cards/ap2o1/4s8nk …",1,0,0,True,#nursing
UPMCCareers,2017-10-05,17:30:05,"Cheers, #nurses! We're hosting happy hours all around Pittsburgh. Stop by and learn about current sign-on bonuses! https://cards.twitter.com/cards/ap2o1/4ve3a …",1,0,1,True,#nurses
UPMCCareers,2017-10-04,17:30:02,"Enjoy a few drinks on us and learn more about our current sign-on bonuses — up to $10,000! https://cards.twitter.com/cards/ap2o1/4ve2y …",0,0,0,True,
UPMCCareers,2017-10-04,12:24:02,"Check out our 6 RN happy hours all around Pittsburgh this fall. Learn about sign-on bonuses up to $10,000! https://cards.twitter.com/cards/ap2o1/4ve2d …",0,0,0,True,
UPMCCareers,2017-10-04,06:25:06,"Jessy Rajput has been a nurse for 33 years, and says she hasn't once thought about changing careers! Read her blog on Friday! pic.twitter.com/V7mXrSbAlr",1,0,0,True,
UPMCCareers,2017-10-02,17:00:05,How far can your nursing career take you? Take a look at all the ways you can grow at UPMC! https://cards.twitter.com/cards/ap2o1/4uwsx …,0,0,1,True,
UPMCCareers,2017-09-29,08:00:06,How does Jessica find time to have a successful #nursing career at UPMC AND maintain her life at home? Read how! https://cards.twitter.com/cards/ap2o1/4s8nt …,0,0,0,True,#nursing
UPMCCareers,2017-09-28,09:07:23,Tune in tomorrow & learn about Jessica Reinersmann. She's using her nursing career to build the life she wants and get where she wants to be pic.twitter.com/dkT078tH4n,1,0,2,True,
UPMCCareers,2017-09-27,17:30:04,Are you a nurse who's passionate about being part of the solution to the #addictioncrisis? We've got news for you! https://cards.twitter.com/cards/ap2o1/4ts9h …,1,0,0,True,#addictioncrisis
UPMCCareers,2017-09-26,15:03:10,Explore #ORnurse and #surgtech opportunities and learn about sign-on bonuses offered for certain positions! #hiring https://cards.twitter.com/cards/ap2o1/4ubt3 …,0,0,0,True,"#ORnurse,#surgtech,#hiring"
UPMCCareers,2017-09-25,11:00:01,Are you a #physician looking for a new opportunity? We have 20+ openings in various medical specialties. #hiring https://cards.twitter.com/cards/ap2o1/4k5a2 …,2,0,1,True,"#physician,#hiring"
UPMCCareers,2017-09-22,08:00:06,"Kaleya's #nursing training not only prepared her for a role at UPMC, but inspired her career path! Her story: https://cards.twitter.com/cards/ap2o1/4s8ne …",0,0,0,True,#nursing
UPMCCareers,2017-09-20,07:08:26,"Our nursing series continues with Kaleya Rose, a newer resident nurse here at UPMC! Why did Kaleya choose to be a nurse on the UPMC team? pic.twitter.com/LiDES22hqS",1,0,2,True,
UPMCCareers,2017-09-18,11:00:06,"With the #ClinicalResearch team at UPMC, you could help us make discoveries that change lives all over the world. https://cards.twitter.com/cards/ap2o1/4k573 …",2,0,2,True,#ClinicalResearch
UPMCCareers,2017-09-15,08:00:06,"Chibugo Uwazie's, a unit director at UPMC Shadyside, story began in Nigeria! Read her #nursing story on the blog. https://cards.twitter.com/cards/ap2o1/4s8n0 …",0,1,0,True,#nursing
UPMCnews,2017-09-13,11:56:32,"Today, Pittsburgh’s advantages are in high-tech manufacturing, high-skilled workers, and world-class research.  http://brook.gs/2gYvmsR  pic.twitter.com/bHhvrG1mJ1",21,1,15,True,
UPMCCareers,2017-09-13,07:01:22,"(2/2) This Friday we'll be sharing the story of Chibugo Uwazie, a unit director at UPMC Shadyside. Why is Chibugo a nurse? Read a preview: pic.twitter.com/gll7X3AzqH",0,0,0,True,
UPMCCareers,2017-09-13,06:59:40,"(1/2) Over the next month we want to highlight the stories of a few of UPMC's 14,000 #nurses and why they choose to be a part of our team!",1,0,0,True,#nurses
UPMCCareers,2017-09-11,11:00:04,"From #marketing to #UXD, we're looking for top talent to support our mission of outstanding care. Sound like you? https://cards.twitter.com/cards/ap2o1/4k56x …",0,0,0,True,"#marketing,#UXD"
UPMCCareers,2017-09-08,08:00:05,Ready to be inspired? The career story of Katie Shultz of @ChildrensPgh is live on the blog! https://cards.twitter.com/cards/ap2o1/4r414 …,3,0,1,True,
UPMCCareers,2017-09-05,08:30:10,"This Friday we'll be sharing the story of Katie Schultz, a neonatal nurse practitioner @ChildrensPgh. You'll be inspired by her story! pic.twitter.com/VHdTclakPc",6,0,2,True,
UPMCCareers,2017-09-04,11:00:06,"Are you a diagnostic technologist, sonographer, or other imaging professional? Explore our opportunities today! https://cards.twitter.com/cards/ap2o1/4k56v …",0,0,0,True,
