,tweet,processed_tweet,polarity,subjectivity,Sentiment,Objectivity
1350,"@WillowCreekCC @BillHybels Not sure if @tom_peters has ever had a chance to mentor @billhybels.  I suspect that BH would think he's teaching Tom.  When the culture of @willowcreekcc is riddled with misconduct, bullying, triangulation, misuse of authority - that is a CEO issue:  Bill Hybels. https://twitter.com/AnneMessenger/status/992862027478700033 …","WillowCreekCC BillHybels Not sure if tom_peters has ever had a chance to mentor billhybels.  I suspect that BH would think he's teaching Tom.  When the culture of willowcreekcc is riddled with misconduct, bullying, triangulation, misuse of authority - that is a CEO issue:  Bill Hybels. ",-0.25,0.8888888888888888,Negative,Subjective
1351,This is another reason why I love Pathology! https://twitter.com/mufster82/status/992562822855970816 …,This is another reason why I love Pathology! ,0.625,0.6,Positive,Subjective
1352,100+ clicks per patient.  Imagine if that time was spent knowing the patient and examining them.  #RestoreTheDoctorPatientRelationship https://twitter.com/kimberli_coxmd/status/992788928905310208 …,100+ clicks per patient.  Imagine if that time was spent knowing the patient and examining them.  RestoreTheDoctorPatientRelationship ,-0.1,0.1,Negative,Objective
1353,"Matthew 5:9 tells us that peaceMAKERS are blessed, and will be called children of God. This is different than peaceKEEPING. Peacemaking requires godly conviction &action, care &effort. Peacekeeping requires suppressing truth,people who question, &pride. #SBC18 #ChurchDVIt’s time","Matthew 5:9 tells us that peaceMAKERS are blessed, and will be called children of God. This is different than peaceKEEPING. Peacemaking requires godly conviction &action, care &effort. Peacekeeping requires suppressing truth,people who question, &pride. SBC18 ChurchDVIt’s time",0.05,0.35,Positive,Objective
1354,If anyone who supports @_PPatterson_ can provide a Biblical reference in which Jesus treated anyone in the manner that Paige and his kind do - please post.  Thank you. https://twitter.com/wad3mullen/status/992591219539763200 …,If anyone who supports _PPatterson_ can provide a Biblical reference in which Jesus treated anyone in the manner that Paige and his kind do - please post.  Thank you. ,0.6,0.9,Positive,Subjective
1355,my mom put oil on her bird feeder to keep squirrels from stealing the bird food and pic.twitter.com/TkrmOR4KlH,my mom put oil on her bird feeder to keep squirrels from stealing the bird food and ,0.0,0.0,Neutral,Objective
1356,"At @michiganstateu ‘s Advanced Degree Commencement Ceremony today, many graduates chose to drop teal flowers at @MSUPresEngler ‘s feet rather than shake his hand. #MSUgrad18 #SupportSurvivors pic.twitter.com/7xkcsrFaRQ","At michiganstateu ‘s Advanced Degree Commencement Ceremony today, many graduates chose to drop teal flowers at MSUPresEngler ‘s feet rather than shake his hand. MSUgrad18 SupportSurvivors ",0.45,0.55,Positive,Subjective
1357,Please Ross - tell me you have a video clip! https://twitter.com/mrossyoung/status/992469621973319681 …,Please Ross - tell me you have a video clip! ,0.0,0.0,Neutral,Objective
1358,A good read @DeMossPR https://twitter.com/dianelangberg/status/992099304817872896 …,A good read DeMossPR ,0.7,0.6000000000000001,Positive,Subjective
1359,Fox9 news aired my and other women's story of abuse by pastor Mark Darling and the cover up by Evergreen Church.  Since airing two victims have come forward.  Please share. Women Accuse Pastor of Inappropriate Conduct http://www.fox9.com/news/investigators/churchtoo-women-accuse-minnesota-pastor-of-inappropriate-conduct#.WuxGhNbpzdM.twitter …,Fox9 news aired my and other women's story of abuse by pastor Mark Darling and the cover up by Evergreen Church.  Since airing two victims have come forward.  Please share. Women Accuse Pastor of Inappropriate Conduct ,-0.012499999999999995,0.5375,Negative,Subjective
1360,"Thank you for RT this, @DefendTheSheep.  Thank you, @BethMooreLPM for writing this letter before you pass into eternity with Jesus. https://twitter.com/DefendTheSheep/status/992077728416399360 …","Thank you for RT this, DefendTheSheep.  Thank you, BethMooreLPM for writing this letter before you pass into eternity with Jesus. ",0.0,0.0,Neutral,Objective
1361,"#ChurchDV  CBMW are dragging their feet in facing facts. They now say ""abuse is a crime,"" but that suggests they think that only physical or sexual assault count as ""real"" abuse. https://twitter.com/_CryforJustice/status/991996041477197824 …","ChurchDV  CBMW are dragging their feet in facing facts. They now say ""abuse is a crime,"" but that suggests they think that only physical or sexual assault count as ""real"" abuse. ",0.175,0.569047619047619,Positive,Subjective
1362,How are these men “spiritual giants?”  Would ANY of these men imagine believing this nonsense if THEY were a woman.  “Imagine you wake up as a woman tomorrow @JohnPiper - would you still believe this wholeheartedly?” https://twitter.com/watchkeep/status/991497139057553408 …,How are these men “spiritual giants?”  Would ANY of these men imagine believing this nonsense if THEY were a woman.  “Imagine you wake up as a woman tomorrow JohnPiper - would you still believe this wholeheartedly?” ,0.0,0.13333333333333333,Neutral,Objective
1363,How to distinguish a metamyelocyte from a band neutrophil. pic.twitter.com/a56k87IrSq,How to distinguish a metamyelocyte from a band neutrophil. ,0.0,0.0,Neutral,Objective
1364,@BillHybels Brings @hpmemphis @andysavage and @WillowCreekCC @billhybels to mind.  Who will be the leaders from the inside to oppose the bolstering “business as usual” to truly eradicate the cancer of abuse of authority from within?  Will outside pressure always be required in these churches https://twitter.com/wad3mullen/status/991103091096375296 …,BillHybels Brings hpmemphis andysavage and WillowCreekCC billhybels to mind.  Who will be the leaders from the inside to oppose the bolstering “business as usual” to truly eradicate the cancer of abuse of authority from within?  Will outside pressure always be required in these churches ,-0.125,0.15,Negative,Objective
1365,Agree!! https://twitter.com/tchang4916/status/991303474276003840 …,Agree!! ,0.0,0.0,Neutral,Objective
1366,"My 9yo son Robbie passed away Saturday night from complications of leukemia. He was the funniest kid I ever met, always knew how to make me smile. One of his wishes in life was to go #viral, and and for the @HuskerFBNation & @packers to win.  #RobbiesWay pic.twitter.com/1W31kDDdCS","My 9yo son Robbie passed away Saturday night from complications of leukemia. He was the funniest kid I ever met, always knew how to make me smile. One of his wishes in life was to go viral, and and for the HuskerFBNation & packers to win.  RobbiesWay ",0.55,0.25,Positive,Objective
1367,PSA:  women who have had silicone breast plants are at higher risk for a specific type of lymphoma.  Thank you @ForestHulsMD for the well demonstrated post https://twitter.com/foresthulsmd/status/990288201460994049 …,PSA:  women who have had silicone breast plants are at higher risk for a specific type of lymphoma.  Thank you ForestHulsMD for the well demonstrated post ,0.125,0.3125,Positive,Objective
1368,This initiative by @lbsmithmd and the hematopathology team she leads was so well received and phenomenal for patients. https://twitter.com/lbsmithmd/status/990183714402504704 …,This initiative by lbsmithmd and the hematopathology team she leads was so well received and phenomenal for patients. ,0.5,0.5,Positive,Objective
1369,THIS MAN IS A TRUE HERO. This needs to be shared far and wide. https://twitter.com/abc/status/990344538702086144 …,THIS MAN IS A TRUE HERO. This needs to be shared far and wide. ,0.11666666666666665,0.6833333333333332,Positive,Subjective
1370,The results of what this man did is just amazing and deserves endless RTs pic.twitter.com/eS7V607lDX,The results of what this man did is just amazing and deserves endless RTs ,0.23750000000000004,0.825,Positive,Subjective
1371,Trigger warning:  This is Paige Patterson being lauded for this counsel - offered not in 1950 - but during the #metoo and #churchtoo movements.   https://baptistblog.files.wordpress.com/2018/04/paigepatterson.mp3 …,Trigger warning:  This is Paige Patterson being lauded for this counsel - offered not in 1950 - but during the metoo and churchtoo movements.   ,0.0,0.0,Neutral,Objective
1372,"Domestic violence is perpetrated by men who appear to profess faith in Christ, but are cunning deceivers.  A man who knows Jesus will NOTrepeatedly physically harm his wife.  SBC leaders who think this abuse must be submitted to by women are enablers of abuse.  Unyoke from them. pic.twitter.com/uiRn3suBcm","Domestic violence is perpetrated by men who appear to profess faith in Christ, but are cunning deceivers.  A man who knows Jesus will NOTrepeatedly physically harm his wife.  SBC leaders who think this abuse must be submitted to by women are enablers of abuse.  Unyoke from them. ",0.0,0.3142857142857143,Neutral,Objective
1373,When speaking re: #metoo SBC leader @_PPatterson_  proudly teaches that only the most serious degrees of abuse should warrant TEMPORARY separation & any degree of abuse should be submitted to by women rather than to divorce.  SBC leaders show how little they know Christ. pic.twitter.com/XgAzTLCtFX,When speaking re: metoo SBC leader _PPatterson_  proudly teaches that only the most serious degrees of abuse should warrant TEMPORARY separation & any degree of abuse should be submitted to by women rather than to divorce.  SBC leaders show how little they know Christ. ,0.15583333333333335,0.7333333333333333,Positive,Subjective
1374,A very good read - including the replies.  A small community of people bonded together by ITP gently fist bump.  @TeamCaptainJohn https://twitter.com/whippletom/status/989770232242683905 …,A very good read - including the replies.  A small community of people bonded together by ITP gently fist bump.  TeamCaptainJohn ,0.2866666666666666,0.66,Positive,Subjective
1375,This evening I was asked to speak to what happens in the brain with cycles of abuse - why is it hard to leave an abuser?  Simply stated - the abuser knows how to hijack the brain's chemistry to create an addiction to the abuser. pic.twitter.com/y3WRZF4Mcj,This evening I was asked to speak to what happens in the brain with cycles of abuse - why is it hard to leave an abuser?  Simply stated - the abuser knows how to hijack the brain's chemistry to create an addiction to the abuser. ,-0.14583333333333334,0.44940476190476186,Negative,Objective
1376,@BillHybels Just like voting:  @TyndaleHouse and @Zondervan:  Thank you for taking the allegations against @billhybels seriously & encouraging his season of reflection by suspending publication of his book.  It is my prayer he fully repent.  I will continue to purchase from you. https://twitter.com/JimBilello/status/989989579120873477 …,BillHybels Just like voting:  TyndaleHouse and Zondervan:  Thank you for taking the allegations against billhybels seriously & encouraging his season of reflection by suspending publication of his book.  It is my prayer he fully repent.  I will continue to purchase from you. ,-0.3333333333333333,0.6666666666666666,Negative,Subjective
1377,Ever wonder why spouses of abusers choose to support them instead of the victims? Are they evil? Ignorant? Careless?  The real reasons may surprise you.  This is our favorite episode yet. https://www.spreaker.com/episode/14641260 …,Ever wonder why spouses of abusers choose to support them instead of the victims? Are they evil? Ignorant? Careless?  The real reasons may surprise you.  This is our favorite episode yet. ,-0.2,0.8,Negative,Subjective
1378,Yet another reason I have respect for @DrQuinnCapers4 https://twitter.com/DrQuinnCapers4/status/989672172854697985 …,Yet another reason I have respect for DrQuinnCapers4 ,0.0,0.0,Neutral,Objective
1379,"We make great efforts to be more comfortable, to avoid pain. But Jesus willingly entered into our pain and suffering and joins us there.","We make great efforts to be more comfortable, to avoid pain. But Jesus willingly entered into our pain and suffering and joins us there.",0.4875,0.7,Positive,Subjective
1380,And @AndyStanley is completely wrong https://twitter.com/christianpost/status/989824036153839616 …,And AndyStanley is completely wrong ,-0.5,0.9,Negative,Subjective
1381,Thank you Christ Church for taking the intentional pause.  We continue to pray that an external investigation take place.  Thank you for supporting the pursuit of truth.  @ChristChurchOB  https://www.cc-ob.org/glsupdate ,Thank you Christ Church for taking the intentional pause.  We continue to pray that an external investigation take place.  Thank you for supporting the pursuit of truth.  ChristChurchOB  ,0.125,0.175,Positive,Objective
1382,Thank You Christ Church.  We continue to pray that an external investigation and any repentance required will take place https://twitter.com/txcyclist72/status/989519056662384640 …,Thank You Christ Church.  We continue to pray that an external investigation and any repentance required will take place ,0.0,0.1,Neutral,Objective
1383,@BillHybels Please @AngelaAhrendts consider this a respectful request to reconsider your involvement w/ this year's WCA Global Summit. Neither WCA or WCCC boards have been willing to provide victims w/an independent external investigation of @billhybels misconduct.   http://www.willowcreek.com/events/leadership … https://twitter.com/AngelaAhrendts/status/971815204630614016 …,BillHybels Please AngelaAhrendts consider this a respectful request to reconsider your involvement w/ this year's WCA Global Summit. Neither WCA or WCCC boards have been willing to provide victims w/an independent external investigation of billhybels misconduct.    ,0.15,0.335,Positive,Objective
1384,@BillHybels Please @simonsinek consider this a respectful request to reconsider your involvement with this year's WCA Global Summit. Neither WCA or WCCC boards have been willing to provide victims with an independent external investigation of @billhybels misconduct.   http://www.willowcreek.com/events/leadership/#Simon_Sinek … https://twitter.com/simonsinek/status/985209515111923712 …,BillHybels Please simonsinek consider this a respectful request to reconsider your involvement with this year's WCA Global Summit. Neither WCA or WCCC boards have been willing to provide victims with an independent external investigation of billhybels misconduct.    ,0.15,0.335,Positive,Objective
1385,BREAKING: A Pennsylvania jury has convicted Bill Cosby of three counts of aggravated indecent assault after 14 hours of deliberations. Accuser Andrea Constand is stony faced. Other accusers are crying in court.,BREAKING: A Pennsylvania jury has convicted Bill Cosby of three counts of aggravated indecent assault after 14 hours of deliberations. Accuser Andrea Constand is stony faced. Other accusers are crying in court.,-0.1625,0.4875,Negative,Objective
1386,Pathologists have the benefit of seeing common things occur in uncommon locations.   I suppose the daily work we do trains us to consider many possibilities while trying to pull it all together to make sense! https://twitter.com/Chucktowndoc/status/989550167979446278 …,Pathologists have the benefit of seeing common things occur in uncommon locations.   I suppose the daily work we do trains us to consider many possibilities while trying to pull it all together to make sense! ,0.28125,0.5,Positive,Objective
1387,"Thank you, Jamie https://twitter.com/defendthesheep/status/989195843310948352 …","Thank you, Jamie ",0.0,0.0,Neutral,Objective
1388,Incredible! https://twitter.com/maxplanckpress/status/988696316648873984 …,Incredible! ,1.0,0.9,Positive,Subjective
1389,Wonderful Birthday @AquiRosemarie Hoping it has been magnificent!,Wonderful Birthday AquiRosemarie Hoping it has been magnificent!,1.0,1.0,Positive,Subjective
1390,So grateful for these words offered by @jmitchelllittle.  Thank you! https://twitter.com/DefendTheSheep/status/988959660450373632 …,So grateful for these words offered by jmitchelllittle.  Thank you! ,0.0,0.0,Neutral,Objective
1391,THE HAT pic.twitter.com/wNsrjSed2T,THE HAT ,0.0,0.0,Neutral,Objective
1392,"@WillowCreekCC @BillHybels For those believing that @billhybels retirement from @willowcreekcc means ""nothing to see here, problem solved"" this post is a MUST READ.  For 30+ years, @billhybels abused his position of authority w/various forms of abusive behavior. Bill's actions teach: ""how not to lead"" https://twitter.com/wad3mullen/status/988802093807960064 …","WillowCreekCC BillHybels For those believing that billhybels retirement from willowcreekcc means ""nothing to see here, problem solved"" this post is a MUST READ.  For 30+ years, billhybels abused his position of authority w/various forms of abusive behavior. Bill's actions teach: ""how not to lead"" ",0.0,0.0,Neutral,Objective
1393,This is quite true and part of the diagnostic criteria used to define NPD and sociopathy.  When some signs of the disorder are present - the person displaying them should be treated w/caution.  These are very destructive people. https://twitter.com/8rachellynn/status/986994505151844353 …,This is quite true and part of the diagnostic criteria used to define NPD and sociopathy.  When some signs of the disorder are present - the person displaying them should be treated w/caution.  These are very destructive people. ,-0.14333333333333334,0.4766666666666667,Negative,Objective
1394,@BillHybels Thank you Julia Williams for sharing your story.   @billhybels reaction to Julia's confrontation of his behavior contains SEVEN separate characteristics of narcissistic abuse.  @wartwatch @watchkeep @ennabre_bryna.  Thirty years ago - Bill Hybels was abusing women/authority. pic.twitter.com/Q4lWnYaxha,BillHybels Thank you Julia Williams for sharing your story.   billhybels reaction to Julia's confrontation of his behavior contains SEVEN separate characteristics of narcissistic abuse.  wartwatch watchkeep ennabre_bryna.  Thirty years ago - Bill Hybels was abusing women/authority. ,0.0,0.0,Neutral,Objective
1395,"Willow Creek, stop investigating. You’ve already shown you can’t be impartial to the victims. Bring in a reputable outside team—not one that restores image, but one trained to find pastoral abusers.On Monday, I will be showing why churches cannot be objective concerning abuse. https://twitter.com/ctmagazine/status/987728089047339009 …","Willow Creek, stop investigating. You’ve already shown you can’t be impartial to the victims. Bring in a reputable outside team—not one that restores image, but one trained to find pastoral abusers.On Monday, I will be showing why churches cannot be objective concerning abuse. ",0.16666666666666666,0.3166666666666667,Positive,Objective
1396,"5) The most recent CT article continues to document Bill's pattern of setting up scenes to be alone w/women, even 1 on his boat.  When Bill describes his concern for the damage to HIS appearance in this clip, it raises the question:  Where was your concern for appearances then?","5) The most recent CT article continues to document Bill's pattern of setting up scenes to be alone w/women, even 1 on his boat.  When Bill describes his concern for the damage to HIS appearance in this clip, it raises the question:  Where was your concern for appearances then?",0.25,0.375,Positive,Objective
1397,4)  Bill notes that he is down below listening to worship music - then feels an urgent need to do something heroic given recent drowning deaths related to intoxication - but as soon as he sees who it is he is furious?  (says it twice).  What is that emotional transition about?,4)  Bill notes that he is down below listening to worship music - then feels an urgent need to do something heroic given recent drowning deaths related to intoxication - but as soon as he sees who it is he is furious?  (says it twice).  What is that emotional transition about?,0.10888888888888887,0.4977777777777778,Positive,Objective
1398,3) Bill Hybels makes a point of being heroically concerned for the woman in the water given drowning deaths from inebriated people falling off the dock.  I couldn't find reports of that in South Haven.  Is Bill playing the hero curious to anyone but me?,3) Bill Hybels makes a point of being heroically concerned for the woman in the water given drowning deaths from inebriated people falling off the dock.  I couldn't find reports of that in South Haven.  Is Bill playing the hero curious to anyone but me?,-0.1,1.0,Negative,Subjective
1399,"2) If the incident was ONLY witnessed by Bill Hybels and the woman in question, how, then did this come to the elder's attention?  Did the profoundly embarrassed and shamed woman actually share it with other people?  Does that make sense?","2) If the incident was ONLY witnessed by Bill Hybels and the woman in question, how, then did this come to the elder's attention?  Did the profoundly embarrassed and shamed woman actually share it with other people?  Does that make sense?",-0.01041666666666667,0.61875,Negative,Subjective
1400,"A few more questions:1) What are other people's reactions to Bill's ""watch the sunrise, sunset, whatever.... just the sunset"" ?","A few more questions:1) What are other people's reactions to Bill's ""watch the sunrise, sunset, whatever.... just the sunset"" ?",0.05833333333333333,0.325,Positive,Objective
1401,@BillHybels This is a transcript of the video from about 28:00.  I encourage watching the video to see @billhybels body language.  The comparison of his response to Lori Anne's is worth considering.  As are a few more questions. pic.twitter.com/uukfPSpcBv,BillHybels This is a transcript of the video from about 28:00.  I encourage watching the video to see billhybels body language.  The comparison of his response to Lori Anne's is worth considering.  As are a few more questions. ,0.2,0.2333333333333333,Positive,Objective
1402,A transcript of Bill Hybels response to the nude woman in the water.  Still unable to post a clip with sound - but RT'd the original youtube link pic.twitter.com/Ku6WslmbNU,A transcript of Bill Hybels response to the nude woman in the water.  Still unable to post a clip with sound - but RT'd the original youtube link ,0.09166666666666667,0.5499999999999999,Positive,Subjective
1403,"The video was a clip from this video - starting at 28:00.  Bill Hybels response:  ""I was furious... I was furious!!""  It's worth a listen to compare how Bill and Lori Anne respond.  Will try again to post edited clip w/sound. https://www.youtube.com/watch?v=ojmS_uEhQRo … https://twitter.com/jdahlmd/status/987673235700449280 …","The video was a clip from this video - starting at 28:00.  Bill Hybels response:  ""I was furious... I was furious!!""  It's worth a listen to compare how Bill and Lori Anne respond.  Will try again to post edited clip w/sound.  ",0.15,0.1,Positive,Objective
1404,April is recognized as #Sarcoidosis Awareness Month in Michigan thanks in large part to patient Sheron Williams. Read more about her story and how she worked tirelessly for the proclamation:  http://michmed.org/MYDKD  pic.twitter.com/l9SOMIAVjs,April is recognized as Sarcoidosis Awareness Month in Michigan thanks in large part to patient Sheron Williams. Read more about her story and how she worked tirelessly for the proclamation:   ,0.30476190476190473,0.3761904761904762,Positive,Objective
1405,For you @EMC_Maine ... a view under the microscope from my professional world that might resemble something from the world you see! https://twitter.com/Patholwalker/status/987956272455532544 …,For you EMC_Maine ... a view under the microscope from my professional world that might resemble something from the world you see! ,0.125,0.1,Positive,Objective
1406,"@BillHybels Considerations for all those who are wondering - will exposure of @billhybels conduct have a downstream negative impact on women in leadership in the church?  Will there be ""protective backlash"" - a la Tony Robbins comments last month? @wartwatch @watchkeep @chicagotribune https://twitter.com/marcusbhuebner/status/988011178382249984 …","BillHybels Considerations for all those who are wondering - will exposure of billhybels conduct have a downstream negative impact on women in leadership in the church?  Will there be ""protective backlash"" - a la Tony Robbins comments last month? wartwatch watchkeep chicagotribune ",-0.15,0.2333333333333333,Negative,Objective
1407,"Accepting applications for Thoracic Pathology Research Fellowship Position @MSKPathology avail July 2018; application deadline June 1, 2018; 1-2 yr position. Stipend commensurate with year of postgraduate training #pulmpath @smlungpathguy @RoseannIWu @Sara_Jiang @JMGardnerMD pic.twitter.com/gmbvTKZDoZ","Accepting applications for Thoracic Pathology Research Fellowship Position MSKPathology avail July 2018; application deadline June 1, 2018; 1-2 yr position. Stipend commensurate with year of postgraduate training pulmpath smlungpathguy RoseannIWu Sara_Jiang JMGardnerMD ",0.0,0.0,Neutral,Objective
1408,Is this gender gap really because women are not as intelligent or capable as men in the STEM disciplines? https://twitter.com/PLOSBiology/status/987367799516516352 …,Is this gender gap really because women are not as intelligent or capable as men in the STEM disciplines? ,0.4,0.5,Positive,Objective
1409,A Saturday morning invitation: @wartwatch @DefendTheSheep @UT_Grad_Amy @watchkeep https://twitter.com/jdahlmd/status/987673235700449280 …,A Saturday morning invitation: wartwatch DefendTheSheep UT_Grad_Amy watchkeep ,0.0,0.0,Neutral,Objective
