,tweet,processed_tweet,polarity,subjectivity,Sentiment,Objectivity
0,"Honored and excited to see our #KidneyCancer study @UMichPath featured on the cover of 30th year/issue of @ModernPathology , official journal of @TheUSCAP  https://www.ncbi.nlm.nih.gov/m/pubmed/28840857 … @UMRogelCancer @sska_path @MLabsUM pic.twitter.com/taJsLK99Ku","Honored and excited to see our KidneyCancer study UMichPath featured on the cover of 30th year/issue of ModernPathology , official journal of TheUSCAP   UMRogelCancer sska_path MLabsUM ",0.375,0.75,Positive,Subjective
1,"A: Rhabdoid tumor of kidney (RTK). AGGRESSIVE! Infants (median: ~1 yr). Discohesive; large cells w/eccentric large vesicular nuclei, big nucleoli; +LVI. IHC: -INI1; patchy +EMA/CK. Molec: hSNF5/INI1 inactivation on 22q11; germline a/w concurrent RTK & AT/RT. #UMichPath #PediPath pic.twitter.com/eNKoLgPd6U","A: Rhabdoid tumor of kidney (RTK). AGGRESSIVE! Infants (median: ~1 yr). Discohesive; large cells w/eccentric large vesicular nuclei, big nucleoli; +LVI. IHC: -INI1; patchy +EMA/CK. Molec: hSNF5/INI1 inactivation on 22q11; germline a/w concurrent RTK & AT/RT. UMichPath PediPath ",0.14285714285714285,0.31904761904761897,Positive,Objective
2,Our newest issue of Inside Pathology is out and it's all about patient-focused pathology. Read the feature article about our Patient and Families Advisory Council here:  https://www.pathology.med.umich.edu/news/629 You can also download the magazine as a PDF:  https://www.pathology.med.umich.edu/static/apps/InsidePathology/InsidePathology2018.pdf … #UMichPath pic.twitter.com/kUaizUGsax,Our newest issue of Inside Pathology is out and it's all about patient-focused pathology. Read the feature article about our Patient and Families Advisory Council here:  ou can also download the magazine as a PDF:   UMichPath ,0.0,0.0,Neutral,Objective
3,"#Microtubules in a human MDA-231 cell (interphase). Highly dynamic! #Spinning_Disk_Microscopy, #cell_biology pic.twitter.com/EMHKZM0wI3","Microtubules in a human MDA-231 cell (interphase). Highly dynamic! Spinning_Disk_Microscopy, cell_biology ",0.0,0.13333333333333333,Neutral,Objective
4,Croatia 🇭🇷 is one of the smallest nations to ever reach the #WorldCupFinal #CROFRA  http://wef.ch/2md6bCh  pic.twitter.com/3XOYA3Y8ZY,Croatia 🇭🇷 is one of the smallest nations to ever reach the WorldCupFinal CROFRA   ,0.0,0.0,Neutral,Objective
5,"🔬 Pediatric #Pathology, Day 5➡️ What’s your #DailyDx of this proximal extremity mass from a teenager?➡️ With what genetic aberrancies are these associated?➡️ We’ll tweet the answers and some quick facts tomorrow! #UMichPath #PediPath pic.twitter.com/izgIUuNugB","🔬 Pediatric Pathology, Day 5➡️ What’s your DailyDx of this proximal extremity mass from a teenager?➡️ With what genetic aberrancies are these associated?➡️ We’ll tweet the answers and some quick facts tomorrow! UMichPath PediPath ",0.4166666666666666,0.5,Positive,Objective
6,"Histopathology of psoriasis: Hyperkeratosis, uniform acanthosis with elongated rete ridges, focal loss of granular layer, suprapapillary thinning over elongated dermal papillae, perivascular infiltrate with occasional neutrophils. #PathElective @kmirza  http://www.pathologyoutlines.com/topic/skinnontumorpsoriasis.html … pic.twitter.com/Iya48kVKmz","Histopathology of psoriasis: Hyperkeratosis, uniform acanthosis with elongated rete ridges, focal loss of granular layer, suprapapillary thinning over elongated dermal papillae, perivascular infiltrate with occasional neutrophils. PathElective kmirza   ",0.0,0.125,Neutral,Objective
7,Malakoplakia of the urinary bladder with histiocytic infiltrate and MG bodies (concentric basophilic inclusions)- one of the highest number of MG bodies I have seen in any case! #bladder #Pathology @UMichPath pic.twitter.com/pSE0odryFB,Malakoplakia of the urinary bladder with histiocytic infiltrate and MG bodies (concentric basophilic inclusions)- one of the highest number of MG bodies I have seen in any case! bladder Pathology UMichPath ,0.0,0.0,Neutral,Objective
8,"🔬 Pediatric #Pathology, Day 2➡️ What’s your #DailyDx of this abdominal mass?➡️ With what syndrome(s) are these related?➡️ We’ll tweet the answers and some quick facts tomorrow! #UMichPath #PediPath pic.twitter.com/XGZxRE47Mn","🔬 Pediatric Pathology, Day 2➡️ What’s your DailyDx of this abdominal mass?➡️ With what syndrome(s) are these related?➡️ We’ll tweet the answers and some quick facts tomorrow! UMichPath PediPath ",0.4166666666666666,0.5,Positive,Objective
9,🔬 #DailyDx theme this week: Pediatric #Pathology➡️ What’s your diagnosis of this soft tissue mass?➡️ What testing would you order to confirm?➡️ We’ll tweet the answers and some quick facts tomorrow! #UMichPath #PediPath pic.twitter.com/LmB6t5miXJ,🔬 DailyDx theme this week: Pediatric Pathology➡️ What’s your diagnosis of this soft tissue mass?➡️ What testing would you order to confirm?➡️ We’ll tweet the answers and some quick facts tomorrow! UMichPath PediPath ,0.2583333333333333,0.425,Positive,Objective
10,LEIOMYOSARCOMA. IHC: H-caldesmon. NB: tumour arising from the wall of a mid-sized vessel; vague fascicular pattern; nuclear pleomorphism and mitotic activity. pic.twitter.com/A4hbmuOxqK,LEIOMYOSARCOMA. IHC: H-caldesmon. NB: tumour arising from the wall of a mid-sized vessel; vague fascicular pattern; nuclear pleomorphism and mitotic activity. ,-0.5,0.5,Negative,Objective
11,EWING SARCOMA. IHC: ERG. NGS: EWSR1-ERG. NB: diffuse strong immunoreactivity for ERG frequently characterizes the subset of Ewing sarcoma with an ERG fusion partner (PMID: 22766791). pic.twitter.com/oY3Nwb2Z3W,EWING SARCOMA. IHC: ERG. NGS: EWSR1-ERG. NB: diffuse strong immunoreactivity for ERG frequently characterizes the subset of Ewing sarcoma with an ERG fusion partner (PMID: 22766791). ,0.26666666666666666,0.5166666666666666,Positive,Subjective
12,"🚨 Save the Date 🚨🔬New Frontiers in Pathology Conference🔬📅 Sep 27-29, 2018📍Ann Arbor, MIAt this 2.5-day symposium participants will gain a better understanding of new methods of diagnosis using current tools & information technology. https://www.pathology.med.umich.edu/newfrontiers  #NFPath2018 pic.twitter.com/9yeywBvUc0","🚨 Save the Date 🚨🔬New Frontiers in Pathology Conference🔬📅 Sep 27-29, 2018📍Ann Arbor, MIAt this 2.5-day symposium participants will gain a better understanding of new methods of diagnosis using current tools & information technology.  NFPath2018 ",0.21212121212121213,0.4515151515151515,Positive,Objective
13,Metastatic adrenocortical carcinoma (bottom-right) in the liver (top left) in a young female patient-characteristic nuclear features including nuclear stippling #pathology @UMichPath pic.twitter.com/Sh1AILeibM,Metastatic adrenocortical carcinoma (bottom-right) in the liver (top left) in a young female patient-characteristic nuclear features including nuclear stippling pathology UMichPath ,0.15,0.26666666666666666,Positive,Objective
14,Frequent PD-L1 Protein Expression and Molecular Correlates in Urinary Bladder Squamous Cell Carcinoma  https://buff.ly/2KIkzND ,Frequent PD-L1 Protein Expression and Molecular Correlates in Urinary Bladder Squamous Cell Carcinoma  ,0.1,0.3,Positive,Objective
15,Looking forward to your study in print! @henning_reis @whynottwitgu https://twitter.com/henning_reis/status/1014785831490523136 …,Looking forward to your study in print! henning_reis whynottwitgu ,0.0,0.0,Neutral,Objective
16,Our new study @EUplatinum shows 65% of pure squamous cell ca of urinary bladder demonstrate PD-L1 expression(compared to only 20% of conventional UCA)-potential implication forthis aggressive cancer in termsof #Immunotherapy @UMichPath @UMichUrology @UMRogelCancer #BladderCancer pic.twitter.com/YuAxqwKoGs,Our new study EUplatinum shows 65% of pure squamous cell ca of urinary bladder demonstrate PD-L1 expression(compared to only 20% of conventional UCA)-potential implication forthis aggressive cancer in termsof Immunotherapy UMichPath UMichUrology UMRogelCancer BladderCancer ,0.05194805194805195,0.577922077922078,Positive,Subjective
17,"Pancreatic insulinoma, a functionally active, well-differentiated pancreatic neuroendocrine tumor that produces clinical symptoms of hypoglycemia due to inappropriate secretion of insulin #NeuroendocrineTumor #NeuroendocrineCancer #PNET #GIPathology #Pathology #PancreaticCancer pic.twitter.com/4mIvMKmUz5","Pancreatic insulinoma, a functionally active, well-differentiated pancreatic neuroendocrine tumor that produces clinical symptoms of hypoglycemia due to inappropriate secretion of insulin NeuroendocrineTumor NeuroendocrineCancer PNET GIPathology Pathology PancreaticCancer ",-0.12916666666666665,0.4875,Negative,Objective
18,Nice magnification loops! Thanks! https://twitter.com/kriyer68/status/1013988372140789761 …,Nice magnification loops! Thanks! ,0.5,0.6,Positive,Subjective
19,"Ooooh, classic case for #pathboards https://twitter.com/drmehrarohit/status/1013846415905316867 …","Ooooh, classic case for pathboards ",0.16666666666666666,0.16666666666666666,Positive,Objective
20,🔬 This week's #DailyDx theme: Soft Tissue #Pathology➡Day 1: What's your diagnosis of this mass?➡ We’ll tweet the answer and some quick facts tomorrow! #UMichPath #BSTPath pic.twitter.com/MFOy1Ips8n,🔬 This week's DailyDx theme: Soft Tissue Pathology➡Day 1: What's your diagnosis of this mass?➡ We’ll tweet the answer and some quick facts tomorrow! UMichPath BSTPath ,0.2583333333333333,0.425,Positive,Objective
21,"Neuroblastoma is the most common ""extracranial solid tumor of children."" Differentiating subtype has >5% ganglionic-appearing neuroblasts, Schwannian stroma-poor but usually neuropil-rich, and usually low mitotic-karyorrhectic index. #pedipath pic.twitter.com/GNSHNNjCQS","Neuroblastoma is the most common ""extracranial solid tumor of children."" Differentiating subtype has >5% ganglionic-appearing neuroblasts, Schwannian stroma-poor but usually neuropil-rich, and usually low mitotic-karyorrhectic index. pedipath ",-0.009999999999999998,0.33,Negative,Objective
22,Canning: Gonadoblastoma can occur as early as 5 months in patients with Turner Mosaic with Y chromosome material. Consider early gonadectomy for all abdominal #gonads. http://ow.ly/ZLOq30kIi7Q ,Canning: Gonadoblastoma can occur as early as 5 months in patients with Turner Mosaic with Y chromosome material. Consider early gonadectomy for all abdominal gonads. ,0.1,0.3,Positive,Objective
23,"perfect case of malakoplakia#PathTip: I'll often get queried about if PAS/VonKossa should be tried to pick up possible malakoplakia.....remember: only worthwhile chasing when histiocytes are PINK on H&E, not pale/clear https://twitter.com/drmehrarohit/status/1013846415905316867 …","perfect case of malakoplakiaPathTip: I'll often get queried about if PAS/VonKossa should be tried to pick up possible malakoplakia.....remember: only worthwhile chasing when histiocytes are PINK on H&E, not pale/clear ",0.28,0.76,Positive,Subjective
24,Malakoplakia of the urinary bladder with histiocytic infiltrate and MG bodies (concentric basophilic inclusions)- one of the highest number of MG bodies I have seen in any case! #bladder #Pathology @UMichPath pic.twitter.com/pSE0odryFB,Malakoplakia of the urinary bladder with histiocytic infiltrate and MG bodies (concentric basophilic inclusions)- one of the highest number of MG bodies I have seen in any case! bladder Pathology UMichPath ,0.0,0.0,Neutral,Objective
25,Excellent update & review! #testis #Cancer @Pathologists @ArchivesPath #Pathology https://twitter.com/pathologists/status/1013414170572787714 …,Excellent update & review! testis Cancer Pathologists ArchivesPath Pathology ,1.0,1.0,Positive,Subjective
26,"All you uro oncs! 🧐 check out our brand new 2nd issue at  https://euoncology.europeanurology.com/current  featuring #pcsm #blcsm #kcsm Multiple disciplines, one goal! @Uroweb @EUplatinum @Els_Urology @ELS_Oncology pic.twitter.com/t4lw3bqzVo","All you uro oncs! 🧐 check out our brand new 2nd issue at   featuring pcsm blcsm kcsm Multiple disciplines, one goal! Uroweb EUplatinum Els_Urology ELS_Oncology ",0.04545454545454545,0.15151515151515152,Positive,Objective
27,Somatic Bi-allelic Loss of TSC Genes in Eosinophilic Solid and Cystic Renal Cell Carcinoma  https://buff.ly/2MvEi3A  pic.twitter.com/x7bia1tzrF,Somatic Bi-allelic Loss of TSC Genes in Eosinophilic Solid and Cystic Renal Cell Carcinoma   ,0.0,0.1,Neutral,Objective
28,"PUBLICATION: @drmehrarohit and others from #UMichPath @UMRogelCancer #MCTP #ChinnaiyanLab author ""Somatic Bi-allelic Loss of TSC Genes in Eosinophilic Solid and Cystic Renal Cell Carcinoma"" in @EUplatinum  https://www.europeanurology.com/article/S0302-2838(18)30432-9/fulltext … #MCTP #ChinnaiyanLab pic.twitter.com/JvPDBMziQR","PUBLICATION: drmehrarohit and others from UMichPath UMRogelCancer MCTP ChinnaiyanLab author ""Somatic Bi-allelic Loss of TSC Genes in Eosinophilic Solid and Cystic Renal Cell Carcinoma"" in EUplatinum   MCTP ChinnaiyanLab ",0.0,0.1,Neutral,Objective
29,"Cribriform basal cell hyperplasia of prostate with blue mucin (+basal cell markers on PIN4)- easy to overcall as cribriform adenocarcinoma #prostatecancer #pathologists #pathboards @UMichPath Not all blue mucin in prostate=cancer, not all cribriform lesions in prostate =cancer pic.twitter.com/8L9cteU9yc","Cribriform basal cell hyperplasia of prostate with blue mucin (+basal cell markers on PIN4)- easy to overcall as cribriform adenocarcinoma prostatecancer pathologists pathboards UMichPath Not all blue mucin in prostate=cancer, not all cribriform lesions in prostate =cancer ",0.14444444444444446,0.3444444444444445,Positive,Objective
30,🔬 H&E #HemePath #DailyDx Day 4: ➡️ What’s your #DailyDx of this blood smear? ➡️ What molecular alteration(s) are associated with a good prognosis? A poor prognosis? ➡️ We’ll tweet the answers and some quick facts tomorrow! pic.twitter.com/H5GNksh1xc,🔬 H&E HemePath DailyDx Day 4: ➡️ What’s your DailyDx of this blood smear? ➡️ What molecular alteration(s) are associated with a good prognosis? A poor prognosis? ➡️ We’ll tweet the answers and some quick facts tomorrow! ,0.23888888888888885,0.5666666666666668,Positive,Subjective
31,"34, female, ovarian mass...Small cell carcinoma, hypercalcemic typeAssociated with rhabdoid tumor predisposition syndrome (SMARCA4 germline mutation). Increased serum calcium and poor prognosis. pic.twitter.com/DQSlcAMuf2","34, female, ovarian mass...Small cell carcinoma, hypercalcemic typeAssociated with rhabdoid tumor predisposition syndrome (SMARCA4 germline mutation). Increased serum calcium and poor prognosis. ",-0.2,0.3833333333333333,Negative,Objective
32,Active Surveillance for Low-risk #ProstateCancer : The European Association of Urology Position in 2018   https://buff.ly/2lBCpGZ  #VisualAbstract @Uroweb pic.twitter.com/wVfbq6oD7O,Active Surveillance for Low-risk ProstateCancer : The European Association of Urology Position in 2018    VisualAbstract Uroweb ,-0.06666666666666668,0.3,Negative,Objective
33,Fresh study from Dr. Hikmat Al-Ahmadie @whynottwitgu & colleagues @MSKPathology @sloan_kettering - focus: intratumoral heterogeneity of ERBB2 amplification and HER2 expression in micropapillary urothelial carcinoma #gupath #bladdercancer link here:  https://www.ncbi.nlm.nih.gov/pubmed/29601842  pic.twitter.com/EgHOwGvbua,Fresh study from Dr. Hikmat Al-Ahmadie whynottwitgu & colleagues MSKPathology sloan_kettering - focus: intratumoral heterogeneity of ERBB2 amplification and HER2 expression in micropapillary urothelial carcinoma gupath bladdercancer link here:   ,0.3,0.5,Positive,Objective
34,Thanks for your contribution! https://twitter.com/slusagar/status/1012131904722649088 …,Thanks for your contribution! ,0.25,0.2,Positive,Objective
35,🔬 H&E #HemePath #DailyDx Day 3: ➡️ What’s your #DailyDx of this blood smear? ➡️ What molecular alteration is common in this neoplasm? ➡️ What clinical condition requires rapid recognition of this neoplasm? ➡️ We’ll tweet the answers and some quick facts tomorrow! pic.twitter.com/bwC965nbdw,🔬 H&E HemePath DailyDx Day 3: ➡️ What’s your DailyDx of this blood smear? ➡️ What molecular alteration is common in this neoplasm? ➡️ What clinical condition requires rapid recognition of this neoplasm? ➡️ We’ll tweet the answers and some quick facts tomorrow! ,0.05833333333333333,0.5,Positive,Objective
36,"🔬 H&E #HemePath #DailyDx, Day 1:➡️ What’s your #DailyDx of this blood smear?➡️ What IHC pattern would you expect in the bone marrow?➡️ What molecular alterations are common in this neoplasm?➡️ We’ll tweet the answers and some quick facts tomorrow! #UMichPath pic.twitter.com/edt2Lk4nuH","🔬 H&E HemePath DailyDx, Day 1:➡️ What’s your DailyDx of this blood smear?➡️ What IHC pattern would you expect in the bone marrow?➡️ What molecular alterations are common in this neoplasm?➡️ We’ll tweet the answers and some quick facts tomorrow! UMichPath ",0.05833333333333333,0.5,Positive,Objective
37,"Embryonal Rhabdomyosarcoma - Paratesticular location in young patients. Small round blue cells or spindle, cellular and less cellular areas, skeletal muscle differentiation (MYOD1 positive seen here). #GUpath pic.twitter.com/oN51hfUK64","Embryonal Rhabdomyosarcoma - Paratesticular location in young patients. Small round blue cells or spindle, cellular and less cellular areas, skeletal muscle differentiation (MYOD1 positive seen here). GUpath ",-0.04823232323232322,0.31868686868686874,Negative,Objective
38,"Mixed epithelial &stromal tumor (MEST)of kidney in middle aged female-solid &cystic,fibrous/sclerotic/ovarian stroma,cystic component with flat/hobnail/cuboidal/columnar epithelium,stroma ER+PR+,majority benign with rare malignant phenotype @UMichPath #KidneyDisease #pathology pic.twitter.com/To4Z4rFJZm","Mixed epithelial &stromal tumor (MEST)of kidney in middle aged female-solid &cystic,fibrous/sclerotic/ovarian stroma,cystic component with flat/hobnail/cuboidal/columnar epithelium,stroma ER+PR+,majority benign with rare malignant phenotype UMichPath KidneyDisease pathology ",0.05,0.3875,Positive,Objective
39,Extensive involvement of periurethral ducts by prostate cancer (intraductal growth pattern)- somewhat uncommon but classic! #prostatecancer @UMichPath #pathology pic.twitter.com/oJp8tJ3CP2,Extensive involvement of periurethral ducts by prostate cancer (intraductal growth pattern)- somewhat uncommon but classic! prostatecancer UMichPath pathology ,0.3361111111111111,0.5,Positive,Objective
40,#WhyPathologistsMatter https://twitter.com/Doc_B_to_the_B/status/1011363389476671493 …,WhyPathologistsMatter ,0.0,0.0,Neutral,Objective
41,@UMichUrology's own Dr. Alon Weizer and @montrose52 served as authors on a landmark study comparing robotic radical cystectomies with open radical cystectomies. The study was published in @TheLancet. https://www.thelancet.com/journals/lancet/article/PIIS0140-6736(18)30996-6/fulltext …,UMichUrology's own Dr. Alon Weizer and montrose52 served as authors on a landmark study comparing robotic radical cystectomies with open radical cystectomies. The study was published in TheLancet. ,0.16666666666666666,0.5666666666666667,Positive,Subjective
42,Nice case! https://twitter.com/uabpathology/status/1010151234446282752 …,Nice case! ,0.75,1.0,Positive,Subjective
43,"🔬 H&E #GUPath #DailyDx, Day 5:➡️ What’s your #DailyDx of this bladder lesion?➡️ What IHC pattern would you expect in this lesion?➡️ We’ll tweet the answers and some quick facts tomorrow! #UMichPath pic.twitter.com/ngk5uIKoM1","🔬 H&E GUPath DailyDx, Day 5:➡️ What’s your DailyDx of this bladder lesion?➡️ What IHC pattern would you expect in this lesion?➡️ We’ll tweet the answers and some quick facts tomorrow! UMichPath ",0.4166666666666666,0.5,Positive,Objective
44,"Modric put the game away with a beautiful strike against Argentina, earning him Goal of the Day honors! pic.twitter.com/t5zJ8uNrfP","Modric put the game away with a beautiful strike against Argentina, earning him Goal of the Day honors! ",0.3,0.7,Positive,Subjective
45,"On needle biopsy, intraductal carcinoma of the prostate (IDC-P) can occasionally be seen as ""intra-acinar"" (i.e. smaller acinar/duct involvement) - note the enlarged/plemorphic nuclei and mitotic figure in the setting of a readily visible basal cell layer #gupath #prostatecancer pic.twitter.com/YxNlVOKaII","On needle biopsy, intraductal carcinoma of the prostate (IDC-P) can occasionally be seen as ""intra-acinar"" (i.e. smaller acinar/duct involvement) - note the enlarged/plemorphic nuclei and mitotic figure in the setting of a readily visible basal cell layer gupath prostatecancer ",0.06666666666666668,0.375,Positive,Objective
46,"Today on #WorldKidneyCancerDay around 926 new cases of #kidneycancer will be diagnosed around the world, we are happy to have joined thousands of  patients across the globe raising awareness for #kidneycancer. Huge thanks to @NHSEngland for your support pic.twitter.com/s03Zz6upAy","Today on WorldKidneyCancerDay around 926 new cases of kidneycancer will be diagnosed around the world, we are happy to have joined thousands of  patients across the globe raising awareness for kidneycancer. Huge thanks to NHSEngland for your support ",0.3840909090909091,0.6386363636363637,Positive,Subjective
47,"I have Kidney Cancer. Maybe you do too, or someone you know. It is World Kidney Cancer Day, so try out this 2 minute quiz to learn more. More information from the brilliant:  @KidneycancerSN @kidneycanceruk @IKCCorg @DebMaskens @campaignkate @THEJamesWhale https://worldkidneycancerday.org/2018-quiz/?platform=hootsuite …","I have Kidney Cancer. Maybe you do too, or someone you know. It is World Kidney Cancer Day, so try out this 2 minute quiz to learn more. More information from the brilliant:  KidneycancerSN kidneycanceruk IKCCorg DebMaskens campaignkate THEJamesWhale ",0.6333333333333333,0.6666666666666666,Positive,Subjective
48,"🔬H&E #GUPath #DailyDx, Day 4:➡️ What’s your #DailyDx of this bladder lesion?➡️ What IHC pattern would you expect in this lesion?➡️ We’ll tweet the answers and some quick facts tomorrow! #UMichPath pic.twitter.com/2KlRHrLDjz","🔬H&E GUPath DailyDx, Day 4:➡️ What’s your DailyDx of this bladder lesion?➡️ What IHC pattern would you expect in this lesion?➡️ We’ll tweet the answers and some quick facts tomorrow! UMichPath ",0.4166666666666666,0.5,Positive,Objective
49,#GUpath: 30ish male with testicular mass.Dx: Epidermoid cyst pic.twitter.com/OrvRJZGnZB,GUpath: 30ish male with testicular mass.Dx: Epidermoid cyst ,0.0,0.1,Neutral,Objective
50,Extensive involvement of periurethral ducts by prostate cancer (intraductal growth pattern)- somewhat uncommon but classic! #prostatecancer @UMichPath #pathology pic.twitter.com/oJp8tJ3CP2,Extensive involvement of periurethral ducts by prostate cancer (intraductal growth pattern)- somewhat uncommon but classic! prostatecancer UMichPath pathology ,0.3361111111111111,0.5,Positive,Objective
51,"It is a great honor to be #ASCP40UnderForty voting for top 5 is on !!! Check out my profile for my work on mentoring, research, advocacy and engagement. Vote-  http://woobox.com/ibeg6a/gallery/QaStgOgH-wc … … or  https://www.ascp.org/content/get-involved/get-recognized/40-under-forty/?utm_source=SilverpopMailing&utm_medium=email&utm_campaign=2018_6_11%20ASCP%2040%20Under%20Forty%20Email%20(1)&utm_content=#patil … … …or  http://bit.ly/2HDJe3J  Appreciate your support for top 5! pic.twitter.com/Yo2Y4TuByx","It is a great honor to be ASCP40UnderForty voting for top 5 is on !!! Check out my profile for my work on mentoring, research, advocacy and engagement. Vote-   … or   … …or   Appreciate your support for top 5! ",0.8005208333333332,0.5833333333333334,Positive,Subjective
52,The cutest urinary bladder biopsy ever! Cystitis cystica @UMichPath pic.twitter.com/fF1EneYY9J,The cutest urinary bladder biopsy ever! Cystitis cystica UMichPath ,0.0,0.0,Neutral,Objective
53,"🔬 H&E #GUPath #DailyDx, Day 1:➡️ What’s your #DailylDx of this bladder lesion?➡️ What IHC would you expect to see in this diagnosis?➡️ We’ll tweet the answers and some quick facts tomorrow! #UMichPath pic.twitter.com/m0SZmgWsue","🔬 H&E GUPath DailyDx, Day 1:➡️ What’s your DailylDx of this bladder lesion?➡️ What IHC would you expect to see in this diagnosis?➡️ We’ll tweet the answers and some quick facts tomorrow! UMichPath ",0.4166666666666666,0.5,Positive,Objective
54,Important work by COG showing that translocation RCC is the most common RCC in the AYA population. RMC is the 3rd most common (26/212 patients). Sickle history known only in 13 so some of these cases may be the RCCU-MP variant.  https://bit.ly/2JUInka  #AYAcancer #endRMC pic.twitter.com/G6eBDjmzbn,Important work by COG showing that translocation RCC is the most common RCC in the AYA population. RMC is the 3rd most common (26/212 patients). Sickle history known only in 13 so some of these cases may be the RCCU-MP variant.   AYAcancer endRMC ,0.1142857142857143,0.5714285714285714,Positive,Subjective
