,tweet,processed_tweet,polarity,subjectivity,Sentiment,Objectivity
309,A kickstarter campaign for science? Why not! Fay-Wei Li and @DukeU prof Kathleen Pryor crowdfunded an effort to sequence the genomes of the Azolla fern and it's bacterial buddies -- work that may help create sustainable biofertilizers.WATCH:  http://ow.ly/RHN530kMsM6 @fern_way pic.twitter.com/2lp99W51g6,A kickstarter campaign for science? Why not! Fay-Wei Li and DukeU prof Kathleen Pryor crowdfunded an effort to sequence the genomes of the Azolla fern and it's bacterial buddies -- work that may help create sustainable biofertilizers.WATCH:  ern_way ,0.0,0.0,Neutral,Objective
310,Duke Engage in DC: Students watch how science policy is made. https://buff.ly/2KFmfaA ,Duke Engage in DC: Students watch how science policy is made. ,0.0,0.0,Neutral,Objective
311,"Kathy Wolf, who has end-stage ovarian cancer, was too ill to use her tickets to see @TheTimMcGraw in Raleigh, so her @dukeobgyn & @DukeCancer docs & nurses messaged the singer on social media. He responded, creating a meaningful memory for this fan & her family. ❤️ pic.twitter.com/VWGJe9t1hn","Kathy Wolf, who has end-stage ovarian cancer, was too ill to use her tickets to see TheTimMcGraw in Raleigh, so her dukeobgyn & DukeCancer docs & nurses messaged the singer on social media. He responded, creating a meaningful memory for this fan & her family. ❤️ ",0.011111111111111108,0.5222222222222223,Positive,Subjective
312,Fred Nijhout of @dukeu has made a career of asking big questions about butterfly wings. He's been able to link the formation of those eye-like spots on the backs of wings to our own human limb development. Meet Nijhout at 12:20. @DukeU (Photo Anatoly Mikhaltsov Wiki Commons) pic.twitter.com/rYohZ2VRXn,Fred Nijhout of dukeu has made a career of asking big questions about butterfly wings. He's been able to link the formation of those eye-like spots on the backs of wings to our own human limb development. Meet Nijhout at 12:20. DukeU (Photo Anatoly Mikhaltsov Wiki Commons) ,0.275,0.45625,Positive,Objective
313,48 babies were born in 41 hours in a Texas hospital & people are blaming the full moon — @dukeobgyn's #mfm R. Phillips Heine offers insight... https://bit.ly/2KJMkWf  @bustle pic.twitter.com/ib0QnvenhN,48 babies were born in 41 hours in a Texas hospital & people are blaming the full moon — dukeobgyn's mfm R. Phillips Heine offers insight...  bustle ,0.225,0.275,Positive,Objective
314,"Eucalyptus leaves are toxic enough to kill most mammals, but not the koala. After sequencing their #genome, researchers have discovered why. http://www.sciencemag.org/news/2018/07/koala-s-diet-would-kill-most-mammals-their-genome-reveals-how-they-survive …","Eucalyptus leaves are toxic enough to kill most mammals, but not the koala. After sequencing their genome, researchers have discovered why. ",0.25,0.5,Positive,Objective
315,🇺🇸🚲 @walkonamerica status: BOOMING. Our guy @brennanbesser is a game-changer. Great turnout in B53's hometown of Chicago. 💨💪🔵😈 pic.twitter.com/LwZyrv8q4t,🇺🇸🚲 walkonamericatatus: BOOMING. Our guy brennanbessers a game-changer. Great turnout in B53's hometown of Chicago. 💨💪🔵😈 ,0.8,0.75,Positive,Subjective
316,Jails and prisons: the unmanned front in the battle against the #opioid epidemic https://www.statnews.com/2018/07/02/opioid-epidemic-jails-prisons-treatment/ …,Jails and prisons: the unmanned front in the battle against the opioid epidemic ,0.0,0.0,Neutral,Objective
317,Duke in Pics: From soil to box.  https://buff.ly/2MKBGiq  pic.twitter.com/GFCJFpa827,Duke in Pics: From soil to box.   ,0.0,0.0,Neutral,Objective
318,"Mohammed Eid shares his story of how he, an @UNRWA refugee from #Gaza, is now a @Rotary Peace Fellowship recipient at @UNC + @DukeU studying Global Studies. He is a testament to the value of the international community investing in and giving opportunities to the youth of Gaza.","Mohammed Eid shares his story of how he, an UNRWA refugee from Gaza, is now a Rotary Peace Fellowship recipient at UNC + DukeU studying Global Studies. He is a testament to the value of the international community investing in and giving opportunities to the youth of Gaza.",0.0,0.0,Neutral,Objective
319,“My favorite memories were spending time with my teammates. Meeting people from different backgrounds and ethnicities. Winning two ACC 🏆 and meeting my husband.” - Richa JacksonSounds like an extremely well-rounded college experience!!! 💙😈📚🌏🏀💕📝  http://goduke.us/2lnq7lG  pic.twitter.com/0ZKpcRMspM,“My favorite memories were spending time with my teammates. Meeting people from different backgrounds and ethnicities. Winning two ACC 🏆 and meeting my husband.” - Richa JacksonSounds like an extremely well-rounded college experience!!! 💙😈📚🌏🏀💕📝   ,0.18896484375,0.8375,Positive,Subjective
320,"""How I made it from Gaza to Duke and UNC.""  https://buff.ly/2IMQSZR  pic.twitter.com/f6xvcPt31P","""How I made it from Gaza to Duke and UNC.""   ",0.0,0.0,Neutral,Objective
321,A floating fern that produces nitrogen because it has bacteria living inside it? Yep. it's called Azolla and the fern and the bug have just had their genomes sequenced.  VIDEO - http://ow.ly/TA3L30kLJ36 ,A floating fern that produces nitrogen because it has bacteria living inside it? Yep. it's called Azolla and the fern and the bug have just had their genomes sequenced.  VIDEO - ,0.0,0.0,Neutral,Objective
322,How a 'lack of civility' helped propel the civil rights movement.  https://buff.ly/2Kuk3GM  pic.twitter.com/8ZJkc3sEsO,How a 'lack of civility' helped propel the civil rights movement.   ,0.0,0.0,Neutral,Objective
323,The Poliovirus Could Help Fight the Most Common Cancerous Brain Tumors http://www.newsweek.com/poliovirus-help-fight-common-cancerous-brain-tumors-1002323 …,The Poliovirus Could Help Fight the Most Common Cancerous Brain Tumors ,0.1,0.5,Positive,Objective
324,Tim McGraw records message for cancer patient who had to miss his show  https://dailym.ai/2NfVqvp  via @MailOnline,Tim McGraw records message for cancer patient who had to miss his show   via MailOnline,0.0,0.0,Neutral,Objective
325,"Butterfly wings are made up of single-cell scales. And each scale can be a different color, says @DukeU professor Frederik Nijhout. (Photo Johan J.Ingles-Le Nobel via Flickr) pic.twitter.com/dckPoCyCIf","Butterfly wings are made up of single-cell scales. And each scale can be a different color, says DukeU professor Frederik Nijhout. (Photo Johan J.Ingles-Le Nobel via Flickr) ",0.0,0.6,Neutral,Subjective
326,.@DukeU Grad student Erin Conley is prepping the massive DUNE experiment to detect neutrinos spit out by dying stars https://twitter.com/Fermilab/status/1013819588293754880 …,.DukeU Grad student Erin Conley is prepping the massive DUNE experiment to detect neutrinos spit out by dying stars ,0.0,1.0,Neutral,Subjective
327,Two Duke faculty take the stage at the Aspen Ideas Festival.  https://buff.ly/2KvvXAA  pic.twitter.com/Uk6PSHK69M,Two Duke faculty take the stage at the Aspen Ideas Festival.   ,0.0,0.0,Neutral,Objective
328,"Construction has started! Excited for  the arrival of Sazón, our new Latin American grill opening this fall in the #brodheadcenter! @DukeU @NACUFS @DukeStudents @foodmanagement #dukedining #newforyou #latinamericangrill pic.twitter.com/26Lap4fDEe","Construction has started! Excited for  the arrival of Sazón, our new Latin American grill opening this fall in the brodheadcenter! DukeU NACUFS DukeStudents foodmanagement dukedining newforyou latinamericangrill ",0.17045454545454544,0.4015151515151516,Positive,Objective
329,"TODAY: Tune in at noon to @state_of_things to hear @DukeU archivist Valerie Gillispie and undergrad Caroline Waring talk about about ""Stone by Stone,"" a project to discover the identities of the workers who built the Gothic Wonderland.  @fhi_duke @dukeuarchives pic.twitter.com/DTJErVDljt","TODAY: Tune in at noon to state_of_things to hear DukeU archivist Valerie Gillispie and undergrad Caroline Waring talk about about ""Stone by Stone,"" a project to discover the identities of the workers who built the Gothic Wonderland.  fhi_duke dukeuarchives ",0.0,0.0,Neutral,Objective
330,Former Blue Devil Hall Brown appears on @MASTERCHEFonFOX.  https://buff.ly/2KDjbyT  pic.twitter.com/c7GM6f9xrT,Former Blue Devil Hall Brown appears on MASTERCHEFonFOX.   ,0.0,0.05,Neutral,Objective
331,Duke eNable printing “prosthetics.”  https://buff.ly/2lPxrXC  pic.twitter.com/K7FmDmnK2d,Duke eNable printing “prosthetics.”   ,0.0,0.0,Neutral,Objective
332,Math can help identify whether a state's proposed district maps are likely to lead to extreme election outcomes  http://ow.ly/PuVI30kJmQO  @jcmattingly @DukeU pic.twitter.com/sjq0jLeMnh,Math can help identify whether a state's proposed district maps are likely to lead to extreme election outcomes   jcmattingly DukeU ,-0.0625,1.0,Negative,Subjective
333,Bill Adair discusses whether truth is informing public discourse.@BillAdairDuke @DukeU @Duke_DeWitt @ReportersLab https://youtu.be/-sP7vYh0koc ,Bill Adair discusses whether truth is informing public discourse.BillAdairDuke DukeU Duke_DeWitt ReportersLab ,0.0,0.06666666666666668,Neutral,Objective
334,".@res1gned, host of #ACupOfTechnology, talks with @DukeU professor Mark Anthony Neal about the cultural expectations of Black men, the influential mentors in his life, why he launched @LeftOfBlack and the radicalism of Black Relationships  http://www.newblackmaninexile.net/2018/07/a-cup-of-technology-mark-anthony-neal.html … pic.twitter.com/KYy4vd2mkU",".res1gned, host of ACupOfTechnology, talks with DukeU professor Mark Anthony Neal about the cultural expectations of Black men, the influential mentors in his life, why he launched LeftOfBlack and the radicalism of Black Relationships   ",-0.07777777777777778,0.32222222222222224,Negative,Objective
335,"Family separation is officially over, but history suggests the U.S. won't find a good solution for migrant children.  https://buff.ly/2z9nbmy  pic.twitter.com/7akWjPacuo","Family separation is officially over, but history suggests the U.S. won't find a good solution for migrant children.   ",0.7,0.6000000000000001,Positive,Subjective
336,Are there long-term solutions to illegal immigration?  https://buff.ly/2IzsBXa  pic.twitter.com/QCGy0CT7St,Are there long-term solutions to illegal immigration?   ,-0.5,0.5,Negative,Objective
337,Picturing a rich culture of black cowboys and cowgirls in #Louisiana.  https://buff.ly/2K9NCxg  pic.twitter.com/DGIWiIxh3D,Picturing a rich culture of black cowboys and cowgirls in Louisiana.   ,0.10416666666666667,0.5916666666666667,Positive,Subjective
338,Duke's Technology Scholars program helps women succeed on a technology path  https://buff.ly/2lKGjxy  pic.twitter.com/WnFTB7yVOV,Duke's Technology Scholars program helps women succeed on a technology path   ,0.0,0.0,Neutral,Objective
339,"2018 Acting on the Call report details how @USAID partners with 25 countries on their journey to self-reliance for preventing child and maternal deaths by enabling countries to plan, fund and manage their own continued progress: http://bit.ly/2MDOB6D ","2018 Acting on the Call report details how USAID partners with 25 countries on their journey to self-reliance for preventing child and maternal deaths by enabling countries to plan, fund and manage their own continued progress: ",0.3,0.5,Positive,Objective
340,What are the long-term solutions for illegal immigration? @DukeU's @AMBPatrickDuddy has the answers:    @DUCIGS http://thehill.com/opinion/international/394497-are-there-long-term-solutions-to-illegal-immigration … pic.twitter.com/KYKZcQEFlk,What are the long-term solutions for illegal immigration? DukeU's AMBPatrickDuddy has the answers:    DUCIGS  ,-0.5,0.5,Negative,Objective
341,.@DukeU launches a shuttle service pilot between campus and downtown @CityofDurhamNC:  http://ow.ly/p6k430kFd3V  @ChesterfieldNC @DukeGradSchool @DukeStudents pic.twitter.com/EXuCuT0a7n,.DukeU launches a shuttle service pilot between campus and downtown CityofDurhamNC:   ChesterfieldNC DukeGradSchool DukeStudents ,0.0,0.0,Neutral,Objective
342,"Nanomaterials could mean more algae outbreaks for wetlands, waterways.  https://buff.ly/2Kh5F0y  pic.twitter.com/ALriYlifWY","Nanomaterials could mean more algae outbreaks for wetlands, waterways.   ",0.09375,0.59375,Positive,Subjective
343,And another photo of the crazy tusks of adult male Cuvier's beaked whales that are adorned by barnacles - this time by the intrepid @heatherjfoley @DukeMarineLab @DukeEnvironment pic.twitter.com/0D50peRjqL,And another photo of the crazy tusks of adult male Cuvier's beaked whales that are adorned by barnacles - this time by the intrepid heatherjfoley DukeMarineLab DukeEnvironment ,-0.16666666666666666,0.43333333333333335,Negative,Objective
344,Does increasing the tipped minimum wage actually help workers? 7 experts weigh in.  https://buff.ly/2tBtx81  pic.twitter.com/303aah45S7,Does increasing the tipped minimum wage actually help workers? 7 experts weigh in.   ,0.0,0.1,Neutral,Objective
345,"“A #SpaceForce as the sixth branch of the armed forces is a really bad idea...Internationally, I predict this will be interpreted as an overt message that the U.S. is intending to accelerate the militarization of space..."" http://bit.ly/2yFXlGh ","“A SpaceForce as the sixth branch of the armed forces is a really bad idea...Internationally, I predict this will be interpreted as an overt message that the U.S. is intending to accelerate the militarization of space..."" ",-0.6999999999999998,0.6666666666666666,Negative,Subjective
346,WATCH: Little girl and her American Girl doll have matching surgery scars  https://buff.ly/2yIgvLD  pic.twitter.com/rFFxTMJhJa,WATCH: Little girl and her American Girl doll have matching surgery scars   ,-0.09375,0.25,Negative,Objective
347,"Diagnosis of Alzheimer’s becoming more common, but less severe.  https://buff.ly/2IqkfkC  pic.twitter.com/224TCxI4sR","Diagnosis of Alzheimer’s becoming more common, but less severe.   ",0.12083333333333332,0.4791666666666667,Positive,Objective
348,"Nanomaterials could mean more algae outbreaks for wetlands, waterways  http://ow.ly/yASr30kEz27  with @KingAquaticEco @BPerrotta16 @smkanderson @CEINTnano @DrBioGC @MicrobialMarie @DukeU pic.twitter.com/7PUOQ1WzsC","Nanomaterials could mean more algae outbreaks for wetlands, waterways   with KingAquaticEco BPerrotta16 smkanderson CEINTnano DrBioGC MicrobialMarie DukeU ",0.09375,0.59375,Positive,Subjective
349,"Here’s how you can get the most out of @DukeU’s 7,000-acre slice of forest wilderness:  http://ow.ly/uhFn30kE4yC  @DurhamNC pic.twitter.com/yClNNOAFqd","Here’s how you can get the most out of DukeU’s 7,000-acre slice of forest wilderness:   DurhamNC ",0.5,0.5,Positive,Objective
350,"Eladio Bobadilla came to the U.S. as an infant with his parents, undocumented farmworkers. He went on to serve in the @USNavy & is now pursuing a Ph.D. at @DukeU. He writes an opinion in @newsobserver about the humanitarian crisis on the border: http://www.newsobserver.com/article213418724.html …","Eladio Bobadilla came to the U.S. as an infant with his parents, undocumented farmworkers. He went on to serve in the USNavy & is now pursuing a Ph.D. at DukeU. He writes an opinion in newsobserver about the humanitarian crisis on the border: ",0.0,0.0,Neutral,Objective
351,Building a garret to tell the story of an escaped slave.  https://buff.ly/2MoUiV7  pic.twitter.com/gbJaA9SrOX,Building a garret to tell the story of an escaped slave.   ,0.0,0.0,Neutral,Objective
352,"Oldies are goodies: These birds may have sung the same songs for 1,000 years, @DukeU researchers find https://buff.ly/2lx26bH  pic.twitter.com/BTJscvWJrY","Oldies are goodies: These birds may have sung the same songs for 1,000 years, DukeU researchers find  ",0.0,0.125,Neutral,Objective
353,".@DukeU researchers have discovered local solutions can play a major part in the global problem of coral bleaching -- for example, rounding up predatory snails. Learn more:  http://bit.ly/2JSODKd  pic.twitter.com/LDraa2xJHl",".DukeU researchers have discovered local solutions can play a major part in the global problem of coral bleaching -- for example, rounding up predatory snails. Learn more:   ",0.140625,0.25,Positive,Objective
354,@FloridaMuseum Tiny #fossils give clues to origins of human social structure:  http://bit.ly/2MdSX3e  “The loss of grooming claws is probably a reflection of more complex social networks & increased social grooming.”#FossilFriday @ucmpberkeley @floridamuseum @NSF @DukeU pic.twitter.com/ZECPT5lBSv,FloridaMuseum Tiny fossils give clues to origins of human social structure:   “The loss of grooming claws is probably a reflection of more complex social networks & increased social grooming.”FossilFriday ucmpberkeley floridamuseum NSF DukeU ,0.042857142857142864,0.24285714285714285,Positive,Objective
355,"After being diagnosed with Stage IV cancer at age 35, professor and author @KatecBowler launched a national conversation about why it feels so difficult to speak frankly about suffering. #TEDMED 2018 pic.twitter.com/ncfc6gMwo6","After being diagnosed with Stage IV cancer at age 35, professor and author KatecBowler launched a national conversation about why it feels so difficult to speak frankly about suffering. TEDMED 2018 ",-0.5,1.0,Negative,Subjective
356,"There's a silver lining in the Supreme Court #gerrymandering decision:  it may lead to better ways to detect partisan gerrymandering, thanks to mathematicians  http://ow.ly/5lyD30kCzN2  @jcmattingly pic.twitter.com/wfTN9sNeWf","There's a silver lining in the Supreme Court gerrymandering decision:  it may lead to better ways to detect partisan gerrymandering, thanks to mathematicians   jcmattingly ",0.35,0.35,Positive,Objective
357,"Opinion: At the U.S.-Mexico border, a water war is brewing.  https://buff.ly/2IiSJoZ  pic.twitter.com/XPEvCzcAZL","Opinion: At the U.S.-Mexico border, a water war is brewing.   ",0.0,0.0,Neutral,Objective
358,Meet the menagerie of parasites that can live in human eyes.  https://buff.ly/2lqJHxj  pic.twitter.com/e67Z5i1chQ,Meet the menagerie of parasites that can live in human eyes.   ,0.06818181818181818,0.3,Positive,Objective
359,Help Identify the Antioquia 32! @DukeLibraries  https://buff.ly/2K8MEgF  pic.twitter.com/F6Hu7CRQvU,Help Identify the Antioquia 32! DukeLibraries   ,0.0,0.0,Neutral,Objective
360,NC names its first African-American Poet Laureate to be ambassador for spoken word. @CDSDuke  https://buff.ly/2yBVi5Y  pic.twitter.com/ljuM868qBK,NC names its first African-American Poet Laureate to be ambassador for spoken word. CDSDuke   ,0.25,0.3333333333333333,Positive,Objective
361,"When a #lemur needed a tooth pulled, animal dentistry got high-tech with 3-D printing:  http://ow.ly/i0SX30kBvFn  @DukeU @DukeLemurCenter pic.twitter.com/1BQxnPN0Tk","When a lemur needed a tooth pulled, animal dentistry got high-tech with 3-D printing:   DukeU DukeLemurCenter ",0.0,0.0,Neutral,Objective
362,"When cozying up with would-be predators, cleaner shrimp follow a dependable script  http://ow.ly/mQBW30kAItA   @ECaves47  @DukeU pic.twitter.com/vA9Dw8OPR4","When cozying up with would-be predators, cleaner shrimp follow a dependable script    ECaves47  DukeU ",0.0,0.0,Neutral,Objective
363,"When a #lemur needed a tooth pulled, animal dentistry got high-tech with 3-D printing:  https://buff.ly/2M96toY  pic.twitter.com/nKicRlZg2T","When a lemur needed a tooth pulled, animal dentistry got high-tech with 3-D printing:   ",0.0,0.0,Neutral,Objective
364,".@DukeU Professor Adrian Bejan has developed a theory as to why people tend to form social structures and why our cities' resource distribution systems (think water, electricity, data, etc) all resemble one another. The answer is, in short, physics.  https://pratt.duke.edu/about/news/constructal-social-organization … pic.twitter.com/19RwGcnvuZ",".DukeU Professor Adrian Bejan has developed a theory as to why people tend to form social structures and why our cities' resource distribution systems (think water, electricity, data, etc) all resemble one another. The answer is, in short, physics.   ",0.04444444444444445,0.2222222222222222,Positive,Objective
365,Newly developed #opioids can target pain without triggering pleasure https://theconversation.com/opioids-dont-have-to-be-addictive-the-new-versions-will-treat-pain-without-triggering-pleasure-97593 …,Newly developed opioids can target pain without triggering pleasure ,0.1,0.3,Positive,Objective
366,.@DukeU students are traveling to Berlin to support #CourseraForRefugees learners as they take Duke courses. Learn more about the inspiring initiative:  https://bit.ly/2I1TLG4  #WithRefugees pic.twitter.com/TMnT6zhLZv,.DukeU students are traveling to Berlin to support CourseraForRefugees learners as they take Duke courses. Learn more about the inspiring initiative:   WithRefugees ,0.5,0.75,Positive,Subjective
367,Scientists @DukeU want to continue their research on the public health of communities in the nation's fracking hot zones.  http://www.newsobserver.com/news/local/education/article213547809.html … #Fracking,Scientists DukeU want to continue their research on the public health of communities in the nation's fracking hot zones.   Fracking,0.125,0.4583333333333334,Positive,Objective
368,"@TamikaGalanis, a grad of the @mfaeda program here @DukeU, is working to document her native #Bahamas. Here's her story:  https://bit.ly/2JSQIpz  @CDSDuke @DukeArts pic.twitter.com/l4vX6BxTuR","TamikaGalanis, a grad of the mfaeda program here DukeU, is working to document her native Bahamas. Here's her story:   CDSDuke DukeArts ",0.0,0.0,Neutral,Objective
369,@DukeEngage Getting our hands dirty with @dukeengage.  https://buff.ly/2yuANby  pic.twitter.com/wMCvQTy2HZ,DukeEngage Getting our hands dirty with dukeengage.   ,-0.6,0.8,Negative,Subjective
370,"New Joint Duke, @DukeKunshan Electrical and Computer Engineering degree seeks to prepare global tech leaders.  https://buff.ly/2lezrZ4  pic.twitter.com/8Ds6ZXqRgw","New Joint Duke, DukeKunshan Electrical and Computer Engineering degree seeks to prepare global tech leaders.   ",0.06818181818181818,0.2272727272727273,Positive,Objective
371,"Sure, humans have culture, but it turns out some birds are also very skilled at passing down traditions through the centuries. http://bit.ly/2teJZeZ ","Sure, humans have culture, but it turns out some birds are also very skilled at passing down traditions through the centuries. ",0.33148148148148143,0.6092592592592593,Positive,Subjective
372,How nature’s fastest strikers use strategy to direct their brutal blows http://cbc.ca/1.4705667 #fastestpunch #mantisshrimp @rl_crane @HopkinsMarine @DukeU pic.twitter.com/wX8Aq7znDH,How nature’s fastest strikers use strategy to direct their brutal blows astestpunch mantisshrimp rl_crane HopkinsMarine DukeU ,-0.3875,0.7,Negative,Subjective
373,.@TamikaGalanis is documenting the Bahamas the world rarely sees—the lives and culture of the Bahamian people. She graduated from Duke’s @mfaeda program in 2016 and was awarded a Documentary Diversity fellowship by @CDSDuke. Meet her work:  http://bit.ly/2MJgrhV  #DukeArts pic.twitter.com/ARoEyUifrx,.TamikaGalanis is documenting the Bahamas the world rarely sees—the lives and culture of the Bahamian people. She graduated from Duke’s mfaeda program in 2016 and was awarded a Documentary Diversity fellowship by CDSDuke. Meet her work:   DukeArts ,0.15,0.45,Positive,Objective
374,"For #WorldRefugeeDay, a story of one refugee's path to Duke and how it changed his life. https://blogs.library.duke.edu/magazine/2018/06/06/one-duke-nation-indivisible/ …","For WorldRefugeeDay, a story of one refugee's path to Duke and how it changed his life. ",0.0,0.0,Neutral,Objective
375,"As shopping moves online, ""close proximity is becoming a less important factor for customers"" - Prof @ryanmcdevitt https://dukefuqua.com/2t9gv26 ","As shopping moves online, ""close proximity is becoming a less important factor for customers"" - Prof ryanmcdevitt ",0.22777777777777775,0.6388888888888891,Positive,Subjective
376,"A new article co-authored by our own @billypizer (also of @DukeSanford) on China’s new national #carbonmarket sheds light on the Chinese market’s unique design, contrasts it with western markets, and highlights possible implications. Read it: http://nieps.org/XVpV30k2fJe ","A new article co-authored by our own billypizer (also of DukeSanford) on China’s new national carbonmarket sheds light on the Chinese market’s unique design, contrasts it with western markets, and highlights possible implications. Read it: ",0.2059659090909091,0.5761363636363637,Positive,Subjective
377,Curtis Freeman: Sessions distorts Romans 13:1 to say civil laws are God's will  http://www.newsobserver.com/opinion/article213435679.html … @DukeU,Curtis Freeman: Sessions distorts Romans 13:1 to say civil laws are God's will   DukeU,0.0,0.0,Neutral,Objective
378,Your guide to summer fun savings at places like @NCZoo @WetNWildEP and @colonialwmsburg:  http://ow.ly/LIgs50hL81B  pic.twitter.com/5qxBEogvMJ,Your guide to summer fun savings at places like NCZoo WetNWildEP and colonialwmsburg:   ,0.3,0.2,Positive,Objective
