,tweet,processed_tweet,polarity,subjectivity,Sentiment,Objectivity
0,Thank you for AWESOME experience today in Boston! Amazing people! @MGHPallCare @NorthwesternMed #Geriatrics pic.twitter.com/mx11kOmZiZ,Thank you for AWESOME experience today in Boston! Amazing people! MGHPallCare NorthwesternMed Geriatrics ,0.875,0.95,Positive,Subjective
1,Thank you @_workingmother_! We're honored to receive this recognition #DBPInclusionIndex https://twitter.com/_workingmother_/status/1021784571380039680 …,Thank you _workingmother_! We're honored to receive this recognition DBPInclusionIndex ,0.0,0.0,Neutral,Objective
2,@NorthwesternMed Bayer Announced It Will Stop Selling  #Essure. Should women who currently have an ESSURE  have it removed? Tune in tomorrow  @WGNMorningNews  9:15  https://www.self.com/story/bayer-stop-selling-essure-in-the-us … via @SELFmagazine @northwesternmed,NorthwesternMed Bayer Announced It Will Stop Selling  Essure. Should women who currently have an ESSURE  have it removed? Tune in tomorrow  WGNMorningNews  9:15   via SELFmagazine northwesternmed,0.0,0.4,Neutral,Objective
3,"Hey, parents! Beat the #stress of #summervacation with these #selfcare tips from a Northwestern Medicine psychologist. http://bit.ly/2NJ5XOX ","Hey, parents! Beat the stress of summervacation with these selfcare tips from a Northwestern Medicine psychologist. ",0.0,0.0,Neutral,Objective
4,Drs. Ansari and Darwish representing @NorthwesternMed at @SNISinfo #SNIS2018 meeting! pic.twitter.com/mYTUzP0fOZ – at Hilton San Francisco Union Square,Drs. Ansari and Darwish representing NorthwesternMed at SNISinfo SNIS2018 meeting!  – at Hilton San Francisco Union Square,0.0,0.0,Neutral,Objective
5,#TAVR procedures are providing patients with a minimally invasive alternative to open heart surgery. #Cardiology http://bit.ly/2mz4xeF ,TAVR procedures are providing patients with a minimally invasive alternative to open heart surgery. Cardiology ,-0.05,0.55,Negative,Subjective
6,Combat #Alzheimers and #Parkinsons with some #summerfun and #aerobics. http://bit.ly/2NyIX59 ,Combat Alzheimers and Parkinsons with some summerfun and aerobics. ,0.0,0.0,Neutral,Objective
7,Who says cake can't be #brainfood? 🧠🎂😋 #NMNeurology #NMBetter pic.twitter.com/fSEbIgrKu4,Who says cake can't be brainfood? 🧠🎂😋 NMNeurology NMBetter ,0.0,0.0,Neutral,Objective
8,"Alcohol-related liver deaths have skyrocketed among millennials, according to a new study. Haripriya Maddur, MD, transplant hematologist at Northwestern Memorial Hospital, weighs in. https://www.nbcnews.com/health/health-news/deaths-liver-disease-are-surging-drinking-blame-n892521?sf90615189=1 …","Alcohol-related liver deaths have skyrocketed among millennials, according to a new study. Haripriya Maddur, MD, transplant hematologist at Northwestern Memorial Hospital, weighs in. ",0.13636363636363635,0.4545454545454545,Positive,Objective
9,Does #chocolate cause #migraines? #Coffee prolong life? #Fertility treatments promote #ovarian cancer?  http://bit.ly/2L6BCgI … for this mornings segment on @WGNMorningNews @NorthwesternMed pic.twitter.com/jP4DvsQQNx,Does chocolate cause migraines? Coffee prolong life? Fertility treatments promote ovarian cancer?   for this mornings segment on WGNMorningNews NorthwesternMed ,0.0,0.0,Neutral,Objective
10,"Scientists @NorthwesternMed have discovered a protective cellular mechanism that kicks in during iron deficiency, keeping cells running even in the face of continued iron deprivation, according to a study published in @PNASNews:  http://bit.ly/2mt6MzW  pic.twitter.com/F5A5YwuLoQ","Scientists NorthwesternMed have discovered a protective cellular mechanism that kicks in during iron deficiency, keeping cells running even in the face of continued iron deprivation, according to a study published in PNASNews:   ",0.0,0.0,Neutral,Objective
11,A beautiful night and a great event with amazing colleagues!!  #purplepride #summerinchicago #WomenofNorthwestern https://twitter.com/NU_WFO/status/1019740789604257794 …,A beautiful night and a great event with amazing colleagues!!  purplepride summerinchicago WomenofNorthwestern ,0.8624999999999999,0.8833333333333333,Positive,Subjective
12,Northwestern Medicine is taking the lead in finding new ways treat the number one cause of death in the world. http://bit.ly/2msxc4X ,Northwestern Medicine is taking the lead in finding new ways treat the number one cause of death in the world. ,0.13636363636363635,0.4545454545454545,Positive,Objective
13,Could a #ChicagoHotDog ever be considered healthy? We dare you to try. Check out our step-by-step recipe! #NationalHotDogDay  http://bit.ly/2Ns6ODO  pic.twitter.com/6cI9ogqO4H,Could a ChicagoHotDog ever be considered healthy? We dare you to try. Check out our step-by-step recipe! NationalHotDogDay   ,0.625,0.5,Positive,Objective
14,It was an honor to care for you and help with your #fibroids ⁦@NorthwesternMed⁩. https://wgntv.com/2017/10/23/fibroids-and-fertility/ …,It was an honor to care for you and help with your fibroids ⁦NorthwesternMed⁩. ,0.0,0.0,Neutral,Objective
15,New research from Northwestern Medicine shows potential for reducing the severity of #allergicreactions. http://bit.ly/2NsSACn ,New research from Northwestern Medicine shows potential for reducing the severity of allergicreactions. ,0.06818181818181818,0.7272727272727273,Positive,Subjective
16,"Healthcare providers are invited to attend the 2018 Northwestern Medicine Comprehensive Stroke and Cerebrovascular Conference on Saturday, October 13 at the Hyatt Centric Chicago Magnificent Mile. Book your seat now! http://bit.ly/2NmRYyj ","Healthcare providers are invited to attend the 2018 Northwestern Medicine Comprehensive Stroke and Cerebrovascular Conference on Saturday, October 13 at the Hyatt Centric Chicago Magnificent Mile. Book your seat now! ",0.5,0.55,Positive,Subjective
17,@NorthwesternMed @CountryPumpDoc speaks to @Suntimes and @chicagotribune about the rare heart condition that tragically took the life of a @ChicagoFireDep rescue diver: https://chicago.suntimes.com/news/juan-bucio-cfd-diver-autopsy/ …,NorthwesternMed CountryPumpDoc speaks to Suntimes and chicagotribune about the rare heart condition that tragically took the life of a ChicagoFireDep rescue diver: ,0.3,0.9,Positive,Subjective
18,"Due to increased patient volumes, expect extended wait times in the Kishwaukee Hospital Emergency Department. For minor illnesses or injuries, please consider visiting your primary care physician or Northwestern Medicine Convenient Care Sycamore located at 1850 Gateway Drive.","Due to increased patient volumes, expect extended wait times in the Kishwaukee Hospital Emergency Department. For minor illnesses or injuries, please consider visiting your primary care physician or Northwestern Medicine Convenient Care Sycamore located at 1850 Gateway Drive.",0.07500000000000001,0.3583333333333333,Positive,Objective
19,We'll be LIVE on @facebook today at 1:15pm CST with two of our @NMCardiology physicians! Tune in to learn more about the latest advances in #cardiacsurgery at Northwestern Medicine. #HeartHealth #Cardiology pic.twitter.com/I1rHkTF77c,We'll be LIVE on facebook today at 1:15pm CST with two of our NMCardiology physicians! Tune in to learn more about the latest advances in cardiacsurgery at Northwestern Medicine. HeartHealth Cardiology ,0.3901515151515152,0.6333333333333333,Positive,Subjective
20,"#behindthescenes @NorthwesternMed’s Haripriya Maddur, MD speaks with @DrJohnTorres about the rising number of millennials being diagnosed with #liverdisease ! Tune in to @NBCNightlyNews tomorrow evening! pic.twitter.com/SVcmyGJTFJ","behindthescenes NorthwesternMed’s Haripriya Maddur, MD speaks with DrJohnTorres about the rising number of millennials being diagnosed with liverdisease ! Tune in to NBCNightlyNews tomorrow evening! ",0.0,0.0,Neutral,Objective
21,Always a good day working with @NBCNewsHealth! Looking forward to their upcoming segment on @NorthwesternMed’s efforts to address the opioid epidemic. @JJStulberg pic.twitter.com/JeQk2c8rcV,Always a good day working with NBCNewsHealth! Looking forward to their upcoming segment on NorthwesternMed’s efforts to address the opioid epidemic. JJStulberg ,0.875,0.6000000000000001,Positive,Subjective
22,Scientists have identified thousands of molecules unique to human fat cells that may play an important role in fat metabolism.  http://bit.ly/2zZiaNR  #metabolism #genetics @sciencemagazine pic.twitter.com/HQBcZcINDk,Scientists have identified thousands of molecules unique to human fat cells that may play an important role in fat metabolism.   metabolism genetics sciencemagazine ,0.25833333333333336,0.7000000000000001,Positive,Subjective
23,"Martella, a longtime friend and fellow Northwestern Medicine nurse, surprised @BonnieHunt_real on the set of @WindyCityLIVE earlier today. Thank you both for touching the lives of so many patients in and outside these hospital walls! pic.twitter.com/zEAmMS82RR","Martella, a longtime friend and fellow Northwestern Medicine nurse, surprised BonnieHunt_real on the set of WindyCityLIVE earlier today. Thank you both for touching the lives of so many patients in and outside these hospital walls! ",0.22000000000000006,0.49,Positive,Objective
24,"#CardiacSurgery is one of the most rapidly evolving fields of medicine. Join us LIVE on Wednesday, July 18 at 1:15pm CST to learn how Northwestern Medicine is pioneering these incredible advances. pic.twitter.com/KCgek5rsXQ","CardiacSurgery is one of the most rapidly evolving fields of medicine. Join us LIVE on Wednesday, July 18 at 1:15pm CST to learn how Northwestern Medicine is pioneering these incredible advances. ",0.5121212121212121,0.6333333333333333,Positive,Subjective
25,"On @QueerEye, the #Fab5 share more than fashion advice, but also how to talk with others who have differing ideologies. Dr. Reinecke, chief psychologist, offers tips to @chicagotribune on how to have productive conversations when discussing tough topics. http://www.chicagotribune.com/lifestyles/sc-fam-queer-eye-political-differences-0724-story.html …","On QueerEye, the Fab5 share more than fashion advice, but also how to talk with others who have differing ideologies. Dr. Reinecke, chief psychologist, offers tips to chicagotribune on how to have productive conversations when discussing tough topics. ",0.07037037037037036,0.4444444444444445,Positive,Objective
26,Do you #crossfit? @NaderDahdaleh & research team have published 20 papers recently & generating a significant amount of interest for paper on Cross Fit related injuries treated at @NorthwesternMed  as well as papers on #DVT after spinal surgery.  http://ow.ly/Q01i30kYuXS  #spine pic.twitter.com/YLSO9TsAWj,Do you crossfit? NaderDahdaleh & research team have published 20 papers recently & generating a significant amount of interest for paper on Cross Fit related injuries treated at NorthwesternMed  as well as papers on DVT after spinal surgery.   spine ,0.155,0.385,Positive,Objective
27,"In the latest episode of our ""Breakthroughs"" #podcast, Robert Kalb, MD, Director of @LesTurnerALS at @NorthwesternMed, explains why he is optimistic that breakthroughs in the basic biology of #ALS are on the way and a cure is possible. https://soundcloud.com/user-549060398/what-causes-als-with-robert-kalb-md …","In the latest episode of our ""Breakthroughs"" podcast, Robert Kalb, MD, Director of LesTurnerALS at NorthwesternMed, explains why he is optimistic that breakthroughs in the basic biology of ALS are on the way and a cure is possible. ",0.16666666666666666,0.6749999999999999,Positive,Subjective
28,Northwestern's own @kbilimoria interviewed by @AmCollSurgeons about incorporating research into their profession https://twitter.com/AmCollSurgeons/status/1017529178818785282 …,Northwestern's own kbilimoria interviewed by AmCollSurgeons about incorporating research into their profession ,0.6,1.0,Positive,Subjective
29,"Happy birthday to CTC therapy dog Winston!  Winston visits with patients at @NorthwesternMed.  Wishing you a great day, Winston!To support Winston's comforting work, please consider donating to CTC today:  https://buff.ly/2qHJuIz  pic.twitter.com/6M0tYR5eqL","Happy birthday to CTC therapy dog Winston!  Winston visits with patients at NorthwesternMed.  Wishing you a great day, Winston!To support Winston's comforting work, please consider donating to CTC today:   ",0.9,0.875,Positive,Subjective
30,Heading out on a #RoadTrip? Here are some #HeartHealthy foods that will help fuel you for your adventures. #Nutrition http://bit.ly/2mf5ubG ,Heading out on a RoadTrip? Here are some HeartHealthy foods that will help fuel you for your adventures. Nutrition ,0.0,0.0,Neutral,Objective
31,A new @NorthwesternMed study has identified a trigger of some fibrotic diseases and an experimental compound to treat it:  http://bit.ly/2mfsHdW  pic.twitter.com/EyIv2yY4Go,A new NorthwesternMed study has identified a trigger of some fibrotic diseases and an experimental compound to treat it:   ,0.11818181818181818,0.4272727272727273,Positive,Objective
32,The Northbrook Tower: Third annual digestive health gala raises record-breaking $2.41 Million  http://bit.ly/2L9BwAK  @NorthbrookTower @NMHnews @NorthwesternMed @NUFeinbergMed @ResearchNU pic.twitter.com/k2CJtufJcv,The Northbrook Tower: Third annual digestive health gala raises record-breaking $2.41 Million   NorthbrookTower NMHnews NorthwesternMed NUFeinbergMed ResearchNU ,0.0,0.0,Neutral,Objective
33,Julian is a great example of the modern treatment of spinal cord injury! #spine #trauma Rapid cutting edge surgery + amazing team + extraordinary patient = miraculous  recovery @NorthwesternMed @Chicago_Spine https://chicago.cbslocal.com/2018/07/11/medical-miracle-man-paralyzed-diving-accident-walks-again/ …,Julian is a great example of the modern treatment of spinal cord injury! spine trauma Rapid cutting edge surgery + amazing team + extraordinary patient = miraculous  recovery NorthwesternMed Chicago_Spine ,0.2766666666666667,0.77,Positive,Subjective
34,"John partakes in weight lifting, yoga, Pilates, walking and running, but would you believe us if we told you he suffered a #HeartAttack less than four years ago? @DoctorFitHeart with @NMCardiology explains to @nytimes the benefits of this recovery plan. https://nyti.ms/2me985u ","John partakes in weight lifting, yoga, Pilates, walking and running, but would you believe us if we told you he suffered a HeartAttack less than four years ago? DoctorFitHeart with NMCardiology explains to nytimes the benefits of this recovery plan. ",-0.16666666666666666,0.06666666666666668,Negative,Objective
35,"Motivated by the #TourDeFrance? Turns out, biking offers quite a host of health benefits. #TDF2018 http://bit.ly/2L82uvV ","Motivated by the TourDeFrance? Turns out, biking offers quite a host of health benefits. TDF2018 ",0.1,0.0,Positive,Objective
36,"Female residents report working more, experiencing certain aspects of burnout more frequently, & having poorer psychological well-being. Qualitative findings offer potential solutions. ⁦@CapriceGreenber⁩ ⁦@AmBdSurg⁩  ⁦@AmCollSurgeons⁩ https://journals.lww.com/annalsofsurgery/pages/articleviewer.aspx?year=2018&issue=08000&article=00003&type=Abstract …","Female residents report working more, experiencing certain aspects of burnout more frequently, & having poorer psychological well-being. Qualitative findings offer potential solutions. ⁦CapriceGreenber⁩ ⁦AmBdSurg⁩  ⁦AmCollSurgeons⁩ ",0.1877551020408164,0.4482993197278912,Positive,Objective
37,Did you know that @NorthwesternMed was one of the 6 centers selected by the @American_Heart to be part of a new grant-funded national network dedicated to researching & understanding the causes of atrial fibrillation? Read more about it here:  http://ow.ly/NWxx30kUnrD  #afib,Did you know that NorthwesternMed was one of the 6 centers selected by the American_Heart to be part of a new grant-funded national network dedicated to researching & understanding the causes of atrial fibrillation? Read more about it here:   afib,0.3181818181818182,0.4772727272727273,Positive,Objective
38,"Nearly 80% of people face a painful #back or #neck problem at some point in their lives. Whether you need care for common injuries or complex spine surgery, @NorthwesternMed #spine specialists combine innovation & skill to help restore your movement & improve your quality of life pic.twitter.com/UtKFfSrb60","Nearly 80% of people face a painful back or neck problem at some point in their lives. Whether you need care for common injuries or complex spine surgery, NorthwesternMed spine specialists combine innovation & skill to help restore your movement & improve your quality of life ",-0.24,0.4400000000000001,Negative,Objective
39,#Fertility treatments and #ovariancancer. Is there a connection? Today on @WGNMorningNews 9:15. @NorthwesternMed,Fertility treatments and ovariancancer. Is there a connection? Today on WGNMorningNews 9:15. NorthwesternMed,0.0,0.0,Neutral,Objective
40,#bodypositivity takes on a whole new meaning with gynecologist @DrStreicher's tips for #selflove  http://bit.ly/cw-streicher  pic.twitter.com/GEgHBER97v,bodypositivity takes on a whole new meaning with gynecologist DrStreicher's tips for selflove   ,0.16818181818181818,0.4272727272727273,Positive,Objective
41,Looking good at the Delnor Outpatient Infusion Clinic @NorthwesternMed currently under construction. Check out the before and during photos. @KTGY_Group pic.twitter.com/zDakDUmxBp,Looking good at the Delnor Outpatient Infusion Clinic NorthwesternMed currently under construction. Check out the before and during photos. KTGY_Group ,0.35,0.5,Positive,Objective
42,Less than one month away from our #NMAPH18 conference! Sessions will cover Right Ventricle and Pulmonary Thromboembolism. Register here:   http://ow.ly/esqe30kThzR  pic.twitter.com/qwOdD3rqA8,Less than one month away from our NMAPH18 conference! Sessions will cover Right Ventricle and Pulmonary Thromboembolism. Register here:    ,0.038690476190476185,0.3011904761904762,Positive,Objective
43,"Good news for #coffee drinkers! Drinking coffee is associated with a lower risk of death, according to a large study published in @JAMAInternalMed.  http://bit.ly/2mapTOZ  pic.twitter.com/2hUS1yJX4M","Good news for coffee drinkers! Drinking coffee is associated with a lower risk of death, according to a large study published in JAMAInternalMed.   ",0.5446428571428571,0.5142857142857143,Positive,Subjective
44,"#Running won’t cause #arthritis, but it can lead to other common knee problems. Here are some symptoms and treatment options. http://bit.ly/2JasNfY ","Running won’t cause arthritis, but it can lead to other common knee problems. Here are some symptoms and treatment options. ",-0.2125,0.4375,Negative,Objective
45,"Transcutaneous osseointegrated implants effective in #pediatric pts w/ aural atresia, according to new findings from colleagues at @NorthwesternMed  https://ja.ma/2KIXgY2  pic.twitter.com/cX7AvjDahf","Transcutaneous osseointegrated implants effective in pediatric pts w/ aural atresia, according to new findings from colleagues at NorthwesternMed   ",0.36818181818181817,0.6272727272727273,Positive,Subjective
46,"“Most seniors don’t want to move to assisted living. So, if we can get things lined up so that they can stay in their own home, then why not do it?” — @LeeLindquistMD, a leader in the movement to help seniors “age in place”  http://bit.ly/2L1NNr3  pic.twitter.com/COxsEiJehH","“Most seniors don’t want to move to assisted living. So, if we can get things lined up so that they can stay in their own home, then why not do it?” — LeeLindquistMD, a leader in the movement to help seniors “age in place”   ",0.55,0.75,Positive,Subjective
47,"Neurologist, Dr. Stephen VanHaerents speaks about this rare condition. https://twitter.com/dailyherald/status/1015901001558024195 …","Neurologist, Dr. Stephen VanHaerents speaks about this rare condition. ",0.3,0.9,Positive,Subjective
48,Go beyond plain old H2O and try some enjoyable options for staying hydrated this #summer. #HealthTips http://bit.ly/2J731Jo ,Go beyond plain old H2O and try some enjoyable options for staying hydrated this summer. HealthTips ,0.1285714285714286,0.3857142857142857,Positive,Objective
49,"After being diagnosed with Wilms’ tumor as a child, Chiara Rodgers became an advocate and a symbol of strength for others. When her father was diagnosed with #prostatecancer, she knew exactly how to help him. Learn more about their story. http://bit.ly/2lZPytK ","After being diagnosed with Wilms’ tumor as a child, Chiara Rodgers became an advocate and a symbol of strength for others. When her father was diagnosed with prostatecancer, she knew exactly how to help him. Learn more about their story. ",0.375,0.375,Positive,Objective
50,From @NBCNews - @NorthwesternMed study shows game-based HIV prevention program shows results https://nbcnews.to/2m09Xz2 ,From NBCNews - NorthwesternMed study shows game-based HIV prevention program shows results ,0.0,0.0,Neutral,Objective
51,Feeling grateful to have had opportunity to travel and provide a helping hand in Guatemala.  #GuatemalaEstaUnida #Icare #gratitude #Ophthalmology pic.twitter.com/odosa5fu01,Feeling grateful to have had opportunity to travel and provide a helping hand in Guatemala.  GuatemalaEstaUnida Icare gratitude Ophthalmology ,0.0,0.0,Neutral,Objective
52,Trying to lose weight? Set yourself up for success. http://bit.ly/2KSJEW2 ,Trying to lose weight? Set yourself up for success. ,0.3,0.0,Positive,Objective
53,The Hispanic Brain and Spine Tumor Program at @NorthwesternMed offers care entirely in Spanish https://youtu.be/uSCMvj9OkMw ,The Hispanic Brain and Spine Tumor Program at NorthwesternMed offers care entirely in Spanish ,0.05,0.0,Positive,Objective
54,Could a #ChicagoHotDog ever be considered healthy? We dare you to try! http://bit.ly/2KN7xhT ,Could a ChicagoHotDog ever be considered healthy? We dare you to try! ,0.625,0.5,Positive,Objective
55,Wishing everyone a fun and safe #4thOfJuly! How will you be spending the holiday weekend? Your @KCCougars have a few home games lined up that are enjoyable for the whole family.  https://atmilb.com/2KxLX53  pic.twitter.com/cgQsy5Crvy,Wishing everyone a fun and safe 4thOfJuly! How will you be spending the holiday weekend? Your KCCougars have a few home games lined up that are enjoyable for the whole family.   ,0.28500000000000003,0.36,Positive,Objective
56,Don’t let health hazards hijack your fun! Here are some ways to make the most of a day exploring #musicfestivals. #SummerTips http://bit.ly/2KtN9q2 ,Don’t let health hazards hijack your fun! Here are some ways to make the most of a day exploring musicfestivals. SummerTips ,0.4375,0.35,Positive,Objective
57,Welcome fellows! We are so excited to see what you will do! https://twitter.com/nmhheartdoc/status/1013951066004754433 …,Welcome fellows! We are so excited to see what you will do! ,0.734375,0.825,Positive,Subjective
58,"@American_Heart chose @NorthwesternMed as 1 of 6 centers in a grant-funded national network dedicated to researching atrial fibrillation, the most common type of irregular heartbeat. Congrats to @PassmanRod, who will lead Northwestern's effort. #afib https://bit.ly/2NlekRx ","American_Heart chose NorthwesternMed as 1 of 6 centers in a grant-funded national network dedicated to researching atrial fibrillation, the most common type of irregular heartbeat.ongrats to PassmanRod, who will lead Northwestern's effort. afib ",0.1,0.5,Positive,Objective
59,It’s a beautiful #summer day! How are you enjoying this great weather? pic.twitter.com/WXZdJSHyKE,It’s a beautiful summer day! How are you enjoying this great weather? ,0.7666666666666666,0.7833333333333333,Positive,Subjective
60,A gift of $25 million to @NorthwesternMed from Neil Bluhm through his family’s foundation will go toward using artificial intelligence and machine learning to advance the study and treatment of cardiovascular disease. https://bit.ly/2tUVVSN ,A gift of $25 million to NorthwesternMed from Neil Bluhm through his family’s foundation will go toward using artificial intelligence and machine learning to advance the study and treatment of cardiovascular disease. ,-0.6,1.0,Negative,Subjective
61,On today’s #QuickDose: medical emergencies have their own timeline. Here’s how to prepare before your trip. #HealthTips http://bit.ly/2tZ59gT ,On today’s QuickDose: medical emergencies have their own timeline. Here’s how to prepare before your trip. HealthTips ,0.3,0.5,Positive,Objective
62,Kids who have difficulties standing or walking independently have a chance to be mobile and independent thanks to motorized cars retrofitted by Northwestern students.“The inclusiveness is so important for these kids.” https://trib.in/2KzEscW  pic.twitter.com/MJSNLuCsa3,Kids who have difficulties standing or walking independently have a chance to be mobile and independent thanks to motorized cars retrofitted by Northwestern students.“The inclusiveness is so important for these kids.”  ,0.15000000000000002,0.3625,Positive,Objective
63,Forgetfulness or dementia? Learn the difference and when it's time to see a physician.  http://bit.ly/2IFJpM7  pic.twitter.com/1NicM6ldbT,Forgetfulness or dementia? Learn the difference and when it's time to see a physician.   ,0.0,0.0,Neutral,Objective
