,tweet,processed_tweet,polarity,subjectivity,Sentiment,Objectivity
545,"Don’t be duped! Today, 9:15 on @WGNMorningNews I talk about celeb “health"" advice that could put you in the hospital! @NorthwesternMed @GwynethPaltrow @goop pic.twitter.com/GqZBYtuMDL","Don’t be duped! Today, 9:15 on WGNMorningNews I talk about celeb “health"" advice that could put you in the hospital! NorthwesternMed GwynethPaltrow goop ",0.0,0.0,Neutral,Objective
546,"Checkout Cindy Zadikoff, MD, neurologist at @NorthwesternMed as she discusses Neil Diamond’s Parkinson’s disease diagnosis and singing career with @GallardoABC7 on @ABC7Chicago at 4:30 pm today. pic.twitter.com/YuKAtK5TyB – at Northwestern Memorial Hospital","Checkout Cindy Zadikoff, MD, neurologist at NorthwesternMed as she discusses Neil Diamond’s Parkinson’s disease diagnosis and singing career with GallardoABC7 on ABC7Chicago at 4:30 pm today.  – at Northwestern Memorial Hospital",0.0,0.0,Neutral,Objective
547,"A BIG congratulations to @NU_IntMed's @AashishDidwania on being awarded the McGaw Annual Distinguished Service Award!  Well deserved, Dr. Didwania! #better pic.twitter.com/yvpBcJFt2s","A BIG congratulations to NU_IntMed's AashishDidwania on being awarded the McGaw Annual Distinguished Service Award!  Well deserved, Dr. Didwania! better ",0.25,0.3,Positive,Objective
548,An ink spill sparked the invention of bioactive tissue papers. Find out what this means to the medical world: http://bit.ly/2BrS9Gl ,An ink spill sparked the invention of bioactive tissue papers. Find out what this means to the medical world: ,0.0,0.0,Neutral,Objective
549,@chicagotribune features @NorthwesternMed Digestive Health Center’s Dr. @JJStulberg study on #opioidcrisis - hospital cuts back prescriptions and collects surplus opioids from GI surgery patients #researchmatters @NUFeinbergMed http://www.chicagotribune.com/news/ct-met-hospital-opioids-20180116-story.html …,chicagotribune features NorthwesternMed Digestive Health Center’s Dr. JJStulberg study on opioidcrisis - hospital cuts back prescriptions and collects surplus opioids from GI surgery patients researchmatters NUFeinbergMed ,-0.05,0.05,Negative,Objective
550,This afternoon over 75 books were donated to the Ann & Robert H. Lurie Children's Hospital of Chicago part of @NorthwesternMed Thank you to all our fans who donated! #ALLiN pic.twitter.com/pLo5HX19sZ,This afternoon over 75 books were donated to the Ann & Robert H. Lurie Children's Hospital of Chicago part of NorthwesternMed Thank you to all our fans who donated! ALLiN ,0.0,0.0,Neutral,Objective
551,"Join us in congratulating Erin Gard, who on January 20, 2018 celebrated one year of being #SeizureFree! After receiving care from Dr. Schuele, she and her mother give thanks to the entire #Epilepsy and #Neurology teams. #NMBetter pic.twitter.com/HDEoshra4m","Join us in congratulating Erin Gard, who on January 20, 2018 celebrated one year of being SeizureFree! After receiving care from Dr. Schuele, she and her mother give thanks to the entire Epilepsy and Neurology teams. NMBetter ",0.2125,0.525,Positive,Subjective
552,Stuffy nose got you reaching for a warm bowl of chicken noodle soup? Find out why:  http://bit.ly/2j4SCmV  pic.twitter.com/XDYcSEyHAK,Stuffy nose got you reaching for a warm bowl of chicken noodle soup? Find out why:   ,0.0,0.7749999999999999,Neutral,Subjective
553,"Cow’s milk, #almondmilk and everything in between! Get a quick rundown on the pros and cons of different types of #milk. #NMQuickDose http://bit.ly/2CBNi38 ","Cow’s milk, almondmilk and everything in between! Get a quick rundown on the pros and cons of different types of milk. NMQuickDose ",0.05555555555555555,0.4222222222222222,Positive,Objective
554, pic.twitter.com/hTz3BL5zfI, ,0.0,0.0,Neutral,Objective
555,Losing momentum on your #fitness goals? Start logging! Studies suggest online activity is tied to #weightloss: http://bit.ly/2AD9k4c ,Losing momentum on your fitness goals? Start logging! Studies suggest online activity is tied to weightloss: ,0.0,0.0,Neutral,Objective
556,"Washing your hands can prevent as many as 200 diseases, but can you over-wash? #QuickDose http://bit.ly/2FJk17W ","Washing your hands can prevent as many as 200 diseases, but can you over-wash? QuickDose ",0.5,0.5,Positive,Objective
557,Don't let Jack Frost stop you from #exercising! Warm up with a new #workoutplan: http://bit.ly/2ASjamF ,Don't let Jack Frost stop you from exercising! Warm up with a new workoutplan: ,0.36818181818181817,0.5272727272727272,Positive,Subjective
558,Hosting quarterly EMS educational forum now at Northwestern Memorial Hospital. Great turnout from our life-saving #EMS colleagues! #firstresponder #paramedic#timeisbrain #hospital #healthcare #stroke #ELVO #aneurysm pic.twitter.com/EPb2U3xd79,Hosting quarterly EMS educational forum now at Northwestern Memorial Hospital. Great turnout from our life-saving EMS colleagues! firstresponder paramedictimeisbrain hospital healthcare stroke ELVO aneurysm ,0.625,0.5,Positive,Objective
559,We're behind the scenes with @RonMott at Northwestern Memorial Hospital. Make sure to tune into the @TODAYshow tomorrow morning for a report on the nationwide #flu outbreak! pic.twitter.com/smqP9z2BCw,We're behind the scenes with RonMott at Northwestern Memorial Hospital. Make sure to tune into the TODAYshow tomorrow morning for a report on the nationwide flu outbreak! ,0.1125,0.7944444444444444,Positive,Subjective
560,"Newly diagnosed with malignant #glioblastoma, Harold “Woody” Wolff was looking for his best chance at beating one of the deadliest of brain cancers. He received that chance — and much more when we sought a second opinion from @NorthwesternMed neurosurgeons  http://bit.ly/2DnjVFF  pic.twitter.com/8zRt7iL4Eh","Newly diagnosed with malignant glioblastoma, Harold “Woody” Wolff was looking for his best chance at beating one of the deadliest of brain cancers. He received that chance — and much more when we sought a second opinion from NorthwesternMed neurosurgeons   ",0.40909090909090906,0.3136363636363636,Positive,Objective
561,"Whew!  Survived first day of clinic in our new home, the Regenstein Center for Neurological Care. We're still figuring out where everything is but it's #HomeSweetHome. #neurosurgery @NeurosurgeryNM @NorthwesternMed pic.twitter.com/stIrbm2r0s","Whew!  Survived first day of clinic in our new home, the Regenstein Center for Neurological Care. We're still figuring out where everything is but it's HomeSweetHome. neurosurgery NeurosurgeryNM NorthwesternMed ",0.09545454545454546,0.2959595959595959,Positive,Objective
562,Is your tummy trouble something more? Read up on the early signs of #digestive problems in women: http://bit.ly/2CCyroO ,Is your tummy trouble something more? Read up on the early signs of digestive problems in women: ,0.13333333333333333,0.3333333333333333,Positive,Objective
563,Does your #NewYearResolution take your #hearthealth into consideration? It's never too early to start thinking about it! Learn how a heart-healthy #diet makes an impact from an early age: http://bit.ly/2ADSuSo ,Does your NewYearResolution take your hearthealth into consideration? It's never too early to start thinking about it! Learn how a heart-healthy diet makes an impact from an early age: ,0.1125,0.3,Positive,Objective
564,"Aches and pains, oh my! Learn when it's time to consult a physician about your muscle aches and #jointpains. #QuickDose http://bit.ly/2B75oI3 ","Aches and pains, oh my! Learn when it's time to consult a physician about your muscle aches and jointpains. QuickDose ",0.0,0.0,Neutral,Objective
565,.@NorthwesternMed scientists have developed an algorithm that uses brain scans to predict language ability in deaf children after they receive a cochlear implant:  http://bit.ly/2Bag7Bx  pic.twitter.com/dViPYrKlNL,.NorthwesternMed scientists have developed an algorithm that uses brain scans to predict language ability in deaf children after they receive a cochlear implant:   ,0.1,0.3,Positive,Objective
566,Planning to see a friend or relative with #Alzheimers? Here’s how to communicate with compassion: http://bit.ly/2mK42yS ,Planning to see a friend or relative with Alzheimers? Here’s how to communicate with compassion: ,0.0,0.0,Neutral,Objective
567,Check this out! #HealthTech https://twitter.com/chicago_spine/status/953393777728720903 …,Check this out! HealthTech ,0.0,0.0,Neutral,Objective
568,The Chicago campus is quickly transforming into a winter wonderland! #Chicago #Winter pic.twitter.com/KhrA0bPlfU,The Chicago campus is quickly transforming into a winter wonderland! Chicago Winter ,0.4166666666666666,0.5,Positive,Objective
569,"Congratulations to @NeurosurgeryNM and Neurology 🧠on the move to their new location, the Regenstein Center for Neurological Care! Visit our website to learn more:  http://bit.ly/2FFCkLB  pic.twitter.com/6uY6ohNaf8","Congratulations to NeurosurgeryNM and Neurology 🧠on the move to their new location, the Regenstein Center for Neurological Care! Visit our website to learn more:   ",0.17045454545454544,0.3515151515151516,Positive,Objective
570,"Meet Abby Toms, a social worker at Northwestern Memorial Hospital, and yet another one of this year’s recipients of the Reverend Dr. Martin Luther King Jr. #Humanitarian Award. Click to learn more about her volunteer work with @rapevictimadv. #MLKDay http://bit.ly/2FHvu87 ","Meet Abby Toms, a social worker at Northwestern Memorial Hospital, and yet another one of this year’s recipients of the Reverend Dr. Martin Luther King Jr. Humanitarian Award. Click to learn more about her volunteer work with rapevictimadv. MLKDay ",0.26666666666666666,0.2833333333333333,Positive,Objective
571,"Meet Mamta Swaroop, MD, a trauma surgeon for Northwestern Medicine and one of four recipients of the Reverend Dr. Martin Luther King Jr. #Humanitarian Award. See how her international first responder courses have made their way to the South Side. #MLKDay http://bit.ly/2DfvzCE ","Meet Mamta Swaroop, MD, a trauma surgeon for Northwestern Medicine and one of four recipients of the Reverend Dr. Martin Luther King Jr. Humanitarian Award. See how her international first responder courses have made their way to the South Side. MLKDay ",0.125,0.16666666666666666,Positive,Objective
572,"Meet Beth Froese, MD, from Northwestern Medicine Regional Medical Group. She is another one of this year’s recipients of the Reverend Dr. Martin Luther King Jr. #Humanitarian Award. Visit our YouTube to learn more about her volunteer work in Kenya. #MLKDay http://bit.ly/2DgVCcg ","Meet Beth Froese, MD, from Northwestern Medicine Regional Medical Group. She is another one of this year’s recipients of the Reverend Dr. Martin Luther King Jr. Humanitarian Award. Visit our YouTube to learn more about her volunteer work in Kenya. MLKDay ",0.25,0.25,Positive,Objective
573,"Meet Kris Ongkiko, RN, from Northwestern Medicine Lake Forest Hospital, one of this year’s recipients of the Reverend Dr. Martin Luther King Jr. #Humanitarian Award. See how her local work with Teens for Unity positively impacts our communities. #MLKDay https://youtu.be/aVpCnI6Sf1c ","Meet Kris Ongkiko, RN, from Northwestern Medicine Lake Forest Hospital, one of this year’s recipients of the Reverend Dr. Martin Luther King Jr. Humanitarian Award. See how her local work with Teens for Unity positively impacts our communities. MLKDay ",0.11363636363636365,0.2727272727272727,Positive,Objective
574,"What is the mortality rate of #openheartsurgery? With over 10,000 #cardiac procedures under his belt, Patrick McCarthy, MD, Executive Director of the Bluhm Cardiovascular Institute, explains the risks: http://bit.ly/2Cjwqxd ","What is the mortality rate of openheartsurgery? With over 10,000 cardiac procedures under his belt, Patrick McCarthy, MD, Executive Director of the Bluhm Cardiovascular Institute, explains the risks: ",-0.05,0.0,Negative,Objective
575,"Last Thursday, Northwestern Medicine celebrated the life of #MLK and his ongoing legacy of service during the 39th Annual Humanitarian Awards Program hosted at Northwestern Memorial Hospital. Today, we'll be sharing stories of those remarkable recipients:  http://bit.ly/2D8Oz1a  pic.twitter.com/ZptJKNnyJt","Last Thursday, Northwestern Medicine celebrated the life of MLK and his ongoing legacy of service during the 39th Annual Humanitarian Awards Program hosted at Northwestern Memorial Hospital. Today, we'll be sharing stories of those remarkable recipients:   ",0.3666666666666667,0.5222222222222223,Positive,Subjective
576,Stay informed this #cervicalhealth awareness month! Here are 5 myths about #gynecologiccancer: http://bit.ly/2BeyEhM ,Stay informed this cervicalhealth awareness month! Here are 5 myths about gynecologiccancer: ,0.0,0.0,Neutral,Objective
577,"New year, new doctor? Consider these 5 factors when choosing a #primarycare physician: http://bit.ly/2AAtkEx ","New year, new doctor? Consider these 5 factors when choosing a primarycare physician: ",0.13636363636363635,0.4545454545454545,Positive,Objective
578,"For the 12% of men who will be diagnosed with #prostatecancer, proton therapy can work as a powerful treatment alternative. Click to learn more: http://bit.ly/2CASjc7 ","For the 12% of men who will be diagnosed with prostatecancer, proton therapy can work as a powerful treatment alternative. Click to learn more: ",0.4,0.75,Positive,Subjective
579,The glass exterior of the new Simpson Querrey Biomedical Research Center is nearly complete! Isn’t it amazing to see so much progress in just a few short months? Watch a video to see how far the building has come in the 2 years since we broke ground:  http://bit.ly/2D7WujL  pic.twitter.com/2rNgpgMQl9,The glass exterior of the new Simpson Querrey Biomedical Research Center is nearly complete! Isn’t it amazing to see so much progress in just a few short months?atch a video to see how far the building has come in the 2 years since we broke ground:  ,0.10767045454545457,0.4318181818181818,Positive,Objective
580,"Maha H. Hussain, MD, is translating innovative researchinto unsurpassed #cancer care for #Chicagoans. Visit the link to read more her ongoing efforts:  http://bit.ly/2D4Qyrr  pic.twitter.com/y7oFXZHB1m","Maha H. Hussain, MD, is translating innovative researchinto unsurpassed cancer care for Chicagoans. Visit the link to read more her ongoing efforts:   ",0.5,0.75,Positive,Subjective
581,"Due to the increased risk of #cold and #flu viruses, we ask for your help in protecting the health of our patients. Please view the new visitor guidelines at  http://flu.nm.org .","Due to the increased risk of cold and flu viruses, we ask for your help in protecting the health of our patients. Please view the new visitor guidelines at  ",-0.1962121212121212,0.6098484848484849,Negative,Subjective
582,Things to keep in mind as the temperature drops ❄️☃️ #brrr #layer #prevention pic.twitter.com/pODVk7yOC9,Things to keep in mind as the temperature drops ❄️☃️ brrr layer prevention ,0.0,0.0,Neutral,Objective
583,"10 questions about #gynecological #cancer, answered: http://bit.ly/2kvhzbw ","10 questions about gynecological cancer, answered: ",0.0,0.0,Neutral,Objective
584,Good luck on #MovingDay! https://twitter.com/NeurosurgeryNM/status/951512300887969792 …,Good luck on MovingDay! ,0.875,0.6000000000000001,Positive,Subjective
585,Got Milk? #NationalMilkDay http://bit.ly/2EzOBPZ ,Got Milk? NationalMilkDay ,0.0,0.0,Neutral,Objective
586,Northwestern Rehabilitation at Central DuPage and Delnor Hospital offers a wide range of advanced #rehab services. Their cutting-edge total joint program even allows qualifying patients to go straight home and into outpatient therapy. Click to learn more:  http://bit.ly/2zfsIpj  pic.twitter.com/OTbSndrcro,Northwestern Rehabilitation at Central DuPage and Delnor Hospital offers a wide range of advanced rehab services. Their cutting-edge total joint program even allows qualifying patients to go straight home and into outpatient therapy. Click to learn more:   ,0.15714285714285714,0.4142857142857143,Positive,Objective
587,Movin' on up to a deluxe clinic in the sky!  Great views. Phone number is the same 312-695-8143. @NeurosurgeryNM @NorthwesternMed @NM_365 #newdigs #makingmemories #wheresthebathroom pic.twitter.com/mfy4O3ln1l,Movin' on up to a deluxe clinic in the sky!  Great views. Phone number is the same 312-695-8143. NeurosurgeryNM NorthwesternMed NM_365 newdigs makingmemories wheresthebathroom ,0.5166666666666667,0.5916666666666667,Positive,Subjective
588,Back from my trip to #Myanmar. Join me at 9:15 @WGNMorningNews when I share stories about birthing babies in Burma! @NorthwesternMed pic.twitter.com/TFgZ4SrxAJ,Back from my trip to Myanmar. Join me at 9:15 WGNMorningNews when I share stories about birthing babies in Burma! NorthwesternMed ,0.0,0.0,Neutral,Objective
589,Celebrating nine days into the #NewYear with our #BestNine! We shared several stories throughout 2017 and are looking forward to many more “purple moments” in the year ahead. Make sure to follow along! #NMBetter #ColorOfTheYear @pantone 💜 pic.twitter.com/bW3iJE1Ebl,Celebrating nine days into the NewYear with our BestNine! We shared several stories throughout 2017 and are looking forward to many more “purple moments” in the year ahead. Make sure to follow along! NMBetter ColorOfTheYear pantone 💜 ,0.40625,0.4722222222222222,Positive,Objective
590,"@NorthwesternMed #icymi @nytimes featuring Dr. @dmljmd at @northwesternmed! ""...Testing for lp(a) should be considered for people with early-onset cardiovascular disease — which means younger than age 50 for men and age 60 for women — or a strong family history of it."" http://ow.ly/TGkM50g4nGd ","NorthwesternMed icymi nytimes featuring Dr. dmljmd at northwesternmed! ""...Testing for lp(a) should be considered for people with early-onset cardiovascular disease — which means younger than age 50 for men and age 60 for women — or a strong family history of it."" ",0.21666666666666665,0.36666666666666653,Positive,Objective
591,"Life after locked-in syndrome: Aurora man finds will to live after rare, paralyzing condition  http://trib.in/2CDlECq  pic.twitter.com/pf2HeIi1JW","Life after locked-in syndrome: Aurora man finds will to live after rare, paralyzing condition   ",0.21818181818181814,0.7,Positive,Subjective
592,"Netflix’s “Rotten” episode, “The Peanut Problem,” featuring Lurie Children's food allergy researcher Dr. Ruchi Gupta, brings awareness to the rise in food allergies See the “Rotten” trailer here:  http://bit.ly/2CRZq2Q  . #all4your1 #foodallergy","Netflix’s “Rotten” episode, “The Peanut Problem,” featuring Lurie Children's food allergy researcher Dr. Ruchi Gupta, brings awareness to the rise in food allergies See the “Rotten” trailer here:   . all4your1 foodallergy",0.0,0.0,Neutral,Objective
593,Large-scale study finds not all clot-busting drugs should be used in patients with #bloodclots in their legs:  http://bit.ly/2yEAVQp  pic.twitter.com/ZA8JpNVjaf,Large-scale study finds not all clot-busting drugs should be used in patients with bloodclots in their legs:   ,0.0,0.0,Neutral,Objective
594,"Anchored by Northwestern Memorial Hospital, the highest-ranked #cardiology and #heartsurgery program in #Illinois by @usnews for 10 years straight, we’re on a never-ending pursuit of excellence. Discover how what makes us better, makes you better. pic.twitter.com/aTCP2ormjK","Anchored by Northwestern Memorial Hospital, the highest-ranked cardiology and heartsurgery program in Illinois by usnews for 10 years straight, we’re on a never-ending pursuit of excellence. Discover how what makes us better, makes you better. ",0.4,0.4666666666666666,Positive,Objective
595,"We've got #babynews to report! Valley West Hospital welcomed its first baby of 2018--and it's a boy! Please meet Zayon Ezekiel, born on 1/5/18 at 12:04 pm, weighing 7 lbs,13 oz and 19.5 inches. Congratulations to the Papsch family! pic.twitter.com/vY6Oxyy239","We've got babynews to report! Valley West Hospital welcomed its first baby of 2018--and it's a boy! Please meet Zayon Ezekiel, born on 1/5/18 at 12:04 pm, weighing 7 lbs,13 oz and 19.5 inches. Congratulations to the Papsch family! ",0.390625,0.3333333333333333,Positive,Objective
596,The #NewYear is off to a beautiful start as we celebrate the first babies born across the Northwestern Medicine health system -- all of them girls! Congratulations to the families on their sweet bundles of joy! May your 2018 be filled with #health and #happiness. pic.twitter.com/D2wvwGntdg,The NewYear is off to a beautiful start as we celebrate the first babies born across the Northwestern Medicine health system -- all of them girls! Congratulations to the families on their sweet bundles of joy! May your 2018 be filled with health and happiness. ,0.6020833333333333,0.5472222222222223,Positive,Subjective
597,"“It’s all about helping seniors age in place — because that’s really the best place for seniors to be” —@LeeLindquistMD, on innovative program offering primary care visits in seniors’ own homes:  http://bit.ly/2m0IihS  @NorthwesternMed pic.twitter.com/P4UUzkxSqC","“It’s all about helping seniors age in place — because that’s really the best place for seniors to be” —LeeLindquistMD, on innovative program offering primary care visits in seniors’ own homes:   NorthwesternMed ",0.54,0.6,Positive,Subjective
598,Way to go Megan! @meglynn984 https://twitter.com/tracyswartz/status/949048287654498305 …,Way to go Megan! meglynn984 ,0.0,0.0,Neutral,Objective
599,Thank you Dr. Katie Bandt from @NorthwesternMed for stopping by EFGC today to talk about the latest advances in epilepsy surgery. It was a great Lunch and Learn! #EpilepsyChicago pic.twitter.com/hAZVoJPZFI,Thank you Dr. Katie Bandt from NorthwesternMed for stopping by EFGC today to talk about the latest advances in epilepsy surgery. It was a great Lunch and Learn! EpilepsyChicago ,0.75,0.825,Positive,Subjective
600,Do you know just how dirty your phone is? Northwestern Medicine experts weigh in. #NMQuickDose http://bit.ly/2AREusG ,Do you know just how dirty your phone is? Northwestern Medicine experts weigh in. NMQuickDose ,-0.6,0.8,Negative,Subjective
601,The 10 must-read studies of the year for #gastroenterologists: http://ms.spr.ly/6017rI0hV ,The 10 must-read studies of the year for gastroenterologists: ,0.0,0.0,Neutral,Objective
602,"#EosinophilicEsophagitis is listed on @MedscapeGastro as one of the top 10 Practice Changing 2017 “Must Reads” in #Gastroenterology. Register for free to learn more about the findings of Ikuo Hirano, MD:  http://bit.ly/2lTFfH6  pic.twitter.com/ipKWE833z6","EosinophilicEsophagitis is listed on MedscapeGastro as one of the top 10 Practice Changing 2017 “Must Reads” in Gastroenterology. Register for free to learn more about the findings of Ikuo Hirano, MD:   ",0.4666666666666666,0.6,Positive,Subjective
603,"Take a listen! Chris Malaisrie, MD, talks to @WGNRadio about advances in #cardiacsurgery here at Northwestern Medicine: http://bit.ly/2Ajsz1n ","Take a listen! Chris Malaisrie, MD, talks to WGNRadio about advances in cardiacsurgery here at Northwestern Medicine: ",0.0,0.0,Neutral,Objective
604,"Is #mealprepping on your list of healthy changes for the #newyear? Here's a guide to making delicious, nutritious and ready-to-eat meals: http://bit.ly/2BhpCAw ","Is mealprepping on your list of healthy changes for the newyear? Here's a guide to making delicious, nutritious and ready-to-eat meals: ",0.75,0.75,Positive,Subjective
605,"Did you know that people who can digest #dairy are actually in the minority? Learn the truth about dairy products, milk substitutes and calcium consumption in our latest article: http://bit.ly/2j6Obbu ","Did you know that people who can digest dairy are actually in the minority? Learn the truth about dairy products, milk substitutes and calcium consumption in our latest article: ",0.25,0.5,Positive,Objective
606,"During her 12-week ultrasound, a cyst was found on Melinda's right ovary. After immediate surgery, recovery and three rounds of #chemotherapy, she is now the happy, healthy and #cancerfree mother of Dennis. Read more about her incredible journey:  http://trib.in/2lR2MZl  pic.twitter.com/amxSsoil5V","During her 12-week ultrasound, a cyst was found on Melinda's right ovary. After immediate surgery, recovery and three rounds of chemotherapy, she is now the happy, healthy and cancerfree mother of Dennis. Read more about her incredible journey:   ",0.5971428571428572,0.687142857142857,Positive,Subjective
607,"According to Jonah Stulberg, MD, roughly 80% of #opioids prescribed to patients by surgeons go unused. As a result, he's established a medication disposal program. Click to learn more about his ongoing efforts to lower the number of pills prescribed: http://cbsloc.al/2CFzGnO ","According to Jonah Stulberg, MD, roughly 80% of opioids prescribed to patients by surgeons go unused. As a result, he's established a medication disposal program. Click to learn more about his ongoing efforts to lower the number of pills prescribed: ",0.2,0.45,Positive,Objective
608,A new @NorthwesternMed study flips long-held beliefs that there is an unexplained or genetic reason why black adults have double the rate of diabetes compared to white adults.  http://bit.ly/2lGJu9I  pic.twitter.com/4FSYsNQ8zZ,A new NorthwesternMed study flips long-held beliefs that there is an unexplained or genetic reason why black adults have double the rate of diabetes compared to white adults.   ,-0.01606060606060606,0.17757575757575758,Negative,Objective
