,tweet,processed_tweet,polarity,subjectivity,Sentiment,Objectivity
180,"Nearly 80 million Americans are currently infected and many don’t even know it. Here are some more surprising facts about human papillomavirus, or #HPV. http://www.nmbreakthroughs.org/health-library/five-surprising-facts-about-hpv?utm_campaign=healthlibrary&utm_source=twitter&utm_medium=social&utm_content=awareness&utm_term=curious …","Nearly 80 million Americans are currently infected and many don’t even know it. Here are some more surprising facts about human papillomavirus, or HPV. ",0.3,0.4,Positive,Objective
181,"With a bovine heart valveand a titanium hip, Mark still managed to finish his 39th consecutive #BostonMarathon, setting an Illinois record. http://bit.ly/2kcdtFH ","With a bovine heart valveand a titanium hip, Mark still managed to finish his 39th consecutive BostonMarathon, setting an Illinois record. ",0.0,0.0,Neutral,Objective
182,Struggling to lose weight? Find out if one of these pitfalls is to blame for a plateau in your #weightloss. http://bit.ly/2k75rxy ,Struggling to lose weight? Find out if one of these pitfalls is to blame for a plateau in your weightloss. ,0.0,0.0,Neutral,Objective
183,"This #WorldIBDDay, here are 10 important things you should know:  https://bit.ly/2rRkKP7  @NorthwesternDHF @NMH_SHanauerMD","This WorldIBDDay, here are 10 important things you should know:   NorthwesternDHF NMH_SHanauerMD",0.4,1.0,Positive,Subjective
184,Why did the ducks cross the road? 🐣 #DuckCrossing #Marianjoy #NorthwesternMedicine pic.twitter.com/yRitrUHAsy,Why did the ducks cross the road? 🐣 DuckCrossing Marianjoy NorthwesternMedicine ,0.0,0.0,Neutral,Objective
185,"Tune into #AsianInfluencers on @ABC7Chicago this Saturday, May 19 at 6:00pm CST to see how Wellington Hsu, MD, is using 3D robotic technology to revolutionize spinal fusions. @JudyHsuABC7 will also be featuring other inspirational stories from Chicago’s vibrant Asian community. pic.twitter.com/TGS7s8Z03v","Tune into AsianInfluencers on ABC7Chicago this Saturday, May 19 at 6:00pm CST to see how Wellington Hsu, MD, is using 3D robotic technology to revolutionize spinal fusions. JudyHsuABC7 will also be featuring other inspirational stories from Chicago’s vibrant Asian community. ",0.08833333333333332,0.38166666666666665,Positive,Objective
186,Why do teens engage in risky behaviors? Brain development holds some answers. http://bit.ly/2rRLQWr ,Why do teens engage in risky behaviors? Brain development holds some answers. ,0.0,0.0,Neutral,Objective
187,"Alan G. Micco, MD, neurotologist and otolaryngologist at @NorthwesternMed explains why some people hear ""Yanny"" while others hear ""Laurel."" https://twitter.com/fox32news/status/996949948691251200 …","Alan G. Micco, MD, neurotologist and otolaryngologist at NorthwesternMed explains why some people hear ""Yanny"" while others hear ""Laurel."" ",0.0,0.0,Neutral,Objective
188,Why did the ducks cross the road? 🐣 #DuckCrossing #Marianjoy #NorthwesternMedicine pic.twitter.com/7PiEjJQliJ,Why did the ducks cross the road? 🐣 DuckCrossing Marianjoy NorthwesternMedicine ,0.0,0.0,Neutral,Objective
189,Yanny or Laurel? Internet split on what name they hear in audio clip  http://bit.ly/2L7PNP1  @KristeNicoleFOX reports pic.twitter.com/Dexz1VdHy6,Yanny or Laurel? Internet split on what name they hear in audio clip   KristeNicoleFOX reports ,0.0,0.0,Neutral,Objective
190,WTTW Chicago Tonight covers the Digestive Health Foundation (DHF) BioRepository featuring Dr. Hanauer @NMH_SHanauerMD @NMHnews @NorthwesternMed @NUFeinbergMed #ResearchMatters @wttw  http://bit.ly/2ItbdUJ  pic.twitter.com/93TAMUnMQo,WTTW Chicago Tonight covers the Digestive Health Foundation (DHF) BioRepository featuring Dr. Hanauer NMH_SHanauerMD NMHnews NorthwesternMed NUFeinbergMed ResearchMatters wttw   ,0.0,0.0,Neutral,Objective
191,Yanny vs. Laurel explained! #NorthwesternMedicine physician says it’s all about perception. Find out how! #YannyvsLaurel http://www.fox32chicago.com/news/local/yanny-or-laurel-internet-split-on-what-name-they-hear-in-audio-clip …,Yanny vs. Laurel explained! NorthwesternMedicine physician says it’s all about perception. Find out how! YannyvsLaurel ,0.0,0.0,Neutral,Objective
192,"Communication after a #stroke or other #braininjury can be frustrating. See how an innovative program at Marianjoy Rehabilitation Hospital, part of Northwestern Medicine, is changing the experience for one family. http://bit.ly/2rJhq8K ","Communication after a stroke or other braininjury can be frustrating. See how an innovative program at Marianjoy Rehabilitation Hospital, part of Northwestern Medicine, is changing the experience for one family. ",-0.00833333333333334,0.7583333333333333,Negative,Subjective
193,Why is #FLOTUS still in the hospital? Can cycling cause bladder infections? What foods will make you more fertile? This and much more  9:15 AM @WGNMorningNews @NorthwesternMed,Why is FLOTUS still in the hospital? Can cycling cause bladder infections? What foods will make you more fertile? This and much more  9:15 AM WGNMorningNews NorthwesternMed,0.5,0.5,Positive,Objective
194,"Meet Darryl, a resilient man living with #ALS. See how the @LesTurnerALS Foundation at Northwestern Memorial Hospital gives him the hope and confidence he needs to live a purposeful life. https://youtu.be/3c52rxJUJvk ","Meet Darryl, a resilient man living with ALS. See how the LesTurnerALS Foundation at Northwestern Memorial Hospital gives him the hope and confidence he needs to live a purposeful life. ",0.13636363636363635,0.5,Positive,Objective
195,"This #MentalHealthMonth, here are 12 articles about a healthier state of mind, including the impact of antidepressants on the brain. http://bit.ly/2rHucVr ","This MentalHealthMonth, here are 12 articles about a healthier state of mind, including the impact of antidepressants on the brain. ",0.0,0.0,Neutral,Objective
196,"Dr. @NMH_SHanauerMD will be interviewed live tomorrow, May 15 on Chicago Tonight about the DHF BioRepository. This show will air on WTTW (PBS), channel 11 at 7 pm.  @NMHnews @NorthwesternMed @NUFeinbergMed @wttw #reesarchmatters pic.twitter.com/h4YZ1M5gU0","Dr. NMH_SHanauerMD will be interviewed live tomorrow, May 15 on Chicago Tonight about the DHF BioRepository. This show will air on WTTW (PBS), channel 11 at 7 pm.  NMHnews NorthwesternMed NUFeinbergMed wttw reesarchmatters ",0.13636363636363635,0.5,Positive,Objective
197,Watch @cbschicago to hear more about the first lady’s recent procedure. @NorthwesternMed’s Chief of Urology @EdwardSchaeffer explains at 6pm pic.twitter.com/rsG8NRRkxw,Watch cbschicago to hear more about the first lady’s recent procedure. NorthwesternMed’s Chief of Urology EdwardSchaeffer explains at 6pm ,0.25,0.3611111111111111,Positive,Objective
198,"Following the First Lady’s operation, our own John Friedewald, MD @jfriedo spoke with @WomensHealthMag to discuss Kidney embolization procedures. https://twitter.com/WomensHealthMag/status/996128272760082433 …","Following the First Lady’s operation, our own John Friedewald, MD jfriedo spoke with WomensHealthMag to discuss Kidney embolization procedures. ",0.2833333333333333,0.4777777777777778,Positive,Objective
199,"Vinai Gondi, MD, will be hosting a webinar tomorrow about the advances in #protontherapy for brain, skull base and spinal tumors. Visit the link to register now:  https://bit.ly/2GenoCQ  pic.twitter.com/eNZGLq4p9e","Vinai Gondi, MD, will be hosting a webinar tomorrow about the advances in protontherapy for brain, skull base and spinal tumors. Visit the link to register now:   ",-0.8,1.0,Negative,Subjective
200,Woah!! A #LandsbergSociety member in action!  Congratulations!!🎊🎉 https://twitter.com/expedmedicine/status/995218674037510144 …,Woah!! A LandsbergSociety member in action!  Congratulations!!🎊🎉 ,0.125,0.1,Positive,Objective
201,One more @IllinoisKidney debate pic! Honored to work with this group of people! @NU_Nephrology @NUFeinbergMed @jenniejlin @cybeleg1 @polska_md @JuliaJBrown @jfriedo @TuazonJennifer @A_Safdi @SusanQuaggin. Time to get Jay Paparello on Twitter! pic.twitter.com/n2EhH9gFmm,One more IllinoisKidney debate pic! Honored to work with this group of people! NU_Nephrology NUFeinbergMed jenniejlin cybeleg1 polska_md JuliaJBrown jfriedo TuazonJennifer A_Safdi SusanQuaggin. Time to get Jay Paparello on Twitter! ,0.9765625,0.5,Positive,Objective
202,"During #NationalNursesWeek, 12 of our very own were recognized by @Chicago_Police and the Chicago Fire Department for their excellence and commitment in the emergency departments, trauma units, operating rooms and intensive care units as a result of violence or traumatic injury. pic.twitter.com/13onlPIOQx","During NationalNursesWeek, 12 of our very own were recognized by Chicago_Police and the Chicago Fire Department for their excellence and commitment in the emergency departments, trauma units, operating rooms and intensive care units as a result of violence or traumatic injury. ",0.78,1.0,Positive,Subjective
203,"Please join us for a complimentary emergency medical services symposium on acute #stroke care this Saturday, May 19 from 7:30am to 1:30pm CST. Visit the link for more information:  https://bit.ly/2Fo1L2K  pic.twitter.com/jme0TQKbkl","Please join us for a complimentary emergency medical services symposium on acute stroke care this Saturday, May 19 from 7:30am to 1:30pm CST. Visit the link for more information:   ",0.35,0.475,Positive,Objective
204,"“Because she had such a passion for being a nurse, I knew that I wanted to become one, too.” See how one nurse was inspired by her mother. Who inspires you this #MothersDay? http://bit.ly/2rBC0qN ","“Because she had such a passion for being a nurse, I knew that I wanted to become one, too.” See how one nurse was inspired by her mother. Who inspires you this MothersDay? ",0.0,0.5,Neutral,Objective
205,"A mother's bond with her child is truly indescribable. Suada and Arnela are no exception. This coming #MothersDay, the Hadzics have much to celebrate. https://abc7.ws/2KSJX3y ","A mother's bond with her child is truly indescribable. Suada and Arnela are no exception. This coming MothersDay, the Hadzics have much to celebrate. ",0.2,0.2,Positive,Objective
206,"Tonight we celebrated the 10th anniversary of the Malnati Brain Tumor Institute Benefit Dinner to help raise money towards brain cancer & spinal cord research. Thus far, we’ve raised more than $600,00 with 465 attendees. #mindsmatter2018 @NorthwesternMed @NeurosurgeryNM pic.twitter.com/n2qjQr7hMq – at The Ritz-Carlton Chicago (A Four Seasons Hotel)","Tonight we celebrated the 10th anniversary of the Malnati Brain Tumor Institute Benefit Dinner to help raise money towards brain cancer & spinal cord research. Thus far, we’ve raised more than $600,00 with 465 attendees. mindsmatter2018 NorthwesternMed NeurosurgeryNM  – at The Ritz-Carlton Chicago (A Four Seasons Hotel)",0.31666666666666665,0.75,Positive,Subjective
207,It may be the last day of Nurse’s Week but we will continue to be grateful for all you do throughout the year #NursesWeek pic.twitter.com/Ngs1eoakMV,It may be the last day of Nurse’s Week but we will continue to be grateful for all you do throughout the year NursesWeek ,0.0,0.06666666666666668,Neutral,Objective
208,"Time for the dancing! 💃 🕺 #mindsmatter2018 Also, don’t forget to make a donation for this amazing cause! Every amount is appreciated  http://bit.ly/mindsmatter2018  pic.twitter.com/uk6Dkmhqrv","Time for the dancing! 💃 🕺 mindsmatter2018 Also, don’t forget to make a donation for this amazing cause! Every amount is appreciated   ",0.4750000000000001,0.5,Positive,Objective
209,"@NeurosurgeryNM HAPPY #NursesWeek from all of us at @neurosurgerynm! Thank you for taking such great care of our patients. Without you, none of the daily miracles we've grown accustomed to would happen. #nursesweek2018 #grateful #teamwork #patientsfirst https://www.instagram.com/p/Bio1XT4BT2K/  pic.twitter.com/B82CniQQm1 – at Northwestern Memorial Hospital Feinberg Pavillion","NeurosurgeryNM HAPPY NursesWeek from all of us at neurosurgerynm! Thank you for taking such great care of our patients. Without you, none of the daily miracles we've grown accustomed to would happen. nursesweek2018 grateful teamwork patientsfirst   – at Northwestern Memorial Hospital Feinberg Pavillion",0.45,0.5625,Positive,Subjective
210,"On April 21, Transplant Village supported an amazing cause that made it into the @GWR for the most #livingorgandonors gathered in one place. These remarkable individuals selflessly gave life to others. Learn how you can do the same. http://www.nmbreakthroughs.org/medical-advances/making-a-difference-through-living-donor-donation?utm_campaign=patientstory&utm_source=facebook&utm_medium=social&utm_content=awareness&utm_term=curious …","On April 21, Transplant Village supported an amazing cause that made it into the GWR for the most livingorgandonors gathered in one place. These remarkable individuals selflessly gave life to others. Learn how you can do the same. ",0.4625,0.56875,Positive,Subjective
211,Great evening celebrating our @NU_SOQIC @AmCollSurgeons graduating Research Fellows and graduating chief residents (former research fellows). They all taught us a lot and were a lot of fun. We will miss them. @NorthwesternMed @nu_ipham pic.twitter.com/Qf3fnWJmA8,Great evening celebrating our NU_SOQIC AmCollSurgeons graduating Research Fellows and graduating chief residents (former research fellows). They all taught us a lot and were a lot of fun. We will miss them. NorthwesternMed nu_ipham ,0.3666666666666667,0.31666666666666665,Positive,Objective
212,"Spotted! #NMCardiology Director of Cardiac EP Brad Knight, MD hanging by the booth on day 2 of #HRS2018 pic.twitter.com/ZcIegeK7nz","Spotted! NMCardiology Director of Cardiac EP Brad Knight, MD hanging by the booth on day 2 of HRS2018 ",-0.05,0.0,Negative,Objective
213,"Join our neurological specialists to learn about the complex care for #stroke and other conditions. We'll be at Northwestern Medicine Central DuPage Hospital on Wednesday, May 16 and Northwestern Medicine Delnor Hospital on Thursday, May 17:  https://bit.ly/2wx0cQM  pic.twitter.com/qPDc3yCOCy","Join our neurological specialists to learn about the complex care for stroke and other conditions. We'll be at Northwestern Medicine Central DuPage Hospital on Wednesday, May 16 and Northwestern Medicine Delnor Hospital on Thursday, May 17:   ",-0.14166666666666666,0.3416666666666666,Negative,Objective
214,"""Now I'm the happiest mother in the world."" Mom donates part of her liver to daughter just before Mother's Day:  https://abc7.ws/2jIPXzE  @leahhopeABC7 pic.twitter.com/rNy6gNSXLU","""Now I'm the happiest mother in the world."" Mom donates part of her liver to daughter just before Mother's Day:   leahhopeABC7 ",0.0,0.0,Neutral,Objective
215,"25 days until we celebrate the 25th anniversary of our Cancer Survivors’ Celebration Walk & 5K! We’re counting down by sharing some of our favorite memories, starting with the first Walk in 1993! #LurieCelebrates25 #NationalCancerSurvivorsDay pic.twitter.com/RqhEMGOFkm","25 days until we celebrate the 25th anniversary of our Cancer Survivors’ Celebration Walk & 5K! We’re counting down by sharing some of our favorite memories, starting with the first Walk in 1993! LurieCelebrates25 NationalCancerSurvivorsDay ",0.1642361111111111,0.4305555555555556,Positive,Objective
216,#behindthescenes shot of @stevexuMD with @TODAYshow @NorthwesternMed #suncare #skincare pic.twitter.com/SWQqKzJ4WA,behindthescenes shot of stevexuMD with TODAYshow NorthwesternMed suncare skincare ,0.0,0.0,Neutral,Objective
217,"Happy #nursesweek to all the nurses, especially our teammates at Bluhm Cardiovascular who take exceptional care of our patients day and day out!!! #ittakesheart @NMCardiology @NorthwesternMed @NUFeinbergMed pic.twitter.com/p7EmauIe59","Happy nursesweek to all the nurses, especially our teammates at Bluhm Cardiovascular who take exceptional care of our patients day and day out!!! ittakesheart NMCardiology NorthwesternMed NUFeinbergMed ",0.6,1.0,Positive,Subjective
218,The American College of Obstetrics and Gynecology recommends that girls start seeing an OB/GYN between the ages of 13 and 15. Here are some other things to consider. http://www.nmbreakthroughs.org/health-library/quick-dose-is-my-daughter-too-young-for-an-obgyn?utm_campaign=healthlibrary&utm_source=twitter&utm_medium=social&utm_content=evaluation&utm_term=curious …,The American College of Obstetrics and Gynecology recommends that girls start seeing an OB/GYN between the ages of 13 and 15. Here are some other things to consider. ,-0.0625,0.1875,Negative,Objective
219,"It’s early, but @drevefeinberg is ready to educate audiences across the country about all things #infertility @NorthwesternMed pic.twitter.com/JiwZPFL0cv","It’s early, but drevefeinberg is ready to educate audiences across the country about all things infertility NorthwesternMed ",0.15000000000000002,0.4,Positive,Objective
220,Check out today’s @WSJ to learn more about #hypnotherapy to treat #gerd and other GI conditions! @NorthwesternMed @NorthwesternDHF pic.twitter.com/Fkg16z999q,Check out today’s WSJ to learn more about hypnotherapy to treat gerd and other GI conditions! NorthwesternMed NorthwesternDHF ,0.171875,0.4375,Positive,Objective
221,"Great event today with CPD, OEMC and CFD celebrating  @NorthwesternMed’s exceptional nurses in honor of #NursesWeek2018. pic.twitter.com/HMdstzG3uw","Great event today with CPD, OEMC and CFD celebrating  NorthwesternMed’s exceptional nurses in honor of NursesWeek2018. ",0.7333333333333334,0.875,Positive,Subjective
222,Your @KCCougars are playing from home today and tomorrow. Come out and join us for some fun in the sun! pic.twitter.com/h7kmT5E8yY,Your KCCougars are playing from home today and tomorrow. Come out and join us for some fun in the sun! ,0.375,0.2,Positive,Objective
223,"Northwestern Memorial Hospital is at the forefront of #ALS treatment, offering #edaravone: the first FDA-approved ALS treatment in 22 years. Visit the link to learn more. https://alsnewstoday.com/2017/09/15/potential-als-gene-therapy-vm202-vm-biopharma-seen-safe-first-clinical-trial/ …","Northwestern Memorial Hospital is at the forefront of ALS treatment, offering edaravone: the first FDA-approved ALS treatment in 22 years. Visit the link to learn more. ",0.375,0.4166666666666666,Positive,Objective
224,"It's the question everyone wants the answer to: is my cellphone harming my brain? Rimas Lukas, MD, gets down to the bottom of it. http://bit.ly/2Iqzyhl ","It's the question everyone wants the answer to: is my cellphone harming my brain? Rimas Lukas, MD, gets down to the bottom of it. ",0.022222222222222213,0.19444444444444448,Positive,Objective
225,Our Les Turner ALS Center @NorthwesternMed effectively connects the worlds of research and patient support to ensure the best care is provided and the brightest minds are working to find a cure. Learn more:  http://LesTurnerALS.org/research-patient-center/ …#HopeandHelp#ALSAwarenessMonth pic.twitter.com/UsQUlh95mx,Our Les Turner ALS Center NorthwesternMed effectively connects the worlds of research and patient support to ensure the best care is provided and the brightest minds are working to find a cure. Learn more:  HopeandHelpALSAwarenessMonth ,0.5,0.425,Positive,Objective
226,So very humbled; #ThankYou; “I will remember what you’ve done for me”. @WomenHeartOrg @DrJMieres @ABCardio1 @DrMarthaGulati @avolgman @SharonneHayes @NorthwesternMed @NMCardiology @NU_IntMed @NUFeinbergMed https://twitter.com/drjmieres/status/993652631867482113 …,So very humbled; ThankYou; “I will remember what you’ve done for me”. WomenHeartOrg DrJMieres ABCardio1 DrMarthaGulati avolgman SharonneHayes NorthwesternMed NMCardiology NU_IntMed NUFeinbergMed ,0.2,0.3,Positive,Objective
227,"With our friends at @cbschicago discussing #treatments, #outcomes and #recovery after #BrainAneurysm rupture. pic.twitter.com/ZfNe239e69 – at Northwestern Memorial Hospital Feinberg Pavillion","With our friends at cbschicago discussing treatments, outcomes and recovery after BrainAneurysm rupture.  – at Northwestern Memorial Hospital Feinberg Pavillion",0.0,0.0,Neutral,Objective
228,"About 140,000 people are expected to be diagnosed with #colorectalcancer in 2018. Scott Strong, MD, tells us what symptoms to look out for. https://www.prevention.com/health/health-conditions/a19872320/colon-cancer-symptoms/ …","About 140,000 people are expected to be diagnosed with colorectalcancer in 2018. Scott Strong, MD, tells us what symptoms to look out for. ",0.16666666666666666,0.5666666666666667,Positive,Subjective
229,"#Hypnotherapy can help sufferers of common digestive conditions like #gerd, heartburn, colitis, acid reflux and irritable bowel syndrome. John Pandolfino, MD, and Sarah Quinton, PsyD, provide further insight. https://twitter.com/wsj/status/993502053686276096 …","Hypnotherapy can help sufferers of common digestive conditions like gerd, heartburn, colitis, acid reflux and irritable bowel syndrome. John Pandolfino, MD, and Sarah Quinton, PsyD, provide further insight. ",-0.15,0.5,Negative,Objective
230,More great coverage discussing the new NM Lake Forest Hospital @WGNRadio http://wgnradio.com/2018/05/06/new-state-of-the-art-facility-opens-on-site-of-76-year-old-lake-forest-hospital/ …,More great coverage discussing the new NM Lake Forest Hospital WGNRadio ,0.4787878787878788,0.5681818181818182,Positive,Subjective
231,"May is #StrokeAwarenessMonth and #BrainTumorAwarenessMonth. For more of a behind-the-scenes look into what goes on in this fascinating field of medicine, follow @NeurosurgeryNM and @NMskullbase! pic.twitter.com/8O1xHKahlH","May is StrokeAwarenessMonth and BrainTumorAwarenessMonth. For more of a behind-the-scenes look into what goes on in this fascinating field of medicine, follow NeurosurgeryNM and NMskullbase! ",0.6875,0.675,Positive,Subjective
232,"@NeurosurgeryNM To better understand Sen. McCain and former Sen. Ted Kennedy’s #glioblastoma diagnosis, @roger_stupp has spent his morning talking to 16 radio stations about brain cancer & new treatment options #radiomediatour #braincancerawarenessmonth@neurosurgeryNM @NorthwesternMedicine pic.twitter.com/P4eYaUyIea – at Big Shoulders Productions","NeurosurgeryNM To better understand Sen. McCain and former Sen. Ted Kennedy’s glioblastoma diagnosis, roger_stupp has spent his morning talking to 16 radio stations about brain cancer & new treatment options radiomediatour braincancerawarenessmonthneurosurgeryNM NorthwesternMedicine  – at Big Shoulders Productions",0.10727272727272727,0.2309090909090909,Positive,Objective
233,Check out this great article written by my daughter @rachelzar and featuring my colleagues @drdweck and Dr. Julie Leavitt @NorthwesternMed https://www.dancespirit.com/period-myths-2565616145.html …,Check out this great article written by my daughter rachelzar and featuring my colleagues drdweck and Dr. Julie Leavitt NorthwesternMed ,0.8,0.75,Positive,Subjective
234,"Enrollment is now open! From endurance training and #pilates to #yoga and line dancing, you won't want to miss these fun #fitness and #wellness classes over the #summer:  https://classes.nmh.org/listing/all  pic.twitter.com/1jk9bAQPBo","Enrollment is now open! From endurance training and pilates to yoga and line dancing, you won't want to miss these fun fitness and wellness classes over the summer:   ",0.15,0.35,Positive,Objective
235,Can you spot our #fellows ? https://twitter.com/lwilsbacher/status/993310988094013440 …,Can you spot our fellows ? ,0.0,0.0,Neutral,Objective
236,Happy National #NursesDay from everyone here at Northwestern Medicine! pic.twitter.com/100O5Fj7DF,Happy National NursesDay from everyone here at Northwestern Medicine! ,1.0,1.0,Positive,Subjective
237,"You don’t see them, but you are surrounded by germs. On this #HandHygieneDay, see how washing your hands is the first line of defense. http://bit.ly/2HFlEZg ","You don’t see them, but you are surrounded by germs. On this HandHygieneDay, see how washing your hands is the first line of defense. ",0.25,0.3333333333333333,Positive,Objective
238,"It was a reunion for Erin, not only with the paramedics and crew at Eng 8 but also with the staff and doctor from @NorthwesternMed. After a devastating injury and grueling rehab, Erin wanted to express her gratitude to the paramedics and crew that were there when she needed help. pic.twitter.com/yOvBiguMP0","It was a reunion for Erin, not only with the paramedics and crew at Eng 8 but also with the staff and doctor from NorthwesternMed. After a devastating injury and grueling rehab, Erin wanted to express her gratitude to the paramedics and crew that were there when she needed help. ",-0.5,1.0,Negative,Subjective
239,@Abelkho Join the @NIH @AllofUsResearch program launch celebration at Chicago's Millennium Park this weekend! @NorthwesternMed and CHiP's @AbelKho are helping lead this historic effort to  engage 1 million Americans in accelerating medical breakthroughs.  https://bit.ly/2KBVV1n  pic.twitter.com/Zupgh0gmkT,Abelkho Join the NIH AllofUsResearch program launch celebration at Chicago's Millennium Park this weekend! NorthwesternMed and CHiP's AbelKho are helping lead this historic effort to  engage 1 million Americans in accelerating medical breakthroughs.   ,0.0,0.0,Neutral,Objective
