,tweet,processed_tweet,polarity,subjectivity,Sentiment,Objectivity
526,The Duke Smart Home celebrates a decade of spurring sustainability and technology ideas.  https://buff.ly/2JNTQlK  pic.twitter.com/5rz8yB6SHI,The Duke Smart Home celebrates a decade of spurring sustainability and technology ideas.   ,0.21428571428571427,0.6428571428571429,Positive,Subjective
527,Congrats to @QCook323 and the #Warriors! Quinn Cook '15 joins Shane Battier ’01 as the second Duke alumnus to win both a @NBA and @NCAA title. #GoDuke pic.twitter.com/3DuJ5PRA9L,Congrats to QCook323 and the Warriors! Quinn Cook '15 joins Shane Battier ’01 as the second Duke alumnus to win both a NBA and NCAA title. GoDuke ,0.4,0.2,Positive,Objective
528,Duke in Berlin students are all aglow exploring their new home for the next 6 weeks.  https://buff.ly/2JBgBZL  pic.twitter.com/4Ayws5YTcN,Duke in Berlin students are all aglow exploring their new home for the next 6 weeks.   ,0.04545454545454545,0.21818181818181814,Positive,Objective
529,The state-of-the-art 3D printing studio at @DukeU relies on dozens of @Ultimaker printers to improve patient care:  http://ultim.kr/2vEGDSs  pic.twitter.com/y0b5zaR2eL,The state-of-the-art 3D printing studio at DukeU relies on dozens of Ultimaker printers to improve patient care:   ,0.0,0.0,Neutral,Objective
530,Bamboo in the #SarahPDukeGardens @DukeU Always a beautiful nearby escape to #nature #photography pic.twitter.com/H3xP2TEIU1,Bamboo in the SarahPDukeGardens DukeU Always a beautiful nearby escape to nature photography ,0.85,1.0,Positive,Subjective
531,"Coach K interviews former @DukeMBB players Jayson Tatum, Luol Deng and Mason Plumlee ’13 during SiriusXM’s “Town Hall with Coach K""  http://ow.ly/nshA30kpNWT  pic.twitter.com/kDX9VT9aC8","Coach K interviews former DukeMBB players Jayson Tatum, Luol Deng and Mason Plumlee ’13 during SiriusXM’s “Town Hall with Coach K""   ",0.0,0.0,Neutral,Objective
532,"One game away...Duke blasts Texas Tech, will play for College World Series appearance Monday  http://www.newsobserver.com/sports/article212809524.html …@DukeATHLETICS","One game away...Duke blasts Texas Tech, will play for College World Series appearance Monday  DukeATHLETICS",-0.4,0.4,Negative,Objective
533,The first African-American couple to be married at Duke Chapel is celebrating 50 years of marriage:  http://abc11.com/3586737/  pic.twitter.com/KMDjo7IgsN,The first African-American couple to be married at Duke Chapel is celebrating 50 years of marriage:   ,0.25,0.29166666666666663,Positive,Objective
534,Widespread uranium contamination found in India's groundwater.  https://buff.ly/2HwrtTQ  pic.twitter.com/Yvm5TNFHHq,Widespread uranium contamination found in India's groundwater.   ,0.0,0.0,Neutral,Objective
535,LISTEN: Life after loss for orphans in Africa.  https://buff.ly/2JwEb6Z  pic.twitter.com/FAPTRnw1MP,LISTEN: Life after loss for orphans in Africa.   ,0.0,0.0,Neutral,Objective
536,Widespread Uranium Contamination Found in India's Groundwater  https://nicholas.duke.edu/about/news/widespread-uranium-contamination-found-indias-groundwater … pic.twitter.com/OZAyj4AN9S,Widespread Uranium Contamination Found in India's Groundwater   ,0.0,0.0,Neutral,Objective
537,Are menacing #sharks actually social at heart? #1100words http://ow.ly/L3kB30koiPb @DukeEnvironment @DukeU @WorldOceansDay pic.twitter.com/dGfhGxRAHW,Are menacing sharks actually social at heart? 1100words ukeEnvironment DukeU WorldOceansDay ,-0.4833333333333333,0.5333333333333333,Negative,Subjective
538,"""Even without any retaliation, Trump’s tariffs are economically self-defeating."" - Tim Büthe  http://www.richmond.com/opinion/their-opinion/guest-columnists/tim-b-the-column-the-coming-trade-war-with-canada/article_506361c1-cdd6-5c06-9a71-551967bf53bc.html … #politicalscience #PoliSci","""Even without any retaliation, Trump’s tariffs are economically self-defeating."" - Tim Büthe   politicalscience PoliSci",0.3,0.9,Positive,Subjective
539,"Dr. Andrew Lodge, pediatric heart surgeon, helps his patient feel more comfortable by performing ‘open heart surgery’ on her doll: 'She has a scar just like me!' https://people.com/human-interest/mical-olaiz-doll-surgery-left-heart-syndrome/?utm_source=twitter.com&utm_medium=social&utm_campaign=social-button-sharing …","Dr. Andrew Lodge, pediatric heart surgeon, helps his patient feel more comfortable by performing ‘open heart surgery’ on her doll: 'She has a scar just like me!' ",0.3,0.6,Positive,Subjective
540,"Researchers at Duke led a study to see if a software program accurately measures bone metastases in prostate cancer patients — indeed, the aBSI appears to accurately quantify the degree of bone metastisis in seconds.  https://www.healthdatamanagement.com/news/software-accurately-measures-bone-metastases-in-prostate-cancer-patients … #MovingFurtherFaster #Breakthroughs","Researchers at Duke led a study to see if a software program accurately measures bone metastases in prostate cancer patients — indeed, the aBSI appears to accurately quantify the degree of bone metastisis in seconds.   MovingFurtherFaster Breakthroughs",0.4000000000000001,0.6333333333333334,Positive,Subjective
541,Our @DukeU chapel is looking very fine today pic.twitter.com/3ywg7wx11a,Our DukeU chapel is looking very fine today ,0.5416666666666667,0.65,Positive,Subjective
542,Why grandmothers may hold the key to human evolution.  http://ow.ly/FJVE30koiwm  pic.twitter.com/c4vAd8uXSb,Why grandmothers may hold the key to human evolution.   ,0.0,0.55,Neutral,Subjective
543,Imaging Renders Decayed Texts Visible Once More  https://buff.ly/2sulI4n  pic.twitter.com/1R52b7EZwg,Imaging Renders Decayed Texts Visible Once More   ,0.5,0.5,Positive,Objective
544,"Satana Deberry '94 says her election to DA ""is about a culture change here in Durham County"" http://bit.ly/2Jy0FHN ","Satana Deberry '94 says her election to DA ""is about a culture change here in Durham County"" ",0.0,0.0,Neutral,Objective
545,"In a spectacular display known as bubble net feeding, #humpback whales team up to trap krill inside curtains of air bubbles and feast on the resulting mob. @WorldOceansDay http://ow.ly/EdNM30kmK6a @MarineUAS @DukeMarineLab #drones pic.twitter.com/2YZoSJ13ak","In a spectacular display known as bubble net feeding, humpback whales team up to trap krill inside curtains of air bubbles and feast on the resulting mob. WorldOceansDay arineUAS DukeMarineLab drones ",0.3,0.45,Positive,Objective
546,"Fred and Sylvia Black, the first African-American couple to get married at @DukeChapel, are celebrating their 50th anniversary this weekend 💙Watch and read their story: http://www.newsobserver.com/news/local/article211365799.html …","Fred and Sylvia Black, the first African-American couple to get married at DukeChapel, are celebrating their 50th anniversary this weekend 💙Watch and read their story: ",0.11111111111111112,0.33888888888888885,Positive,Objective
547,"""Director Moustapha Akkad’s “The Message” will be screened in Saudi Arabia for the first time after being passed by the country’s censors.""#oncebanned #40yearsafter #Arabcinema http://www.arabnews.com/node/1317631/saudi-arabia …","""Director Moustapha Akkad’s “The Message” will be screened in Saudi Arabia for the first time after being passed by the country’s censors.""oncebanned 40yearsafter Arabcinema ",0.25,0.3333333333333333,Positive,Objective
548,Happy #WorldOceansDay!  The Duke Marine Lab is dedicated to understanding and protecting the marine environment and maritime communities. But we can all do our part to help protect the ocean. An easy way to start is by eliminating single use plastics and living #plasticfree! pic.twitter.com/M9vsqEhMik,Happy WorldOceansDay!  The Duke Marine Lab is dedicated to understanding and protecting the marine environment and maritime communities. But we can all do our part to help protect the ocean. An easy way to start is by eliminating single use plastics and living plasticfree! ,0.4480158730158729,0.6825396825396827,Positive,Subjective
549,"Jacob Kasper ’18, a two-time All-American heavyweight wrestler at @DukeU, hopes to channel his charisma and athletic ability into a successful pro wrestling career. @DukeWRES #GoDuke http://www.espn.com/wwe/story/_/id/23606591/wwe-collegiate-wrestling-standout-jacob-kasper-next-big-star-world-pro-wrestling …","Jacob Kasper ’18, a two-time All-American heavyweight wrestler at DukeU, hopes to channel his charisma and athletic ability into a successful pro wrestling career. DukeWRES GoDuke ",0.75,0.95,Positive,Subjective
550,WATCH: First black couple wed at @DukeChapel celebrate 50th anniversary. http://ow.ly/95qn30koiCC ,WATCH: First black couple wed at DukeChapel celebrate 50th anniversary. ,0.04166666666666667,0.3833333333333333,Positive,Objective
551,How seafaring scientists are mapping The Deep. #WorldOceansDay  https://buff.ly/2Jv3vNz  pic.twitter.com/bRcKQkH6PD,How seafaring scientists are mapping The Deep. WorldOceansDay   ,0.0,0.4,Neutral,Objective
552,.@DukeAlumni and @DukeU retirees volunteered together @LakewoodBulldog Elementary School last Saturday:  https://community.duke.edu/dukealumsengage/ … pic.twitter.com/gR3IO8hPo3,.DukeAlumni and DukeU retirees volunteered together LakewoodBulldog Elementary School last Saturday:   ,0.15,0.4833333333333333,Positive,Objective
553,"In this @DukeEngineering class, students get a hands-on approach to the engineering design process.  https://buff.ly/2xHZu3H  pic.twitter.com/p8fRHIFj3x","In this DukeEngineering class, students get a hands-on approach to the engineering design process.   ",0.0,0.0,Neutral,Objective
554,Newly identified genetic markers classify previously undetermined #GBM Tumors.  https://buff.ly/2xKZDU3  pic.twitter.com/CU2CU1nt4Q,Newly identified genetic markers classify previously undetermined GBM Tumors.   ,-0.015151515151515154,0.3106060606060606,Negative,Objective
555,"Thanks to @indyweek readers for once again voting Duke Gardens “best place to take visitors from out of town.” The Triangle has so many awesome attractions, we're pleased that you value horticultural excellence as much as we do. Piedmont Prairie photo by Clarence Burke. pic.twitter.com/8TjecCrehR","Thanks to indyweek readers for once again voting Duke Gardens “best place to take visitors from out of town.” The Triangle has so many awesome attractions, we're pleased that you value horticultural excellence as much as we do. Piedmont Prairie photo by Clarence Burke. ",0.5666666666666668,0.5333333333333333,Positive,Subjective
556,Update: The Duke Bike Auction is CLOSED! We're so excited to announce we've raised over $1K to buy bikes for kids in Durham.Stay tuned to learn more about the lucky winner 😉🚲 pic.twitter.com/pAb3FaRU2E,Update: The Duke Bike Auction is CLOSED! We're so excited to announce we've raised over $1K to buy bikes for kids in Durham.Stay tuned to learn more about the lucky winner 😉🚲 ,0.2708333333333333,0.5458333333333334,Positive,Subjective
557,Catch former @DukeMBB player Grayson Allen's AMA today at 4pm. https://buff.ly/2JoHAV3 ,Catch former DukeMBB player Grayson Allen's AMA today at 4pm. ,0.0,0.0,Neutral,Objective
558,#TBT to the new babies at @DukeLemurCenter when they one were just one day old ☺️ Harriot and Helene are now one month old and are snuggling their way into our hearts.  https://durh.am/2HtY3p8  pic.twitter.com/8gZekFchqt,TBT to the new babies at DukeLemurCenter when they one were just one day old ☺️ Harriot and Helene are now one month old and are snuggling their way into our hearts.   ,0.11212121212121212,0.28484848484848485,Positive,Objective
559,Fostering innovation through efficiency. @DukeFuqua  https://buff.ly/2Jh6slL  pic.twitter.com/Cy60vqx81v,Fostering innovation through efficiency. DukeFuqua   ,0.0,0.0,Neutral,Objective
560,How digital learning encompasses broad ecosystem of innovation.  https://buff.ly/2sM7Z8r  pic.twitter.com/LTlIc7lRJg,How digital learning encompasses broad ecosystem of innovation.   ,0.03125,0.15625,Positive,Objective
561,Apple to launch student ID cards for iPhone.  https://buff.ly/2LXHFRv  pic.twitter.com/pkFplmysRS,Apple to launch student ID cards for iPhone.   ,0.0,0.0,Neutral,Objective
562,Why grandmothers may hold the key to human evolution.  https://buff.ly/2M7FHOh  pic.twitter.com/aaAfxPKJwp,Why grandmothers may hold the key to human evolution.   ,0.0,0.55,Neutral,Subjective
563,📷@DukeU @mfaeda and  2017-18 @KenanEthics Graduate Arts Fellow @rachjessen is interviewed by photographer Jess T. Dugan on @StrangeFireCol. We showed her #yarders series; image below from her #girlwrestle series. @DukeArts #ethicsiseverywhere #dukearts  http://www.strangefirecollective.com/qa-rachel-jessen … pic.twitter.com/ahTO8pX6n4,📷DukeU mfaeda and  2017-18 KenanEthics Graduate Arts Fellow rachjessen is interviewed by photographer Jess T. Dugan on StrangeFireCol. We showed her yarders series; image below from her girlwrestle series. DukeArts ethicsiseverywhere dukearts   ,0.0,0.0,Neutral,Objective
564,On our way in from tagging pilot whales off Cape Hatteras @DukeMarineLab @DukeEnvironment pic.twitter.com/Odnp0fR2t9,On our way in from tagging pilot whales off Cape Hatteras DukeMarineLab DukeEnvironment ,0.0,0.0,Neutral,Objective
565,What would the world look like if Robert Kennedy had lived?  https://buff.ly/2Jh7Wsc  pic.twitter.com/vqikUKprMS,What would the world look like if Robert Kennedy had lived?   ,0.0,0.0,Neutral,Objective
566,Great story by @dukeresearch on how we're using multispectral imaging in the library to make historical texts reveal their hidden secrets.  https://today.duke.edu/2018/06/imaging-renders-decayed-texts-visible-once-more … #MSI #digitalhumanities pic.twitter.com/TpkopmbgbH,Great story by dukeresearch on how we're using multispectral imaging in the library to make historical texts reveal their hidden secrets.   MSI digitalhumanities ,0.21111111111111114,0.3611111111111111,Positive,Objective
567,Widespread #uranium contamination found in India's groundwater.  https://buff.ly/2JrFW5f  pic.twitter.com/5DaEsfElOu,Widespread uranium contamination found in India's groundwater.   ,0.0,0.0,Neutral,Objective
568,"ICYMI DCRI’s Asheley Skinner on #Race, Pain & #Opioid Prescribing: ""Pain is not treated in minorities, particularly African Americans...to the same extent as it is for white patients...Our implicit biases affect our behaviors.""  http://bit.ly/2sJN1Hk  #implicitbias #healthequity","ICYMI DCRI’s Asheley Skinner on Race, Pain & Opioid Prescribing: ""Pain is not treated in minorities, particularly African Americans...to the same extent as it is for white patients...Our implicit biases affect our behaviors.""   implicitbias healthequity",0.0,0.04166666666666666,Neutral,Objective
569,.@DukeBASE continues postseason run in Lubbock. #GoDuke  https://buff.ly/2sP5F06  pic.twitter.com/MvkYM5vEJo,.DukeBASE continues postseason run in Lubbock. GoDuke   ,0.0,0.0,Neutral,Objective
570,SHARE: We’re a week into Give #LikeABlueDevil & love your support so far! Help us keep the momentum going by showing the world you bleed a truer blue. 💙Download & share:  http://bit.ly/bluedevilspirit  #foreverduke #goduke pic.twitter.com/5Yqa3EUyRQ,SHARE: We’re a week into Give LikeABlueDevil & love your support so far! Help us keep the momentum going by showing the world you bleed a truer blue. 💙Download & share:   foreverduke goduke ,0.20833333333333331,0.5666666666666668,Positive,Subjective
571,Duke Elder Family/Caregiver Training Center provides training to caregivers across campus.  https://buff.ly/2M5MYhN  pic.twitter.com/9V1kgBQmPN,Duke Elder Family/Caregiver Training Center provides training to caregivers across campus.   ,-0.1,0.1,Negative,Objective
572,"A new study of animal vision shows that human eyes can see fine details that most animals can’t, @DukeU researchers say https://www.aau.edu/research-scholarship/featured-research-topics/you-and-your-dog-see-world-differently …","A new study of animal vision shows that human eyes can see fine details that most animals can’t, DukeU researchers say ",0.2632575757575757,0.3886363636363637,Positive,Objective
573,"When it comes to food consumption, the most important organ is our brain. Two studies highlight how knowing food is 'healthy' may make us gain weight. Article republished in @PsychToday  https://www.psychologytoday.com/us/blog/scientocracy/201806/death-salad-two-reasons-healthy-food-may-make-you-fat … pic.twitter.com/A72zdoQOGi","When it comes to food consumption, the most important organ is our brain. Two studies highlight how knowing food is 'healthy' may make us gain weight. Article republished in PsychToday   ",0.4666666666666666,0.6666666666666666,Positive,Subjective
574,Installation on the first row of solar panels is complete for @DukeU's Research Drive Garage. Construction is expected to finish by the end of July. @SustainableDuke pic.twitter.com/4ogXs3FT0i,Installation on the first row of solar panels is complete for DukeU's Research Drive Garage. Construction is expected to finish by the end of July. SustainableDuke ,0.08333333333333333,0.37777777777777777,Positive,Objective
575,"A Duke study of an iPhone app to screen young children for signs of autism has found that the app is easy to use, welcomed by caregivers and good at producing reliable scientific data.  https://buff.ly/2xCc70e  pic.twitter.com/vlrbgLOOQH","A Duke study of an iPhone app to screen young children for signs of autism has found that the app is easy to use, welcomed by caregivers and good at producing reliable scientific data.   ",0.4111111111111112,0.6111111111111112,Positive,Subjective
576,Multispectral imaging @DukeLibraries unveils the contents of ancient manuscripts  http://ow.ly/SmaG30klVBn  @rubensteinlib pic.twitter.com/ESTujqSoAr,Multispectral imaging DukeLibraries unveils the contents of ancient manuscripts   rubensteinlib ,0.0,0.0,Neutral,Objective
577,"@DukeU Take a look at how we view the world vs. dogs, cats, and goldfish: https://www.futurity.org/visual-acuity-vision-eyes-animals-1772002/ …@dukeU @DukeNews @dukeresearch pic.twitter.com/MNzxtA6SWR","DukeU Take a look at how we view the world vs. dogs, cats, and goldfish: dukeU DukeNews dukeresearch ",0.0,0.0,Neutral,Objective
578,A new emphasis on design for Biomedical Engineers.  https://buff.ly/2Jzjo5L  pic.twitter.com/9lHupQ0MOC,A new emphasis on design for Biomedical Engineers.   ,0.13636363636363635,0.4545454545454545,Positive,Objective
579,"Valinda Shaw, who in Feb. finished chemotherapy for #BreastCancer, enjoys the Zen Garden at our Survivorship Day event. ""I love being able to play with my grandchildren again,"" she said, sharing what she values most about being cancer free. ""I'm glad to be alive."" #CelebrateLife pic.twitter.com/J0WlSrqHA5","Valinda Shaw, who in Feb. finished chemotherapy for BreastCancer, enjoys the Zen Garden at our Survivorship Day event. ""I love being able to play with my grandchildren again,"" she said, sharing what she values most about being cancer free. ""I'm glad to be alive."" CelebrateLife ",0.4166666666666667,0.6541666666666667,Positive,Subjective
580,Bootcamps go to college.  https://buff.ly/2LsC98a  pic.twitter.com/3qDXfGheO5,Bootcamps go to college.   ,0.0,0.0,Neutral,Objective
581,How seafaring scientists are mapping The Deep.  https://buff.ly/2Jv3vNz  pic.twitter.com/JRmwUtmyQE,How seafaring scientists are mapping The Deep.   ,0.0,0.4,Neutral,Objective
582,What would the world look like if Robert Kennedy had lived?  https://buff.ly/2Jh7Wsc  pic.twitter.com/f2v8azI6Id,What would the world look like if Robert Kennedy had lived?   ,0.0,0.0,Neutral,Objective
583,Coach K Announces $3 Million Gift for @EmilyKCenter.  https://buff.ly/2xJuzEh  pic.twitter.com/x0ijvoRsxR,Coach K Announces $3 Million Gift for EmilyKCenter.   ,0.0,0.0,Neutral,Objective
584,Hey @coachchris14 👋WE'RE GOING TO SUPERS 💥💦💦💦#GoDuke | #RoadToOmaha pic.twitter.com/EyQDTT2Ptq,Hey coachchris14 👋WE'RE GOING TO SUPERS 💥💦💦💦GoDuke | RoadToOmaha ,0.0,0.0,Neutral,Objective
585,"As we celebrate #WorldEnvironmentDay, we are committed to help #BeatPlasticPollution #WeAreDukeEnvironment pic.twitter.com/mfK99oQeRr","As we celebrate WorldEnvironmentDay, we are committed to help BeatPlasticPollution WeAreDukeEnvironment ",0.0,0.0,Neutral,Objective
586,"The blue-eyed star of this #pollinatormonday is Presley, a critically endangered blue-eyed black lemur at the @DukeLemurCenter. This species pollinates many plants by eating nectar & pollen from flowers. Only 61 are found in captivity worldwide, 21 of those in North America. pic.twitter.com/foQV2Sjiv9","The blue-eyed star of this pollinatormonday is Presley, a critically endangered blue-eyed black lemur at the DukeLemurCenter. This species pollinates many plants by eating nectar & pollen from flowers. Only 61 are found in captivity worldwide, 21 of those in North America. ",0.08333333333333334,0.6833333333333333,Positive,Subjective
587,This is why bonuses do not motivate employees to work harder like most companies believe pic.twitter.com/UopbxYEVCR,This is why bonuses do not motivate employees to work harder like most companies believe ,0.2,0.25,Positive,Objective
588,How asylums became the crucible of #genetics https://www.nature.com/articles/d41586-018-05313-8 …,How asylums became the crucible of genetics ,0.0,0.0,Neutral,Objective
589,Newly identified genetic markers classify previously undetermined #GBM Tumors.  https://buff.ly/2xKZDU3  pic.twitter.com/7EGcEESyA9,Newly identified genetic markers classify previously undetermined GBM Tumors.   ,-0.015151515151515154,0.3106060606060606,Negative,Objective
590,@RiceUniversity and @DukeU researchers use data 'hashing' to better estimate the number of known Syrian war victims  http://bit.ly/2kOIIql  @RiceCompSci @dukeresearch pic.twitter.com/8YA5KAKP8o,RiceUniversity and DukeU researchers use data 'hashing' to better estimate the number of known Syrian war victims   RiceCompSci dukeresearch ,0.5,0.5,Positive,Objective
591,"#PolicyBrief: The U.S is not fully harnessing the power of private sector-led development. The issue, and some solutions: http://bit.ly/Modernized_Finance_Inst …","PolicyBrief: The U.S is not fully harnessing the power of private sector-led development. The issue, and some solutions: ",0.0,0.375,Neutral,Objective
592,".@DukeU researchers have found a simple, easy-to-use, cost-effective way to screen children for #autism... an app. Learn more:  http://bit.ly/2Je32MA  pic.twitter.com/kmocAwrhd5",".DukeU researchers have found a simple, easy-to-use, cost-effective way to screen children for autism... an app. Learn more:   ",0.25,0.4285714285714286,Positive,Objective
593,All the feels 🤗#GoDuke | #RoadToOmaha pic.twitter.com/iLLfDvgGZ2,All the feels 🤗GoDuke | RoadToOmaha ,0.0,0.0,Neutral,Objective
594,"Prof. Griffin: ""It's hard not to see [Trump pardons] as an intentional signal to those potentially implicated in the Mueller investigation"" https://abcn.ws/2HlPQTY ","Prof. Griffin: ""It's hard not to see [Trump pardons] as an intentional signal to those potentially implicated in the Mueller investigation"" ",-0.3458333333333333,0.5208333333333333,Negative,Subjective
595,New study says a reformed and fully equipped U.S. development finance institution could help meet the global energy poverty challenge by providing billions in additional #energy sector investment and by catalyzing even more in private investment. Read it: http://nieps.org/FekZ30k9lED ,New study says a reformed and fully equipped U.S. development finance institution could help meet the global energy poverty challenge by providing billions in additional energy sector investment and by catalyzing even more in private investment. Read it: ,0.1590909090909091,0.33238636363636365,Positive,Objective
596,"Lead author Jonathan Phillips heads @DukeU's Energy Access Project, a collaborative effort of @DukeUEnergy, @NichInstitute, @DukeEnvironment, @DukeSanford and @BassConnections. Find out more about this new project: http://nieps.org/49Gt30k9mab ","Lead author Jonathan Phillips heads DukeU's Energy Access Project, a collaborative effort of DukeUEnergy, NichInstitute, DukeEnvironment, DukeSanford and BassConnections. Find out more about this new project: ",0.3181818181818182,0.4772727272727273,Positive,Objective
597,The @DurhamNC community and @DukeU colleagues celebrated alongside Phail Wynn Jr. yesterday evening @WashingtonDuke. Phail is retiring at the end of this month as the first and longtime leader of @DukeDARA. pic.twitter.com/eSAtLRbNRs,The DurhamNC community and DukeU colleagues celebrated alongside Phail Wynn Jr. yesterday evening WashingtonDuke. Phail is retiring at the end of this month as the first and longtime leader of DukeDARA. ,0.3,0.5416666666666666,Positive,Subjective
598,Renowned oceanographer @SylviaEarle on why we must act now to save the oceans 🌊  http://ow.ly/4DcX30kiJuY  pic.twitter.com/EssMKLw0qw,Renowned oceanographer SylviaEarle on why we must act now to save the oceans 🌊   ,0.0,0.0,Neutral,Objective
599,Details that look clear and crisp to people may be blurry to their pets. That’s because humans see the world in higher resolution than most other animals.  http://ow.ly/J8pI30kkino  pic.twitter.com/MfVFRvyuAP,Details that look clear and crisp to people may be blurry to their pets. That’s because humans see the world in higher resolution than most other animals.   ,0.195,0.435,Positive,Objective
600,Duke is headed to SUPERS for the first time in Blue Devil history! #RoadToOmaha pic.twitter.com/5yay1XCZKD,Duke is headed to SUPERS for the first time in Blue Devil history! RoadToOmaha ,0.125,0.21666666666666667,Positive,Objective
