,tweet,processed_tweet,polarity,subjectivity,Sentiment,Objectivity
359,"Congratulations to all those who took part in the @StBaldricks fundraising event at @ChicagoProton this past weekend! Former pediatric patient, Jaysen, was our honoree guest and helped surpass the $6,000 goal. Over $11,000 was raised by the entire group! pic.twitter.com/5fsN562Lyc","Congratulations to all those who took part in the StBaldricks fundraising event at ChicagoProton this past weekend! Former pediatric patient, Jaysen, was our honoree guest and helped surpass the $6,000 goal. Over $11,000 was raised by the entire group! ",-0.10416666666666667,0.2916666666666667,Negative,Objective
360,"Spending time in #nature helps boost your #immunesystem and can actually reduce pain. See how Marianjoy Rehabilitation Hospital, part of Northwestern Medicine, is creating a healing environment. #ThinkSpring http://www.nmbreakthroughs.org/health-library/the-healing-power-of-gardens …","Spending time in nature helps boost your immunesystem and can actually reduce pain. See how Marianjoy Rehabilitation Hospital, part of Northwestern Medicine, is creating a healing environment. ThinkSpring ",0.0,0.1,Neutral,Objective
361,"Seasonal #allergies are nothing to sneeze at. In fact, it’s not uncommon for allergies to develop later in life. Find out why they can strike at any age: http://bit.ly/2GkRZ63 ","Seasonal allergies are nothing to sneeze at. In fact, it’s not uncommon for allergies to develop later in life. Find out why they can strike at any age: ",-0.2,0.5,Negative,Objective
362,"After 36 years of delivering babies, Anne Syzmczak is finally stepping down. While trends may have changed, her care and compassion towards new moms, new babies and even new dads never wavered. Congrats on her recent retirement and to all our wonderful caregivers! #NMBetter pic.twitter.com/4D1cdMn05P","After 36 years of delivering babies, Anne Syzmczak is finally stepping down. While trends may have changed, her care and compassion towards new moms, new babies and even new dads never wavered. Congrats on her recent retirement and to all our wonderful caregivers! NMBetter ",0.17907647907647908,0.5575036075036075,Positive,Subjective
363,"In just 2 days, we've sold 60% of our tickets to @laffyourfaceoff. If you plan on attending on May 5, get yours NOW at  http://laughyourfaceoff.org  @parkwestevents @NorthwesternMed pic.twitter.com/7hl6wpQlxF","In just 2 days, we've sold 60% of our tickets to laffyourfaceoff. If you plan on attending on May 5, get yours NOW at   parkwestevents NorthwesternMed ",0.0,0.0,Neutral,Objective
364,Relive last week’s excitement of #NUMatchDay with the @NUFeinbergMed medical students class of 2018 as they opened up their match letters. The faces say it all! #FlashbackFriday #FBF @NM_365 pic.twitter.com/kSglmrNy9u,Relive last week’s excitement of NUMatchDay with the NUFeinbergMed medical students class of 2018 as they opened up their match letters. The faces say it all! FlashbackFriday FBF NM_365 ,0.0,0.03333333333333333,Neutral,Objective
365,"In recognition of Colon Cancer Awareness Month, NMDHC be conducting a Facebook Live Q&A session with our Digestive Health Center Surgical Director and Medical Director on Friday, March 23 at 1:30pm CST. @NorthwesternMed #coloncancerawarenessmonth https://www.facebook.com/northwesternmedicine/ … pic.twitter.com/6EzeFjLhLI","In recognition of Colon Cancer Awareness Month, NMDHC be conducting a Facebook Live Q&A session with our Digestive Health Center Surgical Director and Medical Director on Friday, March 23 at 1:30pm CST. NorthwesternMed coloncancerawarenessmonth  ",0.012121212121212116,0.2,Positive,Objective
366,"It's #NationalPuppyDay and who better to recognize than Miss Sedona from @CTCorps? Thank you for continually putting smiles on the faces of our patients, physicians and staff! #NMBetter pic.twitter.com/0upxR27qGn","It's NationalPuppyDay and who better to recognize than Miss Sedona from CTCorps? Thank you for continually putting smiles on the faces of our patients, physicians and staff! NMBetter ",0.625,0.5,Positive,Objective
367,@D13Jaguars are ready to learn about our brains. Thanks @NorthwesternMed for the important information! #ilbsd13 pic.twitter.com/3yEgeDopJ9,D13Jaguars are ready to learn about our brains. Thanks NorthwesternMed for the important information! ilbsd13 ,0.3,0.5666666666666667,Positive,Subjective
368,Congrats @MamtaSwa on being named a 2017 health hero by @O_Magazine! We are so proud of you @NorthwesternU @NorthwesternMed @NUFeinbergMed #teampurple #WomenInMedicine #womenofnorthwestern pic.twitter.com/nWnn1qLy0P,Congrats MamtaSwa on being named a 2017 health hero by O_Magazine! We are so proud of you NorthwesternU NorthwesternMed NUFeinbergMed teampurple WomenInMedicine womenofnorthwestern ,0.8,1.0,Positive,Subjective
369,#YourCougars return in two weeks. #OpeningNight pic.twitter.com/9wDtFhrA0C,YourCougars return in two weeks. OpeningNight ,0.0,0.0,Neutral,Objective
370,"Today we recognize #WorldDoulaDay with Candida Daniels, who worked closely with her doula Kim Wheaton and Paula Hobson, MD to successfully deliver her baby at Northwestern Medicine Kishwaukee Hospital. Read the full story here:  https://bit.ly/2GgjbCY  #WorldDoulaWeek #NMBetter pic.twitter.com/C0L0mtr9bM","Today we recognize WorldDoulaDay with Candida Daniels, who worked closely with her doula Kim Wheaton and Paula Hobson, MD to successfully deliver her baby at Northwestern Medicine Kishwaukee Hospital. Read the full story here:   WorldDoulaWeek NMBetter ",0.55,0.75,Positive,Subjective
371,Our latest issue—the winter 2018 issue—of Northwestern Medicine magazine hot off the press!  pic.twitter.com/aJPVhAZX13 @NorthwesternMed,Our latest issue—the winter 2018 issue—of Northwestern Medicine magazine hot off the press!   NorthwesternMed,0.40625,0.875,Positive,Subjective
372,Feeling #bloated? Find out if you should be concerned: http://www.nmbreakthroughs.org/health-library/quick-dose-what-causes-bloating?utm_campaign=healthlibrary&utm_source=twitter&utm_medium=social&utm_content=experience&utm_term=curious …,Feeling bloated? Find out if you should be concerned: ,0.0,0.0,Neutral,Objective
373,"Join us on Thursday, March 22 and Thursday, April 5 for connection and support in navigating the challenges of #parenting teens. From tackling arguments and setting boundaries to breaking down technology barriers, our experts are here to offer guidance:  http://bit.ly/2puGvT3  pic.twitter.com/sxGmZSMik6","Join us on Thursday, March 22 and Thursday, April 5 for connection and support in navigating the challenges of parenting teens. From tackling arguments and setting boundaries to breaking down technology barriers, our experts are here to offer guidance:   ",-0.1555555555555556,0.2888888888888889,Negative,Objective
374,"#Flu hospitalizations are the highest on record, according to the @CDCgov. Find out who is most at risk for serious complications from this common illness: http://www.nmbreakthroughs.org/health-library/flu-who-is-most-at-risk …","Flu hospitalizations are the highest on record, according to the CDCgov. Find out who is most at risk for serious complications from this common illness: ",-0.04444444444444443,0.5555555555555555,Negative,Subjective
375,"Watch the full interview on @WGNMorningNews with @babaksjahromi, @pattomasuloon and Amy as they announce the 4th Annual @laffyourfaceoff fundraiser for #trigeminalneuralgia, a chronic nerve pain that usually affects one side of the face. http://bit.ly/2GaisTD  pic.twitter.com/YxcYD6qgnv","Watch the full interview on WGNMorningNews with babaksjahromi, pattomasuloon and Amy as they announce the 4th Annual laffyourfaceoff fundraiser for trigeminalneuralgia, a chronic nerve pain that usually affects one side of the face.  ",0.04999999999999999,0.4,Positive,Objective
376,"Great to meet Amy & @pattomasulo on @WGNTV,  supporting a great cause! @joshuarosenowMD and I will be attending @laffyourfaceoff fundraiser for #TrigeminalNeuralgia and #FacialPain research this May 5th!#ticdouloureux #WellnessWednesday@NeurosurgeryNM@FacePainResrchF pic.twitter.com/UEst6kH9b1 – at WGN Television","Great to meet Amy & pattomasulo on WGNTV,  supporting a great cause! joshuarosenowMD and I will be attending laffyourfaceoff fundraiser for TrigeminalNeuralgia and FacialPain research this May 5th!ticdouloureux WellnessWednesdayNeurosurgeryNMFacePainResrchF  – at WGN Television",0.6833333333333332,0.5833333333333334,Positive,Subjective
377,We’re getting excited for #AMEC2018 in San Francisco! Who will we see there this year? #PurplePride #TheFaceOfMedicine #NorthwesternDiversity #SNMA pic.twitter.com/jSmj2iKbZ3,We’re getting excited for AMEC2018 in San Francisco! Who will we see there this year? PurplePride TheFaceOfMedicine NorthwesternDiversity SNMA ,0.46875,0.75,Positive,Subjective
378,@NorthwesternMed The 4 gynecology questions girls are too embarrassed to ask about  http://dailym.ai/2u6pdB5  via @MailOnline @Northwesternmed,NorthwesternMed The 4 gynecology questions girls are too embarrassed to ask about   via MailOnline Northwesternmed,0.0,0.0,Neutral,Objective
379,Tune in today! @babaksjahromi  will be on @WGNTV this morning at 8:15 a.m. discussing trigeminal neuralgia with @pattomasulo  of @laffyourfaceoff #neurosurgery #Chicago,Tune in today! babaksjahromi  will be on WGNTV this morning at 8:15 a.m. discussing trigeminal neuralgia with pattomasulo  of laffyourfaceoff neurosurgery Chicago,0.0,0.0,Neutral,Objective
380,.@babaksjahromi will be on @WGNTV tomorrow at 8:15 a.m. discussing trigeminal neuralgia with @pattomasulo of @laffyourfaceoff,.babaksjahromi will be on WGNTV tomorrow at 8:15 a.m. discussing trigeminal neuralgia with pattomasulo of laffyourfaceoff,0.0,0.0,Neutral,Objective
381,"Hey, @NorthwesterMed doctors! Today is YOUR day! Take a break and grab some dinner in the atrium on Feinberg 3. Thank you for everything that you do! pic.twitter.com/gFHrZAo7hG – at Northwestern Memorial Hospital","Hey, NorthwesterMed doctors! Today is YOUR day! Take a break and grab some dinner in the atrium on Feinberg 3. Thank you for everything that you do!  – at Northwestern Memorial Hospital",0.0,0.0,Neutral,Objective
382,"New #stemcell transplant trial for #MS, led by #NUFeinbergMed scientist Richard Burt, MD, is stopping the disease and improving symptoms. http://www.bbc.com/news/health-43435868 …","New stemcell transplant trial for MS, led by NUFeinbergMed scientist Richard Burt, MD, is stopping the disease and improving symptoms. ",0.13636363636363635,0.4545454545454545,Positive,Objective
383,"ISET is holding their annual conference at Northwestern Medicine Central DuPage Hospital on Saturday, April 7. If you work within the #neurosciences field, please join us for a chance to hear from our world-class physicians on the latest breakthroughs:  http://bit.ly/2tZymvj  pic.twitter.com/uAldwTFl17","ISET is holding their annual conference at Northwestern Medicine Central DuPage Hospital on Saturday, April 7. If you work within the neurosciences field, please join us for a chance to hear from our world-class physicians on the latest breakthroughs:   ",0.25,0.575,Positive,Subjective
384,"We're just two months away from the 7th Annual Cougars 5K Run/Walk, presented by @NorthwesternMed Delnor Health and Fitness Center! Register now and help #YourCougars raise funds for @SO_Illinois.SIGN UP:  http://bit.ly/Cougs5K  pic.twitter.com/1J3TiylU3d","We're just two months away from the 7th Annual Cougars 5K Run/Walk, presented by NorthwesternMed Delnor Health and Fitness Center! Register now and help YourCougars raise funds for SO_Illinois.SIGN UP:   ",-0.125,0.1,Negative,Objective
385,"Diagnosed with #ParkinsonsDisease at age 43, Bill walked across America to raise awareness and funds to find a cure. Click the link to learn more about his journey: http://www.nmbreakthroughs.org/patient-stories/bills-cross-country-trek-raises-awareness-about-parkinsons?utm_campaign=patientstory&utm_source=twitter&utm_medium=social&utm_content=experience&utm_term=curious …","Diagnosed with ParkinsonsDisease at age 43, Bill walked across America to raise awareness and funds to find a cure. Click the link to learn more about his journey: ",0.5,0.5,Positive,Objective
386,"@AAIMOnline Our  @NUFeinbergMed faculty are so active at @aaimonline #AIMW18!  Come see @NMCardiology 's Dr. @NMPulse co-present on  “Issues in Family Medical Leave in GME: Promoting Wellness with Standardized Proposals” during Workshop Session II, today at 11:30am! @NorthwesternMed","AAIMOnline Our  NUFeinbergMed faculty are so active at aaimonline AIMW18!  Come see NMCardiology 's Dr. NMPulse co-present on  “Issues in Family Medical Leave in GME: Promoting Wellness with Standardized Proposals” during Workshop Session II, today at 11:30am! NorthwesternMed",-0.08333333333333333,0.3,Negative,Objective
387,Watch the murky water of the Chicago River turn bright green for #StPatricksDay. Here's how it happens:  http://trib.in/2ngdnwY  pic.twitter.com/LzCWXFR05r,Watch the murky water of the Chicago River turn bright green for StPatricksDay. Here's how it happens:   ,0.25,0.5499999999999999,Positive,Subjective
388,Have a fun and safe #StPatricksDay! ☘️ pic.twitter.com/cQDUGMgHQo – at Chicago Riverwalk,Have a fun and safe StPatricksDay! ☘️  – at Chicago Riverwalk,0.4625,0.35,Positive,Objective
389,Thinking of grabbing a #greenbeer this #StPatricksDay? Learn more about the impacts of #alcohol on the brain: http://bit.ly/2IsfoRd ,Thinking of grabbing a greenbeer this StPatricksDay? Learn more about the impacts of alcohol on the brain: ,0.5,0.5,Positive,Objective
390,5... 4... 3... 2... Happy #Match2018! #NUMatch @NUFeinbergMed @NorthwesternMed pic.twitter.com/J2LQSpeKC6,5... 4... 3... 2... Happy Match2018! NUMatch NUFeinbergMed NorthwesternMed ,1.0,1.0,Positive,Subjective
391,Share your Match Day photos using #NUMatch. We’ll share them here! #Match2018 pic.twitter.com/YCJdmrO2I4,Share your Match Day photos using NUMatch. We’ll share them here! Match2018 ,0.0,0.0,Neutral,Objective
392,"Congratulations to @NorthwesternMed, winner of this year's #ChicagoHeartWalk Healthcare Significant Growth award! Thank you for your support of our mission. We can't do it without you! pic.twitter.com/okiFtnfqGq","Congratulations to NorthwesternMed, winner of this year's ChicagoHeartWalk Healthcare Significant Growth award! Thank you for your support of our mission. We can't do it without you! ",0.5859375,0.875,Positive,Subjective
393,"Join us at Northwestern Medicine Central DuPage Hospital on Wednesday, April 11 from 4:00pm to 7:00pm CST for an opportunity to hear from our world-class physicians on the latest breakthroughs in #epilepsy treatments, medications and surgical advances:  http://bit.ly/2HCBJuc  pic.twitter.com/aaIwPZV9kJ","Join us at Northwestern Medicine Central DuPage Hospital on Wednesday, April 11 from 4:00pm to 7:00pm CST for an opportunity to hear from our world-class physicians on the latest breakthroughs in epilepsy treatments, medications and surgical advances:   ",0.25,0.575,Positive,Subjective
394,How much do you know about the pacemaker of the brain? Learn more about deep brain stimulation and how it helps reduce symptoms of #ParkinsonsDisease and other movement disorders: http://www.nmbreakthroughs.org/medical-advances/how-does-deep-brain-stimulation-work?utm_campaign=healthlibrary&utm_source=twitter&utm_medium=social&utm_content=experience&utm_term=curious …,How much do you know about the pacemaker of the brain? Learn more about deep brain stimulation and how it helps reduce symptoms of ParkinsonsDisease and other movement disorders: ,0.14375,0.36875,Positive,Objective
395,"@NorthwesternU One. More. Day. Good luck to all the @NUFeinbergMed M4s! We'll see you tomorrow for #Match2018! Until then, here's a #Match2017 #tbt video to tide you over. #NUMatch @NorthwesternMed @Northwesternu @dianebwayne @pmgarcia @dhsalz13 @ahammer1260 @AAMCtoday @AAMCMedStudent @TheNRMP pic.twitter.com/QUwQRWdWzy","NorthwesternU One. More. Day. Good luck to all the NUFeinbergMed M4s! We'll see you tomorrow for Match2018! Until then, here's a Match2017 tbt video to tide you over. NUMatch NorthwesternMed Northwesternu dianebwayne pmgarcia dhsalz13 ahammer1260 AAMCtoday AAMCMedStudent TheNRMP ",0.75,0.55,Positive,Subjective
396,3yrs and counting! What an inspiration you are to all. You are my Champion Sarah Wood! Everyone encourage the women in your lives to go get checked! It saved the life of mine. Thank you to @NorthwesternMed and @LurieCancer for all that you do. #BlessedAndGrateful pic.twitter.com/oEguQSuO6w,3yrs and counting! What an inspiration you are to all. You are my Champion Sarah Wood! Everyone encourage the women in your lives to go get checked! It saved the life of mine. Thank you to NorthwesternMed and LurieCancer for all that you do. BlessedAndGrateful ,0.0,0.0,Neutral,Objective
397,"Get ready to rock this Saturday at “The Heart of Rock and Roll"" event, hosted by the Kish Health Foundation! Proceeds will benefit the expansion of the Bluhm Cardiovascular Institute in DeKalb County:  http://foundation.nmh.org/kishformal  pic.twitter.com/aoJhQ1FtOn","Get ready to rock this Saturday at “The Heart of Rock and Roll"" event, hosted by the Kish Health Foundation! Proceeds will benefit the expansion of the Bluhm Cardiovascular Institute in DeKalb County:   ",0.25,0.5,Positive,Objective
398,Ravinia thanks @NorthwesternMed for its generous support of the Northwestern Medicine Grand Entrance! pic.twitter.com/YT3wLsIy4S,Ravinia thanks NorthwesternMed for its generous support of the Northwestern Medicine Grand Entrance! ,0.4125,0.6,Positive,Subjective
399,Transferring from the original Northwestern Medicine Lake Forest Hospital to the new one took approximately 10 minutes. Here’s a glimpse from Baby Mason’s point of view! #NMLFHMovingDay #NMBetter pic.twitter.com/PfKUFPPjVM,Transferring from the original Northwestern Medicine Lake Forest Hospital to the new one took approximately 10 minutes. Here’s a glimpse from Baby Mason’s point of view! NMLFHMovingDay NMBetter ,0.003787878787878785,0.6015151515151516,Positive,Subjective
400,Thank you to all of the volunteers who sent in hats for this year's #LittleHatsBigHearts campaign! Here are just a few of the adorable recipients from @UChicagoMed @NorthwesternMed @advocatehealth and  @LurieChildrens . pic.twitter.com/fWnrqiBZ14,Thank you to all of the volunteers who sent in hats for this year's LittleHatsBigHearts campaign! Here are just a few of the adorable recipients from UChicagoMed NorthwesternMed advocatehealth and  LurieChildrens . ,0.15,0.55,Positive,Subjective
401,"We'r honored to be @flowers4dreams local charity for the month of March! 25% of their profits this month will benefit our patients and families. Visit  https://www.flowersfordreams.com/  to order a beautiful bouquet for yourself, a loved one or an event this month! pic.twitter.com/g1mNxsEzkK","We'r honored to be flowers4dreams local charity for the month of March! 25% of their profits this month will benefit our patients and families. Visit   to order a beautiful bouquet for yourself, a loved one or an event this month! ",0.5750000000000001,0.6,Positive,Subjective
402,Who’s excited for Match Day this Friday? We are! Make sure to share your photos using #NUMatch #Match2018 pic.twitter.com/gnIYef0NYG,Who’s excited for Match Day this Friday? We are! Make sure to share your photos using NUMatch Match2018 ,0.484375,0.8194444444444444,Positive,Subjective
403,"“This represents a good portion of my life’s work, and I think it’s wonderful that these advancements are happening in our lifetime,” — Maha Hussain, MD, of the @LurieCancer on four new publications about #ProstateCancer treatment & screening:  http://bit.ly/2IhEuCl  pic.twitter.com/zhqFAZn4Rx","“This represents a good portion of my life’s work, and I think it’s wonderful that these advancements are happening in our lifetime,” — Maha Hussain, MD, of the LurieCancer on four new publications about ProstateCancer treatment & screening:   ",0.6121212121212122,0.6848484848484849,Positive,Subjective
404,Northwestern Medicine debunks common excuses for avoiding colorectal cancer screening tests: http://www.nmbreakthroughs.org/healthy-tips/six-excuses-for-avoiding-your-colorectal-cancer-screening?utm_campaign=healthlibrary&utm_source=twitter&utm_medium=social&utm_content=awareness&utm_term=manager …,Northwestern Medicine debunks common excuses for avoiding colorectal cancer screening tests: ,-0.3,0.5,Negative,Objective
405,"Feeling a bit groggy today? Our own Sabra Abbott, MD, PhD, at Northwestern Memorial Hospital explains how to adjust to the time change! #DaylightSavingsTime ⏰ https://twitter.com/abc7chicago/status/973333491529084928 …","Feeling a bit groggy today? Our own Sabra Abbott, MD, PhD, at Northwestern Memorial Hospital explains how to adjust to the time change! DaylightSavingsTime ⏰ ",0.75,1.0,Positive,Subjective
406,"“It’s an honor to be elected to lead such an influential group that continues to rapidly grow in membership, reach and impact in the U.S. and abroad,” — Karl Bilimoria, MD, (@kbilimoria) recently elected president of the Association for Academic Surgery:  http://bit.ly/2Ikc1Mb  pic.twitter.com/kCPQEFBbPB","“It’s an honor to be elected to lead such an influential group that continues to rapidly grow in membership, reach and impact in the U.S. and abroad,” — Karl Bilimoria, MD, (kbilimoria) recently elected president of the Association for Academic Surgery:   ",0.0,0.25,Neutral,Objective
407,"At #ACC18? Watch @NorthwesternMed's Robert O. Bonow, MD present ""Aortic Valvular Stenosis: 4 challenging variables for Management Asymptomatic, Low vs Normal Flow, Low vs Normal Gradient, LVEF"" in Room 311 E now:  http://ja.ma/2tANmjg ","At ACC18? Watch NorthwesternMed's Robert O. Bonow, MD present ""Aortic Valvular Stenosis: 4 challenging variables for Management Asymptomatic, Low vs Normal Flow, Low vs Normal Gradient, LVEF"" in Room 311 E now:  ",0.13333333333333333,0.4833333333333333,Positive,Objective
408,"Do your hands shake? From caffeine overload to #ParkinsonsDisease, there are many possible explanations for shakiness. Here are some common causes: http://bit.ly/2FG8AAR ","Do your hands shake? From caffeine overload to ParkinsonsDisease, there are many possible explanations for shakiness. Here are some common causes: ",0.06666666666666668,0.6666666666666666,Positive,Subjective
409,"April is #DonateLifeMonth and this year, Transplant Village is supporting an amazing cause intended to raise awareness for #livingorgandonors. Learn how you can become a part of this once-in-a-lifetime event: https://www.eventbrite.com/e/guinness-world-record-attempt-living-donor-rally-tickets-41312598093 …","April is DonateLifeMonth and this year, Transplant Village is supporting an amazing cause intended to raise awareness for livingorgandonors. Learn how you can become a part of this once-in-a-lifetime event: ",0.425,0.575,Positive,Subjective
410,Packed room at #AAOS2018 Spine Sessions! Great turn out for a great program. I’ll be presenting our progress in making #surgery #safer. @NorthwesternMed @Chicago_Spine pic.twitter.com/zqHq82UMgW,Packed room at AAOS2018 Spine Sessions! Great turn out for a great program. I’ll be presenting our progress in making surgery safer. NorthwesternMed Chicago_Spine ,0.8,0.75,Positive,Subjective
411,"Julian suffered a devastating spinal cord injury, but he wouldn’t trade the experience for anything: http://www.nmbreakthroughs.org/patient-stories/it-helped-me-turn-my-life-around?utm_campaign=patientstory&utm_source=twitter&utm_medium=social&utm_content=experience&utm_term=curious …","Julian suffered a devastating spinal cord injury, but he wouldn’t trade the experience for anything: ",-1.0,1.0,Negative,Subjective
412,"This #InternationalWomensDay, and every day in between, Northwestern Medicine would like to applaud the trailblazers, mentors and leaders who bring better care to our patients and the surrounding communities. https://chicagohealthonline.com/women-in-medicine/ …","This InternationalWomensDay, and every day in between, Northwestern Medicine would like to applaud the trailblazers, mentors and leaders who bring better care to our patients and the surrounding communities. ",0.5,0.5,Positive,Objective
413,"“Northwestern Medicine’s culture supports its entire workforce in balancing career achievements and personal lives. We are proud that NM has earned recognition from NAFE for the past decade."" Click to learn more about this prestigious honor: https://www.nm.org/about-us/northwestern-medicine-newsroom/press-releases/2018/northwestern-memorial-healthcare-named-a-top-10-nonprofit-company-for-executive-women …","“Northwestern Medicine’s culture supports its entire workforce in balancing career achievements and personal lives. We are proud that NM has earned recognition from NAFE for the past decade."" Click to learn more about this prestigious honor: ",0.21,0.5349999999999999,Positive,Subjective
414,Today we celebrate the impact women across #NUFeinbergMed and @NorthwesternMed are making around the world. Thank you for all that you do! #MedEd #Research #Health #Education #Chicago #Northwestern #MedSchool #IWD2018 #PressForProgress #InternationalWomensDay pic.twitter.com/4kYCisWHqT,Today we celebrate the impact women across NUFeinbergMed and NorthwesternMed are making around the world. Thank you for all that you do! MedEd Research Health Education Chicago Northwestern MedSchool IWD2018 PressForProgress InternationalWomensDay ,0.0,0.0,Neutral,Objective
