,0
34,Pleased to announce that our @HopkinsMedicine #WomensSportsMedicine 2018 #SummerInternship will be a paid internship! Applications close March 1. https://www.hopkinsmedicine.org/orthopaedic-surgery/specialty-areas/sports-medicine/womens-sports-medicine/internship.html …
35,My latest blog on #Orthopedics Today: Update on patellofemoral  anatomy and #MPFL #MPFC #MQTFL reconstruction @SaveThePatella  https://www.healio.com/orthopedics/sports-medicine/news/blogs/%7Bcae8aa69-18ba-4391-a2fa-6bbf03db6d73%7D/patellofemoral-update/blog-mpfl-mpfc-mqtfl-reconstruction-patellar-stabilization-and-alphabet-soup …
36,Thanks and good luck to Laura from Howard County for her #CSpan #StudentCam documentary submission on promoting #ACL injury #prevention for #FemaleAthletes! pic.twitter.com/lghdecKWrr
37,Truly honored to lecture on #WomensSportsMedicine and reconnect with friends @KobeU_Global while in #Japan. Thank you for your hospitality! pic.twitter.com/fOiWI1POpG
38,"Are you a current NCAA female athlete? If so, help us by completing a research survey on ACL injuries! IRB00125593 https://jhmi.co1.qualtrics.com/jfe/form/SV_cIyhjVVht2Rgsw5 …"
39,"In the lab, recording a technique video for #MPFL reconstruction. Thanks @StrykerEndo & @ConMedLinvatec for donating instruments! pic.twitter.com/9cdNnuAa7Z"
40,Great discussion and #international perspective on #SportsMedicine with our visiting surgeons from China! @HopkinsMedicine pic.twitter.com/6ZSYP73rXR
41,In Dallas this weekend for @AAOS1 #LeadershipFellowsProgram with current and future leaders in #orthopaedic #surgery.  #LFP pic.twitter.com/vLHEtv5XfT
42,It’s time for the Baltimore Running Festival again and @DrMihoTanaka is here to help you avoid injuries http://wypr.org/post/avoiding-injury-dr-miho-tanaka-ahead-baltimore-running-festival …
43,Thanks @MiddayTomHall @WYPR881FM for a great show discussing sports injuries and prevention today! http://www.bit.ly/2gkI0ir 
44,Are you running in the @baltrunfest this Saturday? Got a question for @DrMihoTanaka? Call us: 410-662-8780 or email: midday@wypr.org
45,Great breakout session and discussion with aspiring #female #physicians at #AMWA regional conference @HopkinsMedicine pic.twitter.com/wdxXtpqMdt
46,Very honored to be inducted into the International #Patellofemoral Study Group this year and joining an incredible group @SaveThePatella pic.twitter.com/oAWI8LnbrT
47,In-depth discussion w the world's experts at International #Patellofemoral Study Group in #Munich @SaveThePatella pic.twitter.com/TB6DfimcXM
48,Great time teaching w friends at the Masters Patellofemoral Course in Chicago! @OLC_Events @SaveThePatella pic.twitter.com/GQZA1lIxmN
49,The Rise of Female Surgeons @HopkinsMedicine http://www.hopkinsmedicine.org/news/articles/the-rise-of-female-surgeons-at-johns-hopkins#.WabK3CMlWCw.twitter …
50,@DrMihoTanaka ...Thank you Dr T  for the awesome job you did putting my shoulder back together.  Lisa thanks you too...xo pic.twitter.com/dT6R6lIhKx
51,Thanks @Giles_news for a great piece on women's sports medicine on TRT World News @HopkinsMedicine https://m.youtube.com/watch?v=f4WDqcJeilw …
52,The Johns Hopkins Hospital is proud to be ranked No. 3 in the nation and No. 1 in Maryland on the @usnews 2017–18 #BestHospitals list pic.twitter.com/R5fmN4NjNR
53,"Our 2017 traveling fellows, reunited in Toronto at #AOSSM2017! pic.twitter.com/6V1tf7jFq4"
54,Proud to exhibit at the 2017 AOSSM meeting in Toronto Canada! pic.twitter.com/7qXDvucv0m
55,Thanks @Giles_news for the interview today @HopkinsMedicine. Glad to see there's growing interest in women's sports injuries! pic.twitter.com/SYZK7Rjg1Z
56,Do you have questions about #running injuries? @DrMihoTanaka talks to Dr. Steve Yang & @MehulRShahMD on the #Orthopedics Show. 877-698-3627
0,Very nice review on BCG @ImmunoBladder!  40 years later and we still have so much to learn. @NatRevUrol https://www.nature.com/articles/s41585-018-0055-4 …
1,2018 AUA Guideline on management of LUTS/BPH doesn't even mention PSA once?  Seems like it should be at least discussed.... http://www.auanet.org/guidelines/benign-prostatic-hyperplasia/lower-urinary-tract-symptoms-(2018) …
2,High dose-rate Intra-Operative Radiation Therapy During High Risk Genitourinary Surgery: Initial Observations and a Proposal for its Study in #BladderCancer  https://content.iospress.com/articles/bladder-cancer/blc170104 …@tbivala1 @drphil_urology @MaxKates @HopkinsMedicine pic.twitter.com/B2k2xwwbQM
3,"A few favorites: 1) ""You can't operate on what you can't see"" 2) ""What get's us into trouble?  It's not what we don't know it's what we do know that ain't so!"" 3) ""utilize the least number of maneuvers to accomplish a task"" 4)""You can learn from anyone"""
4,Found this Book by the late and great Frey Marshall when moving offices at work:  Very inspirational and full of #TipsForNewDocs.  Full of surgery related inspirational musings: https://www.amazon.com/Handbook-physicians-insights-medicine-Difference/dp/1467926914 …
5,Congratulations @alan_partin on well-deserved recognition of @BAUSurology St. Paul’s Medal👏👏👏#BAUS18 pic.twitter.com/vRsowc5wbM
6,"Wonderful day at #birdlandThank you @Orioles for supporting @HopkinsMedicine, #ProstateCancer awareness/research and us!Thanks to all our patients and #HappyFathersDay Congrats to Dr. Burnett #birdlandhero to many!!! pic.twitter.com/3sfaKtyges"
7,celebrate #FathersDay and play catch with dad on the Orioles’ field! Join @brady_urology at Camden Yards as the @Orioles host the @Marlins.  All proceeds will go to the #ProstateCancer Discovery Fund. Purchase your tickets here  https://www.mlb.com/orioles/tickets/specials/catch …#birdland pic.twitter.com/HGprtlprtZ
8,"Congrats to all applicants matching into 2019 SUO fellowship positions this morning! We look forward to you joining the @SUO_YUO If you'd like, we'd welcome a reply with where you're going for fellowship in 2019 and to make sure we're following you on Twitter@AmerUrological"
9,Congratulations to @heathernoellemc Teacher of the Year by the #urology residents.... well deserved!!!#meded #SurgMentoring pic.twitter.com/70YUe2imBA
10,One thing I simply do not understand in bladder cancer:1) some are advocating observation for T2 who are complete responders to neoadjuvant chemo 2) Many suggest cystectomy for recurrent T1 3) BUT few recommend neoadjuvant chemo for recurrent T1.  This incongruity makes no sense!
11,Mine and PCW's view on the PRECISION trial https://www.europeanurology.com/article/S0302-2838(18)30367-1/fulltext …I'm told a response from UCL group is coming. Eager to read.
12,Can Renal and Bladder Ultrasound Replace CT Urography in Patients Investigated for Microscopic Hematuria?  http://prac.co/l/ybu5nh2b  via @practiceupdate  data appears to support use of renal u/s w/expert commentary by @MaxKates frm @brady_urology
13,Fascinating study on Small Cell carcinoma of the bladder: Distinct pathogenesis form small cell of lung.  APOBEC Mediated. http://clincancerres.aacrjournals.org/content/24/8/1965 …
14,Don't forget to join today's #bladdercancer webinar at 7pm ET with @akfsurgeon and @JCensits -> Sign up here:  https://bit.ly/2rOBMNe . @brady_urology @HopkinsMedicine @HopkinsKimmel @BloombergKimmel https://twitter.com/djmcconkey/status/992401468853497856 …
15,An awesome contribution to our ability to study bladder cancer. Thank you to Billy Kim and colleagues @UNC_Lineberger @OSUCCC_James @B_C_A_N http://cancerres.aacrjournals.org/content/early/2018/05/18/0008-5472.CAN-18-0173 …
16,Ambitious and Impressive in scope.  Randomized surgical trials with functional outcome data are so few and far between https://twitter.com/EUplatinum/status/1000774402676547585 …
17,This is a pretty good paper on the PUNLMP topic https://diagnosticpathology.biomedcentral.com/articles/10.1186/s13000-015-0234-z …
18,"Whats the equivalent of the ""Is Gleason 6 Disease prostate cancer"" with Bladder Cancer.  PUNLMP: 1) 20% recurrence rates almost always PUNLMP or low grade Ta, 2) 1% risk of progression to MIBC and this may really be new cancer not progression, 3) <1% risk of bladder cancer death."
19,That moment when you realize the last edition of Campbell-Walsh did not discuss molecular subtypes in #bladdercancer. pic.twitter.com/m5dzJtVot2
20,"Urinary biomarkers for bladder cancer diagnosis are evolving.   For this week's #bladdercancerreview, my favorite meta-analysis on the topic by Chou,@gorejohn and Selph.  Focus here is on what's FDA approved and currently used. Rigorous methodology  http://annals.org/aim/fullarticle/2466370 …"
21,Crazy high 90-day readmission rates across US for GU onc presented by @MeeraChappidi @UCSFUrology #AUA18 pic.twitter.com/8kwA0Jcp3y
22,Congrats Alexa!  Best poster - Restating TURBT after NAC misses >25% of invasive bladder cancer on RC final pathology despite no evidence of cancer on endoscopic TURBT (T0).  Important message for clinical trial design. @brady_urology @MaxKates @drphil_urology pic.twitter.com/AxYIWvOfRH
23,Dr. Bivalacqua presents final results of Phase I neourinary conduit trial. Very promising results but still needs optimization. #aua18 @brady_urology @tbivala1 @DrGreg_MD pic.twitter.com/QWAzqbffsU
24,We should not be getting urine cytology for asymptomatic microhematuria.  I wonder what contemporary practice patterns are with this in the urologic community.  Any data out there to see how well we are following this? #ChoosingWisely http://www.choosingwisely.org/societies/american-urological-association/ … pic.twitter.com/MU1qeG3kCB
25,"Did you know men are 3X more likely to develop #bladdercancer than women? @SenatorIsakson & I just got word our resolution recognizing May as National Bladder Cancer Awareness Month passed. Get the facts, learn its symptoms and how to reduce your risk     https://www.cancer.org/cancer/bladder-cancer.html …"
26,We are increasingly performing MRI for #bladdercancer at our institution.   As imaging improves so will our clinical staging. However its important to realize that there is very little data in general in this space (especially outside of the great work by @ValeriaPanebian).
27,Great Effort to standardize MP-MRI for Bladder Cancer.  Would have liked to have seen the VIRADS schema tested in a group of patients within the article. https://www.europeanurology.com/article/S0302-2838(18)30335-X/fulltext#.Wv1n8zpEECo.twitter …
28,Join us Friday morning at 9:30 for the Kidney Cancer Tumor Board with all-star panelists @Robert_Uzzo @Drkavoussi @haberurology @montypal @sandysrimd. Will present scenarios in the management of both local and advanced #kidneycancer  https://goo.gl/jGiZWZ  #AUA18
29,"Growing up, dad had open repair of type A dissection, grandma had AAA repaired w/ EVAR, grandpa had TIAs s/p carotid endarterectomy. Didn’t know what they meant then, but now I realize how #vascularsurgeons saved my family. Humbled to be one today. #tellastoryinonetweet"
30,Other interesting take-aways: progression to MIBC was high for truly low risk nmibc: about 2.5% in treated group and 5% in untreated group.
31,"Future will be some cogent combination of immuno and chemotherapy, and predicting what NMIBC patients will respond to one vs another."
32,There is going to be a 2nd coming for intravesical chemo.  Immunotherapy is great for some but won't cure all NMIBC. Intravesical chemo flat out works. https://jamanetwork.com/journals/jama/fullarticle/2680547 …
33,@JCensits @BloombergKimmel @HopkinsKimmel @HopkinsMedicine Join our free @Hopkinsmedicine webinar to learn more about women’s #bladdercancer on Thursday May 31 at 7pm.  https://bit.ly/2joSYVH  @bradyurology @hopkinskimmel @bloombergkimmel @akfsurgeon @jcensits
34,"Going to Wesleyan changed my life.I'm proud of all of you making that commitment to college.  Show me your pride, youths of tomorrow!  Tell me where you're going.#BetterMakeRoom #CollegeSigningDay pic.twitter.com/H0R5FiIaWS"
35,"This article should be in the pantheon of #bladdercancer classics: Ferguson in Egypt in 1911, using observation and scientific curiosity, identified the link between schistosomiasis and bladder cancer.  https://onlinelibrary.wiley.com/doi/abs/10.1002/path.1700160107 …"
36,To continue this month's theme of bladder cancer risk factors (you can tell what chapter I'm writing)...2 recent papers further the concept that Obesity is associated with bladder cancer independent of smoking.  1)   http://www.oncotarget.com/index.php?journal=oncotarget&page=article&op=view&path[]=16722&pubmed-linkout=1 …  2)    https://www.nature.com/articles/s41598-018-19531-7 …
37, https://torontolife.com/city/life/orthodox-jew-became-gender-reassignment-surgeon/ …
38,This is what academic discourse is all about  https://goo.gl/PWkW24 
39,Paging Dr @michael_gorin https://twitter.com/JUrology/status/988462779576221697 …
40,"#bladdercancer guru @djmcconkey has joined Twitter, welcome! @brady_urology"
41,"Another classic #bladder cancer article. As more factory work (ie rubber, dye) moves into developing countries, will this shift bladder cancer incidence? Already smoking increasing in low income countries & down in high income ones. Global stats will shift. https://twitter.com/MaxKates/status/988098219757457409 …"
42,Contemporary Occupational Carcinogen Exposure and Bladder Cancer  https://ja.ma/2HPrgN7 
43,This year marks the 50th Anniversary of @IcahnMountSinai.  The School’s journey began in the late 1960s when The Mount Sinai Hospital created its own medical school and graduate school. Learn more:  http://fal.cn/4WTF  #CelebrateISMMS pic.twitter.com/0ZywEq1XmN
44,Totally sobering stat re #bladdercancer funding in FY2013.  Would be curious to see how this graph has or hasn't changed in 2018. From  http://www.milkeninstitute.org/assets/PDF/BladderCancer-GSG.pdf … pic.twitter.com/j1OT1pxI4U
45,Game changer!  What student would go anywhere else!?  Amazing foresight. https://twitter.com/Columbia/status/984090103864840192 …
46,"3) This data ends in 2015.  Will be fascinating to see how these #bladdercancer stats change from 2015-2025 in the face of systemic immunotherapies, work to prevent NMIBC progression, molecular subtyping and promise of personalized medicine etc....will it make a dent?"
47,"2)  #bladdercancer Disability adjusted life years (DALYs) are actually declining in high income countries and increasing in low income countries.  IN other words, high income countries are making progress and need to transfer this progress to lower income countries..."
48,Some salient points: 1)  #bladdercancer rates increased by 31% over a 10 yr period (2005-2015).  This is attributable to aging of the population
49,"For those interested in Global Cancer Statistics, look no further than this article. https://jamanetwork.com/journals/jamaoncology/fullarticle/2588797?platform=hootsuite …"
50,Risk stratification key.  Nice take. https://twitter.com/EUplatinum/status/983422070326530048 …
51,Great #testismass case discussion.  Would have picked lymphoma 99% of time but important to always keep in mind the rare birds and great impersonators....  https://twitter.com/NEJM/status/982268023103897600 … @drphil_urology https://twitter.com/NEJM/status/982268023103897600 …
52,Oy https://twitter.com/wojespn/status/980144024941158405 …
53,Great headline but what does this image have to do with prostate cancer?  Not even sure what the surgeon is marking for... https://twitter.com/HopkinsMedicine/status/978949865429446656 …
54,Congrats @urodrnik for strong showing at #EAU182nd best non-oncology paperResident's Corner winner for #peniletransplant paper https://www.youtube.com/watch?v=QwlL5GJ44H4 …@Uroweb @EUplatinum @eauyoungurology pic.twitter.com/Cv5DkRLrBi
55,PROSPER RCC: Study of neoadjuvant/adjuvant Nivolumab in localized high risk #kidneycancer.INVITING ALL to join a webinar discussion-we need you HELP and THOUGHTS!!! @kcCURE @HHammersMD @AmerUrological @LeiboMN1 @KidneyCancerDoc @anilkapoormd @virajmaster @uroegg @LaurenCHarshman pic.twitter.com/0yTxOMgesj
56,"As I finish training, I think about this article a great deal.  Surgeons I respect the most are constantly learning from others regardless of their seniority. https://twitter.com/hollyby/status/976817200446300161 …"
57,Great urologist gift pic.twitter.com/ovkFg0yedd
58,"Words to live by in residency, in surgery, in research. pic.twitter.com/aws66eAFRu"
59,"According to the ACGME update, PGY-1 year of uro training will no longer be a prelim year in gen surg, but folded into urology residency. Effective 7/1/19.  http://www.acgme.org/Portals/0/PFAssets/ReviewandComment/480_Urology_2017-10-23_Impact.pdf …"
60,Very Low–Risk #BladderCancer—A New Entity?  http://ow.ly/CRCA30hT4Gc  #blcsm comment: @MaxKates
61,Congrats @drphil_urology @P_Nichols !  Very cool telemedicine project.  @brady_urology https://twitter.com/AmerUrological/status/956178368793317376 …
62,Very proud of Aaron.  Will be a star at @WCMUrology https://twitter.com/WCMUrology/status/954050858198683649 …
63,Based on the Jewett bladder cancer staging.  Amazing how relevant it still is today! @brady_urology http://bradyurology.blogspot.com/2014  https://twitter.com/fabriziodalmoro/status/953308648494829568 …
64,"Very cool trial with potential to change the field in major ways.  Would love to also see translational correlates, as we know not all HGT1 tumors are the same... https://twitter.com/EUplatinum/status/950055178769784832 …"
65,#FlannyFriday pic.twitter.com/o54RVrBRPb
66,Great slide by @markballmd highlighting safety of surveillance in VHL  lt 3cm pic.twitter.com/d79vldcCQV
67,These prices are almost identical to what we get in Baltimore.  A 6 week induction of MMC is nearly $7k!  Way more expensive the GEM or even BCG #suo17 https://twitter.com/UroCancer/status/936300764171030529 …
68,Beautiful @brady_urology @pienta_brady https://twitter.com/TheCancerLetter/status/932555641536659456 …
69,Awesome news. @NitaAhujaMD represents everything great about Hopkins and academic medicine. So grateful to have worked with you as a student and resident. https://twitter.com/yalesurgery/status/931156918793592833 …
70,"Our  beloved mentor, always our Chief, is with us only in spirit now.  Our grief knows no bounds, but he inspired us not only to approach discovery, but to live life with JOY. #ourchief https://twitter.com/PCFnews/status/929038046175027200 …"
71,Important to report neg findings.  #PSMA not great for #BladderCa. Need better ways to identify occult disease. Nice work @michael_gorin ! https://twitter.com/michael_gorin/status/923160273300672514 …
72,Congratulations to @drphil_urology Among the newest Associate Professors at @HopkinsMedicine pic.twitter.com/aEimuIuyzD
73,Portugal really bringing its coffee A game with the enormous @Nespresso  machines @ChampalimaudF #ibcn pic.twitter.com/2Y5rYRAE6E
74,@hopkinssurgery @Forbes @MarceloCerullo @AnnalsofSurgery @elliotthaut John Cameron is a great man who influenced my career.Same can be written about Pat Walsh who’s best accomplishment r his trainees.#mentor
75,Need to sort out the heterogeneity question first  https://www.nature.com/articles/s41598-017-11291-0 … https://twitter.com/Agarwal_CaB/status/921029058896498693 …
76,Seth Lerner presents latest update from #TCGA re #bladdercancer #sui17 #bcsmSee recent pub:  http://dx.doi.org/10.1016/j.cell.2017.09.007 … pic.twitter.com/y17wXtARjS
77,A great combo pioneered by O'Donnell/Iowa.  We use it @brady_urology regularly. Cheaper than BCG or MMC.  Warrants more formal study. https://twitter.com/urogerlimd/status/919196602127998977 …
78,We received this beautiful email from our Kochvaya 2017 Chanichim: We have heard about the fire in Santa Rosa... http://fb.me/6WTdvUOtL 
79,"Thrilled to be apart of the Bladder Health Alliance at @AmerUrological headquarters, representing @brady_urology & #GreenbergBCI pic.twitter.com/9yssze1Nen"
80,"PODCAST Recommendation from my father: Larry Summer Approach to Mentoring, Macroeconomics, etc #GaryKatesPodcastRec https://itunes.apple.com/us/podcast/conversations-with-tyler/id983795625?mt=2&i=1000392509132 …"
81,One of those studies that creates as many questions as it answers! Reminds me of related work by @DrFaltas
82,Fascinating Implications:1) Reliability of subtype calls w/ multifocal dz 2) what Tumor heterogeneity means for personalized #bladderca care https://twitter.com/LDyrskjot/status/908650387602903041 …
83,Female surgeons are shattering gender barriers at Johns Hopkins  http://bit.ly/2gX5KwI  pic.twitter.com/9D4sSAV2aI
84,"For what its worth--There is a place for IORT in #bladdercancer but still unclear who, what, and when. https://twitter.com/MaxKates/status/904873191025332224 …"
85,High dose-rate Intra-Operative Radiation Therapy During High Risk Genitourinary Surgery  https://www.ncbi.nlm.nih.gov/pmc/articles/PMC5545919/ … @bradyurology
86,I can't imagine getting censored in this way.  This is crazy. https://twitter.com/doctorwhy/status/900897050484670465 …
87,Ureteroenteric stricture rate 19% after robotic cystectomy–open & robotic repair w/comparable outcomes http://ow.ly/Ty1P30el7jC @KhurshidGuru pic.twitter.com/fsFCllcgfp
88,Cc @brady_urology @tbivala1 https://twitter.com/urologycarefdn/status/897428959750758402 …
89,Preclincial Evaluation of Intravesical Cisplatin Nanoparticles for Non-Muscle-Invasive Bladder Cancer @bradyurology http://clincancerres.aacrjournals.org/content/early/2017/08/12/1078-0432.CCR-17-1082 …
90,Need Reading on Urinary Biomarkers in #BladderCancer?  This comprehensive Review takes the cake.     http://annals.org/aim/article/2466370/urinary-biomarkers-diagnosis-bladder-cancer-systematic-review-meta-analysis …
91,This case is nuts!  Gleason 3+3 though? https://twitter.com/alan_partin/status/894135660554203136 …
92,Systemic therapy for NMIBC has officially hit primetime! Wow. #BCANTT17 (slide via Jim McKiernan) pic.twitter.com/Sy73LK0UyY
93,Jim McKiernan- pushing the envelope of NMIBC.  #bcantt17 pic.twitter.com/VdD5X4xlek
94,Very important issue.  FDA should support these Patient centered approaches in bladder cancer trials. https://twitter.com/urodocash/status/892344738543616000 …
95,Farewell from all the Brady residents to Dr. Stephen Schatz Gentleman. Scholar. Knower of all things urology and random trivia we'll miss u! pic.twitter.com/TkmDjhRlUg
96,"Makes sense:when the learning curve is steep as an intern, you feel you need more hours.Then you get efficient, can get it done in less time https://twitter.com/nejm/status/885456326410866689 …"
97,"Key Review: Immunotherapy for Prostate Cancer: vaccines, checkpoint inhibition:  http://ow.ly/D23530cUgHv  #PCSM pic.twitter.com/IF0bBMJ2TP"
0,"Important study demonstrating what many of us know quite well.  We also burden trainees with lots of expenses for licenses, qualifying exams, interview travel costs, skills exams required for certification, etc. Give trainees a financial break-they r the future https://twitter.com/amcollsurgeons/status/1012693476641792001 …"
1,Congrats Tony. https://twitter.com/ihpba/status/1012641581546033153 …
2,"""Are we asking the research questions that will impact the patient sitting in front of us?"" -Dr. Matt Weiss @HopkinsMedicine https://youtu.be/cNW-ACaLNHE "
3,Congrats Drew.  Welcome. https://twitter.com/drewshirleymd/status/1004018130186797061 …
4,"Agreed.  That’s why my wife and I paid out of pocket. Insurance companies base decision on financial variables, worth every penny to me. https://twitter.com/heatheryeomd/status/1003283778855489536 …"
5,Surgical and Patient-Centered Outcomes after Pancreatic Resection in High-Risk Individuals for Pancreatic Cancer:A 20-Year Prospective Cancer of the Pancreas Screening (CAPS) Cohort Study:Just presented at #SSAT18 Presidential Plenary Rm 202A #DDW18  @JournalofGISurgery @drjmier pic.twitter.com/bkKI6eezRL
6,"Funny, I have been recommending age 40 for screening colonoscopies for years.  See way too many young people die of this disease. https://twitter.com/heatheryeomd/status/1003277368209891329 …"
7,"What is the prognostic association of #BRAF mutations with survival and recurrence in patients with metastatic #colorectal #liver #cancer, and how does it compare with #KRAS mutations?  https://ja.ma/2IY1sy0  #VisualAbstract pic.twitter.com/tCx0KxFqUS"
8,#KRAS and #BRAF Mutations With Survival and Recurrence in Metastatic #Colorectalcancer #Livermetastases  https://ja.ma/2Kubnf7  #molecularsurgery @JAMASurgery pic.twitter.com/WSgmxlhgzA
9,"@MariaBartiromo Looking forward to the premiere of our film #ThePatientsAreWaiting tonight in NYC, with discussion hosted by @mariabartiromo and panelists @bobwrightnbc, Dr. Geoff Ling, Dr. Karen Reeves & Dr. Herb Pardes  @NYP pic.twitter.com/fuJxej8xqL"
10,"Agreed. Not sure we can say absolute contraindication, but maybe accurately prognosticating should dictate timing sequence of multimodality therapies “to test biology”.  Great work by my fellow Tony Margonis. https://twitter.com/nirajgusani/status/998014060707897344 …"
11,@hopkinssurgery From @Hopkinssurgery: A series of papers about a new scoring system that may help improve advanced colorectal cancer prognosis  http://bit.ly/2G6BRko  pic.twitter.com/kB744m9T8X
12,I’ve been looking forward to this read since Jason told me about it at the ACS in San Diego.  Amazing. https://twitter.com/univsurg/status/991058896881094658 …
13,Exciting talk by @DrRABurkhart at @pancreas2018 discussing organoid pharmacotyping.  The future is here! #pancreas2018 pic.twitter.com/Yvs26sMl5l
14,IPMNs and bacteria...any correlation? @pancreas2018 pic.twitter.com/jEVQjEWcvD
