,0
259,Happy Birthday @BarackObama! Hope you get some balloons. I love a good balloon. #HBD44
260,"One of the biggest myths in Medicine is ""NPO after midnight"" prior to a procedure. Kudos for teaching this pearl of wisdom#MedEd https://twitter.com/stggas/status/892380703790444544 …"
261,Impact of Mesh Fixation on Chronic Pain in Total Extraperitoneal Inguinal Hernia Rep: A Nat'l Study  http://bit.ly/2uQRdXK  #VisualAbstract pic.twitter.com/r3OqsMTQF9
262,"@lisamurkowski Woke up to find that sanity prevailed. Thank you @SenatorCollins, @LisaMurkowski, and @SenJohnMcCain."
263,"Firearm Deaths in America: Can We Learn From 462,000 Lives Lost?  http://bit.ly/2v0DE9d  #VisualAbstract pic.twitter.com/LpIJHXK0HR"
264,Bolus infusion is more pharmacodynamically effective:) https://twitter.com/jonessurgery/status/890168572877697025 …
265,A video is worth a thousand pictures! Great paper & video on retrohepatic cava injuries from @EAST_TRAUMA  Meeting  http://bit.ly/2uL4eCU  pic.twitter.com/PRbCG1skb6
266,.@HopkinsMedicine Trauma Surgeon @JosephSakran's near death experience led him to medicine:   http://owl.li/RKoY30dVKry  #EndGunViolence
267,Proud of the 11 Republican and Democrat governors who have pulled together to share an important message on health care reform. pic.twitter.com/IcmUyM4m4g
268,Every employee at VA jails will be trained to work w/ people who have #mentalillness. @MHFirstAidUSA #StateofMH
269,"""We have dug a hole"" by failing to invest in #mentalhealth prevention & treatment, the result is too many ppl in jails-Fred Osher #StateofMH"
270, https://www.google.com/amp/s/amp.cnn.com/cnn/2017/07/18/health/acid-burn-attacks-what-to-know/index.html …@JulieCaff @hopkinssurgery talking about chemical burns
271,"Ten years ago in J Trauma: Prehospital procedures before ED thoracotomy: ""scoop & run"" saves lives. @MarkSeamonMD  http://ow.ly/OBLd30ds03v "
272,Not bad for an Arkansas boy https://twitter.com/billclinton/status/885970827748851712 …
273,Healthcare treat thyselves https://twitter.com/hstoklosa/status/885849970355703808 …
274,Interesting thought https://twitter.com/ezraklein/status/885879619425103872 …
275,Gov. John Kasich’s statement on the Senate health care reform bill: pic.twitter.com/0LCBu5B0xh
276,Discussing intersection of advocacy and policy #RISEConf @nih_nhlbi #Rise2017 @KBibbinsDomingo pic.twitter.com/VEpbJl6nI8
277,"#EHR Incentive Programs @CMSGov reporting as of May 2017 525,000+ providers participating  #meaningfuluse http://tinyurl.com/y83jy38l "
278,Sounds like you have the same disease as the rest of us :) https://twitter.com/JJcolemanMD/status/885896649763164161 …
279,"Thanks for your support, Chairman @michaelcburgess! This important legislation a priority for @ACSTrauma #traumaZPDD  http://ow.ly/IU0D30dzUHO "
280,So proud of @DetHealth  Senior Policy Advisor Kim Rustem talking about our work on LeadSafeDetroit! #NACCHO2017 pic.twitter.com/TCVcXtE8B1
281,I've met several patients who didn't know the insurance plan they have and like is actually medicaid https://twitter.com/Atul_Gawande/status/884521733520281600 …
282,Thanks so much to all of you. It's been a great year! https://twitter.com/elliotthaut/status/885001142144512001 …
283,"Quite the milestone: @GetVetsHoused & @VeteransHealth together have helped 1,500 #Veterans find permanent housing  http://bit.ly/2spdeNG "
284,"Pandemic Emergency Financing Facility has the potential to save lives, protect economies #endpandemics  http://wrld.bg/ldFm30d3PMo  pic.twitter.com/cmegHti10i"
0,I wish you all a great beginning of 2018!!. Please enjoy this beautiful schistosoma eggs in bladder. Note the eosinophilic microabscess surrounding the eggs. No associated tumor or squamous met in this case.  #GUpath #urology #2018 pic.twitter.com/FfoFJeO7tL
1,"Colonic glands in prostate biopsy can mimic prostate cancer, specially if they are dysplastic. Key is to recognize the presence of lamina propria and not to misinterpret a PIN4 stain.  #GUpath pic.twitter.com/1i8U3t9LK4"
2,"Flat carcinoma in situ of bladder - including: a) involvement of squamous metaplasia , b) a field with overlying umbrella cell layer, c) a contrast with normal von Brunn nest and d) hi power view of nuclear irregularity - this one's for you @evacomperat #gupath #bladdercancer pic.twitter.com/wft4h7Yiy0"
3,The many faces of one clear cell renal cell carcinoma - lower grade regressed areas - increasing nuclear grade w/more eosinophilic cytoplasm - transitions from lower to higher nuclear grade #gupath #kidneycancer pic.twitter.com/a38TcT72Ca
4,Nice study by @Andres_Matoso delineating orchiectomy findings in gender dysphoria patients @Human_Pathology  https://www.ncbi.nlm.nih.gov/pubmed/29555572  ; @umichmedicine holds a major gender dysphoria clinic as well-good to see no testis cancer identified (in this study & anecdotally) @UMichPath
5,Well-circumscribed masses of embryonal carcinoma plugging vascular spaces in the spermatic cord near the tetsis #gupath #testicularcancer pic.twitter.com/r8WyMvyBkX
6,#PediPath https://twitter.com/cu_pathology/status/997512463284240384 …
7,"Sex cord week: Pick adenoma always in atrophic cryptorchid testis #gupath #pathology, benign lesion pic.twitter.com/VKQql0nJjt"
8,"Large cells up to 100 microns, lack of prominent lymphocytic infiltration or granulomatous inflammation. Intratubular spread but no GCNI, OCT4(-), CD117 can be (+). Spermatocytic tumor!! ~10% in younger than 30yo but more common >50. Happy Friday! #GUpath pic.twitter.com/eGcnAoK0C8"
9,Tightly packed cords of tumor cells is the most frequent pattern observed in kidney carcinoids. Rare but cute. #gupath pic.twitter.com/F4lZGlUsxo
10,Abdominal lesion. Diagnosis? IHC stains? Prognosis? #pathboards pic.twitter.com/dtUyAPB4nG
11,Infographic: Crossing the Digital Divide https://hubs.ly/H0bjgn_0 
12,The #PROMIS trial – time for multi-parametric MRI before a first #prostate biopsy  https://www.urologynews.uk.com/features/features/post/the-promis-trial-time-for-multi-parametric-mri-before-a-first-prostate-biopsy …#TRUS #Urology #Uroradiology #uronews pic.twitter.com/4x9gTY3lxZ
13,Dr. Motoso from Johns Hopkins giving a platform on neuro tumors in context of germ cell tumors #uscap2018 #gupath pic.twitter.com/dSccniIgPh
14,Here is @Andres_Matoso presenting in the upgraded #GUPath platform room! Waterfront view! (Ballroom D)Bladder cancer ambiguous for muscularis propria invasion on TUR pic.twitter.com/lQzPvNqAom – at Vancouver Convention Centre West
15,Popular #gupath platform presentations at #USCAP2018! Room is full an people watching from the hallway! pic.twitter.com/F447ADNc1q
16,Enjoying the best of #USCAP2018 with friends! @mreyesm @clamsalgado pic.twitter.com/cnDY1XXaYU
17,Neuroglial differentiation in testicular tumors is rare and is more commonly associated with teratomas.  They can show a variety of morphologic features. Below are some examples. Enjoy! 😀 #gupath pic.twitter.com/dfB4xfWxUq
18,"Our new educational iPAD application, the Johns Hopkins Atlas of prostate Pathology is now available in the iTunes Store ( https://itunes.apple.com/us/app/hopkins-prostate-pathology/id1355871112?mt=8 …)! This app is designed to teach residents, fellows, and practicing pathologists the intricacies of prostate pathology. Enjoy!"
19,"Botryoid rhabdomyosarcoma from old files. Infant girl, vaginal lesion. #PediPath Compare with the diagram of a vegetable seed to see the cambium layer. #BSTPath pic.twitter.com/WFaqtL4mkH"
20,New case (but same old story). Young patient. Renal tumour with eosinophilic (but not oxyphilic) cytoplasm. Cytoplasmic vacuoles. This case cytokeratin negative (as is usual). Can only be one thing! http://onlinelibrary.wiley.com/doi/10.1111/his.13277/full … pic.twitter.com/h2ZTLAPs6f
21,Mesenchymal Kidney Tumors by Dr. Andres Matoso (@JHUPath) coming in May! #GUpathMake sure to preview DIGITAL SLIDES of the cases before the #pathCast goes live by visiting our website:  http://pathologycast.com/mesenchymal-kidney-tumors/ … 🔬🖥 pic.twitter.com/oikKeSBpm5
22,"At the other end of the spectrum of basal cell hyperplasia of prostate is basal cell carcinoma. Adenoid cystic pattern (pics) is a feature more associated with carcinoma than hyperplasia. Others include Ki67>20%, BCL2+ diffuse, extending out... #gupath #urology pic.twitter.com/vdsVGEhl9g"
23,"GCT in blood vessel. At low power the necrosis simulates embryonal, but closer look demonstrates two cells populations, c/w choriocarcinoma. Monomorphic nuclei and amphophilic cytoplasm are a hint for cytotrophoblast (vs. embryonal). #gupath pic.twitter.com/S3MeAZudy8"
24,Patient with uncontrolled hypertension and a unilateral peripherally located solitary renal mass. Laboratory features of hyperaldosteronism and hypokalemia. Juxtaglomerular cell tumor. inset CD34. #gupath (Pics by Dr Mangray) pic.twitter.com/P94yoAFvyy
25,@Andres_Matoso and here are the lovely worms which lay these eggs!! #GUpath #pathology #urology (only seen once in my life) pic.twitter.com/O0vJFCdorh
26,We are looking forward to seeing you all at @ASCP_Chicago 's Annual meeting taking place October 2018!@aakasharmand @AnneMillsMD @Sinchita_Roy @DrFNA @SGottesmanMD @edusqo @EdCibas pic.twitter.com/qu3V6a5qCm – at Brown University
27,#GUpath quiz - hydrocele specimen: what are these cells? What if I told you they are CD56+? 😱 pic.twitter.com/m5JaqyZH0r
28,Small round blue cell tumor of kidney. Confirmed PNET/Ewing sarcoma by molecular. CD99 positivity as seen in this case should not be taken as diagnostic.  #gupath #pathology #urology Happy Monday! pic.twitter.com/xm4EE9CUez
29,Check out our paper on resident Surg path structuring - @ktmontone! Awesome teamwork @PennPathLabMed https://twitter.com/ktmontone/status/936446221782257665 …
30,"New in December @ArchivesPath: Precursor Lesions of Urologic Malignancies, by @WeillCornell #pathologists Drs. Francesca Khani and Brian D. Robinson:  http://capatholo.gy/2iziz1z . #pathologists pic.twitter.com/tWGOh1Lvnd"
31,Monophasic synovial sarcoma with entrapped renal tubules (not biphasic). See brisk mitotic activity despite lack of pleomorphism. EMA is focally positive in the spindle cell component. #gupath #pathology #urology pic.twitter.com/UtexQYnjat
32,Sneaky prostate ca with aberrant expression of P63! Note lack of staining with HMWCK. P63 is staining luminal cells and not basal cells. A classic one worth to be remembered. #gupath #pathologyAm J Surg Pathol. 2013 Sep;37(9):1401-6. pic.twitter.com/SzPoF84ueb
33,"Answer to #GUpath quiz: Hyperplasia of rete testis with hyaline globules, potential mimic of yolk sac tumor, likely reactive to tumor invasion of rete. Ulbright & Gersell 1991  https://www.ncbi.nlm.nih.gov/pubmed/1702268  pic.twitter.com/nP2n8BvG0F"
34,"@SiddiqueA_MD @marcoslepe @Levelsx5 @bansar_bansaria @Gleason4plus5 @Williamson_SR @mreyesm Excellent job! Yes, this is a large cell calcifying Sertoli cell tumor. It has an association with Carney complex. FH is mut in a subset of Leydig CT, CTNNB1 is freq mutant in Sertoli CT, STK11 in intratubular hyalinizing Sertoli C Neo. Marcos claim your latte at USCAP!"
35,"What mutation is frequently present in this testicular tumor? 1)FH; 2)CTNNB1; 3)PRKAR1; 4)STK11. First resident winner gets a ""grande latte"" (must be claimed at JHH or USCAP18)  Have fun! #GUpath #pathology #pathresident pic.twitter.com/nwAxnYwkJK"
36,Case 5 part 2: Nested eosinophilic tumor with nuclei demonstrating prominent nucleoli. High nuclear grade. Some nuclei have a clear halo around them. Atypical mitoses were seen. This has a fumurate hydratase mutation. Diagnosis: Hereditary leiomyomatosis associated RCC #NJSP2017 pic.twitter.com/WxkXSqc6TB
37,On November 15 we will celebrate the International #Pathology Day  https://shar.es/1PIOGD . Our specialty needs to gain visibility. Please RT
38,"Testicular teratoma gone bad. Primitive looking somatic malignancy. See glomeruloid structures. PanCK should prompt WT1 staining. ""Nephroblastoma arising from Teratoma"" #GUpath #pathology pic.twitter.com/9Bzx6OTRj6"
39,"in testicular #GUpath, currently hilar soft tissue invasion =pT1 but be aware that 1/1/2018 using 8th AJCC hilar soft tissue invasion = pT2 pic.twitter.com/RwuacTq4px"
40,@MiPathKunju @drmehrarohit @Andres_Matoso @Gleason4plus5 @Kiril_T_Can @SunnyKaoMD @Williamson_SR bonus 2nd diagnosis: scattered subcapsular non-caseating granulomas --> patient has known SARCOIDOSIS! pic.twitter.com/q1EVH6eq9o
41,"nephrectomy: Renal oncocytoma ""invading"" fat (I'd recommend using ""extending into fat"" to avoid confusion as a malignant feature). #GUpath pic.twitter.com/lQhbvNkfjW"
42,"Continuing with weird location for a tumor with classic morphology... Look at this epithelioid hemangioendothelioma in the penile urethra! CD31+, CK-, HHV8-. #gupath #pathology pic.twitter.com/NQPVcYBIfF"
43,Rare example of systemic amyloidosis involving prostate bx with widespread amyloid deposits in stroma and blood vessels- may lead to elevated PSA as well! Still important to rule out #prostatecancer in such cases... #Pathology pic.twitter.com/kHGUAqzC4D
44,Continuing with LNs involved by weird stuff. Angiomyolipomas can involve LNs and is not indicative of malignancy. #gupath pic.twitter.com/mxs1nEaMlt
45,@mreyesm @Williamson_SR @bansar_bansaria It is easy to say when you have a deep bx like here. In a small superficial bx PAX8 could be misleading
46,Be careful when trusting PAX8 in the DD of nested ca vs. NA. Here is an example of a nested ca PAX8+. #gupath pic.twitter.com/hZv1nSvzgP
47,Benign epithelial inclusions in regional lymph nodes around a kidney tumor can mimic met. Key is to recognize its bland cytology. #gupath pic.twitter.com/kyfFS3UX8J
48,Bladder with amyloid in lamina propria and monoclonal population of plasma cells. Overlying NA seen in pic1!  #gupath pic.twitter.com/0DMf6hciuU
49,"Primary urethral melanoma are rare and can be amelanotic. Should be in  ddx of urothelial carcinoma, sarcomas, and sarcomatoid ca.#gupath pic.twitter.com/OqAw4Qn9On"
50,"Paratesticular mass in a child. Testis spared. Age, location and morphology should guide you. IHC will nail it. #gupath #PediPath #pathology pic.twitter.com/NCSxDnqUnK"
51,Paratesticular tumor. Unusual location but classic morphology for a glomus tumor! 😀😀 #gupath #pathology pic.twitter.com/gBBuH2KeDb
52,"Sertoli cell tumor can show similarity to NETs. In fact, they are often SYN+, CHR+. Can 🐝 a dx pitfall in  metastatic sites!! #gupath pic.twitter.com/BNfvp8Rl5R"
53,Review: Precursor lesions in the prostate & bladder from Drs. @FKhaniPath & Robinson #EarlyOnline #gupath  https://buff.ly/2fnORu5  pic.twitter.com/rB9IxQTm37
54,Striking tram-track pattern in tall cell variant of PTC- good low power clue to diagnosis! #EndoPath #PathArt pic.twitter.com/AeKfVcQjdP
55,Acto de inauguración e instalación de nuestro XXXI Congreso Cartagena 2017 #slap #slapCartagena pic.twitter.com/xTQHvbudAB
56,"Urothelial carcinoma with syncytiotrophoblastic giant cells, associated with poor prognosis #pathology #pathologists #GUpath #pathboards pic.twitter.com/1JpUnAtUz8"
57,"In contrast to torsion that involves the entire testis, well-demarcated areas of infarcts suggest vasculitis. Most common PAN-like. #gupath pic.twitter.com/HRFKIwv3PN"
58,"XGP, an unusual variant of chronic pyelonephritis, occurring in the setting of obstruction due2 infected renal stones👉non-functioning kidney pic.twitter.com/uBhDfGQx0u"
59,"Malakoplakia, masquerading as a retroperitoneal mass; von Kossa highlighting numerous MG bodies pic.twitter.com/RkcgImVbO3"
60,Med School Dean Marschall Runge weighs in on recent mortality data comparing teaching and non-teaching hospitals:  http://michmed.org/eV4AK  pic.twitter.com/8NCoDd5xOf
61,@LMBarton1 @bansar_bansaria Immunoassay for antigen
62,This case tested positive for histoplasma but the dd is very difficult based on morphology alone @bansar_bansaria @LMBarton1 pic.twitter.com/VIvpFOFCob
63,Histoplasma😉
64,20+yo man with elevated LFTs found to have low CD4 count-tested positive for HIV. Hard to see in H&E but look at GMS! #pathology #GIpath pic.twitter.com/JcZy5XBS3Z
65,"@CaDxPath Yes, SDH strikes again! TURB or partial is ttx-complete resection is the goal."
66,Not every tumor in the detrusor is urothelial carcinoma. Here is a nice example of paraganglioma. Look SDH! #GUpath #pathology #urology pic.twitter.com/sn6bpdkD3T
67,Adult with gastric mass + metastatic lymph node. Conventional risk stratification is not recommended PMID: 27340750. Bonus dx too! #GIpath 😀 pic.twitter.com/E2CzM2nQ8Q
68,Beautiful example of a nasty tumor. Plasmacytoid variant of urothelial carcinoma. #urology #pathology #gupath pic.twitter.com/gi8socMGTU
69,"Inv urothelial carcinoma with divergent differentiation, common association of small cell carcinoma and glandular diff #gupath #pathology pic.twitter.com/8Sn87yPkAm"
70,"A constellation of asteroid bodies for July 4th. Characteristic of sarcoid, but not specific- these came with hernia mesh! #SurgPath pic.twitter.com/XL4GSKBECo"
0,When Can PSA Testing Be Stopped After Prostatectomy?#prostatecancer f. @Wes_Ludwig_MD #PCW https://www.hopkinsmedicine.org/brady-urology-institute/patient-information/books-publications/articles/when-can-psa-testing-be-stopped-after-prostatectomy …#discovery18 #pcsm pic.twitter.com/Xx674GXyJT
1,Use of NSAIDS for treatment of acute renal colic -  http://bit.ly/2iyElhZ 
2," http://urologytimes.modernmedicine.com/urology-times/news/how-do-ureteroscope-types-compare-ergonomically?page=0,0 …"
3,#NEWinNRU Review by @Wes_Ludwig_MD et al. on robot-assisted retroperitoneal oncological surgery #UroOnc  http://go.nature.com/2xY0NuW  pic.twitter.com/qYANFZjTZJ
4,@EndourolSoc @Wes_Ludwig_MD @brady_urology very nice study!#wce17 #wce2017 pic.twitter.com/olaW1Wb0kg
5,"Another great World Congress of Endourology in the books, in a beautiful locale! #WCE17 @brady_urology pic.twitter.com/Rm3Pac6AXJ"
6,.@BrianMatlaga on the place for single-use ureteroscopes at a high volume institution. #WCE17 https://twitter.com/kativonhe/status/907699306160734208 …
7,Thank you @drphil_urology for a great grand rounds talk on the new AUA guidelines on small renal masses! @AmerUrological @brady_urology pic.twitter.com/fYjE7qlZwQ
8,Ever wonder which ureteroscope has the best ergonomic profile?  http://online.liebertpub.com/doi/10.1089/end.2017.0378 …@JEndourology @Justin_Ziemba @brady_urology
9,When can we stop testing PSA 20 years after radical prostatectomy? @JUrology @brady_urology http://www.jurology.com/article/S0022-5347(17)77319-3/fulltext …
10,Ureteral Stent Tracker improves patient safety by preventing the forgotten ureteral stent READ NOW:  http://ow.ly/qJib30e5r4v 
0, https://bit.ly/2uv7YHo  - Take a look at risk factors and epidemiology of recurrent ACL tears in NCAA athletes - recently published in @OJSM_SportsMed  and copublished with @DrMihoTanaka #orthopedics #SportsMedicine @HopkinsOrtho pic.twitter.com/tC8mHQjs99
1,Thanks to @envisionexp for hosting us on a panel to talk to the next generation of #leaders in #medicine.  Excited to see the contributions they will each make to our field! #NationalYouthLeadershipForum #PowerSelfie pic.twitter.com/6rP6DcDqX5
2,Stay #healthy and avoid #sports #injuries this summer! Thanks ⁦@MiaTaylorWriter⁩ for the mention! https://blog.cheapism.com/summer-sports-injuries/ …
3,Thanks @CharmCityRun for hosting me today to discuss #injuries and #prevention in #runners! Always inspired to be around thoughtful and dedicated athletes. pic.twitter.com/qUlER66fCB
4,"Thank you to @DePuySynthes for their educational #grant for our ICL on #patellofemoral Surgery at #AOSSM2018. And thanks to master PF surgeons @JackFarrMD, @Patelladoc and Dr Andy Cosgarea for another great session- glad to see so much interest in this topic! pic.twitter.com/VyDHTseg0V"
5,"Congratulations and welcome to Alex Otwell from Little Rock, our 2018 #WomensSportsMedicine #SummerIntern @HopkinsMedicine, selected from over 150 applicants! Thanks to our supporters who have made it possible for this to be a funded program this year! pic.twitter.com/28mp223Z5w"
6,How do you know when it is time to see a sports medicine doctor? These tips can help.  https://buff.ly/2MtAsYX  #SportsMedicine #SportsMed pic.twitter.com/TIfR5SLo0M
7,Final night with the #APKASS ⁦@AOSSM_SportsMed⁩ traveling fellows. Thanks to the ⁦#Orioles org for a great reception! pic.twitter.com/8YfIeEgCKL
8,Day 3 continued with our #APKASS @AOSSM_SportsMed traveling fellows. Thanks @jondickensmd for organizing the #WhiteHouse tour! pic.twitter.com/rGLlmR1U7l
9,"Day 3 with our #APKASS ⁦@AOSSM_SportsMed⁩ traveling fellows, a special tour of the White House organized by our military colleagues! pic.twitter.com/oDLWqpmSUt"
10,Very honored to have hosted the traveling fellows from #APKASS during their @AOSSM_SportsMed tour! An incredible day of academic exchange @HopkinsMedicine pic.twitter.com/GLMpQ0XRup
11,Think #pregnancy is a license to kick your feet up? Learn the truth behind common myths about exercising while expecting. #PregnancyTips  http://bit.ly/2IgeE0c  pic.twitter.com/Oqwx497ai3
12,"Johns Hopkins team of researchers, including our own Lynne Jones and @DrMihoTanaka, looked at the 25 #NCAA sports to identify and compare sport-specific risk factors for a recurrent #ACL rupture that occurs in 1% to 11% of all athletes.  https://buff.ly/2JISMfm  pic.twitter.com/urb87aZ80Z"
13,"Dance may look effortless, but it requires a lot of strength, flexibility and stamina. It also comes with a high risk of injuries—some more common than others.  http://bit.ly/2K4Wnor  pic.twitter.com/tFmUyTsxaE"
14,"Which came first, the patella or the trochlea? Discussing the relationship between the two in ⁦@ArthroscopyJ⁩ 2018. https://www.arthroscopyjournal.org/article/S0749-8063(18)30321-9/fulltext …"
15,Always a fun time with @tomhallwypr on @MiddayWYPR! Also streaming live on FB today as we discuss #injury #prevention in #runners: https://www.facebook.com/WYPR881FM/videos/10156487314618980/ …
16,"COMING UP AT NOON:  Training for the 10-Miler? Need tips on getting fit? Or healing a painful knee? @DrMihoTanaka orthopedic surgeon + director of Women's Sports Medicine @HopkinsMedicine -- joins us w/expert advice. Join us too! 410-662-8780, email midday@wypr.org. Watch FB Live pic.twitter.com/QCsekrXB9L"
17,The Rise of Female Surgeons at Johns Hopkins https://www.hopkinsmedicine.org/news/articles/the-rise-of-female-surgeons-at-johns-hopkins#.Wwc5F3U87do.twitter …
18,@drcgoldstein and @DrMihoTanaka would likely approve this. https://twitter.com/sheldenmartinmd/status/997898635479171072 …
19,"Grace was an avid runner with five long-distance races planned for a year. But after tearing her left meniscus during a half-marathon, she feared she might never run again, until she met @DrMihoTanaka. #ShareAStoryInOneTweet http://bit.ly/2wPPRjl "
20,Enjoyed discussing 6 #KneePain Causes That Have (Almost) Nothing to Do With #GettingOld  https://www.prevention.com/fitness/a20664700/knee-pain-causes/ … with @PreventionMag
21,"With Drs Getgood, Dhawan and Kaeding for an @AOSSM_SportsMed #TravelingFellows reunion at the #MagellanSociety meeting in #Gleneagles, where we were given the Kirkley Award! #FabFourAsiaTour @FKSMC_Getgood #AOSSM pic.twitter.com/KcZyNt8OAW"
22,"For @DrMihoTanaka, bridging treatment disparities in women’s #sportsmedicine is a team effort.  http://bit.ly/2HYvqSh  pic.twitter.com/beHgaqA7aV"
23,"Thanks @PreventionMag for the quote, and for helping people to get rid of their pain! https://twitter.com/preventionmag/status/991457799837224960 …"
24,Great turnout for our ICL at #AANA18! https://twitter.com/JackFarrMD/status/989900059151126529 …
25,"Honored to be with #WomenLeaders in #SportsMedicine @DocMatzkin, @DrDeCampos and Dr Tammy Scarpella at #AANA18 pic.twitter.com/AI0amHrwUm"
26,"State of art #Patellofemoral ICL MPFL, MQTFL, MPFC Recon PF INstability #AANA18 moderated by @DrMihoTanaka @HopkinsMedicine  with @JackFarrMD and Drs Fullerton, Cosgarea pic.twitter.com/tzYI5xPOWX"
27,Thanks to @HopkinsMedicine for this kind feature and for supporting our #patellofemoral research as well as our goals to optimize care for #FemaleAthletes ! https://www.hopkinsmedicine.org/news/articles/surgeon-expands-patellofemoral-research-womens-sports-medicine …
28,"Not my typical type of interview @HowStuffWorks , but relevant to #FemaleAthletes nonetheless! https://health.howstuffworks.com/wellness/women/general/do-too-tight-jog-bras-impair-breathing.htm …"
29,"Lynne Jones, Ph.D. and @DrMihoTanaka will present on epidemiology of #ACL injury and reinjury in #NCAA 2004-2005 and 2013-2014 this afternoon in Theater B #AAOS2018"
30, https://www.wsj.com/articles/contortion-thats-no-circus-act-1519473660 … Thanks @WSJ for letting me discuss the role of pain in #contortionism as a #workout. There may be potential for new types of #SportsMedicine #injuries!
31,The Orthopedics Show is LIVE! Dr. Steve Yang and Dr. Aaron Buckland talk to @DrMihoTanaka about preventing & treating knee injuries. Do you have questions for the Docs? 877-698-3627
32,Thanks @BloombergLaw for including my thoughts on the role of #healthcare in elite athletes. Interesting discussion of #healthcarecoverage for the #Olympics https://www.bna.com/olympic-athletes-patch-n57982088574/ …
33,Thanks to @ArthroscopyJ for the opportunity to provide an #editorial #commentary for an important study  on #MPFL reconstruction performed by @bethshubinstein and her team http://www.arthroscopyjournal.org/article/S0749-8063(17)31266-5/fulltext?elsca1=etoc&elsca2=email&elsca3=0749-8063_201802_34_2_&elsca4=Orthopaedics …
